Date	Result	WhiteElo	BlackElo	Opening	Moves
2019.07.01	0-1	1290	1272	Van't Kruijs Opening	1. e3 d5 2. c3 e5 3. d4 exd4 4. Qxd4 Nc6
2019.07.01	1-0	830	780	Alekhine Defense: Sämisch Attack	1. e4 Nf6 2. e5 Nd5 3. Nc3 Nxc3 4. dxc3 e6
2019.07.01	1-0	2097	1968	Four Knights Game: Italian Variation	1. e4 e5 2. Nf3 Nc6 3. Nc3 Nf6 4. Bc4 Bc5
2019.07.01	1-0	1998	1732	French Defense: Queen's Knight	1. e4 e6 2. Nc3 f6 3. Bc4 d6 4. d3 Qe7
2019.07.01	0-1	2073	2091	Bishop's Opening: Vienna Hybrid, Hromádka Variation	1. e4 Nf6 2. Nc3 e5 3. Bc4 Nc6 4. d3 Bb4
2019.07.01	0-1	1615	1668	Bishop's Opening: Boi Variation	1. e4 e5 2. Bc4 Bc5 3. Nf3 d6 4. c3 Nf6
2019.07.01	1-0	1957	2005	Sicilian Defense: Old Sicilian	1. e4 c5 2. Nf3 Nc6 3. Nc3 d6 4. Bb5 a6
2019.07.01	1-0	1423	1412	Philidor Defense #2	1. e4 e5 2. Nf3 d6 3. Be2 c5 4. c3 Nc6
2019.07.01	1-0	1367	1317	Sicilian Defense	1. e4 c5 2. Nf3 d6 3. Nc3 Nf6 4. d4 cxd4
2019.07.01	1-0	1788	1793	Sicilian Defense: Nyezhmetdinov-Rossolimo Attack	1. e4 c5 2. Nf3 Nc6 3. Bb5 d6 4. Bxc6+ bxc6
2019.07.01	1-0	1653	1698	Indian Game	1. d4 Nf6 2. Bf4 g6 3. e3 Bg7 4. Be2 O-O
2019.07.01	0-1	1454	1369	Hungarian Opening	1. g3 Nc6 2. Bg2 d5 3. d4 b6 4. e4 Bb7
2019.07.01	1-0	1894	1934	Queen's Pawn	1. d4 d6 2. Nf3 c6 3. e3 Nf6 4. Bd3 g6
2019.07.01	1-0	1738	1764	Torre Attack	1. d4 Nf6 2. Nf3 g6 3. Bg5 Bg7 4. e3 O-O
2019.07.01	0-1	1996	2036	Indian Game: London System	1. d4 Nf6 2. Nf3 e6 3. Bf4 d5 4. e3 Bd6
2019.07.01	1-0	1337	1368	Caro-Kann Defense: Two Knights Attack, Mindeno Variation	1. e4 c6 2. Nf3 d5 3. Nc3 Bg4 4. Be2 Bxf3
2019.07.01	1-0	1035	1038	Alekhine Defense: Scandinavian Variation	1. e4 Nf6 2. Nc3 d5 3. e5 Ne4 4. Nxe4 dxe4
2019.07.01	1-0	1602	1567	Scandinavian Defense: Mieses-Kotroc Variation	1. e4 d5 2. exd5 Qxd5 3. Nf3 Bg4 4. Nc3 Qd6
2019.07.01	1-0	1384	1374	Blackmar-Diemer Gambit	1. d4 d5 2. e4 dxe4 3. Bf4 Bf5 4. Bb5+ c6
2019.07.01	0-1	1421	1415	Ruy Lopez: Rotary-Albany Gambit	1. e4 e5 2. Nf3 Nc6 3. Bb5 b6 4. Bxc6 dxc6
2019.07.01	1-0	1926	1720	Scotch Game	1. e4 e5 2. Nf3 Nc6 3. d4 d6 4. dxe5 dxe5
2019.07.01	1-0	1403	1430	French Defense: Queen's Knight	1. e4 e6 2. Nc3 d5 3. Bb5+ c6 4. Ba4 b5
2019.07.01	1-0	1573	1511	Pirc Defense #4	1. e4 d6 2. d3 c6 3. f4 Nd7 4. Nf3 Qc7
2019.07.01	1-0	1056	1073	Hungarian Opening	1. g3 e6 2. Bg2 c5 3. d3 Nf6 4. Nf3 d5
2019.07.01	1-0	1659	1586	Van't Kruijs Opening	1. e3 e5 2. a3 d5 3. d4 e4 4. h3 Nf6
2019.07.01	0-1	1484	1479	Sicilian Defense: Smith-Morra Gambit #2	1. e4 c5 2. d4 cxd4 3. Qxd4 Nc6 4. Qd1 d6
2019.07.01	1-0	1796	1792	Queen's Gambit Refused: Chigorin Defense #3	1. d4 d5 2. c4 dxc4 3. Nc3 Nc6 4. e3 Nf6
2019.07.01	0-1	1350	1318	Sicilian Defense	1. e4 c5 2. Nf3 d6 3. g3 Nf6 4. Nc3 Nc6
2019.07.01	1-0	1950	1907	French Defense: Franco-Hiva Gambit I	1. e4 e6 2. d4 f5 3. exf5 exf5 4. Bd3 d5
2019.07.01	1-0	1399	1392	Van't Kruijs Opening	1. e3 d5 2. Nf3 e5 3. Nxe5 Nf6 4. Qf3 Bg4
2019.07.01	0-1	1471	1403	Hungarian Opening	1. g3 e5 2. b3 d5 3. Bb2 f6 4. Bg2 c6
2019.07.01	1-0	1020	1051	Pirc Defense #4	1. e4 d6 2. Nf3 Nf6 3. Bc4 e5 4. Ng5 Be6
2019.07.01	0-1	1725	1764	Horwitz Defense	1. d4 e6 2. Bf4 d5 3. e3 Nf6 4. Nf3 c5
2019.07.01	0-1	1774	1782	Nimzowitsch-Larsen Attack	1. Nf3 d5 2. b3 c5 3. Bb2 Nc6 4. e3 Qc7
2019.07.01	0-1	1247	1201	Philidor Defense #2	1. e4 e5 2. Nf3 d6 3. Nc3 Bg4 4. b3 Bxf3
2019.07.01	0-1	1326	1311	Bird Opening: Dutch Variation	1. f4 d5 2. Nf3 Nc6 3. e3 Bg4 4. Bb5 e6
2019.07.01	1-0	1229	1210	Italian Game	1. e4 e5 2. Nf3 Nc6 3. Bc4 a6 4. c3 b5
2019.07.01	1-0	1731	1606	Ruy Lopez: Steinitz Defense	1. e4 e5 2. Nf3 Nc6 3. Bb5 d6 4. h3 Bd7
2019.07.01	1-0	1444	1377	Scotch Game: Scotch Gambit	1. e4 e5 2. Nf3 Nc6 3. d4 exd4 4. Bc4 d6
2019.07.01	0-1	1749	1795	Sicilian Defense: Old Sicilian	1. e4 c5 2. Nf3 Nc6 3. d3 e5 4. g3 Be7
2019.07.01	0-1	992	862	Ponziani Opening: Jaenisch Counterattack	1. e4 e5 2. Nf3 Nc6 3. c3 Nf6 4. Qe2 Bc5
2019.07.01	1-0	1966	1920	Sicilian Defense: French Variation	1. e4 c5 2. Nf3 e6 3. d3 Nc6 4. Nbd2 d5
2019.07.01	0-1	792	871	Queen's Pawn Game: Chigorin Variation	1. d4 d5 2. Nc3 Nf6 3. e3 Nc6 4. Nf3 g6
2019.07.01	0-1	1833	2013	English Opening: Symmetrical Variation, Normal Variation	1. c4 c5 2. Nc3 g6 3. g3 Bg7 4. Bg2 Nf6
2019.07.01	1-0	1746	1738	London System	1. d4 Nf6 2. Nf3 g6 3. Bf4 c5 4. e3 cxd4
2019.07.01	1-0	1486	1500	King's Pawn Game: Damiano Defense	1. e4 e5 2. Nf3 f6 3. Nc3 c6 4. d4 Bd6
2019.07.01	1-0	1558	1563	Three Knights Opening	1. e4 e5 2. Nf3 Nc6 3. Nc3 d6 4. Nd5 Be6
2019.07.01	0-1	2037	2143	Sicilian Defense: Closed	1. e4 c5 2. Nc3 d6 3. d3 g6 4. g3 Bg7
2019.07.01	1-0	1579	1623	Old Benoni Defense	1. d4 c5 2. c4 cxd4 3. Qxd4 Nf6 4. Qd1 Nc6
2019.07.01	0-1	1052	1236	Englund Gambit Declined, Reversed French	1. e3 e5 2. d4 exd4 3. Qxd4 Nc6 4. Qe4+ Be7
2019.07.01	1-0	1725	1698	Sicilian Defense: Bowdler Attack	1. e4 c5 2. Bc4 e6 3. Nf3 Nc6 4. d4 cxd4
2019.07.01	0-1	1685	1736	Scandinavian Defense: Marshall Variation	1. e4 d5 2. exd5 Nf6 3. d4 Nxd5 4. Nc3 Nxc3
2019.07.01	0-1	1421	1379	Italian Game	1. e4 e5 2. Nf3 Nc6 3. Bc4 d6 4. c3 Nf6
2019.07.01	1-0	957	1021	Scandinavian Defense: Mieses-Kotroc Variation	1. e4 d5 2. exd5 Qxd5 3. Nc3 Qe6+ 4. Be2 Qd6
2019.07.01	1-0	2027	1743	Englund Gambit	1. d4 e5 2. c4 exd4 3. Qxd4 Nf6 4. Qd1 Be7
2019.07.01	0-1	1865	1861	Dutch Defense	1. d4 f5 2. Nf3 Nf6 3. c4 e6 4. Nc3 Nc6
2019.07.01	0-1	1889	1895	Sicilian Defense: Dragon, 6.Be3	1. e4 c5 2. Nf3 d6 3. d4 cxd4 4. Nxd4 Nf6
2019.07.01	1-0	1507	1529	Italian Game: Anti-Fried Liver Defense	1. e4 e5 2. Nf3 Nc6 3. Bc4 h6 4. d3 Nf6
2019.07.01	1-0	1776	1567	Zukertort Opening: Vos Gambit	1. d4 e5 2. Nf3 d6 3. dxe5 Nc6 4. Bf4 dxe5
2019.07.01	0-1	1740	1745	Sicilian Defense: Hyperaccelerated Dragon	1. e4 c5 2. Nf3 g6 3. Nc3 Bg7 4. d4 d6
2019.07.01	0-1	1649	1677	Queen's Gambit Declined: Orthodox Defense, Botvinnik Variation	1. d4 d5 2. c4 e6 3. Nc3 Nf6 4. Bg5 Be7
2019.07.01	1-0	1662	2050	Pirc Defense: Classical Variation	1. e4 d6 2. Nf3 Nf6 3. Nc3 g6 4. d4 Bg7
2019.07.01	0-1	1745	1872	Four Knights Game: Scotch Variation Accepted	1. e4 e5 2. Nf3 Nc6 3. Nc3 Nf6 4. d4 exd4
2019.07.01	0-1	1558	1971	Nimzo-Indian Defense: Classical Variation	1. d4 Nf6 2. c4 e6 3. Nc3 Bb4 4. Qc2 b6
2019.07.01	1-0	1432	1294	Sicilian Defense: Snyder Variation	1. e4 c5 2. b3 d6 3. Bc4 Nf6 4. Nc3 g6
2019.07.01	1-0	1399	1318	English Opening: Anglo-Indian Defense, Flohr-Mikenas-Carls Variation, Nei Gambit	1. c4 e6 2. e4 c5 3. Nc3 Nf6 4. e5 Ng8
2019.07.01	1-0	1646	1686	Queen's Pawn Game #2	1. d4 d5 2. e3 c6 3. c4 Qc7 4. Nf3 f6
2019.07.01	1-0	1724	1596	Caro-Kann Defense	1. e4 c6 2. d4 d6 3. c4 Nd7 4. f4 Ngf6
2019.07.01	0-1	1790	1924	Alekhine Defense: Modern Variation, Larsen Variation	1. e4 Nf6 2. e5 Nd5 3. d4 d6 4. Nf3 dxe5
2019.07.01	1-0	2013	2002	Scandinavian Defense: Mieses-Kotroc Variation	1. e4 d5 2. exd5 Qxd5 3. Nc3 Qe5+ 4. Be2 Qa5
2019.07.01	1-0	2068	2033	Italian Game: Giuoco Pianissimo, Normal	1. e4 e5 2. Nf3 Nc6 3. Bc4 Nf6 4. d3 Bc5
2019.07.01	1-0	1345	1346	Grünfeld Defense: Three Knights Variation, Burille Variation	1. d4 Nf6 2. c4 d5 3. Nf3 g6 4. Nc3 Bg7
2019.07.01	0-1	1398	1412	Ruy Lopez: Morphy Defense, Tarrasch Variation	1. e4 e5 2. Nf3 Nc6 3. Bb5 a6 4. Ba4 Nf6
2019.07.01	0-1	1000	975	Queen's Pawn Game: Mason Attack	1. d4 d5 2. Bf4 Nf6 3. e3 Ng4 4. h3 Nf6
2019.07.01	1-0	1130	1149	Sicilian Defense: Canal Attack, Main Line	1. e4 c5 2. Nf3 d6 3. Bb5+ Bd7 4. Bxd7+ Nxd7
2019.07.01	0-1	1491	1475	Queen's Pawn	1. d4 a6 2. c4 h6 3. Nc3 e6 4. e4 d6
2019.07.01	0-1	1030	1030	Bishop's Opening	1. e4 e5 2. Bc4 Nh6 3. Nh3 d6 4. Ng5 Qxg5
2019.07.01	0-1	1842	1855	Sicilian Defense	1. e4 c5 2. Nf3 d6 3. Bc4 Nf6 4. d3 g6
2019.07.01	1-0	1395	1371	Horwitz Defense	1. d4 e6 2. e3 Bb4+ 3. Bd2 Bd6 4. a3 a6
2019.07.01	0-1	1682	1663	Vienna Game: Vienna Gambit	1. e4 e5 2. Nc3 Nf6 3. f4 d6 4. Nf3 exf4
2019.07.01	0-1	1655	1550	Sicilian Defense: Bowdler Attack	1. e4 c5 2. Bc4 Nc6 3. Nf3 e6 4. c3 Na5
2019.07.01	1-0	1879	1884	Sicilian Defense: McDonnell Attack	1. e4 c5 2. f4 d5 3. e5 Nh6 4. Nf3 Nc6
2019.07.01	0-1	1384	1376	Van Geet Opening: Reversed Nimzowitsch	1. Nc3 e5 2. d3 Nf6 3. Nf3 Nc6 4. Bg5 h6
2019.07.01	0-1	1481	1472	Scandinavian Defense	1. e4 d5 2. Qe2 d4 3. d3 e5 4. a3 a6
2019.07.01	0-1	1726	1748	Zukertort Opening: Tennison Gambit	1. e4 d5 2. Nf3 dxe4 3. Ng5 Bf5 4. Bd3
2019.07.01	1-0	1071	1063	English Defense #2	1. d4 b6 2. c4 Bb7 3. Nc3 Nc6 4. e4 e5
2019.07.01	0-1	1448	1661	French Defense: Advance, Steinitz Variation	1. e4 e6 2. d4 d5 3. e5 c5 4. dxc5 Bxc5
2019.07.01	1/2-1/2	2163	2118	Queen's Pawn Game: Symmetrical Variation, Pseudo-Catalan	1. Nf3 d5 2. d4 Nf6 3. g3 Bf5 4. Bg2 h6
2019.07.01	1-0	1365	1364	King's Pawn Game: King's Head Opening #2	1. e4 e5 2. f3 Nc6 3. Bb5 Qg5 4. Bf1 Nd4
2019.07.01	0-1	1035	1007	Hungarian Opening	1. g3 e5 2. Bg2 d5 3. e3 e4 4. Ne2 c6
2019.07.01	0-1	1873	1827	Italian Game: Classical Variation, Giuoco Pianissimo	1. e4 e5 2. Nf3 Nc6 3. Bc4 Nf6 4. d3 Bc5
2019.07.01	1-0	1409	1384	French Defense: Advance Variation, Paulsen Attack	1. e4 e6 2. d4 d5 3. e5 c5 4. c3 Nc6
2019.07.01	1-0	1617	1792	Zukertort Opening: Sicilian Invitation	1. Nf3 c5 2. c4 e6 3. d4 cxd4 4. Nxd4 a6
2019.07.01	1-0	2192	2505	Zukertort Opening: Queen's Gambit Invitation	1. Nf3 e6 2. d3 Ne7 3. Nbd2 d5 4. g3 g6
2019.07.01	0-1	1546	1488	English Opening: King's English Variation, Reversed Closed Sicilian	1. c4 e5 2. Nc3 Nc6 3. e4 Nge7 4. Nge2 g6
2019.07.01	0-1	1937	2003	Pterodactyl Defense: Eastern, Rhamphorhynchus	1. e4 g6 2. d4 Bg7 3. Nc3 c5 4. dxc5 Nc6
2019.07.01	1-0	1624	1600	Philidor Defense #3	1. e4 e5 2. Nf3 d6 3. Bc4 Be6 4. Bxe6 fxe6
2019.07.01	1-0	1125	1021	Horwitz Defense	1. d4 e6 2. Bf4 f5 3. e3 d5 4. c3 c6
2019.07.01	1-0	1289	1126	Queen's Gambit Refused: Chigorin Defense	1. d4 d5 2. c4 Nc6 3. Nf3 dxc4 4. e3 Nf6
2019.07.01	0-1	1383	1361	Queen's Gambit Refused: Austrian Defense	1. d4 d5 2. c4 c5 3. Nc3 dxc4 4. d5 e6
2019.07.01	1-0	1663	1635	Sicilian Defense: Alapin Variation	1. e4 c5 2. c3 Nc6 3. d4 e6 4. d5 Ne5
2019.07.01	0-1	1819	1922	Caro-Kann Defense: Exchange Variation	1. e4 c6 2. d4 d5 3. exd5 cxd5 4. Nf3 Nc6
2019.07.01	1-0	1496	1483	Nimzo-Larsen Attack	1. b3 e6 2. Bb2 d5 3. Bxg7 Nc6 4. Bxh8 Be7
2019.07.01	0-1	1802	1741	Bird Opening: Dutch Variation	1. f4 d5 2. e3 Bf5 3. Nf3 e6 4. b3 Be7
2019.07.01	1-0	1587	1549	Center Game #2	1. e4 e5 2. d4 Qh4 3. Bd3 exd4 4. Nf3 Qf6
2019.07.01	0-1	1751	1871	Sicilian Defense #2	1. e4 c5 2. Nf3 d6 3. d4 cxd4 4. Nxd4 Nc6
2019.07.01	0-1	1365	1406	Van't Kruijs Opening	1. e3 c5 2. b3 e5 3. Bb2 Nc6 4. d4 cxd4
2019.07.01	1-0	1340	1347	Nimzo-Indian Defense: Ragozin Variation	1. d4 d5 2. c4 e6 3. Nc3 Nf6 4. Nf3 Bb4
2019.07.01	1-0	1575	1508	Russian Game: Damiano Variation	1. e4 e5 2. Nf3 Nf6 3. Nxe5 Nxe4 4. Qe2 Nf6
2019.07.01	0-1	1742	1663	Scandinavian Defense: Mieses-Kotroc Variation	1. e4 d5 2. exd5 Qxd5 3. Nc3 Qe6+ 4. Be2 g6
2019.07.01	1-0	1441	1440	Grob Opening	1. g4 c5 2. Bg2 Nc6 3. e3 h6 4. a3 Nf6
2019.07.01	1-0	1575	1553	Sicilian Defense: Closed	1. e4 c5 2. Nc3 e6 3. Nf3 a6 4. d4 b5
2019.07.01	1-0	2009	1979	Budapest Defense: Adler Variation	1. d4 Nf6 2. c4 e5 3. dxe5 Ng4 4. Nf3 Nc6
2019.07.01	0-1	1635	1659	Italian Game: Anti-Fried Liver Defense	1. e4 e5 2. Nf3 Nc6 3. Bc4 h6 4. c3 Bc5
2019.07.01	0-1	1824	1854	Nimzowitsch Defense: Scandinavian Variation, Exchange Variation	1. e4 Nc6 2. d4 d5 3. exd5 Qxd5 4. c3 Nf6
2019.07.01	0-1	2174	2116	Pirc Defense #5	1. e4 d6 2. d4 c6 3. Nc3 Qc7 4. Nf3 e5
2019.07.01	1-0	1751	1562	Nimzowitsch Defense: Franco-Nimzowitsch Variation	1. e4 e6 2. Nf3 Nc6 3. d4 d5 4. exd5 exd5
2019.07.01	1-0	952	1031	Vienna Game	1. e4 e5 2. Nc3 Qh4 3. Nf3 Qg4 4. Nxe5 Qg5
2019.07.01	0-1	1290	1231	Russian Game: Cozio (Lasker) Attack	1. e4 e5 2. Nf3 Nf6 3. Nxe5 d6 4. Nf3 Nxe4
2019.07.01	1-0	1934	1940	King's Gambit Accepted, Gianutio Countergambit	1. e4 e5 2. f4 exf4 3. Nf3 f5 4. e5 d6
2019.07.01	1-0	1354	1398	Bishop's Opening	1. e4 e5 2. Bc4 d6 3. d3 Be6 4. Nf3 Bxc4
2019.07.01	1-0	2509	2176	Old Indian Defense	1. d4 Nf6 2. c4 d6 3. Nf3 Nbd7 4. g3 e5
2019.07.01	1-0	1526	1580	Slav Defense: Modern	1. d4 d5 2. c4 c6 3. Nf3 Nf6 4. Bf4 g6
2019.07.01	0-1	2151	2352	King's Indian Defense: Orthodox Variation, Aronin-Taimanov Defense	1. d4 Nf6 2. Nf3 g6 3. c4 Bg7 4. Nc3 O-O
2019.07.01	1/2-1/2	1615	1418	Philidor Defense	1. e4 e5 2. Nf3 d6 3. d4 Bg4 4. dxe5 Nc6
2019.07.01	1-0	1685	1674	Philidor Defense #2	1. e4 e5 2. Nf3 d6 3. Nc3 Nc6 4. Bb5 Nf6
2019.07.01	0-1	1903	1903	Benoni Defense: King's Pawn Line	1. d4 c5 2. d5 e6 3. c4 exd5 4. cxd5 d6
2019.07.01	1-0	1327	1304	King's Gambit Accepted, MacLeod Defense	1. e4 e5 2. f4 Nc6 3. Nf3 exf4 4. Bc4 Nf6
2019.07.01	0-1	1606	1564	King's Gambit Accepted, Salvio Gambit	1. e4 e5 2. f4 exf4 3. Nf3 g5 4. Bc4 g4
2019.07.01	1-0	1328	1212	Queen's Gambit Refused: Chigorin Defense, Modern Gambit	1. Nf3 d5 2. d4 Nf6 3. c4 Nc6 4. Nc3 dxc4
2019.07.01	1-0	1294	1042	Queen's Pawn Game: Mason Attack	1. d4 d5 2. Bf4 c6 3. Nc3 g6 4. e3 Nf6
2019.07.01	0-1	1325	1354	Queen's Pawn	1. d4 c6 2. Nc3 d5 3. Bf4 Bf5 4. f3 Nf6
2019.07.01	0-1	1864	1863	Englund Gambit Declined, Reversed French	1. e3 e5 2. d4 Nf6 3. dxe5 Ng8 4. Nf3 d6
2019.07.01	0-1	1509	1631	Dutch Defense	1. d4 f5 2. e3 Nf6 3. Bd3 e6 4. Nf3 c5
2019.07.01	0-1	1800	1985	Bird Opening: Dutch Variation	1. f4 d5 2. Nf3 c5 3. e3 e6 4. Bb5+ Nc6
2019.07.01	1/2-1/2	2148	2098	Old Benoni Defense	1. d4 c5 2. Nf3 cxd4 3. Nxd4 e5 4. Nb5 d6
2019.07.01	0-1	946	1090	Queen's Pawn Game: Mason Attack	1. d4 d5 2. Bf4 Nf6 3. e3 g6 4. Bd3 Bg7
2019.07.01	0-1	2177	2324	Sicilian Defense: Dragon, Classical, Amsterdam Variation	1. e4 c5 2. Nf3 g6 3. d4 Bg7 4. Be3 Nf6
2019.07.01	1-0	1610	1557	English Opening: Anglo-Scandinavian Defense	1. c4 d5 2. Qc2 dxc4 3. Qxc4 Nf6 4. a3 Nc6
2019.07.01	1-0	2086	1950	Neo-Grünfeld Defense: Non- or Delayed Fianchetto	1. d4 Nf6 2. c4 d5 3. Nf3 g6 4. Bf4 Bg7
2019.07.01	1/2-1/2	873	843	Queen's Pawn Game: Chigorin Variation	1. d4 d5 2. Nf3 Nc6 3. c4 e6 4. cxd5 exd5
2019.07.01	1-0	1376	1385	King's Pawn Game: Leonardis Variation	1. e4 e5 2. d3 Nf6 3. Bg5 h6 4. Bxf6 Qxf6
2019.07.01	0-1	1449	1551	Bird Opening: Dutch Variation	1. f4 d5 2. d4 Nf6 3. e3 Bf5 4. Nf3 e6
2019.07.01	0-1	1119	1278	Alekhine Defense: Scandinavian Variation	1. e4 Nf6 2. Nc3 d5 3. d3 Bg4 4. Be2 e6
2019.07.01	1-0	1852	1685	Indian Game	1. d4 Nf6 2. Bf4 g6 3. e3 Bg7 4. Nf3 O-O
2019.07.01	1-0	1679	1547	Latvian Gambit Accepted	1. e4 e5 2. Nf3 f5 3. exf5 Nf6 4. d3 Bc5
2019.07.01	1-0	1653	1694	Nimzowitsch Defense: Kennedy Variation, Linksspringer Variation	1. e4 Nc6 2. d4 e5 3. d5 Nce7 4. c4 Ng6
2019.07.01	0-1	1335	1327	French Defense: Winawer Variation, Advance Variation	1. d4 d5 2. Nc3 e6 3. e4 Bb4 4. e5 Bxc3+
2019.07.01	1-0	2083	2183	Sicilian Defense: Paulsen Variation	1. e4 e6 2. Nf3 c5 3. Nc3 a6 4. d4 cxd4
2019.07.01	1-0	1446	1387	Sicilian Defense: Modern Variations, Anti-Qxd4 Move Order	1. e4 c5 2. Nf3 d6 3. d4 Nf6 4. dxc5 g6
2019.07.01	1-0	1103	1068	Alekhine Defense	1. e4 Nf6 2. Nc3 Nxe4 3. Nxe4 d5 4. Ng3 e5
2019.07.01	0-1	1350	1370	Sicilian Defense: Old Sicilian	1. e4 c5 2. Nf3 Nc6 3. Bc4 e6 4. d4 cxd4
2019.07.01	1-0	2036	2004	French Defense: Exchange Variation	1. e4 e6 2. d4 d5 3. exd5 exd5 4. Bd3 c6
2019.07.01	0-1	1835	1884	Caro-Kann Defense: Breyer Variation	1. e4 c6 2. d3 d5 3. Nd2 dxe4 4. dxe4 e5
2019.07.01	1-0	1221	1207	Portuguese Opening	1. e4 e5 2. Bb5 Nc6 3. Nc3 Bb4 4. Nge2 Bxc3
2019.07.01	1-0	1807	1807	Modern Defense: Two Knights Variation, Suttles Variation	1. e4 g6 2. d4 Bg7 3. Nf3 d6 4. Nc3 c6
2019.07.01	0-1	1348	1348	King's Pawn Game: Maróczy Defense	1. e4 e5 2. d4 d6 3. dxe5 dxe5 4. Qxd8+ Kxd8
2019.07.01	0-1	1014	850	Owen Defense	1. e4 b6 2. d4 Bb7 3. Nc3 e6 4. Nf3 d5
2019.07.01	1-0	1341	1364	Sicilian Defense: Smith-Morra Gambit #2	1. e4 c5 2. d4 cxd4 3. Qxd4 Nc6 4. Qe3 e5
2019.07.01	0-1	1465	1510	Ruy Lopez: Cozio Defense	1. e4 e5 2. Nf3 Nc6 3. Bb5 Nge7 4. O-O d6
2019.07.01	1/2-1/2	1638	1736	Queen's Pawn Game: Mason Attack	1. d4 d5 2. Bf4 e6 3. Nf3 h6 4. h3 Nf6
2019.07.01	0-1	1680	1710	Modern Defense	1. e4 g6 2. c4 Bg7 3. d3 d6 4. Nc3 e5
2019.07.01	0-1	1822	1826	Sicilian Defense: Closed Variation	1. e4 c5 2. Nc3 d6 3. f4 Nc6 4. Nf3 e6
2019.07.01	1-0	1534	1538	Franco-Benoni Defense	1. e4 e6 2. d4 c5 3. d5 Nf6 4. dxe6 fxe6
2019.07.01	1-0	982	985	Sicilian Defense: Alapin Variation	1. e4 c5 2. c3 e6 3. d4 Nc6 4. dxc5 Bxc5
2019.07.01	0-1	1399	1402	Indian Game	1. d4 Nf6 2. Nc3 e6 3. e4 g6 4. e5 Nd5
2019.07.01	1-0	1856	1841	Philidor Defense: Exchange Variation	1. e4 e5 2. Nf3 d6 3. d4 exd4 4. Nxd4 Nf6
2019.07.01	1-0	1663	1669	French Defense: Normal Variation	1. e4 e6 2. d4 Ne7 3. c4 Ng6 4. g3 Be7
2019.07.01	1-0	1087	1100	Russian Game: Three Knights Game	1. e4 e5 2. Nf3 Nf6 3. Nc3 Bb4 4. d3 d6
2019.07.01	1-0	1101	1171	King's Indian Defense: Accelerated Averbakh Variation	1. d4 Nf6 2. c4 g6 3. e4 d6 4. Nc3 Bg7
2019.07.01	1-0	1539	1551	Queen's Pawn Game: Colle System	1. d4 d5 2. Nf3 Nf6 3. e3 c5 4. c4 cxd4
2019.07.01	1-0	1185	1188	Center Game: Paulsen Attack Variation	1. e4 e5 2. d4 exd4 3. Qxd4 Nc6 4. Qe3 b6
2019.07.01	0-1	1777	1773	Sicilian Defense: Old Sicilian	1. e4 c5 2. Nf3 Nc6 3. Bc4 e6 4. d4 Nf6
2019.07.01	1-0	1580	1663	Sicilian Defense: Staunton-Cochrane Variation	1. e4 c5 2. c4 Nc6 3. Nf3 d6 4. h3 Nf6
2019.07.01	0-1	1228	1192	King's Pawn Game: Macleod Attack	1. e4 e5 2. c3 d5 3. d3 dxe4 4. dxe4 Qxd1+
2019.07.01	0-1	1613	2021	Queen's Indian Defense	1. d4 Nf6 2. Nf3 b6 3. e3 Bb7 4. c4 e6
2019.07.01	1-0	1279	1234	Italian Game: Two Knights Defense, Ponziani-Steinitz Gambit	1. e4 e5 2. Nf3 Nc6 3. Bc4 Nf6 4. Ng5 Nxe4
2019.07.01	0-1	2001	1904	Nimzo-Indian Defense: Classical Variation, Berlin Variation	1. d4 Nf6 2. c4 e6 3. Nc3 Bb4 4. Qc2 c5
2019.07.01	1-0	856	1020	Barnes Defense	1. e4 f6 2. Nf3 g5 3. e5 h5 4. exf6 exf6
2019.07.01	1-0	1492	1526	English Opening: Anglo-Scandinavian Defense	1. c4 d5 2. g3 dxc4 3. Bg2 c6 4. a4 e5
2019.07.01	0-1	1880	1892	Scandinavian Defense: Mieses-Kotroc Variation	1. e4 d5 2. exd5 Qxd5 3. Nf3 Nf6 4. Be2 Bf5
2019.07.01	0-1	1551	1560	Ruy Lopez: Berlin Defense #2	1. e4 e5 2. Nf3 Nc6 3. Bb5 Nf6 4. Bxc6 dxc6
2019.07.01	1-0	1421	1395	Queen's Pawn Game #2	1. d4 d5 2. e3 Nc6 3. c4 e6 4. a3 Nf6
2019.07.01	1-0	1386	1313	Four Knights Game	1. e4 e5 2. Nc3 Nf6 3. Nf3 Nc6 4. h3 Bb4
2019.07.01	0-1	1423	1576	Italian Game: Anti-Fried Liver Defense	1. e4 e5 2. Nf3 Nc6 3. Bc4 h6 4. d3 Nf6
2019.07.01	0-1	2157	2125	Horwitz Defense	1. d4 e6 2. Nc3 b6 3. e4 Bb4 4. Ne2 Bb7
2019.07.01	1-0	1841	1610	Alekhine Defense #2	1. e4 Nf6 2. e5 Nd5 3. d4 b6 4. f4 Bb7
2019.07.01	1-0	1722	1904	Sicilian Defense: Delayed Alapin	1. e4 c5 2. Nf3 d6 3. c3 e6 4. Bb5+ Bd7
2019.07.01	0-1	1250	1732	Englund Gambit Declined, Reversed French	1. e3 e5 2. d4 exd4 3. Qxd4 d6 4. Qe4+ Be7
2019.07.01	1-0	2232	2137	Sicilian Defense: Chekhover Variation	1. e4 c5 2. Nf3 d6 3. d4 cxd4 4. Qxd4 Nf6
2019.07.01	0-1	1876	2245	Zukertort Opening: Tennison Gambit	1. e4 d5 2. Nf3 dxe4 3. Ng5 f5 4. Bc4 Nh6
2019.07.01	0-1	1268	1467	Sicilian Defense: Open	1. e4 c5 2. Nf3 Nc6 3. d4 cxd4 4. Nxd4 Nf6
2019.07.01	0-1	1699	1848	Modern Defense: Mongredien Defense #2	1. e4 g6 2. Nf3 Bg7 3. d4 b6 4. e5 Bb7
2019.07.01	0-1	900	843	Queen's Pawn Game: Zukertort Variation	1. d4 d5 2. Nf3 e6 3. e3 Bb4+ 4. Nbd2 Bd7
2019.07.01	0-1	1238	1254	Philidor Defense #2	1. e4 e5 2. Nf3 d6 3. Bb5+ Bd7 4. Bxd7+ Qxd7
2019.07.01	0-1	1676	1629	Queen's Pawn Game: Colle System	1. d4 d5 2. Nf3 Nf6 3. e3 Bg4 4. Bd3 Bxf3
2019.07.01	1-0	1345	1345	Sicilian Defense: McDonnell Attack	1. e4 c5 2. f4 Nc6 3. c4 e5 4. d3 Nf6
2019.07.01	1-0	1469	1576	Robatsch (Modern) Defense	1. e4 g6 2. d4 Bg7 3. Be3 e6 4. Bd3 d6
2019.07.01	0-1	940	1012	Sicilian Defense: French Variation	1. e4 c5 2. Nf3 e6 3. Bc4 d5 4. exd5 exd5
2019.07.01	1-0	2110	2138	Mieses Opening	1. d3 d5 2. Bh6 Nxh6 3. Nf3 e5 4. g3 Nc6
2019.07.01	0-1	1365	1448	Sicilian Defense: Nyezhmetdinov-Rossolimo Attack	1. e4 c5 2. Nf3 Nc6 3. Bb5 d6 4. d4 a6
2019.07.01	0-1	1754	1808	Ruy Lopez: Morphy Defense, Bayreuth Variation	1. e4 e5 2. Nf3 Nc6 3. Bb5 a6 4. Ba4 Nf6
2019.07.01	1-0	977	1094	Sicilian Defense: Bowdler Attack	1. e4 c5 2. Bc4 g6 3. Qf3 Nh6 4. Nh3 d6
2019.07.01	1-0	1687	1445	Ruy Lopez: Nuernberg Variation	1. e4 e5 2. Nf3 Nc6 3. Bb5 f6 4. Nc3 a6
2019.07.01	1-0	1425	1428	Queen's Gambit Declined	1. d4 d5 2. c4 e6 3. a3 Nf6 4. Nc3 Bd7
2019.07.01	1-0	998	998	Scandinavian Defense: Modern Variation #2	1. e4 d5 2. exd5 Nf6 3. Nc3 e6 4. dxe6 Bxe6
2019.07.01	1-0	1931	2137	Pirc Defense #5	1. e4 d6 2. d4 g6 3. g3 b6 4. Bg2 Bb7
2019.07.01	1-0	1500	1449	Scandinavian Defense	1. e4 d5 2. e5 Qd7 3. d4 b5 4. b4 Bb7
2019.07.01	0-1	1346	1334	Van't Kruijs Opening	1. e3 d5 2. c4 d4 3. exd4 Qxd4 4. d3 e5
2019.07.01	1-0	1215	1138	Queen's Pawn Game: Chigorin Variation	1. d4 d5 2. Nc3 Nf6 3. Bf4 Bf5 4. Nb5 c6
2019.07.01	0-1	1561	1593	Scotch Game: Classical Variation	1. e4 e5 2. Nf3 Nc6 3. d4 exd4 4. Nxd4 Bc5
2019.07.01	1/2-1/2	1974	1254	Queen's Pawn	1. d4 d6 2. e3 Bd7 3. Bd3 Bc6 4. Nf3 Ba4
2019.07.01	1-0	2120	1922	French Defense: Rubinstein Variation	1. e4 e6 2. d4 d5 3. Nc3 dxe4 4. Nxe4 Be7
2019.07.01	0-1	1570	2014	Queen's Pawn Game: Franco-Sicilian Defense	1. e4 e6 2. d4 c5 3. dxc5 Bxc5 4. Nf3 Nf6
2019.07.01	1-0	1549	1585	Ruy Lopez: Morphy Defense, Tarrasch Variation	1. e4 e5 2. Nf3 Nc6 3. Nc3 Nf6 4. Bb5 a6
2019.07.01	0-1	2180	2423	Saragossa Opening	1. c3 c5 2. f3 d5 3. Kf2 e5 4. e3 d4
2019.07.01	0-1	1559	1456	Sicilian Defense: Paulsen-Basman Defense	1. e4 c5 2. Nf3 e6 3. d4 cxd4 4. Nxd4 Bc5
2019.07.01	1-0	1677	1618	Hungarian Opening	1. g3 b6 2. Bg2 c5 3. Bxa8
2019.07.01	1-0	942	805	King's Pawn Game: Leonardis Variation	1. e4 e5 2. d3 h5 3. Be3 a5 4. Be2 Rh6
2019.07.01	0-1	1174	1212	Polish Opening	1. b4 e5 2. Bb2 Nc6 3. b5 Nd4 4. Nf3 Nxf3+
2019.07.01	0-1	1633	1722	Queen's Pawn Game: Symmetrical Variation, Pseudo-Catalan	1. Nf3 Nf6 2. g3 d5 3. d4 c6 4. Bg2 Bf5
2019.07.01	1/2-1/2	1891	1724	Rat Defense: Small Center Defense	1. e4 e6 2. d4 d6 3. c4 Nf6 4. Nc3 Be7
2019.07.01	0-1	1362	1406	French Defense: Normal Variation	1. e4 e6 2. d4 Qh4 3. Nc3 Bb4 4. g3 Bxc3+
2019.07.01	1-0	2480	2228	Sicilian Defense: Snyder Variation	1. e4 c5 2. b3 Nc6 3. Bb2 d6 4. f4 e6
2019.07.01	1-0	1635	1784	Queen's Pawn	1. d4
2019.07.01	0-1	1491	1485	Scandinavian Defense	1. e4 d5 2. Bd3 dxe4 3. Bxe4 Nf6 4. Bd3 Nc6
2019.07.01	0-1	2047	2012	English Opening: Caro-Kann Defensive System	1. c4 c6 2. Nc3 Nf6 3. d4 g6 4. e4 d6
2019.07.01	1-0	1727	1998	Bird Opening	1. f4 c5 2. Nf3 Nc6 3. e3 d5 4. c3 Nf6
2019.07.01	1-0	1817	1477	Giuoco Piano	1. e4 e5 2. Nf3 Nc6 3. Bc4 Bc5 4. O-O Nge7
2019.07.01	1-0	1545	1545	King's Pawn Game: Leonardis Variation	1. d3 e5 2. e4 d5 3. Nc3 d4 4. Nd5 Nf6
2019.07.01	1-0	1623	1797	Four Knights Game: Scotch Variation Accepted	1. e4 Nc6 2. Nc3 e5 3. Nf3 Nf6 4. d4 exd4
2019.07.01	1-0	1247	1139	Queen's Gambit Accepted: Normal Variation	1. d4 d5 2. c4 dxc4 3. Nf3 Nc6 4. e4 f6
2019.07.01	1-0	1465	1417	Dutch Defense: Queen's Knight Variation	1. d4 f5 2. c4 Nf6 3. Nc3 e6 4. g3 Bb4
2019.07.01	1-0	1940	1967	Benoni Defense	1. d4 Nf6 2. c4 c5 3. e3 e6 4. Nc3 g6
2019.07.01	0-1	1928	1931	Semi-Slav Defense: Main Line	1. d4 c6 2. c4 d5 3. e3 Nf6 4. Nc3 e6
2019.07.01	1-0	1293	1357	Queen's Gambit Declined	1. d4 d5 2. c4 e6 3. Bf4 c5 4. Nf3 Nc6
2019.07.01	0-1	1991	1968	Queen's Gambit Refused: Marshall Defense	1. d4 d5 2. c4 Nf6 3. Nc3 c6 4. Bg5 e6
2019.07.01	1-0	1907	1911	Sicilian Defense: McDonnell Attack	1. e4 c5 2. f4 g6 3. Nf3 Bg7 4. Bc4 Nc6
2019.07.01	1-0	1503	1497	Scotch Game: Schmidt Variation	1. e4 e5 2. Nf3 Nc6 3. d4 exd4 4. Nxd4 Nf6
2019.07.01	1-0	2435	2129	Sicilian Defense: Najdorf, Lipnitsky Attack	1. e4 c5 2. Nf3 d6 3. d4 cxd4 4. Nxd4 Nf6
2019.07.01	1-0	1655	1759	Slav Defense #2	1. d4 d5 2. c4 c6 3. Nc3 Bf5 4. f3 e6
2019.07.01	0-1	1534	1530	Ruy Lopez: Steinitz Defense	1. e4 e5 2. Nf3 Nc6 3. Bb5 d6 4. O-O Bd7
2019.07.01	1-0	2417	2390	Bird Opening	1. f4 Nf6 2. Nf3 d5 3. g3 c5 4. Bg2 Nc6
2019.07.01	1-0	1371	1325	Scandinavian Defense: Modern Variation #2	1. e4 d5 2. exd5 Nf6 3. Nc3 Nxd5 4. Nxd5 Qd6
2019.07.01	0-1	1748	1798	Mieses Opening	1. d3 c6 2. f4 d5 3. g3 Bg4 4. h3 Bd7
2019.07.01	0-1	1729	1954	Alekhine Defense: Normal Variation	1. e4 Nf6 2. e5 Nd5 3. f4 d6 4. d4 c6
2019.07.01	0-1	2069	2188	Dutch Defense: Raphael Variation	1. d4 f5 2. Nc3 Nf6 3. Bg5 g6 4. e4 d6
2019.07.01	1-0	1549	1545	Nimzowitsch Defense: Kennedy Variation, Paulsen Attack	1. e4 e5 2. d4 Nc6 3. dxe5 Nxe5 4. Nf3 Nxf3+
2019.07.01	0-1	1728	1591	French Defense: Exchange Variation	1. e4 e6 2. d4 d5 3. exd5 exd5 4. Nf3 Nf6
2019.07.01	1-0	1904	1817	Van't Kruijs Opening	1. e3 Nf6 2. d4 g6 3. f3 Bg7 4. c3 O-O
2019.07.01	0-1	1109	1209	Queen's Pawn Game: Mason Attack	1. d4 d5 2. Bf4 e6 3. Nf3 Nc6 4. Nc3 Bd7
2019.07.01	1-0	2038	2060	Nimzo-Larsen Attack: English Variation	1. b3 c5 2. Bb2 d5 3. e3 Nc6 4. Be2 e5
2019.07.01	1-0	1439	1543	Italian Game: Two Knights Defense, Modern Bishop's Opening	1. e4 e5 2. Nf3 Nc6 3. Bc4 Nf6 4. d3 Be7
2019.07.01	0-1	1845	1878	Sicilian Defense: Smith-Morra Gambit Accepted, Scheveningen Formation	1. e4 c5 2. d4 cxd4 3. Nf3 Nc6 4. c3 dxc3
2019.07.01	1-0	1613	1614	Sicilian Defense: French Variation	1. e4 c5 2. Nf3 e6 3. Nc3 d5 4. d4 cxd4
2019.07.01	1-0	2062	1888	Sicilian Defense: Nimzowitsch Variation	1. e4 c5 2. Nf3 Nf6 3. d4 Nxe4 4. d5 e6
2019.07.01	1-0	1226	1188	Four Knights Game: Italian Variation	1. e4 e5 2. Nf3 Nc6 3. Bc4 Nf6 4. Nc3 Be7
2019.07.01	0-1	1939	2118	Benoni Defense: Modern Variation, Snake Variation	1. d4 e6 2. c4 c5 3. d5 Nf6 4. Nc3 exd5
2019.07.01	0-1	1101	1077	King's Gambit Accepted, King's Knight Gambit	1. e4 e5 2. f4 exf4 3. Nf3 Bc5 4. d4 Bb6
2019.07.01	0-1	1845	1783	Nimzo-Larsen Attack: Classical Variation	1. b3 d5 2. Bb2 Nc6 3. Nf3 Bd7 4. g3 Nf6
2019.07.01	1/2-1/2	1344	1258	Queen's Pawn Game: Mason Attack	1. d4 d5 2. Bf4 f6 3. Qd2 Nc6 4. Nc3 e5
2019.07.01	0-1	1624	1681	Caro-Kann Defense	1. e4 c6 2. Nf3 d5 3. exd5 cxd5 4. d4 Bf5
2019.07.01	0-1	1204	1183	Queen's Gambit Refused: Marshall Defense	1. d4 d5 2. c4 Nf6 3. Nc3 dxc4 4. e3 e6
2019.07.01	1-0	1280	1282	Van't Kruijs Opening	1. e3 d5 2. c3 e6 3. b4 c5 4. b5 b6
