Date	Result	WhiteElo	BlackElo	Opening	Moves
2019.06.01	1-0	1588	1569	Robatsch (Modern) Defense	1. e4 g6 2. d4 Bg7 3. c3 d6 4. Bd3 Nf6
2019.06.01	1-0	1276	1259	King's Gambit Accepted, Schallopp Defense	1. e4 e5 2. f4 exf4 3. Nf3 Nf6 4. d4 Nxe4
2019.06.01	0-1	1255	1236	Van't Kruijs Opening	1. e3 d5 2. f3 e5 3. a3 Bd7 4. b4 Bc6
2019.06.01	0-1	1309	1282	Queen's Pawn Game: Zukertort Variation	1. d4 d5 2. Nf3 e6 3. Bf4 Nc6 4. e3 a6
2019.06.01	1-0	1156	1174	Dutch Defense	1. d4 f5 2. Bf4 e6 3. e3 Nf6 4. Be2 Be7
2019.06.01	1-0	1946	1982	Scandinavian Defense: Modern Variation #2	1. e4 d5 2. exd5 Nf6 3. f4 Nxd5 4. Nf3 Nc6
2019.06.01	0-1	1734	1752	Sicilian Defense: McDonnell Attack	1. e4 c5 2. f4 Nc6 3. Nf3 g6 4. Bc4 Bg7
2019.06.01	1-0	1396	1290	French Defense: Queen's Knight	1. e4 e6 2. Nc3 d5 3. exd5 exd5 4. d4 Qf6
2019.06.01	0-1	1034	1063	Scandinavian Defense: Mieses-Kotroc Variation	1. e4 d5 2. exd5 Qxd5 3. Nc3 Qd8 4. Nf3 Nc6
2019.06.01	0-1	1500	1812	Bishop's Opening: Berlin Defense	1. e4 e5 2. Bc4 Nf6 3. Qf3 Bc5 4. d3 d6
2019.06.01	0-1	1772	1741	Queen's Pawn Game: London System	1. d4 d5 2. Bf4 Nf6 3. Nf3 e6 4. c3 c5
2019.06.01	0-1	1408	1420	Van't Kruijs Opening	1. e3 g6 2. b3 Bg7 3. Nc3 b5 4. Bb2 b4
2019.06.01	0-1	818	1035	Vienna Game: Stanley Variation, Three Knights Variation	1. e4 e5 2. Nc3 Nc6 3. Bc4 Nf6 4. Qf3 Bc5
2019.06.01	0-1	1540	2008	Pirc Defense: Classical Variation	1. e4 d6 2. d4 Nf6 3. Nf3 g6 4. Nc3 Bg7
2019.06.01	0-1	1812	1713	King's Gambit Accepted, Fischer Defense	1. e4 e5 2. f4 exf4 3. Nf3 d6 4. Bc4 Bg4
2019.06.01	0-1	1371	1420	King's Pawn Game: Wayward Queen Attack	1. e4 e5 2. Qh5 Nc6 3. c3 g6 4. Qf3 Nf6
2019.06.01	1-0	1828	1796	Pirc Defense: Classical Variation, Schlechter Variation	1. e4 g6 2. d4 Bg7 3. Nf3 d6 4. h3 Nf6
2019.06.01	1-0	2090	1929	Caro-Kann Defense: Panov Attack	1. e4 c6 2. d4 d5 3. exd5 cxd5 4. c4 Nf6
2019.06.01	1-0	1341	1388	Giuoco Piano	1. e4 e5 2. Nf3 Nc6 3. Bc4 Bc5 4. O-O d6
2019.06.01	0-1	1041	1005	King's Pawn Game: Wayward Queen Attack	1. e4 e5 2. Qh5 d6 3. h3 g6 4. Qf3 Bh6
2019.06.01	1-0	1194	1141	King's Pawn Game: Damiano Defense	1. e4 e5 2. Nf3 f6 3. d3 Nc6 4. a3 Nd4
2019.06.01	0-1	1840	2028	Sicilian Defense: Open	1. e4 c5 2. Nf3 Nc6 3. d4 cxd4 4. Nxd4 Nf6
2019.06.01	1-0	1103	1138	Queen's Gambit Declined: Vienna Variation	1. d4 Nf6 2. c4 d5 3. Nc3 dxc4 4. Nf3 e6
2019.06.01	1-0	1507	1523	Sicilian Defense: Open #3	1. e4 c5 2. Nf3 Nc6 3. d4 cxd4 4. Nxd4 Nxd4
2019.06.01	0-1	1495	1500	King's Knight Opening: Normal Variation	1. e4 e5 2. Nf3 Nc6 3. b3 Nf6 4. d3 Bc5
2019.06.01	0-1	1266	1277	King's Pawn Game: McConnell Defense	1. e4 e5 2. Nf3 Qf6 3. Bc4 c6 4. O-O Be7
2019.06.01	1-0	1875	1817	Anderssen Opening	1. a3 d5 2. b4 Nf6 3. Bb2 g6 4. f3 Bg7
2019.06.01	1-0	1456	1507	Caro-Kann Defense: Hillbilly Attack	1. e4 c6 2. Bc4 d5 3. exd5 cxd5 4. Bb3 e6
2019.06.01	0-1	1073	1115	Ruy Lopez: Bird Variation	1. e4 e5 2. Nf3 Nc6 3. Bb5 Nd4 4. Nxd4 exd4
2019.06.01	1-0	1439	1437	Modern Defense: Standard Defense	1. d4 g6 2. e4 Bg7 3. Nc3 d6 4. Bf4 Nf6
2019.06.01	0-1	1066	913	Modern Defense	1. d4 g6 2. Bf4 Bg7 3. e3 Nf6 4. Nf3 O-O
2019.06.01	1-0	1256	1165	Nimzo-Larsen Attack: Modern Variation #3	1. b3 e5 2. Bb2 Nc6 3. Nf3 Nf6 4. e4 d6
2019.06.01	0-1	1357	1426	Alekhine Defense	1. e4 Nf6
2019.06.01	1/2-1/2	1881	1785	Scandinavian Defense: Modern Variation #2	1. e4 d5 2. exd5 Nf6 3. Bb5+ c6 4. dxc6 bxc6
2019.06.01	0-1	1720	1623	Sicilian Defense: Bowdler Attack	1. e4 c5 2. Bc4 Nc6 3. Qf3 e6 4. d3 Ne5
2019.06.01	1-0	2139	2046	Pirc Defense: Roscher Gambit	1. e4 d6 2. Nf3 Nf6 3. d4 Nxe4 4. Bd3 Nf6
2019.06.01	0-1	1510	1771	French Defense	1. e4 e6 2. d4 d5 3. Bb5+ c6 4. Ba4 Nf6
2019.06.01	1-0	2198	1907	Indian Game: Budapest Defense	1. d4 Nf6 2. c4 e5 3. Nc3 exd4 4. Qxd4 Nc6
2019.06.01	1-0	1345	1259	Russian Game: Three Knights Game	1. e4 e5 2. Nf3 Nf6 3. Nc3 d6 4. Bc4 h6
2019.06.01	0-1	1395	1382	Queen's Gambit Declined	1. d4 d5 2. c4 e6 3. c5 c6 4. e3 Nf6
2019.06.01	0-1	1724	1532	King's Pawn Game: Wayward Queen Attack	1. e4 e5 2. Qh5 g6 3. Qxe5+ Qe7 4. Qxh8 Nh6
2019.06.01	0-1	1721	1753	King's Gambit Accepted, King's Knight Gambit	1. e4 e5 2. f4 exf4 3. Nf3 g5 4. Bc4 d6
2019.06.01	0-1	1470	1508	Modern Defense	1. d4 g6 2. e3 Bg7 3. c3 d6 4. Nd2 Nf6
2019.06.01	0-1	1689	1671	Scandinavian Defense: Kloosterboer Gambit	1. e4 d5 2. exd5 c6 3. dxc6 e5 4. b3 Bc5
2019.06.01	0-1	2242	2130	King's Indian Attack	1. Nf3 d5 2. g3 Nf6 3. Bg2 e6 4. O-O b6
2019.06.01	1/2-1/2	2387	2326	French Defense: Tarrasch Variation, Closed Variation, Main Line	1. e4 e6 2. d4 d5 3. Nd2 Nf6 4. e5 Nfd7
2019.06.01	0-1	1718	1689	King's Gambit Declined, Queen's Knight Defense	1. e4 e5 2. f4 Nc6 3. Nf3 d6 4. Bb5 Bg4
2019.06.01	1-0	1719	1739	Italian Game: Giuoco Pianissimo, Normal	1. e4 e5 2. Nf3 Nc6 3. Bc4 Bc5 4. d3 Nf6
2019.06.01	1-0	1421	1464	Queen's Pawn Game: Mason Attack	1. d4 d5 2. Bf4 b6 3. e3 Bb7 4. Nf3 h6
2019.06.01	1-0	1407	1393	Van't Kruijs Opening	1. e3 f5 2. g3 Nf6 3. Bg2 d5 4. b3 e5
2019.06.01	1-0	1942	2010	Queen's Pawn Game: London System	1. d4 d5 2. Nf3 Nf6 3. Bf4 Bf5 4. h3 e6
2019.06.01	1-0	1549	1566	Queen's Pawn Game: Mason Attack	1. d4 d5 2. Bf4 Nc6 3. c4 Nf6 4. c5 e6
2019.06.01	1-0	1235	1107	Van't Kruijs Opening	1. e3 d5 2. c4 dxc4 3. Bxc4 Bf5 4. Qf3 e6
2019.06.01	0-1	1607	1615	Sicilian Defense: Dragon Variation, Classical Variation	1. e4 c5 2. Nf3 Nc6 3. d4 cxd4 4. Nxd4 d6
2019.06.01	1-0	1073	1007	French Defense #2	1. e4 e6 2. Bc4 Bc5 3. Qf3 d5 4. exd5 exd5
2019.06.01	1-0	1743	1718	King's Gambit Declined: Falkbeer Countergambit	1. e4 e5 2. f4 d5 3. Qe2 Bc5 4. Nf3 Ne7
2019.06.01	0-1	1144	1727	Hungarian Opening	1. g3 d5 2. b3 e5 3. Bh3 f5 4. Bb2 Bd6
2019.06.01	0-1	1500	1534	Queen's Pawn Game: Mason Attack	1. d4 d5 2. Bf4 Nf6 3. Nc3 Bf5 4. e3 e6
2019.06.01	1/2-1/2	1640	1595	King's Gambit Accepted, Fischer Defense	1. e4 e5 2. f4 exf4 3. Nf3 d6 4. d4 Nf6
2019.06.01	1-0	1817	1738	Four Knights Game: Italian Variation	1. e4 e5 2. Nf3 Nc6 3. Nc3 Nf6 4. Bc4 d6
2019.06.01	0-1	1407	1757	Danish Gambit	1. e4 e5 2. d4 exd4 3. c3 Qe7 4. Bd3 d5
2019.06.01	0-1	1600	2070	Scandinavian Defense: Modern Variation #2	1. e4 d5 2. exd5 Nf6 3. Nf3 Nxd5 4. d3 Nc6
2019.06.01	1-0	1655	1661	Bishop's Opening: Boi Variation	1. e4 e5 2. Bc4 Bc5 3. Qf3 Qf6 4. d3 Qxf3
2019.06.01	1-0	967	841	Bishop's Opening: Berlin Defense	1. e4 e5 2. Bc4 Nf6 3. a3 c6 4. Nc3 d5
2019.06.01	1-0	1812	1751	French Defense: Advance Variation	1. e4 e6 2. d4 d5 3. e5 c5 4. c3 Nc6
2019.06.01	0-1	1946	2043	Sicilian Defense: Dragon Variation, Yugoslav Attack, Early Deviations	1. e4 c5 2. Nf3 d6 3. d4 cxd4 4. Nxd4 g6
2019.06.01	0-1	1629	1614	Caro-Kann Defense	1. e4 c6 2. Nf3 d5 3. exd5 cxd5 4. d4 a6
2019.06.01	0-1	1293	1288	Queen's Pawn Game #3	1. d4 d5 2. e3 Nf6 3. Nc3 Bf5 4. a4 e6
2019.06.01	0-1	1700	1735	Queen's Pawn Game: Zukertort Variation	1. d4 d5 2. Nf3 c6 3. Bf4 a6 4. Nc3 Bg4
2019.06.01	0-1	1331	1377	Sicilian Defense: Old Sicilian	1. e4 c5 2. Nf3 Nc6 3. Bc4 d6 4. d4 cxd4
2019.06.01	1-0	1909	1828	Sicilian Defense: Accelerated Dragon	1. e4 c5 2. Nf3 Nc6 3. d4 cxd4 4. Nxd4 g6
2019.06.01	0-1	1530	1442	Indian Game: Anti-Nimzo-Indian	1. d4 Nf6 2. c4 e6 3. Nf3 d5 4. Ne5 Bd6
2019.06.01	0-1	1232	1205	Ponziani Opening: Jaenisch Counterattack	1. e4 e5 2. Nf3 Nc6 3. c3 Nf6 4. d3 Bc5
2019.06.01	0-1	1260	1260	Center Game: Berger Variation	1. e4 e5 2. d4 exd4 3. Qxd4 Nc6 4. Qe3 Nf6
2019.06.01	0-1	1252	1259	Philidor Defense #2	1. e4 e5 2. Nf3 d6 3. Nc3 c6 4. d4 Bg4
2019.06.01	0-1	1035	1141	Italian Game: Schilling-Kostic Gambit	1. e4 e5 2. Nf3 Nc6 3. Bc4 Nd4 4. c3 Nxf3+
2019.06.01	1-0	2203	2170	Old Benoni Defense	1. d4 c5 2. c4 cxd4 3. Qxd4 Nf6 4. Nc3 g6
2019.06.01	0-1	1746	1812	King's Indian Attack: Symmetrical Defense	1. Nf3 Nf6 2. g3 g6 3. Bg2 Bg7 4. d3 O-O
2019.06.01	0-1	1215	1242	Four Knights Game: Spanish Variation	1. e4 e5 2. Nf3 Nc6 3. Bb5 Nf6 4. Nc3 d6
2019.06.01	1-0	1565	1549	English Opening: Anglo-Scandinavian Defense	1. c4 d5 2. e3 e5 3. Nc3 d4 4. exd4 exd4
2019.06.01	1-0	1244	1245	Three Knights Opening #2	1. e4 e5 2. Nf3 Nc6 3. Nc3 Bb4 4. Nd5 Bc5
2019.06.01	0-1	1671	1588	Four Knights Game: Italian Variation	1. e4 e5 2. Nf3 Nc6 3. Nc3 Nf6 4. Bc4 Be7
2019.06.01	1-0	1542	1508	Italian Game: Anti-Fried Liver Defense	1. e4 e5 2. Nf3 Nc6 3. Bc4 h6 4. d3 Nf6
2019.06.01	1-0	1169	1024	Van't Kruijs Opening	1. e3 e5 2. b3 Bc5 3. Bb2 Qh4 4. Bxe5 Bb4
2019.06.01	1-0	1365	1363	Philidor Defense	1. e4 e5 2. Nf3 d6 3. d4 Bg4 4. dxe5 Bxf3
2019.06.01	0-1	825	1020	Nimzowitsch Defense: Breyer Variation	1. e4 Nc6 2. d4 Nf6 3. Nc3 e5 4. d5 Nd4
2019.06.01	0-1	1663	1692	King's Pawn Game: Macleod Attack	1. e4 e5 2. c3 Nc6 3. d4 d6 4. d5 Nb8
2019.06.01	0-1	1259	1323	French Defense: Two Knights Variation	1. e4 e6 2. Nf3 d5 3. Nc3 c5 4. exd5 exd5
2019.06.01	1-0	1991	2160	King's Indian Defense: Kazakh Variation	1. d4 Nf6 2. Nf3 g6 3. c4 Bg7 4. Nc3 O-O
2019.06.01	1-0	1181	1174	Ruy Lopez: Lucena Variation	1. e4 e5 2. Nf3 Nc6 3. Bb5 Be7 4. O-O Nf6
2019.06.01	0-1	1983	1921	Trompowsky Attack	1. d4 Nf6 2. Bg5 c5 3. d5 d6 4. Bxf6 exf6
2019.06.01	0-1	1056	1129	Center Game: von der Lasa Gambit	1. e4 e5 2. d4 exd4 3. Bc4 c5 4. e5 d6
2019.06.01	0-1	1238	1292	Three Knights Opening #2	1. e4 e5 2. Nf3 Nc6 3. Nc3 Bb4 4. d4 Bxc3+
2019.06.01	1-0	1521	1450	Slav Defense: Modern	1. d4 d5 2. c4 c6 3. Nf3 Nf6 4. g3 Bg4
2019.06.01	0-1	1358	1407	Queen's Gambit	1. d4 d5 2. c4 g6 3. e3 Bg7 4. Nf3 Nf6
2019.06.01	1-0	1901	1911	Ruy Lopez: Morphy Defense, Caro Variation	1. e4 e5 2. Nf3 Nc6 3. Bb5 a6 4. Ba4 b5
2019.06.01	1-0	1778	1733	Indian Game: London System	1. d4 e6 2. Nf3 Nf6 3. Bf4 c5 4. e3 cxd4
2019.06.01	0-1	1036	1035	Italian Game	1. e4 e5 2. Nf3 Nc6 3. Bc4 d6 4. d3 g6
2019.06.01	1-0	2093	1798	Zukertort Opening: Black Mustang Defense	1. Nf3 Nc6 2. c4 b6 3. Nc3 Bb7 4. d4 f6
2019.06.01	0-1	1186	1405	Four Knights Game: Italian Variation	1. e4 e5 2. Nc3 Nc6 3. Nf3 Nf6 4. Bc4 Nxe4
2019.06.01	1-0	1193	1210	Scotch Game	1. e4 e5 2. Nf3 Nc6 3. d4 f6 4. d5 Nd4
2019.06.01	0-1	1719	1673	English Opening: King's English Variation, Reversed Sicilian	1. c4 e5 2. Nc3 f5 3. e3 Nf6 4. g3 Bb4
2019.06.01	1-0	1994	2036	Sicilian Defense: Lasker-Pelikan Variation, Exchange Variation	1. e4 c5 2. Nf3 Nc6 3. d4 cxd4 4. Nxd4 Nf6
2019.06.01	1-0	1229	1224	Queen's Pawn	1. d4 d6 2. e3 e6 3. Nf3 Nf6 4. c3 c6
2019.06.01	0-1	1788	1775	Queen's Pawn Game: Mason Attack	1. d4 d5 2. Bf4 Nf6 3. e3 e6 4. Nf3 Bd6
2019.06.01	1-0	1013	998	Italian Game: Two Knights Defense, Polerio Defense, Bishop Check Line	1. e4 e5 2. Nf3 Nc6 3. Bc4 Nf6 4. Ng5 d5
2019.06.01	1-0	1654	1636	Queen's Gambit Declined: Semi-Tarrasch Defense, Pillsbury Variation	1. d4 e6 2. c4 d5 3. Nc3 Nf6 4. Nf3 c5
2019.06.01	1-0	1601	1619	Owen Defense: Smith Gambit	1. e4 b6 2. Nf3 Bb7 3. d4 e6 4. Nc3 Bb4
2019.06.01	1-0	1586	1456	Sicilian Defense: Old Sicilian	1. e4 c5 2. Nf3 Nc6 3. Nc3 Nf6 4. e5 Ng4
2019.06.01	0-1	1064	1110	French Defense: Knight Variation	1. e4 e6 2. Nf3 d5 3. exd5 Qxd5 4. Nc3 Qd8
2019.06.01	0-1	1772	1813	Queen's Gambit Accepted	1. d4 d5 2. c4 dxc4 3. Nc3 Bd7 4. e4 b5
2019.06.01	0-1	1545	1675	Bird Opening	1. f4 e6 2. Nf3 Nc6 3. e4 Nf6 4. e5 Nh5
2019.06.01	1-0	1762	1729	Polish Opening: Czech Defense	1. b4 e5 2. Bb2 d6 3. b5 Bd7 4. e3 Nf6
2019.06.01	0-1	928	870	Van't Kruijs Opening	1. e3 e5 2. f4 d6 3. Bd3 Nc6 4. Be4 Bd7
2019.06.01	0-1	1388	1402	Caro-Kann Defense: Breyer Variation	1. e4 c6 2. d3 e6 3. Nf3 d5 4. exd5 cxd5
2019.06.01	1-0	1335	1324	Duras Gambit	1. e4 f5 2. e5 d6 3. f4 dxe5 4. fxe5 e6
2019.06.01	1-0	935	932	Van't Kruijs Opening	1. e3 d5 2. Qf3 e6 3. c4 c6 4. cxd5 cxd5
2019.06.01	1-0	1472	1467	King's Gambit Declined, Queen's Knight Defense	1. e4 e5 2. f4 Nc6 3. Nf3 d6 4. Bc4 Nf6
2019.06.01	1-0	1359	1351	Philidor Defense #3	1. e4 e5 2. Nf3 d6 3. Bc4 Nc6 4. c3 a6
2019.06.01	1-0	1248	1228	Slav Defense: Schlechter Variation	1. d4 d5 2. c4 c6 3. Nc3 Nf6 4. Nf3 g6
2019.06.01	1-0	1215	1128	Italian Game	1. e4 Nc6 2. Nf3 e5 3. Bc4 f6 4. O-O Nge7
2019.06.01	1-0	1626	1720	Ruy Lopez: Classical Variation	1. e4 e5 2. Nf3 Nc6 3. Bb5 Bc5 4. O-O d6
2019.06.01	1-0	1552	1581	Indian Game: Wade-Tartakower Defense	1. d4 d6 2. Nf3 Nf6 3. Bf4 Nc6 4. e3 e6
2019.06.01	0-1	1453	1444	Sicilian Defense: Accelerated Dragon, Modern Variation	1. e4 c5 2. Nc3 Nc6 3. Nf3 g6 4. d4 cxd4
2019.06.01	1-0	843	969	Dutch Defense	1. d4 f5 2. e3 Nf6 3. Nh3 b6 4. Ng5 Bb7
2019.06.01	0-1	1078	1078	English Opening: King's English Variation	1. c4 e5 2. e3 Nf6 3. Qc2 Nc6 4. Ne2 Bb4
2019.06.01	1-0	1503	1483	King's Indian Defense: 3.Nc3	1. d4 Nf6 2. c4 g6 3. Nc3 d6 4. e3 Bg7
2019.06.01	1-0	1063	1040	English Opening: King's English Variation, Two Knights Variation	1. c4 Nf6 2. Nc3 e5 3. e4 Nc6 4. d3 Bb4
2019.06.01	0-1	1424	1418	Caro-Kann Defense: Advance Variation, Short Variation	1. e4 c6 2. d4 d5 3. e5 Bf5 4. Nf3 e6
2019.06.01	1-0	1331	1365	English Opening: Anglo-Indian Defense	1. c4 Nf6 2. g3 Nc6 3. Bg2 d6 4. Nf3 Be6
2019.06.01	0-1	1246	1251	King's Pawn Game	1. e4 e5
2019.06.01	1-0	1732	1701	Sicilian Defense: Closed Variation	1. e4 c5 2. Nc3 d6 3. Bb5+ Bd7 4. Nf3 Nc6
2019.06.01	0-1	951	1346	Van't Kruijs Opening	1. e3 e5 2. Nc3 f5 3. Nce2 Nf6 4. Rb1 Bc5
2019.06.01	1-0	1011	985	Nimzowitsch Defense	1. e4 Nc6 2. Bc4 Nh6 3. d3 e6 4. Nf3 Bc5
2019.06.01	1-0	1542	1447	Van't Kruijs Opening	1. e3 e5 2. c4 Nf6 3. Nc3 Bc5 4. d3 O-O
2019.06.01	1/2-1/2	2239	1999	Queen's Gambit Declined: Exchange Variation	1. d4 d5 2. c4 Nf6 3. Nc3 e6 4. cxd5 Nxd5
2019.06.01	0-1	1351	1710	Four Knights Game	1. e4 e5 2. Nc3 Nc6 3. Nf3 Nf6 4. d3 Bb4
2019.06.01	1-0	1590	1557	Caro-Kann Defense: Exchange Variation	1. e4 c6 2. d4 d5 3. exd5 cxd5 4. Be2 Nf6
2019.06.01	0-1	1436	1473	English Opening: Symmetrical Variation	1. c4 c5 2. d4 e6 3. dxc5 Bxc5 4. Nc3 Nf6
2019.06.01	0-1	1644	1678	Modern Defense	1. d4 g6 2. Bf4 Bg7 3. Nf3 b6 4. e3 Bb7
2019.06.01	1-0	1905	1923	Owen Defense	1. e4 b6 2. Nf3 Bb7 3. Bd3 e6 4. Qe2 Nf6
2019.06.01	0-1	996	1020	English Opening: Symmetrical Variation	1. c4 c5 2. g3 e6 3. Bg2 Nc6 4. Nf3 d5
2019.06.01	1-0	1863	1853	Old Benoni Defense	1. d4 c5 2. c4 cxd4 3. Qxd4 Nc6 4. Qd2 Nf6
2019.06.01	1-0	2160	1940	Italian Game: Giuoco Pianissimo	1. e4 e5 2. Nf3 Nc6 3. Bc4 Bc5 4. d3 d6
2019.06.01	0-1	1129	1166	Bird Opening: Williams Gambit	1. e4 d5 2. f4 dxe4 3. Nf3 Nf6 4. Ng5 Bg4
2019.06.01	1-0	1454	1399	Russian Game: Urusov Gambit	1. e4 e5 2. Nf3 Nf6 3. Bc4 Bc5 4. Nxe5 O-O
2019.06.01	0-1	1739	1755	Caro-Kann Defense	1. e4 c6 2. Nf3 d5 3. e5 e6 4. d4 Ne7
2019.06.01	1-0	1294	1352	French Defense: Knight Variation	1. e4 e6 2. Nf3 d6 3. e5 Nd7 4. exd6 cxd6
2019.06.01	1/2-1/2	2014	1927	Bird Opening: Dutch Variation	1. f4 d5 2. d3 e6 3. Nc3 f5 4. e4 Nf6
2019.06.01	0-1	1363	1499	Yusupov-Rubinstein System	1. d4 Nf6 2. e3 e6 3. Nf3 Nc6 4. a3 d6
2019.06.01	1-0	1761	1721	King's Gambit Declined, Queen's Knight Defense	1. e4 Nc6 2. f4 e5 3. f5 Bc5 4. Nf3 d5
2019.06.01	1-0	1802	1757	King's Pawn Game: Leonardis Variation	1. e4 e5 2. d3 Nc6 3. f4 exf4 4. Bxf4 g5
2019.06.01	0-1	1480	2108	French Defense	1. d4 d5 2. e4 e6 3. Bf4 dxe4 4. Nc3 Bd6
2019.06.01	0-1	1446	1448	Center Game: Normal Variation	1. e4 e5 2. d4 exd4 3. Qxd4 Nc6 4. Qd1 d6
2019.06.01	0-1	1924	1784	French Defense: Exchange Variation	1. e4 e6 2. d4 d5 3. exd5 Qxd5 4. c4 Qd8
2019.06.01	0-1	1498	1427	Sicilian Defense: Nyezhmetdinov-Rossolimo Attack	1. e4 c5 2. Nf3 Nc6 3. Bb5 a6 4. Ba4 b5
2019.06.01	0-1	1328	1378	Italian Game: Classical Variation, Giuoco Pianissimo	1. e4 e5 2. Nf3 Nc6 3. Bc4 Nf6 4. d3 Bc5
2019.06.01	1-0	1902	1900	Nimzowitsch Defense	1. e4 Nc6 2. f4 e6 3. Nf3 Be7 4. d4 d5
2019.06.01	0-1	1972	2079	Robatsch (Modern) Defense	1. e4 g6 2. d4 Bg7 3. e5 d6 4. f4 c5
2019.06.01	1-0	1779	1792	Petrov's Defense	1. e4 e5 2. Nf3 Nf6 3. d3 d6 4. Nc3 c6
2019.06.01	0-1	2152	2170	Indian Game: Tartakower Attack	1. d4 Nf6 2. g3 c6 3. Bg2 d5 4. Nf3 Bf5
2019.06.01	0-1	1620	1659	Sicilian Defense	1. e4 c5 2. f3 Nc6 3. Ne2 e6 4. d4 cxd4
2019.06.01	1-0	1534	1578	Queen's Gambit Refused: Austrian Defense	1. d4 c5 2. c4 d5 3. e3 e6 4. Nc3 cxd4
2019.06.01	1-0	1962	1906	Sicilian Defense: Lasker-Pelikan Variation	1. e4 c5 2. Nf3 Nc6 3. d4 cxd4 4. Nxd4 Nf6
2019.06.01	1-0	1516	1516	Scotch Game: Schmidt Variation	1. e4 e5 2. Nf3 Nc6 3. d4 exd4 4. Nxd4 Nf6
2019.06.01	1-0	1758	1756	Englund Gambit Declined, Reversed Krebs	1. d4 e5 2. Nf3 e4 3. Nfd2 d5 4. e3 Nf6
2019.06.01	0-1	1829	1855	Ruy Lopez: Steinitz Defense	1. e4 e5 2. Nf3 Nc6 3. Bb5 d6 4. c3 Be6
2019.06.01	1-0	1224	1084	Modern Defense	1. d4 g6 2. c4 Bg7 3. e3 e6 4. Nf3 Ne7
2019.06.01	0-1	1122	1127	Philidor Defense #2	1. e4 e5 2. Nf3 d6 3. Nc3 Bg4 4. Bc4 Nc6
2019.06.01	1-0	1744	1774	Pirc Defense: Classical Variation	1. e4 g6 2. d4 Bg7 3. Nf3 d6 4. Nc3 Nf6
2019.06.01	1-0	1186	1207	Modern Defense	1. d4 g6 2. d5 Nf6 3. Nc3 e6 4. e4 Bb4
2019.06.01	0-1	1543	1503	Bishop's Opening	1. e4 e5 2. Bc4 Nc6 3. Qf3 Qf6 4. d3 Nd4
2019.06.01	1-0	2107	2007	Sicilian Defense: Loewenthal Variation	1. e4 c5 2. Nf3 Nc6 3. d4 cxd4 4. Nxd4 e5
2019.06.01	1-0	855	937	Alekhine Defense	1. e4 Nf6 2. e5 Ng4 3. d4 f6 4. Nf3 d6
2019.06.01	0-1	1229	1244	Horwitz Defense	1. d4 e6 2. a3 Nf6 3. Nc3 g6 4. e4 Bg7
2019.06.01	0-1	1227	1160	Van't Kruijs Opening	1. e3 e5 2. Bc4 Nf6 3. c3 Bc5 4. Qb3 O-O
2019.06.01	1-0	1336	1292	Modern Defense	1. e4 g6 2. Bc4 Bg7 3. Qf3 e6 4. Nh3 h6
2019.06.01	1/2-1/2	1041	943	Pirc Defense #4	1. e4 d6 2. Nc3 Nf6 3. Nf3 Bg4 4. Bc4 c6
2019.06.01	1-0	1086	960	Queen's Pawn	1. d4 d6 2. Bg5 f6 3. Bh4 e5 4. dxe5 dxe5
2019.06.01	1-0	1521	1519	French Defense: Two Knights Variation	1. e4 e6 2. Nc3 d5 3. Nf3 dxe4 4. Nxe4 Nf6
2019.06.01	0-1	1110	1090	Alekhine Defense: Krejcik Variation	1. e4 Nf6 2. Bc4 Nc6 3. Nc3 d6 4. h3 e5
2019.06.01	1-0	1868	1821	Carr Defense	1. e4 h6 2. Nc3 e6 3. d4 Ne7 4. Nf3 a6
2019.06.01	1-0	1996	2081	Sicilian Defense: Kan Variation, Knight Variation	1. e4 c5 2. Nf3 e6 3. d4 cxd4 4. Nxd4 a6
2019.06.01	0-1	1324	1365	English Opening: Anglo-Indian Defense	1. c4 Nf6 2. g3 g6 3. Bg2 Bg7 4. Nc3 d6
2019.06.01	0-1	1739	1768	Queen's Pawn Game: Mason Attack	1. d4 d5 2. Bf4 Nc6 3. e3 Nf6 4. Bd3 e6
2019.06.01	0-1	1729	1859	Dutch Defense	1. d4 f5 2. c4 d6 3. Bg5 Nd7 4. Nc3 Ngf6
2019.06.01	0-1	1685	1683	French Defense: Knight Variation	1. e4 e6 2. Nf3 c6 3. d4 d5 4. e5 c5
2019.06.01	1-0	1293	1304	King's Pawn Game: Macleod Attack	1. e4 e5 2. c3 c6 3. d4 d5 4. Nf3 dxe4
2019.06.01	1/2-1/2	1826	1870	Horwitz Defense	1. d4 e6 2. Bf4 d5 3. e3 c5 4. c3 Nc6
2019.06.01	1-0	1030	981	Van Geet Opening	1. Nc3 Nc6 2. Nf3 e6 3. d4 d5 4. e4 e5
2019.06.01	1-0	1584	1531	Robatsch (Modern) Defense	1. e4 g6 2. d4 Bg7 3. c3 h5 4. Be3 a6
2019.06.01	0-1	1246	1244	St. George Defense: Polish Variation	1. e4 e6 2. Nf3 a6 3. d4 b5 4. Bd3 Bb7
2019.06.01	1-0	1453	1468	Bird Opening	1. f4 Nf6 2. Nf3 d5 3. e3 e6 4. Be2 Bd6
2019.06.01	1-0	1099	1205	Van't Kruijs Opening	1. e3 d5 2. f4 g6 3. c4 Be6 4. Na3 Bg7
2019.06.01	1-0	1048	1094	Sicilian Defense: Smith-Morra Gambit #2	1. e4 c5 2. d4 cxd4 3. Qxd4 Nc6 4. Qd1 Nf6
2019.06.01	1-0	1196	1198	Scandinavian Defense: Mieses-Kotroc Variation	1. e4 d5 2. exd5 Qxd5 3. Nc3 Qe6+ 4. Be2 Nf6
2019.06.01	0-1	1799	1771	Slav Defense: Quiet Variation, Pin Defense	1. d4 Nf6 2. c4 d5 3. e3 c6 4. Nf3 Bg4
2019.06.01	0-1	2182	2307	King's Indian Attack: Symmetrical Defense	1. Nf3 Nf6 2. g3 g6 3. Bg2 d6 4. O-O Bg7
2019.06.01	1-0	1233	1290	Center Game: Lanc-Arnold Gambit, Schippler Gambit	1. e4 e5 2. d4 exd4 3. c3 Bc5 4. Bc4 dxc3
2019.06.01	1-0	1921	1917	King's Pawn	1. e4
2019.06.01	1/2-1/2	2017	1992	English Opening: Caro-Kann Defensive System	1. c4 c6 2. Nc3 d6 3. b3 e5 4. Bb2 f5
2019.06.01	0-1	1342	1360	Bishop's Opening	1. e4 e5 2. Bc4 Bb4 3. Nf3 d6 4. a3 Ba5
2019.06.01	1-0	1847	1834	Horwitz Defense	1. d4 e6 2. Bf4 f5 3. Nf3 Nf6 4. e3 Bb4+
2019.06.01	1-0	1520	1508	Three Knights Opening	1. e4 e5 2. Nf3 Nc6 3. Nc3 d6 4. Bb5 Bg4
2019.06.01	1-0	1663	1671	Horwitz Defense	1. d4 e6 2. g3 Nf6 3. Bg2 d5 4. Nf3 c5
2019.06.01	1-0	1643	1601	Sicilian Defense: McDonnell Attack	1. e4 c5 2. f4 e6 3. Nf3 Nf6 4. e5 Nd5
2019.06.01	0-1	1120	1148	Four Knights Game: Italian Variation	1. e4 Nf6 2. Nc3 Nc6 3. Nf3 e5 4. Bc4 h6
2019.06.01	1-0	1680	1703	Sicilian Defense: Smith-Morra Gambit	1. e4 c5 2. d4 cxd4 3. c3 dxc3 4. Nxc3 e6
2019.06.01	0-1	1619	1657	Queen's Gambit Accepted: Old Variation	1. d4 d5 2. c4 dxc4 3. e3 Nf6 4. Bxc4 Bg4
2019.06.01	0-1	1330	1339	Modern Defense	1. d4 g6 2. c4 Bg7 3. Nf3 Nf6 4. Nc3 d6
2019.06.01	0-1	1255	1208	Bird Opening: Dutch Variation	1. f4 d5 2. Nf3 Nf6 3. d4 Bg4 4. Nc3 Bxf3
2019.06.01	0-1	1600	1592	Horwitz Defense	1. d4 e6 2. Nf3 c5 3. c3 Qa5 4. dxc5 Bxc5
2019.06.01	1/2-1/2	1502	1503	Hungarian Opening	1. g3 d5 2. Bg2 Nf6 3. Nf3 c6 4. O-O Bf5
2019.06.01	1-0	1810	1795	Modern Defense	1. d4 g6 2. Bf4 Bg7 3. Nc3 d6 4. e4 Nc6
2019.06.01	0-1	1375	1419	Italian Game: Classical Variation #2	1. e4 e5 2. Nf3 Nc6 3. Bc4 Bc5 4. c3 d6
2019.06.01	1-0	1984	1922	Rat Defense: Accelerated Gurgenidze	1. e4 d6 2. d4 c6 3. Nc3 g6 4. f4 Bg7
2019.06.01	1-0	1476	1465	Caro-Kann Defense	1. e4 c6 2. Nf3 d5 3. e5 Bg4 4. d4 e6
2019.06.01	1-0	1555	1570	Indian Game	1. d4 Nf6 2. Bf4 d6 3. e3 Nc6 4. h3 b6
2019.06.01	1-0	1657	1646	King's Gambit Accepted, Bishop's Gambit, Maurian Defense	1. e4 e5 2. f4 exf4 3. Bc4 Nc6 4. d4 g5
2019.06.01	1-0	1734	1753	Sicilian Defense: Accelerated Dragon, Modern Bc4 Variation	1. e4 c5 2. Nf3 Nc6 3. Bc4 g6 4. d4 cxd4
2019.06.01	0-1	879	1011	Scandinavian Defense	1. e4 d5 2. f3 d4 3. d3 e5 4. Nh3 h6
2019.06.01	1-0	1692	1887	Lion Defense: Lion's Jaw	1. e4 d6 2. d4 Nf6 3. f3 e5 4. d5 Be7
2019.06.01	0-1	2045	2028	Slav Defense #2	1. d4 d5 2. c4 c6 3. Nc3 Nf6 4. e4 dxe4
2019.06.01	1-0	1475	1419	Italian Game: Two Knights Defense, Modern Bishop's Opening	1. e4 e5 2. Nf3 Nc6 3. Bc4 Nf6 4. d3 Bb4+
2019.06.01	1-0	1377	1310	Van't Kruijs Opening	1. e3 e5 2. Qf3 Nf6 3. Nc3 Nc6 4. b3 Nb4
2019.06.01	1-0	1663	1645	Philidor Defense	1. e4 e5 2. Nf3 d6 3. d4 Nc6 4. dxe5 Nxe5
2019.06.01	1-0	1238	1116	Queen's Pawn Game #2	1. d4 d5 2. e3 Bf5 3. Nf3 e6 4. Bd3 Bg6
2019.06.01	1-0	1111	1112	Scotch Game	1. e4 e5 2. Nf3 Nc6 3. d4 d5 4. Nxe5 Bb4+
2019.06.01	0-1	2073	2074	Benoni Defense: Old Benoni	1. d4 c5 2. d5 d6 3. c4 g6 4. Nc3 Bg7
2019.06.01	1-0	1550	1609	Modern Defense	1. d4 g6 2. Nf3 Bg7 3. Nc3 f5 4. e4 d6
2019.06.01	1/2-1/2	943	1003	Scandinavian Defense	1. e4 d5 2. e5 Nc6 3. Nf3 e6 4. d4 Be7
2019.06.01	1/2-1/2	1519	1536	Ruy Lopez: Morphy Defense, Classical Defense Deferred	1. e4 e5 2. Nf3 Nc6 3. Bb5 a6 4. Ba4 Bc5
2019.06.01	1-0	1892	1941	Alekhine Defense: Scandinavian Variation, Geschev Gambit	1. e4 d5 2. exd5 Nf6 3. Nc3 c6 4. Nf3 cxd5
2019.06.01	1-0	1372	1218	Horwitz Defense	1. d4 e6 2. Bf4 g6 3. e3 h6 4. h3 g5
2019.06.01	0-1	1650	1693	Italian Game	1. e4 e5 2. Nf3 Nc6 3. Bc4 d6 4. O-O Bg4
2019.06.01	0-1	1166	1190	Italian Game: Two Knights Defense, Modern Bishop's Opening	1. e4 e5 2. Nf3 Nc6 3. Bc4 Nf6 4. d3 d6
2019.06.01	1-0	1909	1900	Italian Game: Two Knights Defense, Modern Bishop's Opening	1. e4 e5 2. Nf3 Nc6 3. Bc4 Nf6 4. d3 h6
2019.06.01	0-1	1798	1798	Queen's Pawn Game: London System	1. d4 Nf6 2. Bf4 d5 3. Nf3 c5 4. e3 Nc6
2019.06.01	1-0	1219	1191	French Defense: Knight Variation	1. e4 e6 2. Nf3 d5 3. exd5 Qxd5 4. d4 c5
2019.06.01	1-0	1498	1515	Queen's Gambit Accepted: Saduleto Variation	1. d4 d5 2. c4 dxc4 3. e4 e6 4. Bxc4 Bb4+
2019.06.01	1-0	1443	1352	Bird Opening	1. f4 c5 2. Nf3 Nc6 3. e3 a5 4. Be2 a4
2019.06.01	1-0	1982	2063	Caro-Kann Defense: Karpov Variation	1. e4 c6 2. d4 d5 3. Nd2 dxe4 4. Nxe4 Nd7
2019.06.01	0-1	1580	1607	Robatsch (Modern) Defense	1. e4 g6 2. d4 Bg7 3. Nf3 e6 4. Bc4 Ne7
2019.06.01	1-0	1227	1228	English Opening: King's English Variation	1. c4 e5 2. d3 d6 3. g3 Be7 4. Bg2 Nf6
2019.06.01	0-1	1305	1285	Queen's Pawn	1. d4 h6 2. e4 d5 3. e5 f6 4. Nf3 fxe5
2019.06.01	1-0	1124	995	Russian Game: Urusov Gambit	1. e4 e5 2. Bc4 Nf6 3. Nf3 Nxe4 4. d3 d5
2019.06.01	1-0	1564	1562	Queen's Gambit Declined: Harrwitz Attack	1. d4 d5 2. c4 e6 3. Nc3 Nf6 4. Bf4 Bd6
2019.06.01	1-0	1833	1898	Modern Defense: Averbakh Variation	1. d4 d6 2. c4 g6 3. Nc3 Bg7 4. e4 Bxd4
2019.06.01	1-0	1869	1751	French Defense: King's Indian Attack	1. e4 e6 2. d3 d5 3. Bd2 dxe4 4. dxe4 Nf6
2019.06.01	0-1	1570	1648	French Defense: Normal Variation	1. e4 e6 2. d4 Ne7 3. Nf3 Ng6 4. Bd3 Be7
2019.06.01	0-1	1078	2094	French Defense: Advance Variation, Paulsen Attack	1. e4 e6 2. d4 d5 3. e5 c5 4. Nf3 Nc6
2019.06.01	1-0	2155	2313	Caro-Kann Defense: Panov Attack, Modern Defense, Mieses Line	1. e4 c6 2. d4 d5 3. exd5 cxd5 4. c4 Nf6
2019.06.01	1-0	1729	1526	Bird Opening	1. f4 Nf6 2. Nf3 d6 3. e3 Nc6 4. Be2 e5
2019.06.01	0-1	2011	2008	Old Benoni Defense	1. d4 c5 2. c3 Nf6 3. e3 g6 4. f4 Bg7
2019.06.01	1-0	1125	1144	Italian Game: Two Knights Defense, Knight Attack, Normal Variation	1. e4 e5 2. Nf3 Nc6 3. Bc4 Nf6 4. Ng5 d5
2019.06.01	1-0	1783	1783	Queen's Pawn	1. d4 c6 2. Nf3 d5 3. Bg5 Nf6 4. e3 Bg4
2019.06.01	0-1	1198	1175	Sicilian Defense	1. e4 c5 2. d3 d6 3. c4 Nf6 4. b3 g6
2019.06.01	0-1	1680	1644	English Opening: King's English Variation, Reversed Sicilian	1. c4 e5 2. Nc3 d6 3. d3 Be7 4. Bd2 Bf6
2019.06.01	1-0	1070	968	Hungarian Opening	1. g3 e5 2. Bg2 Nc6 3. Nf3 Nf6 4. O-O Bc5
2019.06.01	0-1	1729	1813	Horwitz Defense	1. d4 e6 2. c4 d6 3. Nc3 Nf6 4. Bg5 Be7
2019.06.01	1-0	2090	2263	French Defense: Two Knights Variation	1. e4 e6 2. Nf3 d5 3. Nc3 Nf6 4. e5 Nfd7
2019.06.01	1-0	1583	1526	Nimzowitsch Defense	1. e4 Nc6 2. Bc4 d6 3. Qh5 e6 4. Nf3 Ne5
2019.06.01	1-0	1898	1891	Bird Opening: From's Gambit	1. f4 e5 2. Nf3 d6 3. fxe5 Nc6 4. e4 Nxe5
2019.06.01	1-0	1750	1723	Three Knights Opening	1. e4 e5 2. Nf3 Nc6 3. Nc3 d6 4. d4 Bg4
2019.06.01	1/2-1/2	1479	1427	Pirc Defense #4	1. e4 d6 2. Nc3 Bd7 3. Nf3 Nc6 4. Bc4 Nf6
2019.06.01	0-1	1301	1380	Gunderam Defense	1. e4 e5 2. Nf3 Qe7 3. g3 Nf6 4. Nc3 b6
2019.06.01	1/2-1/2	1907	1952	French Defense: Exchange Variation, Monte Carlo Variation	1. e4 e6 2. d4 d5 3. exd5 exd5 4. c4 Be6
2019.06.01	1-0	1258	1262	Philidor Defense #3	1. e4 e5 2. Nf3 d6 3. Bc4 Nc6 4. d3 Nf6
2019.06.01	1-0	1520	1514	Slav Defense: Quiet Variation, Schallopp Defense	1. d4 c6 2. c4 d5 3. e3 Nf6 4. Nf3 Bf5
