Date	Result	WhiteElo	BlackElo	Opening	Moves
2018.12.31	1-0	1269	1263	Slav Defense: Exchange Variation	1. d4 c6 2. c4 d5 3. cxd5 cxd5 4. Nc3 Nc6
2018.12.31	1-0	1445	1342	Sicilian Defense: Old Sicilian	1. e4 c5 2. Nf3 Nc6 3. Nc3 Nf6 4. Bc4 e6
2018.12.31	1-0	1013	1000	French Defense: Knight Variation	1. e4 e6 2. Nf3 d6 3. Nc3 f5 4. e5 dxe5
2018.12.31	1-0	1137	1047	French Defense: Knight Variation	1. e4 e6 2. Nf3 d5 3. exd5 exd5 4. d3 Bf5
2018.12.31	1-0	1500	1684	Zukertort Opening: Queen's Gambit Invitation	1. Nf3 e6 2. d4 d5 3. Bg5 Nf6 4. Bxf6 Qxf6
2018.12.31	0-1	1892	1875	Queen's Pawn Game	1. d4 d5 2. g3 Nf6 3. Bg2 e6 4. Nf3 Bd6
2018.12.31	1-0	1669	1686	Slav Defense: Exchange Variation	1. d4 d5 2. c4 c6 3. cxd5 cxd5 4. Nc3 Nc6
2018.12.31	1-0	1413	1390	Nimzowitsch Defense: Mikenas Variation	1. e4 d6 2. d4 Nc6 3. Be3 Nf6 4. Nc3 e5
2018.12.31	1-0	1170	1048	Queen's Pawn Opening: Veresov, Richter Attack	1. d4 Nf6 2. Nc3 d5 3. f3 Nc6 4. e4 e5
2018.12.31	0-1	1582	1624	Center Game: Normal Variation	1. e4 e5 2. d4 exd4 3. Qxd4 Nc6 4. Qc3 Bb4
2018.12.31	0-1	1564	1545	Bishop's Opening: Berlin Defense	1. e4 e5 2. Bc4 Nf6 3. d3 Be7 4. h4 O-O
2018.12.31	0-1	1763	1826	Sicilian Defense: Old Sicilian	1. e4 c5 2. Nf3 Nc6 3. Bc4 Nf6 4. e5 Ng4
2018.12.31	0-1	1230	1240	English Orangutan	1. b4 Nf6 2. c4 d5 3. e3 c6 4. Nc3 Bf5
2018.12.31	1-0	849	800	Queen's Pawn Game: Zukertort Variation	1. d4 d5 2. Nf3 f6 3. g3 e5 4. dxe5 fxe5
2018.12.31	1-0	1272	1253	Sicilian Defense: Najdorf Variation, Adams Attack	1. e4 c5 2. Nf3 d6 3. Nc3 Nf6 4. d4 cxd4
2018.12.31	1-0	1477	1477	Caro-Kann Defense	1. e4 c6 2. f4 d6 3. Nf3 Nd7 4. Bc4 e6
2018.12.31	1-0	1614	1608	Alekhine Defense: Scandinavian Variation	1. e4 Nf6 2. Nc3 d5 3. e5 Ne4 4. Nf3 Nxc3
2018.12.31	1-0	1767	1809	Queen's Pawn Game: Mason Attack	1. d4 d5 2. Bf4 Nc6 3. Nc3 Nf6 4. Qd3 h6
2018.12.31	0-1	1084	1190	Queen's Pawn Game: Chigorin Variation	1. d4 d5 2. Nf3 Nc6 3. Bf4 e6 4. e3 Nf6
2018.12.31	1-0	1609	1719	Italian Game: Schilling-Kostic Gambit	1. e4 e5 2. Nf3 Nc6 3. Bc4 Nd4 4. O-O d6
2018.12.31	0-1	978	948	Sicilian Defense: Closed Variation, Traditional	1. e4 c5 2. Nc3 Nc6 3. Qf3 e5 4. Bc4 Nh6
2018.12.31	1-0	1627	1483	Caro-Kann Defense: Modern Variation	1. d4 d5 2. Nd2 c6 3. e4 g6 4. Ngf3 Bg7
2018.12.31	1-0	1308	1183	Nimzo-Larsen Attack: Modern Variation #3	1. b3 e5 2. Bb2 Nc6 3. Nf3 Qe7 4. e3 d5
2018.12.31	1-0	1433	1373	Slav Defense: Slav Gambit, Alekhine Attack	1. d4 d5 2. c4 dxc4 3. Nc3 c6 4. e4 b5
2018.12.31	0-1	1872	2056	French Defense: Knight Variation	1. e4 e6 2. Nf3 d6 3. Nc3 Ne7 4. d4 Nd7
2018.12.31	1-0	1184	1254	Horwitz Defense	1. d4 e6 2. Bf4 Qh4 3. e3 Qf6 4. Nc3 g5
2018.12.31	0-1	1811	1907	Sicilian Defense: McDonnell Attack	1. e4 c5 2. f4 a6 3. Nf3 e6 4. d3 d6
2018.12.31	0-1	2049	2009	King's Indian Attack: French Variation	1. Nf3 d5 2. g3 c5 3. Bg2 Nc6 4. O-O Bg4
2018.12.31	1-0	1500	1528	Modern Defense	1. d4 g6 2. Nf3 Bg7 3. Bf4 d6 4. e3 Nf6
2018.12.31	1-0	1917	1959	French Defense: Steinitz Variation, Boleslavsky Variation	1. e4 e6 2. d4 d5 3. Nc3 Nf6 4. e5 Nfd7
2018.12.31	1-0	844	1001	Alekhine Defense: Mokele Mbembe	1. e4 Nf6 2. e5 Ne4 3. d3 d5 4. dxe4 dxe4
2018.12.31	0-1	1192	1237	French Defense: Knight Variation	1. e4 e6 2. Nf3 Nf6 3. e5 Ng4 4. d4 c5
2018.12.31	0-1	1295	1241	Borg Defense	1. e4 g5 2. Nf3 g4 3. Nh4 Bg7 4. Nf5 Bf6
2018.12.31	1-0	1813	1795	French Defense: Two Knights Variation	1. e4 e6 2. Nf3 d5 3. Nc3 d4 4. Ne2 c5
2018.12.31	0-1	1363	1406	King's Pawn Game: Napoleon Attack	1. e4 e5 2. Qf3 Nc6 3. Bc4 Qf6 4. Qxf6 Nxf6
2018.12.31	1-0	1324	1351	Modern Defense	1. d4 g6 2. e4 d6 3. e5 dxe5 4. dxe5 Bg7
2018.12.31	1-0	1709	1740	Alekhine Defense: John Tracy Gambit	1. e4 Nf6 2. Nf3 Nxe4 3. d3 Nf6 4. Nc3 e6
2018.12.31	1-0	1888	1888	King's Pawn Game: King's Head Opening #2	1. f3 e5 2. e4 d5 3. Nc3 f5 4. exd5 e4
2018.12.31	0-1	1135	1226	Center Game: Normal Variation	1. e4 e5 2. d4 exd4 3. Qxd4 Nc6 4. Qd5 d6
2018.12.31	1-0	1865	1812	Scandinavian Defense: Anderssen Counterattack	1. e4 d5 2. exd5 Qxd5 3. Nc3 Qa5 4. d4 e5
2018.12.31	0-1	1030	1086	Sicilian Defense: Modern Variations, Anti-Qxd4 Move Order Accepted	1. e4 c5 2. Nf3 d6 3. d4 Nf6 4. dxc5 Nxe4
2018.12.31	1-0	818	992	Four Knights Game: Scotch Variation	1. e4 e5 2. Nf3 Nc6 3. Nc3 Nf6 4. d4 Bb4
2018.12.31	0-1	1486	1475	Old Benoni Defense	1. d4 c5 2. Nf3 Qb6 3. dxc5 Qxc5 4. Nc3 e6
2018.12.31	0-1	1425	1336	Queen's Pawn Game: Symmetrical Variation	1. d4 d5 2. Nf3 Nf6 3. Nc3 g6 4. Bf4 Bg7
2018.12.31	1-0	1724	1662	Sicilian Defense: Smith-Morra Gambit	1. e4 c5 2. d4 cxd4 3. c3 Nc6 4. Nf3 d5
2018.12.31	0-1	1932	1729	Zukertort Opening: Queenside Fianchetto Variation	1. Nf3 b6 2. g3 Bb7 3. Bg2 Nc6 4. O-O e6
2018.12.31	0-1	1598	1571	Queen's Pawn Game: Mason Attack	1. d4 d5 2. Bf4 Bf5 3. e3 e6 4. c4 Bd6
2018.12.31	0-1	1268	1309	Sicilian Defense: Open	1. e4 c5 2. Nf3 Nc6 3. d4 g6 4. d5 Nb4
2018.12.31	0-1	1601	1582	Queen's Gambit Accepted	1. d4 d5 2. c4 dxc4 3. Nc3 e6 4. Nf3 Bb4
2018.12.31	0-1	1339	1330	French Defense: Steinitz Attack	1. e4 e6 2. e5 c5 3. f4 f6 4. Nf3 d5
2018.12.31	0-1	1186	1228	English Opening: King's English Variation, Reversed Sicilian	1. c4 e5 2. Nc3 c5 3. Nf3 d6 4. g3 Be6
2018.12.31	0-1	1572	1543	Horwitz Defense	1. d4 e6 2. c4 d6 3. Nf3 h6 4. Nc3 a6
2018.12.31	0-1	1128	1101	Nimzowitsch Defense: Kennedy Variation, Linksspringer Variation	1. e4 e5 2. d4 Nc6 3. d5 Nd4 4. f4 exf4
2018.12.31	1-0	1348	1404	Benoni Defense: Benoni Gambit Accepted	1. d4 c5 2. dxc5 Qa5+ 3. c3 Qxc5 4. e4 Nf6
2018.12.31	0-1	841	1097	Indian Game	1. d4 Nf6 2. Nc3 e6 3. Bf4 d5 4. e3 b6
2018.12.31	1-0	1739	1866	Sicilian Defense: Scheveningen Variation	1. e4 c5 2. Nf3 d6 3. Nc3 e6 4. d4 cxd4
2018.12.31	1-0	1621	1768	Zukertort Opening: Wade Defense	1. e4 d6 2. Nf3 Bg4 3. h3 Bxf3 4. Qxf3 Nf6
2018.12.31	1-0	1294	1239	Horwitz Defense	1. d4 e6 2. c4 a6 3. Nc3 Bb4 4. Nf3 Bxc3+
2018.12.31	1-0	1855	1852	Queen's Pawn	1. d4 c6 2. c4 g6 3. e4 Nf6 4. Nc3 Bg7
2018.12.31	1-0	1522	1433	Sicilian Defense	1. e4 c5 2. Qh5 Nc6 3. Qxc5 e6 4. Qe3 Nf6
2018.12.31	0-1	1783	1510	Bishop's Opening: Berlin Defense	1. e4 e5 2. Bc4 Nf6 3. d3 d6 4. h3 h6
2018.12.31	1-0	1444	1459	Queen's Pawn Game: Levitsky Attack	1. d4 d5 2. Bg5 c5 3. dxc5 Qa5+ 4. Nc3 Qxc5
2018.12.31	1-0	1789	1827	Van Geet Opening: Reversed Nimzowitsch	1. Nc3 e5 2. Nf3 e4 3. Nxe4 d5 4. Nc3 Nf6
2018.12.31	1-0	1040	1073	Queen's Gambit Declined: Normal Defense	1. d4 d5 2. c4 Nf6 3. Nc3 e6 4. f3 Bb4
2018.12.31	0-1	1605	1606	Old Benoni Defense	1. d4 c5 2. e3 cxd4 3. Qxd4 Nc6 4. Qd1 Nf6
2018.12.31	1-0	1840	1669	Grob Opening: Grob Gambit	1. g4 d5 2. Bg2 Nc6 3. c4 dxc4 4. Nc3 Bxg4
2018.12.31	1-0	1715	1726	King's Pawn Game	1. e4 e5 2. Be2 Nc6 3. f4 exf4 4. Nf3 Nge7
2018.12.31	1-0	1383	1239	Caro-Kann Defense	1. e4 c6 2. d4 e6 3. Nf3 Nf6 4. Nc3 Na6
2018.12.31	1-0	1686	1631	English Opening: Symmetrical Variation, Normal Variation	1. c4 c5 2. Nc3 d6 3. Nf3 Nc6 4. d3 Nf6
2018.12.31	1-0	1524	1561	Philidor Defense #3	1. e4 e5 2. Nf3 d6 3. Bc4 Be6 4. Bxe6 fxe6
2018.12.31	0-1	1500	1421	Ware Defense	1. e4 a5 2. d4 Ra6 3. Ke2 b6 4. c3 e6
2018.12.31	1-0	957	993	Queen's Pawn Game: Symmetrical Variation	1. d4 d5 2. Nf3 Nf6 3. Nc3 e6 4. g3 Bd6
2018.12.31	1-0	1624	1623	French Defense: Exchange Variation	1. e4 e6 2. d4 d5 3. exd5 exd5 4. Bd3 Nf6
2018.12.31	0-1	1066	1080	King's Pawn Game: Damiano Defense	1. e4 e5 2. Nf3 f6 3. b4 Nc6 4. c3 a6
2018.12.31	1-0	1137	1086	King's Pawn Game: Wayward Queen Attack	1. e4 e5 2. Qh5 Nc6 3. Bc4 Qf6 4. d4 exd4
2018.12.31	0-1	2009	2047	Philidor Defense: Exchange Variation	1. e4 e5 2. Nf3 d6 3. d4 exd4 4. Nxd4 Nf6
2018.12.31	0-1	2019	2083	Sicilian Defense: Lasker-Pelikan Variation, Sveshnikov Variation, Chelyabinsk Variation	1. e4 c5 2. Nf3 Nc6 3. d4 cxd4 4. Nxd4 Nf6
2018.12.31	0-1	1221	1199	Sicilian Defense: Old Sicilian	1. e4 c5 2. Nf3 Nc6 3. Bc4 d6 4. Ng5 e6
2018.12.31	0-1	1084	1009	Sicilian Defense: Smith-Morra Gambit #2	1. e4 c5 2. d4 Nc6 3. dxc5 Nf6 4. Bd3 e5
2018.12.31	1-0	1438	1495	Scandinavian Defense: Mieses-Kotroc Variation	1. e4 d5 2. exd5 Qxd5 3. Nc3 Qd8 4. d4 Nf6
2018.12.31	1-0	1513	1527	Rat Defense: English Rat	1. d4 d6 2. c4 e5 3. Nc3 exd4 4. Qxd4 Nc6
2018.12.31	1-0	2150	2224	King's Indian Defense: Normal Variation, King's Knight Variation	1. d4 Nf6 2. Nf3 g6 3. c4 Bg7 4. Nc3 d6
2018.12.31	0-1	1763	1927	Indian Game	1. d4 Nf6 2. Bf4 d6 3. e3 g6 4. Nf3 Bg7
2018.12.31	0-1	1728	1740	Queen's Pawn Game #3	1. d4 Nf6 2. e3 d5 3. c3 c5 4. Bd3 a6
2018.12.31	1-0	1568	1592	Queen's Pawn Game: Chigorin Variation	1. d4 d5 2. Nf3 Nc6 3. Nc3 Bg4 4. e3 e6
2018.12.31	0-1	2019	2004	Hungarian Opening: Dutch Defense	1. g3 f5 2. Bg2 Nf6 3. Nf3 e6 4. O-O d5
2018.12.31	1-0	1316	1135	English Opening: Symmetrical Variation, Two Knights Variation	1. c4 c5 2. Nc3 Nc6 3. e4 e5 4. d3 d6
2018.12.31	0-1	1008	895	Owen Defense	1. e4 b6 2. Nf3 Bb7 3. Bc4 Nc6 4. d4 e6
2018.12.31	0-1	1720	1672	Indian Game: Omega Gambit	1. e4 Nf6 2. d4 Nxe4 3. Bd3 Nf6 4. Nf3 e6
2018.12.31	0-1	1632	1629	English Opening: Agincourt Defense	1. c4 e6 2. g3 d5 3. cxd5 Qxd5 4. Nc3 Qxh1
2018.12.31	1-0	1221	1200	Queen's Pawn	1. d4 h5 2. c4 h4 3. h3 g5 4. Nc3 g4
2018.12.31	1-0	1234	1240	Queen's Pawn Game: Mason Attack	1. d4 d5 2. Bf4 e6 3. Nf3 Bd7 4. e3 Be7
2018.12.31	1-0	1640	1637	Russian Game: Stafford Gambit	1. e4 e5 2. Nf3 Nf6 3. Nxe5 Nc6 4. Nxc6 dxc6
2018.12.31	1-0	1294	1310	Queen's Pawn Game: Krause Variation	1. d4 d5 2. Nf3 c5 3. c3 cxd4 4. Nxd4 Nc6
2018.12.31	1-0	832	927	Modern Defense	1. e4 g6 2. Nf3 Bg7 3. d4 d6 4. Bc4 c6
2018.12.31	0-1	1774	1765	Owen Defense	1. e4 b6 2. Nf3 Bb7 3. Bc4 e6 4. Qe2 Nf6
2018.12.31	0-1	1481	1485	Scandinavian Defense: Modern Variation #2	1. e4 d5 2. exd5 Nf6 3. Nc3 Nxd5 4. Nxd5 Qxd5
2018.12.31	1-0	1771	1713	English Opening	1. c4 b6 2. Nc3 Bb7 3. d4 d6 4. Nf3 Nd7
2018.12.31	1-0	1071	918	Scandinavian Defense: Mieses-Kotroc Variation	1. e4 d5 2. exd5 Qxd5 3. b3 Qe6+ 4. Ne2 f6
2018.12.31	1-0	1859	2085	Sicilian Defense: Kramnik Variation	1. e4 c5 2. Nf3 e6 3. c4 Nc6 4. d3 e5
2018.12.31	0-1	2093	2142	Scandinavian Defense: Main Line	1. e4 d5 2. exd5 Qxd5 3. Nc3 Qa5 4. Nf3 Nf6
2018.12.31	1-0	1263	1187	King's Pawn Game: Busch-Gass Gambit	1. e4 e5 2. Nf3 Bc5 3. Nc3 Qf6 4. d3 Nh6
2018.12.31	0-1	1493	1737	Scotch Game: Classical Variation, Intermezzo Variation	1. e4 e5 2. Nf3 Nc6 3. d4 exd4 4. Nxd4 Bc5
2018.12.31	0-1	2131	2107	Englund Gambit Complex: Soller Gambit Deferred	1. d4 e5 2. dxe5 f6 3. Nf3 Nc6 4. Bf4 Qe7
2018.12.31	0-1	1527	1459	Scandinavian Defense: Modern Variation #2	1. e4 d5 2. exd5 Nf6 3. Nc3 e6 4. dxe6 Bxe6
2018.12.31	0-1	1923	1942	Nimzowitsch Defense: Kennedy Variation, de Smet Gambit	1. e4 d6 2. d4 e5 3. dxe5 Nc6 4. exd6 Bxd6
2018.12.31	1-0	2191	2038	Queen's Pawn	1. d4 c6 2. Nf3 d6 3. e3 Qc7 4. Be2 b6
2018.12.31	0-1	1997	1965	Torre Attack #2	1. d4 Nf6 2. Nf3 e6 3. g3 b6 4. Bg2 Bb7
2018.12.31	0-1	1807	1751	French Defense: Advance Variation #4	1. e4 d5 2. e5 e6 3. d4 c5 4. Bb5+ Bd7
2018.12.31	0-1	1609	1579	French Defense: Knight Variation	1. e4 e6 2. Nf3 d5 3. e5 c5 4. c3 Ne7
2018.12.31	0-1	1799	1835	Sicilian Defense: Modern Variations, Tartakower	1. e4 c5 2. Nf3 d6 3. d4 cxd4 4. c3 dxc3
2018.12.31	1-0	1226	1334	Owen Defense	1. e4 b6 2. Nf3 Bb7 3. Bb5 Bxe4 4. Nc3 Bb7
2018.12.31	0-1	2074	2124	Grob Opening	1. g4 c5 2. Bg2 h5 3. h4 hxg4 4. c4 Nc6
2018.12.31	0-1	2020	2013	English Opening: Symmetrical Variation, Anti-Benoni Variation, Spielmann Defense	1. d4 c5 2. c4 cxd4 3. Nf3 e6 4. Nxd4 Nf6
2018.12.31	0-1	1537	1499	St. George Defense	1. e4 a6 2. Bd3 h6 3. Nc3 d6 4. b3 e5
2018.12.31	0-1	1416	1441	Bishop's Opening	1. e4 e5 2. Bc4 Nc6 3. Qh5 g6 4. Qf3 Qf6
2018.12.31	0-1	1884	1994	Queen's Pawn Game #2	1. d4 d5 2. e3 e6 3. Ne2 c5 4. Ng3 Nc6
2018.12.31	0-1	1334	1342	French Defense: La Bourdonnais Variation	1. e4 e6 2. f4 d5 3. exd5 exd5 4. Nc3 Nf6
2018.12.31	0-1	1682	1734	Pirc Defense #4	1. e4 d6 2. f3 g6 3. d3 Bg7 4. Nc3 e5
2018.12.31	0-1	1057	929	Modern Defense	1. d4 g6 2. c3 Bg7 3. f4 b6 4. g3 Bb7
2018.12.31	1-0	1480	1450	Ruy Lopez: Classical Variation	1. e4 e5 2. Nf3 Nc6 3. Bb5 Bc5 4. d3 Nf6
2018.12.31	1-0	1804	1946	Nimzo-Indian Defense #2	1. d4 Nf6 2. c4 e6 3. Nc3 c5 4. d5 exd5
2018.12.31	1-0	2218	1948	Scotch Game: Scotch Gambit, Sarratt Variation	1. e4 e5 2. Nf3 Nc6 3. d4 exd4 4. Bc4 Bc5
2018.12.31	0-1	1714	1716	Nimzowitsch Defense	1. e4 Nc6 2. g3 e5 3. Bg2 Nf6 4. Ne2 Bc5
2018.12.31	1-0	1436	1436	English Opening: Anglo-Dutch Defense	1. c4 f5 2. g3 e5 3. Bg2 Nf6 4. Nc3 c6
2018.12.31	1-0	1495	1488	Philidor Defense #3	1. e4 e5 2. Bc4 d6 3. Nf3 Be6 4. Na3 Bxc4
2018.12.31	1-0	1624	1566	Queen's Gambit Declined	1. d4 e6 2. c4 d5 3. a3 dxc4 4. Nf3 Bd6
2018.12.31	1-0	1692	1438	Bird Opening: From's Gambit	1. f4 e5 2. d3 Bc5 3. Nf3 exf4 4. Bxf4 h6
2018.12.31	0-1	1867	1914	Queen's Pawn Game: Zukertort Variation	1. Nf3 d5 2. d4 c6 3. Bf4 Bg4 4. h3 Bxf3
2018.12.31	0-1	1507	1506	Old Indian Defense	1. d4 Nf6 2. c4 d6 3. Nc3 c5 4. dxc5 dxc5
2018.12.31	0-1	1064	1094	Caro-Kann Defense	1. d4 c6 2. e4 b5 3. c3 Na6 4. a3 Nc7
2018.12.31	0-1	1237	1405	French Defense: Knight Variation	1. e4 e6 2. Nf3 d5 3. e5 c5 4. c4 d4
2018.12.31	0-1	1831	1829	French Defense: Horwitz Attack	1. e4 e6 2. b3 c6 3. Bb2 d5 4. exd5 cxd5
2018.12.31	1-0	1734	1485	Scandinavian Defense: Mieses-Kotroc Variation	1. e4 d5 2. exd5 Qxd5 3. Nc3 Qd8 4. d4 Bf5
2018.12.31	0-1	1580	1736	Zukertort Opening: Queenside Fianchetto Variation	1. Nf3 b6 2. Nc3 Bb7 3. d4 Bc8 4. e4 Bb7
2018.12.31	0-1	1535	1517	Sicilian Defense: Bowdler Attack	1. e4 c5 2. Bc4 e6 3. a3 a6 4. Nc3 b5
2018.12.31	0-1	949	1298	Scandinavian Defense: Mieses-Kotroc Variation	1. e4 d5 2. exd5 Qxd5 3. Nc3 Qd8 4. Nf3 e6
2018.12.31	1-0	1800	1775	Philidor Defense: Bird Gambit	1. e4 e5 2. Nf3 d6 3. d4 exd4 4. c3 dxc3
2018.12.31	1-0	1747	1591	Scandinavian Defense: Lasker Variation	1. e4 d5 2. exd5 Qxd5 3. Nc3 Qa5 4. d4 Nf6
2018.12.31	0-1	1280	1268	Van Geet Opening: Reversed Nimzowitsch	1. Nc3 e5 2. Nf3 e4 3. Nxe4 Nf6 4. Nc3 Be7
2018.12.31	1-0	1380	1419	Sicilian Defense: Old Sicilian	1. e4 c5 2. Nf3 Nc6 3. c3 d5 4. exd5 Qxd5
2018.12.31	1-0	2079	1818	Van't Kruijs Opening	1. e3 Nf6 2. c4 g6 3. Nc3 Bg7 4. h4 O-O
2018.12.31	1-0	1128	1160	Queen's Gambit Declined: Exchange Variation	1. d4 Nf6 2. c4 e6 3. Nc3 d5 4. cxd5 Nxd5
2018.12.31	1-0	1809	1795	Zukertort Opening: Pirc Invitation	1. Nf3 d6 2. g3 e5 3. Bg2 c6 4. d3 Bg4
2018.12.31	1-0	1450	1428	King's Pawn Game: Leonardis Variation	1. e4 e5 2. d3 Nc6 3. g3 d6 4. Bg2 Be6
2018.12.31	1-0	1490	1498	Queen's Pawn Game: Mason Attack	1. d4 d5 2. Bf4 c6 3. e3 Nf6 4. h3 e6
2018.12.31	0-1	1670	1651	French Defense: Marshall Variation	1. e4 e6 2. d4 d5 3. Nc3 c5 4. exd5 exd5
2018.12.31	0-1	1476	1475	Philidor Defense #2	1. e4 e5 2. Nf3 d6 3. Bb5+ Bd7 4. Bc4 g6
2018.12.31	0-1	1611	1636	King's Gambit	1. e4 e5 2. f4 d6 3. Nf3 Bg4 4. Bc4 h6
2018.12.31	0-1	1339	1288	King's Pawn Game: Wayward Queen Attack	1. e4 e5 2. Qh5 Nc6 3. Bb5 Nf6 4. Qf3 Nd4
2018.12.31	1-0	1410	1340	Queen's Gambit Accepted: Rosenthal Variation	1. d4 d5 2. c4 dxc4 3. Nf3 e6 4. e3 b5
2018.12.31	1-0	1399	1449	Philidor Defense	1. e4 e5 2. Nf3 d6 3. d4 Nc6 4. dxe5 dxe5
2018.12.31	1/2-1/2	1773	1781	King's Pawn Game: Busch-Gass Gambit	1. e4 e5 2. Nf3 Bc5 3. d4 exd4 4. Nxd4 Qe7
2018.12.31	1-0	1252	1228	Scotch Game	1. e4 e5 2. Nf3 Nc6 3. d4 exd4 4. Nxd4 Nxd4
2018.12.31	0-1	1564	1711	Horwitz Defense	1. d4 e6 2. c4 g6 3. Nc3 Bg7 4. Nf3 Ne7
2018.12.31	0-1	1543	1467	Ponziani Opening: Spanish Variation	1. e4 e5 2. Nf3 Nc6 3. c3 d5 4. Bb5 Qf6
2018.12.31	1-0	1603	1367	King's Pawn Game: Damiano Defense	1. e4 e5 2. Nf3 f6 3. Bc4 Ne7 4. d3 c6
2018.12.31	0-1	1388	1451	Danish Gambit	1. e4 e5 2. d4 exd4 3. c3 Bc5 4. cxd4 Bb6
2018.12.31	1-0	936	952	English Opening: Anglo-Scandinavian Defense	1. c4 d5 2. cxd5 Qxd5 3. Nc3 Qd4 4. Nb5 Qb4
2018.12.31	0-1	1195	1225	Torre Attack #2	1. d4 Nf6 2. Nf3 Nc6 3. Bf4 d5 4. e3 Bf5
2018.12.31	1-0	1565	1510	Queen's Gambit	1. d4 d5 2. c4 Be6 3. Nf3 Nc6 4. Nc3 dxc4
2018.12.31	0-1	1598	1567	Queen's Pawn Game: London System	1. d4 d5 2. Nf3 Nf6 3. Bf4 e6 4. e3 c5
2018.12.31	1-0	985	1029	Scandinavian Defense	1. e4 d5 2. Nc3 e5 3. exd5 Na6 4. Bxa6 bxa6
2018.12.31	1-0	1290	1263	French Defense: Knight Variation	1. e4 e6 2. Nf3 Qf6 3. Bc4 Qg6 4. O-O d5
2018.12.31	1-0	1128	1169	Ponziani Opening: Jaenisch Counterattack	1. e4 e5 2. Nf3 Nc6 3. c3 Nf6 4. Bd3 Bc5
2018.12.31	1-0	1742	1747	Queen's Gambit Declined: 4.Bg5 Be7	1. d4 e6 2. c4 d5 3. Nc3 Nf6 4. Bg5 Be7
2018.12.31	0-1	1102	1041	Scandinavian Defense: Main Line, Leonhardt Gambit	1. e4 d5 2. exd5 Qxd5 3. Nc3 Qa5 4. b4 Qxb4
2018.12.31	1-0	1335	1300	Indian Game	1. d4 Nf6 2. e3 d6 3. Be2 Bf5 4. Bd2 Ne4
2018.12.31	0-1	985	1108	Horwitz Defense	1. d4 e6 2. Nf3 h5 3. e3 d6 4. Nc3 e5
2018.12.31	0-1	1555	1485	Sicilian Defense: Accelerated Dragon, Modern Variation	1. e4 c5 2. Nf3 Nc6 3. d4 cxd4 4. Nxd4 g6
2018.12.31	1-0	1274	1272	French Defense: La Bourdonnais Variation, Reuter Gambit	1. e4 e6 2. f4 d5 3. Nf3 dxe4 4. Ne5 Nf6
2018.12.31	0-1	1281	1275	Queen's Pawn Game: Anti-Torre	1. d4 d5 2. Nf3 Bg4 3. Bf4 Nf6 4. e3 e6
2018.12.31	0-1	1800	1838	Alekhine Defense: Maróczy Variation	1. d3 Nf6 2. e4 e5 3. Nf3 Nc6 4. c3 Be7
2018.12.31	0-1	1695	2001	Kadas Opening	1. h4 d5 2. d4 e6 3. c3 c5 4. dxc5 Bxc5
2018.12.31	0-1	954	1155	Sicilian Defense: Closed Variation, Traditional	1. e4 c5 2. Nc3 Nc6 3. d3 Nf6 4. Bf4 e6
2018.12.31	1-0	1421	1435	French Defense: Two Knights Variation	1. e4 e6 2. Nc3 d5 3. Nf3 d4 4. Ne2 c5
2018.12.31	0-1	1488	1551	Slav Defense #2	1. d4 d5 2. c4 c6 3. Nc3 Nf6 4. Bg5 h6
2018.12.31	1-0	1595	1689	Sicilian Defense: Bowdler Attack	1. e4 c5 2. Bc4 e6 3. Nf3 a6 4. a4 d5
2018.12.31	0-1	1680	1661	French Defense	1. d4 e6 2. e4 d5 3. c3 dxe4 4. f3 f5
2018.12.31	0-1	1624	1631	Nimzo-Larsen Attack	1. b3 d6 2. Bb2 Nf6 3. d4 e6 4. e3 Be7
2018.12.31	1-0	1097	1079	Mieses Opening	1. d3 c6 2. Nc3 d5 3. d4 e6 4. Bf4 Nd7
2018.12.31	1-0	1358	1177	Owen Defense	1. e4 b6 2. Nf3 Bb7 3. Bb5 Bxe4 4. Qe2 Bg6
2018.12.31	0-1	1928	1842	Modern Defense: Standard Line	1. e4 g6 2. d4 Bg7 3. Nc3 e6 4. Be3 Ne7
2018.12.31	0-1	1684	1654	Scotch Game: Schmidt Variation	1. e4 e5 2. Nf3 Nc6 3. d4 exd4 4. Nxd4 Nf6
2018.12.31	1-0	1972	1954	Queen's Pawn Game #2	1. d4 d5 2. e3 g6 3. Nf3 Bg7 4. Be2 Nf6
2018.12.31	0-1	1145	1152	Scandinavian Defense	1. e4 d5 2. Nc3 d4 3. Nb1 e6 4. Bb5+ Bd7
2018.12.31	0-1	1482	1560	English Opening: Anglo-Indian Defense	1. c4 Nf6 2. g3 g6 3. Bg2 Bg7 4. e3 d6
2018.12.31	0-1	1855	1824	King's Pawn Game: Tayler Opening, Inverted Hanham	1. e4 e5 2. Nf3 Nf6 3. d3 Nc6 4. Be2 d5
2018.12.31	0-1	1623	1617	English Opening: Symmetrical Variation, Two Knights Variation	1. c4 c5 2. Nc3 Nc6 3. b3 Nf6 4. Bb2 g6
2018.12.31	1-0	1024	881	French Defense #2	1. e4 e6 2. Ne2 d5 3. Nbc3 Ne7 4. d4 c5
2018.12.31	0-1	2028	2081	Ruy Lopez: Berlin Defense, Hedgehog Variation	1. e4 e5 2. Nf3 Nc6 3. Bb5 d6 4. d4 Bd7
2018.12.31	1-0	1361	1443	Queen's Gambit Refused: Marshall Defense	1. d4 d5 2. c4 Nf6 3. e3 e6 4. Nf3 c5
2018.12.31	0-1	1561	1482	Slav Defense: Modern Line	1. d4 d5 2. c4 c6 3. Nf3 e6 4. Bg5 Nf6
2018.12.31	0-1	1861	2010	Queen's Gambit Declined: Exchange Variation, Positional Variation #2	1. d4 Nf6 2. c4 e6 3. Nc3 d5 4. cxd5 exd5
2018.12.31	1-0	1673	1635	Ruy Lopez: Steinitz Defense	1. e4 e5 2. Nf3 Nc6 3. Bb5 d6 4. Bxc6+ bxc6
2018.12.31	1-0	1573	1547	Modern Defense	1. d4 g6 2. Bf4 Bg7 3. e3 Nf6 4. g3 d6
2018.12.31	1-0	1325	1330	Russian Game: Urusov Gambit	1. e4 e5 2. Bc4 Nf6 3. Nf3 c6 4. d4 exd4
2018.12.31	1-0	2115	2028	Philidor Defense: Exchange Variation #2	1. Nf3 d6 2. e4 e5 3. d4 exd4 4. Nxd4 Nc6
2018.12.31	1-0	1234	1072	Sicilian Defense	1. e4 c5 2. Nf3 d6 3. Bc4 a6 4. Ng5 Nh6
2018.12.31	0-1	1479	1531	Sicilian Defense: Paulsen Variation, Normal Variation	1. e4 e6 2. d4 c5 3. Nf3 cxd4 4. Nxd4 Nc6
2018.12.31	0-1	1268	1289	Italian Game: Two Knights Defense, Modern Bishop's Opening	1. e4 e5 2. Nf3 Nc6 3. Bc4 Nf6 4. d3 Be7
2018.12.31	0-1	1650	1733	English Opening: Symmetrical Variation, Anti-Benoni Variation, Spielmann Defense	1. d4 Nf6 2. c4 c5 3. Nf3 cxd4 4. Nxd4 e6
