Date	Result	WhiteElo	BlackElo	Opening	Moves
2019.07.01	1-0	1307	1395	Grünfeld Defense: Stockholm Variation	1. d4 Nf6 2. c4 g6 3. Nc3 d5 4. Bg5 e6
2019.07.01	1-0	2045	2062	Old Benoni Defense	1. d4 c5 2. e3 d5 3. c4 Nf6 4. Nc3 e6
2019.07.01	1-0	1690	1597	Italian Game: Schilling-Kostic Gambit	1. e4 e5 2. Bc4 Nc6 3. Nf3 Nd4 4. Nxd4 exd4
2019.07.01	0-1	1764	1697	Queen's Pawn Game: Chigorin Variation	1. Nc3 d5 2. d4 Nc6 3. e3 Nf6 4. h3 e5
2019.07.01	0-1	1500	1516	French Defense: Queen's Knight	1. e4 e6 2. Nc3 d5 3. f3 c6 4. d4 c5
2019.07.01	0-1	1136	1192	Queen's Gambit Accepted: Accelerated Mannheim Variation	1. d4 d5 2. c4 dxc4 3. Qa4+ b5 4. Qxb5+ Nc6
2019.07.01	0-1	1461	1387	Italian Game: Two Knights Defense, Knight Attack, Normal Variation	1. e4 e5 2. Nf3 Nc6 3. Bc4 Nf6 4. Ng5 d5
2019.07.01	1-0	1239	1274	Vienna Game: Vienna Gambit	1. e4 e5 2. Nc3 Nf6 3. f4 exf4 4. e5 Qe7
2019.07.01	1/2-1/2	1079	1061	Scandinavian Defense	1. e4 d5 2. d3 dxe4 3. Qe2 exd3 4. Qxd3 Qxd3
2019.07.01	1-0	1104	1405	Queen's Pawn	1. d4
2019.07.01	0-1	1084	1433	Scandinavian Defense	1. e4 d5 2. Nc3 e6 3. exd5 exd5 4. Nf3 Be6
2019.07.01	1-0	1808	1872	Sicilian Defense: Najdorf Variation, Opocensky Variation	1. e4 c5 2. Nf3 a6 3. d4 cxd4 4. Nxd4 Nf6
2019.07.01	0-1	2064	2001	Sicilian Defense: Pin Variation	1. e4 c5 2. Nf3 e6 3. d4 cxd4 4. Nxd4 Nf6
2019.07.01	1-0	1901	1905	Vienna Game: Stanley Variation	1. e4 e5 2. Bc4 Nf6 3. Nc3 Bc5 4. Nge2 O-O
2019.07.01	1/2-1/2	1578	1729	Sicilian Defense: Old Sicilian	1. e4 c5 2. Nf3 Nc6 3. Bc4 d6 4. O-O e5
2019.07.01	0-1	1528	1798	Robatsch (Modern) Defense	1. d4 g6 2. e4 Bg7 3. Nf3 Nf6 4. e5 Ng4
2019.07.01	1-0	1446	1343	Caro-Kann Defense: Advance Variation, Tal Variation	1. e4 c6 2. d4 d5 3. e5 Bf5 4. h4 e6
2019.07.01	0-1	1772	1822	Robatsch (Modern) Defense	1. e4 g6 2. d4 Bg7 3. c4 e6 4. Nc3 Ne7
2019.07.01	1/2-1/2	1291	1229	Semi-Slav Defense: Marshall Gambit	1. d4 d5 2. c4 c6 3. Nc3 e6 4. e4 dxc4
2019.07.01	0-1	1938	2267	Ruy Lopez: Cozio Defense	1. e4 e5 2. Nf3 Nc6 3. Bb5 Nge7 4. O-O d6
2019.07.01	1-0	1663	1658	Four Knights Game	1. e4 e5 2. Nf3 Nc6 3. Nc3 Nf6 4. Be2 Bc5
2019.07.01	1-0	2072	1804	Sicilian Defense: Nyezhmetdinov-Rossolimo Attack, Fianchetto Variation	1. e4 c5 2. Nf3 Nc6 3. Bb5 g6 4. O-O Bg7
2019.07.01	1-0	1531	1573	Horwitz Defense	1. d4 e6 2. Bf4 c5 3. e3 cxd4 4. exd4 Bb4+
2019.07.01	0-1	1683	1676	Queen's Gambit Refused: Marshall Defense	1. d4 d5 2. c4 Nf6 3. Nc3 Bf5 4. cxd5 Nxd5
2019.07.01	1-0	1697	1730	Queen's Pawn Game: Chigorin Variation	1. d4 Nf6 2. Nc3 d5 3. Bf4 c6 4. e3 g6
2019.07.01	1-0	1471	1443	French Defense: Knight Variation	1. e4 e6 2. Nf3 d5 3. e5 Nc6 4. d4 b6
2019.07.01	0-1	1118	955	Pirc Defense #4	1. e4 d6 2. Qh5 g6 3. Qf3 Nf6 4. Bc4 Be6
2019.07.01	0-1	1920	1890	Dutch Defense: Raphael Variation	1. d4 f5 2. Nc3 Nf6 3. Bf4 d6 4. e3 g6
2019.07.01	1-0	1303	1325	Philidor Defense: Exchange Variation	1. e4 d6 2. Nf3 e5 3. d4 exd4 4. Nxd4 Nf6
2019.07.01	0-1	1804	1795	French Defense: Knight Variation	1. e4 e6 2. Nf3 d5 3. exd5 exd5 4. d4 Nf6
2019.07.01	0-1	1684	1694	King's Indian Defense: Normal Variation	1. d4 g6 2. c4 Bg7 3. Nc3 Nf6 4. e4 O-O
2019.07.01	1-0	2131	2132	Benoni Defense: Classical Variation, Czerniak Defense, Tal Line	1. d4 Nf6 2. c4 g6 3. Nc3 Bg7 4. e4 d6
2019.07.01	0-1	1612	1603	Modern Defense	1. d4 g6 2. Bf4 Bg7 3. e3 d6 4. h3 Nf6
2019.07.01	1-0	1700	1517	Sicilian Defense: McDonnell Attack	1. e4 c5 2. f4 Nc6 3. Nf3 e6 4. a3 d6
2019.07.01	1-0	1534	1470	King's Pawn Game: Busch-Gass Gambit	1. e4 e5 2. Nf3 Bc5 3. c3 a5 4. d4 exd4
2019.07.01	0-1	912	918	Mieses Opening	1. d3 d5 2. e4 e5 3. exd5 Qxd5 4. Qe2 Nf6
2019.07.01	1-0	1871	1827	Caro-Kann Defense: Hillbilly Attack	1. e4 c6 2. Bc4 d5 3. exd5 cxd5 4. Bb5+ Bd7
2019.07.01	0-1	2012	2087	Hungarian Opening	1. g3 d5 2. Bg2 Nf6 3. c4 e6 4. cxd5 exd5
2019.07.01	1-0	1561	1605	Scandinavian Defense: Main Line, Mieses Variation	1. e4 d5 2. exd5 Qxd5 3. Nc3 Qa5 4. d4 Nf6
2019.07.01	0-1	1272	1353	French Defense: Franco-Hiva Gambit I Accepted	1. e4 f5 2. exf5 Nf6 3. d4 e6 4. Bg5 exf5
2019.07.01	0-1	1431	1425	Scandinavian Defense: Blackburne Gambit	1. e4 d5 2. exd5 c6 3. dxc6 Nxc6 4. Nf3 Nf6
2019.07.01	0-1	1529	1476	Owen Defense	1. e4 b6 2. f4 Bb7 3. e5 f6 4. Nf3 fxe5
2019.07.01	1-0	1630	1688	Queen's Pawn Game: Levitsky Attack	1. d4 d5 2. Bg5 c5 3. c3 f6 4. Bh4 e5
2019.07.01	1-0	1027	977	Queen's Pawn Game: Chigorin Variation	1. Nc3 d5 2. d4 c6 3. Nf3 Nf6 4. e3 Bg4
2019.07.01	0-1	1788	1806	Hungarian Opening: Symmetrical Variation	1. g3 g6 2. Bg2 Bg7 3. Nh3 Nf6 4. O-O d6
2019.07.01	0-1	1179	1070	French Defense: Knight Variation	1. e4 e6 2. Nf3 Nf6 3. e5 Nd5 4. d4 c5
2019.07.01	1-0	1485	1413	Ruy Lopez: Berlin Defense #2	1. e4 e5 2. Nf3 Nc6 3. Bb5 Nf6 4. Bxc6 bxc6
2019.07.01	1-0	1313	1477	English Opening: Agincourt Defense	1. c4 e6 2. Nc3 c5 3. g3 Nf6 4. Bg2 Nc6
2019.07.01	0-1	1269	1270	Indian Game	1. d4 Nf6 2. Bf4 d6 3. Nf3 e5 4. dxe5 dxe5
2019.07.01	1/2-1/2	1378	1294	Queen's Pawn Game: Mason Attack	1. d4 d5 2. Bf4 Nc6 3. Nf3 f5 4. Nbd2 e6
2019.07.01	1-0	1180	1052	Queen's Pawn	1. d4 c6 2. Bf4 d5 3. e3 Nd7 4. Nf3 f6
2019.07.01	0-1	1838	1797	English Opening: Caro-Kann Defensive System	1. c4 c6 2. Nc3 d5 3. b3 Nf6 4. g3 a6
2019.07.01	1-0	1025	1004	Queen's Pawn Game: Veresov Attack, Classical Defense	1. d4 d5 2. Nf3 Nf6 3. Nc3 e6 4. Bg5 Bb4
2019.07.01	0-1	1918	1999	Indian Game: Anti-Nimzo-Indian	1. d4 Nf6 2. c4 e6 3. Nf3 d5 4. g3 Bb4+
2019.07.01	0-1	1895	1900	King's Indian Defense: Normal Variation, Rare Defenses	1. d4 Nf6 2. Nf3 d6 3. c4 g6 4. Nc3 Bg7
2019.07.01	1-0	1633	1688	Robatsch (Modern) Defense	1. d4 g6 2. e4 Bg7 3. Be3 d6 4. Nf3 Nf6
2019.07.01	1-0	1465	1512	King's Pawn Game: Maróczy Defense	1. e4 e5 2. d4 d6 3. c3 Be6 4. d5 Bd7
2019.07.01	1-0	1100	1129	Van't Kruijs Opening	1. e3 e5 2. c4 Nc6 3. d3 Nf6 4. Qd2 e4
2019.07.01	1-0	1832	1929	Italian Game: Classical Variation, Greco Gambit	1. e4 e5 2. Nf3 Nc6 3. Bc4 Bc5 4. c3 Nf6
2019.07.01	1-0	1681	1599	Caro-Kann Defense	1. e4 c6 2. f4 d5 3. exd5 cxd5 4. Nf3 Bf5
2019.07.01	0-1	1872	1801	Sicilian Defense: Open #2	1. e4 c5 2. d4 cxd4 3. Nf3 Nc6 4. Bc4 h6
2019.07.01	0-1	1294	1688	Modern Defense	1. d4 g6 2. e4 d6 3. Nf3 a6 4. Nc3 Bg7
2019.07.01	0-1	1220	1463	Italian Game: Two Knights Defense, Polerio Defense, Bishop Check Line	1. e4 e5 2. Nf3 Nc6 3. Bc4 Nf6 4. Ng5 d5
2019.07.01	1-0	1118	1020	Scandinavian Defense	1. e4 d5 2. d3 e5 3. f3 Nc6 4. c3 Nf6
2019.07.01	1-0	1677	1522	Scandinavian Defense	1. e4 d5 2. e5 d4 3. Nf3 Bf5 4. Bb5+ c6
2019.07.01	1-0	1825	1711	French Defense: Exchange Variation	1. e4 e6 2. d4 d5 3. exd5 exd5 4. Bd3 c6
2019.07.01	1-0	1751	1750	Queen's Pawn Game: Zukertort Variation	1. d4 d5 2. Nf3 c6 3. e3 f6 4. Bd3 Bg4
2019.07.01	0-1	1773	1754	Van't Kruijs Opening	1. e3 e5 2. Nf3 d5 3. Nxe5 Nc6 4. Bb5 Bd7
2019.07.01	0-1	1215	1316	Sicilian Defense: Bowdler Attack	1. e4 c5 2. Bc4 e6 3. Qh5 g6 4. Qd1 Nf6
2019.07.01	1-0	839	1132	Van't Kruijs Opening	1. e3 f5 2. f4 Nf6 3. g3 e6 4. e4 Be7
2019.07.01	0-1	2100	2159	Queen's Pawn Game: Mason Attack	1. d4 d5 2. Bf4 c6 3. e3 Nf6 4. Bd3 Bg4
2019.07.01	0-1	1509	1503	Queen's Pawn Game: Stonewall Attack	1. d4 d5 2. e3 Nf6 3. Bd3 Nc6 4. c3 Bg4
2019.07.01	0-1	1785	1750	Hungarian Opening	1. g3 Nc6 2. Bg2 g6 3. d3 Bg7 4. Nd2 Nf6
2019.07.01	1-0	1609	1582	Vienna Game: Max Lange Defense	1. e4 e5 2. Nc3 Nc6 3. d3 d6 4. Nf3 Bg4
2019.07.01	1-0	1535	1553	Sicilian Defense: Smith-Morra Gambit #2	1. e4 c5 2. d4 cxd4 3. Qxd4 Nc6 4. Qe3 d6
2019.07.01	1-0	1736	1642	Sicilian Defense	1. e4 c5 2. Nf3 d6 3. Bc4 Nf6 4. d3 e6
2019.07.01	1-0	1897	1840	Vienna Game: Falkbeer Variation	1. e4 Nf6 2. Nc3 e5 3. d3 Nc6 4. Nf3 d5
2019.07.01	1-0	1365	1334	Sicilian Defense: Smith-Morra Gambit #2	1. e4 c5 2. d4 Qb6 3. d5 e6 4. Nc3 Nf6
2019.07.01	0-1	1636	1576	Queen's Pawn Game: Mason Attack	1. d4 d5 2. Bf4 e6 3. e3 Bd6 4. Bd3 g5
2019.07.01	0-1	1470	1453	English Opening: Carls-Bremen System	1. c4 e5 2. Nc3 Nf6 3. g3 d6 4. Bg2 Nc6
2019.07.01	0-1	1441	1383	Horwitz Defense	1. d4 e6 2. e3 Ne7 3. Be2 a6 4. Nf3 h6
2019.07.01	0-1	1713	1682	Horwitz Defense	1. d4 e6 2. c4 d6 3. Nc3 c6 4. Bf4 Nf6
2019.07.01	0-1	1305	1200	Ruy Lopez: Classical Variation	1. e4 e5 2. Nf3 Nc6 3. Bb5 Bc5 4. Bxc6 dxc6
2019.07.01	1-0	1506	1505	French Defense: La Bourdonnais Variation	1. e4 e6 2. f4 c6 3. Nf3 Qb6 4. d4 Bb4+
2019.07.01	0-1	1730	1728	French Defense: Perseus Gambit	1. e4 e6 2. Nf3 d5 3. d4 Nf6 4. e5 Nfd7
2019.07.01	0-1	1803	1846	Four Knights Game: Italian Variation	1. e4 e5 2. Bc4 Nf6 3. Nf3 Nc6 4. Nc3 Bb4
2019.07.01	1-0	1626	1599	Nimzo-Larsen Attack: Classical Variation	1. b3 d5 2. Bb2 d4 3. e3 e5 4. exd4 exd4
2019.07.01	0-1	1796	1769	Slav Defense #2	1. d4 d5 2. c4 c6 3. Nc3 Nf6 4. e3 Bf5
2019.07.01	1-0	1984	1883	Caro-Kann Defense	1. d4 c6 2. Nc3 d5 3. e4 Nf6 4. e5 Ng8
2019.07.01	1/2-1/2	1551	1516	Italian Game: Two Knights Defense	1. e4 e5 2. Nf3 Nc6 3. Bc4 Nf6 4. O-O Bc5
2019.07.01	0-1	2014	2100	English Defense #2	1. d4 b6 2. c3 Bb7 3. e3 g6 4. f4 Bg7
2019.07.01	1-0	2081	2063	French Defense: Paulsen Variation	1. e4 e6 2. d4 d5 3. Nc3 c6 4. Nf3 f5
2019.07.01	0-1	1620	1620	Three Knights Opening	1. e4 e5 2. Nf3 Nc6 3. Nc3 d6 4. Bb5 Be6
2019.07.01	1-0	1200	961	English Opening: King's English Variation	1. c4 e5 2. Qc2 Nc6 3. Nc3 Nf6 4. b3 d5
2019.07.01	0-1	830	856	Rat Defense: Balogh Defense	1. e4 d6 2. d4 f5 3. Nc3 Nf6 4. exf5 Bxf5
2019.07.01	1-0	1771	1768	Van Geet Opening: Dunst-Perrenet Gambit	1. e4 d5 2. d3 dxe4 3. Nc3 exd3 4. Bxd3 Nc6
2019.07.01	0-1	1484	1489	Sicilian Defense: Hyperaccelerated Dragon	1. e4 c5 2. Nf3 g6 3. Bc4 Bg7 4. Qe2 Nc6
2019.07.01	0-1	1590	1653	Italian Game	1. e4 e5 2. Nf3 Nc6 3. Bc4 d6 4. d3 Bg4
2019.07.01	1-0	1347	1352	King's Pawn Game: Wayward Queen Attack	1. e4 e5 2. Qh5 g6 3. Qxe5+ Qe7 4. Qxh8 Qxe4+
2019.07.01	1-0	1085	1081	Queen's Pawn Game: Anglo-Slav Opening	1. d4 d6 2. c4 c6 3. e4 e6 4. d5 exd5
2019.07.01	1-0	1716	1676	Caro-Kann Defense: Advance Variation	1. e4 c6 2. d4 d5 3. e5 Bf5 4. f4 Nd7
2019.07.01	0-1	948	986	Zukertort Opening: Queen's Gambit Invitation	1. Nf3 e6 2. Nc3 d5 3. d4 Bb4 4. Bg5 f6
2019.07.01	1-0	1546	1500	Italian Game: Giuoco Pianissimo	1. e4 e5 2. Nf3 Nc6 3. Bc4 Bc5 4. d3 Qf6
2019.07.01	1-0	1015	1055	King's Pawn Game: Busch-Gass Gambit	1. e4 e5 2. Nf3 Bc5 3. d4 exd4 4. Nxd4 Bxd4
2019.07.01	0-1	1354	1420	Zukertort Opening: Wade Defense	1. e4 d6 2. Nf3 Bg4 3. h3 Bxf3 4. Qxf3 e5
2019.07.01	1-0	2093	2020	Bird Opening: Dutch Variation	1. f4 d5 2. Nf3 c5 3. e3 Nc6 4. d4 e6
2019.07.01	1-0	2219	2177	Horwitz Defense	1. d4 e6 2. c3 d5 3. e3 Nf6 4. f4 c5
2019.07.01	1-0	1872	1926	English Opening: Agincourt Defense	1. c4 e6 2. Nc3 d6 3. Nf3 b6 4. d4 Bb7
2019.07.01	1-0	1226	1254	Old Benoni Defense	1. d4 c5 2. c4 cxd4 3. Qxd4 Nf6 4. Qd1 Nc6
2019.07.01	1-0	1519	1416	Englund Gambit Declined, Reversed French	1. e3 e5 2. d4 d6 3. c4 Be7 4. b4 d5
2019.07.01	1-0	1512	1526	King's Gambit Accepted, Fischer Defense	1. e4 e5 2. f4 d6 3. Nf3 exf4 4. Bc4 Bg4
2019.07.01	0-1	1763	1703	Queen's Gambit Declined: Normal Defense	1. d4 e6 2. c4 d5 3. Nc3 Nf6 4. e3 Bb4
2019.07.01	0-1	2137	1987	King's Pawn Game: King's Head Opening #2	1. e4 e5 2. f3 f5 3. d3 f4 4. b3 Bc5
2019.07.01	1-0	1805	1843	Hungarian Opening	1. g3 e5 2. Bg2 d5 3. d3 Nf6 4. Nf3 Nc6
2019.07.01	0-1	1275	1402	Sicilian Defense: Alapin Variation	1. e4 c5 2. c3 e6 3. d4 cxd4 4. cxd4 Nf6
2019.07.01	1-0	1153	1281	Kadas Opening	1. h4 e6 2. e4 d6 3. Nf3 h6 4. d3 c6
2019.07.01	0-1	1826	1821	Zukertort Opening	1. Nc3 Nf6 2. Nf3 Nc6 3. d3 d5 4. e3 e5
2019.07.01	0-1	1217	1193	Center Game: Berger Variation	1. e4 e5 2. d4 exd4 3. Qxd4 Nc6 4. Qe3 Nf6
2019.07.01	0-1	1137	1116	Modern Defense	1. e4 g6 2. Bc4 Bg7 3. Nf3 e6 4. d3 d5
2019.07.01	1-0	1802	1811	English Defense #2	1. d4 b6 2. c4 Bb7 3. Nc3 e6 4. e4 Bb4
2019.07.01	0-1	1070	1101	Four Knights Game: Spanish Variation	1. e4 e5 2. Nf3 Nc6 3. Nc3 Nf6 4. Bb5 d6
2019.07.01	0-1	1446	1472	Old Benoni Defense	1. d4 c5 2. c3 d5 3. e3 cxd4 4. cxd4 Nc6
2019.07.01	0-1	1618	1555	English Opening: Anglo-Lithuanian Variation	1. c4 Nc6 2. Nc3 e6 3. e4 Nce7 4. g3 Ng6
2019.07.01	0-1	1279	1326	Sicilian Defense: Bowdler Attack	1. e4 c5 2. Bc4 g6 3. Nc3 Bg7 4. d3 d6
2019.07.01	1-0	1682	1633	French Defense: Advance Variation, Lputian Variation	1. d4 e6 2. e4 d5 3. e5 c5 4. c3 Qb6
2019.07.01	0-1	1785	1789	Indian Game	1. d4 Nf6 2. Bf4 g6 3. Nc3 Bg7 4. Qd2 d5
2019.07.01	0-1	1327	1349	Petrov's Defense	1. e4 e5 2. Nf3 Nf6 3. c3 b6 4. Bc4 Bb7
2019.07.01	1-0	1517	1500	Caro-Kann Defense	1. e4 c6 2. Nf3 d5 3. exd5 cxd5 4. d4 Bg4
2019.07.01	0-1	953	822	Philidor Defense: Nimzowitsch Variation	1. e4 e5 2. Nf3 Nf6 3. d4 d6 4. dxe5 dxe5
2019.07.01	1-0	1754	1751	Nimzo-Indian Defense: Three Knights Variation	1. d4 Nf6 2. c4 e6 3. Nc3 Bb4 4. Nf3 O-O
2019.07.01	0-1	1996	2035	Czech Defense	1. e4 d6 2. d4 Nf6 3. Nc3 c6 4. f4 Qa5
2019.07.01	1-0	1056	991	English Opening: The Whale	1. e4 e5 2. c4 Bc5 3. Nf3 f6 4. Nc3 c6
2019.07.01	1/2-1/2	1590	1771	Italian Game: Giuoco Pianissimo, Normal	1. e4 e5 2. Nf3 Nc6 3. Bc4 Nf6 4. d3 Bc5
2019.07.01	0-1	856	967	Giuoco Piano	1. e4 e5 2. Bc4 Bc5 3. Nf3 Nc6 4. O-O Nf6
2019.07.01	1-0	1079	1091	King's Pawn Game	1. e4 e5 2. Be2 Nf6 3. d3 Bc5 4. Nf3 Nc6
2019.07.01	0-1	1797	1883	Sicilian Defense: Classical Variation, Fianchetto Variation	1. e4 c5 2. Nf3 Nc6 3. d4 cxd4 4. Nxd4 d6
2019.07.01	0-1	1370	1330	Caro-Kann Defense	1. e4 c6 2. Nf3 d5 3. exd5 cxd5 4. c4 Nf6
2019.07.01	1-0	1139	1186	Vienna Game: Stanley Variation, Reversed Spanish	1. e4 e5 2. Nc3 Nf6 3. Bc4 Bb4 4. Nf3 Bxc3
2019.07.01	0-1	1655	1735	Nimzo-Indian Defense: Ragozin Variation	1. d4 d5 2. c4 e6 3. Nf3 Nf6 4. Nc3 Bb4
2019.07.01	1-0	1536	1587	Queen's Pawn Game: Chigorin Variation	1. d4 d5 2. Nf3 Nc6 3. Bf4 Bg4 4. Nbd2 Nf6
2019.07.01	0-1	1854	1977	English Defense #2	1. d4 b6 2. c4 Bb7 3. Nf3 a6 4. g3 Nc6
2019.07.01	1-0	1576	1494	Scandinavian Defense	1. e4 d5 2. d3 dxe4 3. dxe4 Qxd1+ 4. Kxd1 Nc6
2019.07.01	0-1	1731	1790	Scandinavian Defense: Main Line	1. e4 d5 2. exd5 Qxd5 3. Nc3 Qa5 4. d4 c6
2019.07.01	0-1	1837	1764	Kadas Opening	1. h4 c5 2. h5 d6 3. c3 Nc6 4. d3 e5
2019.07.01	0-1	1646	1725	Robatsch (Modern) Defense	1. e4 g6 2. d4 Bg7 3. Nf3 e6 4. Nc3 Ne7
2019.07.01	0-1	1414	1554	Queen's Pawn Game: Mason Attack	1. d4 d5 2. Bf4 e6 3. Nf3 Nf6 4. e3 Be7
2019.07.01	0-1	2223	2138	Queen's Gambit Refused: Marshall Defense	1. d4 Nf6 2. c4 d5 3. cxd5 Nxd5 4. e4 Nf6
2019.07.01	1-0	1190	1111	Clemenz Opening	1. h3 d5 2. g4 e5 3. e4 d4 4. f3 Nc6
2019.07.01	0-1	2023	2028	French Defense: Knight Variation	1. e4 e6 2. Nf3 d5 3. exd5 exd5 4. d4 Bd6
2019.07.01	0-1	1860	1906	Sicilian Defense: Bowdler Attack	1. e4 c5 2. Bc4 Nc6 3. Bxf7+ Kxf7 4. f4 Nf6
2019.07.01	0-1	1616	1595	Polish Defense	1. d4 b5 2. e3 Bb7 3. Nf3 b4 4. Bd2 e6
2019.07.01	1-0	1431	1463	Hungarian Opening: Indian Defense	1. g3 Nf6 2. Bg2 g6 3. Nf3 Bg7 4. O-O O-O
2019.07.01	0-1	1321	1380	English Opening: Caro-Kann Defensive System	1. c4 c6 2. Nf3 d5 3. Nc3 d4 4. e3 dxc3
2019.07.01	1-0	1780	1707	Queen's Gambit Accepted: Central Variation, Rubinstein Defense	1. d4 d5 2. c4 dxc4 3. e4 c5 4. d5 e6
2019.07.01	0-1	1660	1638	Nimzo-Larsen Attack: Modern Variation #2	1. b3 e5 2. Bb2 f6 3. e3 d5 4. Bxe5 fxe5
2019.07.01	1-0	1316	1320	Scotch Game: Lolli Variation	1. e4 e5 2. d4 Nc6 3. Nf3 Nxd4 4. Nxd4 exd4
2019.07.01	0-1	1544	1593	Torre Attack	1. d4 Nf6 2. Bg5 e6 3. Nf3 Be7 4. Bxf6 Bxf6
2019.07.01	1-0	1887	1937	Slav Defense: Alekhine Variation	1. Nf3 Nf6 2. e3 c6 3. c4 d5 4. d4 dxc4
2019.07.01	1-0	1708	1651	Sicilian Defense: Alapin Variation	1. e4 c5 2. c3 g6 3. d4 Bg7 4. Nf3 cxd4
2019.07.01	0-1	2262	2333	Sicilian Defense: Bowdler Attack	1. e4 c5 2. Bc4 Nc6 3. c3 e6 4. a3 d5
2019.07.01	1-0	1706	1547	Zukertort Opening: Tennison Gambit	1. e4 d5 2. Nf3 dxe4 3. Ng5 Bf5 4. Nc3 Nf6
2019.07.01	1-0	1422	907	Nimzo-Larsen Attack: Classical Variation	1. b3 d5 2. Bb2 e6 3. g3 c6 4. Bg2 b5
2019.07.01	0-1	1054	1477	French Defense: Knight Variation	1. e4 e6 2. Nf3 d5 3. d3 dxe4 4. dxe4 Nc6
2019.07.01	1-0	1333	1296	Sicilian Defense: Nyezhmetdinov-Rossolimo Attack	1. e4 c5 2. Nf3 Nc6 3. Bb5 a6 4. Bxc6 bxc6
2019.07.01	1-0	1717	1459	Nimzo-Larsen Attack: Modern Variation #3	1. b3 e5 2. Bb2 Nc6 3. d3 Bc5 4. Nd2 d6
2019.07.01	1-0	2141	2177	Sicilian Defense: Grand Prix Attack	1. e4 c5 2. Nc3 Nc6 3. f4 h5 4. Nf3 e6
2019.07.01	1-0	1192	1302	Van't Kruijs Opening	1. e3 e5 2. Ne2 d5 3. d4 e4 4. Nf4 f5
2019.07.01	1-0	1535	1550	Semi-Slav Defense	1. d4 d5 2. c4 c6 3. Nc3 Nf6 4. Nf3 e6
2019.07.01	1-0	1712	1642	Bird Opening	1. f4 e6 2. Nf3 d5 3. e3 c5 4. b3 Nc6
2019.07.01	1-0	1583	1631	Caro-Kann Defense	1. e4 c6 2. d4 d5 3. Nc3 Nf6 4. Bd3 Bg4
2019.07.01	0-1	1468	1494	Scotch Game: Classical Variation	1. e4 e5 2. Nf3 Nc6 3. d4 exd4 4. Nxd4 Bc5
2019.07.01	1-0	1951	1860	Old Indian Defense: Normal Variation	1. d4 d6 2. Nf3 Nd7 3. c4 e5 4. Nc3 Ngf6
2019.07.01	0-1	1975	1958	Sicilian Defense: Dragon Variation	1. e4 c5 2. Nf3 d6 3. d4 cxd4 4. Nxd4 Nf6
2019.07.01	0-1	1352	1462	Scotch Game	1. e4 e5 2. Nf3 Nc6 3. d4 exd4 4. Nxd4 d6
2019.07.01	0-1	1357	1334	Queen's Pawn Game: Zukertort Variation	1. d4 d5 2. Nf3 Bf5 3. e3 c6 4. Bd3 Qd7
2019.07.01	0-1	1640	1658	Horwitz Defense	1. d4 e6 2. g3 d5 3. Bg2 Bd6 4. Nh3 Nf6
2019.07.01	1-0	1854	1386	Zukertort Opening: Sicilian Invitation	1. Nf3 c5 2. d4 cxd4 3. Nxd4 e5 4. Nf3 d6
2019.07.01	1-0	2168	1809	Queen's Pawn Game: Torre Attack	1. d4 Nf6 2. Nf3 d5 3. Bg5 c6 4. Bxf6 exf6
2019.07.01	0-1	1867	2220	Zukertort Opening: Sicilian Invitation	1. Nf3 c5 2. g3 d6 3. Bg2 g6 4. c4 Bg7
2019.07.01	1-0	1569	1611	Queen's Pawn Game: Steinitz Countergambit	1. d4 d5 2. Bf4 c5 3. e3 cxd4 4. exd4 Nf6
2019.07.01	0-1	1257	1393	Queen's Gambit Accepted: Central Variation, Modern Defense	1. d4 d5 2. c4 dxc4 3. e4 Nc6 4. Nf3 Bg4
2019.07.01	0-1	1493	1501	Alekhine Defense: John Tracy Gambit	1. e4 Nf6 2. Nf3 Nxe4 3. Bc4 Nf6 4. Ng5 e6
2019.07.01	0-1	1121	1254	Englund Gambit	1. d4 e5 2. c4 exd4 3. Qxd4 Nc6 4. Qd1 Nf6
2019.07.01	1-0	2354	2317	Nimzo-Indian Defense: Normal Variation, Taimanov Variation	1. d4 Nf6 2. c4 e6 3. Nc3 Bb4 4. e3 Nc6
2019.07.01	1-0	1396	1398	Hungarian Opening	1. g3 e5 2. Bg2 Bc5 3. e3 Qf6 4. c3 c6
2019.07.01	0-1	1914	1874	English Defense #2	1. d4 b6 2. Nf3 Bb7 3. e3 d6 4. Bd3 Nd7
2019.07.01	0-1	1706	1640	English Defense #2	1. d4 b6 2. c4 Bb7 3. Nc3 g6 4. e4 Bg7
2019.07.01	1/2-1/2	2019	2042	English Opening: Anglo-Scandinavian Defense, Schulz Gambit	1. c4 d5 2. cxd5 Nf6 3. Nc3 c6 4. e4 cxd5
2019.07.01	0-1	1649	1635	French Defense: Normal Variation	1. e4 e6 2. d4 c6 3. c4 d5 4. cxd5 cxd5
2019.07.01	0-1	1074	1066	French Defense: Exchange Variation	1. e4 e6 2. d4 d5 3. exd5 exd5 4. Nf3 c5
2019.07.01	0-1	2092	2111	Benoni Defense	1. d4 Nf6 2. c4 c5 3. Nc3 cxd4 4. Qxd4 Nc6
2019.07.01	1-0	1958	1724	Sicilian Defense: Open #3	1. e4 c5 2. d4 cxd4 3. Nf3 Nc6 4. Nxd4 Nxd4
2019.07.01	0-1	1576	1615	Van't Kruijs Opening	1. e3 c5 2. Qf3 d6 3. Bc4 e6 4. Nc3 a6
2019.07.01	0-1	1713	1736	Englund Gambit Declined, Reversed Brooklyn	1. d4 e5 2. Nf3 e4 3. Ng1 d5 4. e3 Bf5
2019.07.01	1-0	1751	1893	Alekhine Defense: Two Pawn Attack	1. e4 Nf6 2. e5 Nd5 3. c4 Nb6 4. Nf3 d6
2019.07.01	0-1	1130	1058	Scotch Game: Mieses Variation	1. e4 e5 2. Nf3 Nf6 3. d4 exd4 4. Nxd4 Nc6
2019.07.01	1-0	1497	1532	Benoni Defense: King's Pawn Line	1. d4 c5 2. d5 e6 3. c4 exd5 4. cxd5 d6
2019.07.01	1-0	1928	2017	Nimzowitsch Defense: Kennedy Variation, de Smet Gambit	1. e4 d6 2. d4 e5 3. dxe5 Nc6 4. exd6 Bxd6
2019.07.01	1-0	2148	2191	French Defense: Winawer Variation, Bogoljubov Variation, Icelandic Defense	1. e4 e6 2. d4 d5 3. Nc3 Bb4 4. e5 c5
2019.07.01	1-0	1362	1235	Nimzowitsch Defense: Williams Variation	1. e4 Nc6 2. Nf3 d6 3. d4 Bg4 4. Nbd2 e6
2019.07.01	1-0	1545	1542	Queen's Pawn Game: Mason Attack	1. d4 d5 2. Bf4 Bf5 3. Nf3 Nf6 4. Nc3 e6
2019.07.01	0-1	1574	1573	Englund Gambit Complex: Englund Gambit	1. d4 e5 2. dxe5 Nc6 3. Nf3 Qe7 4. Bf4 Qb4+
2019.07.01	0-1	1709	1674	Scotch Game: Schmidt Variation	1. e4 e5 2. Nf3 Nc6 3. d4 exd4 4. Nxd4 Nf6
2019.07.01	0-1	1213	1145	Caro-Kann Defense: Breyer Variation	1. e4 c6 2. d3 d5 3. exd5 cxd5 4. Nc3 d4
2019.07.01	0-1	1605	1462	Réti Opening	1. Nf3 d5 2. c3 c5 3. d4 cxd4 4. cxd4 e6
2019.07.01	1-0	1430	1284	Bishop's Opening	1. e4 e5 2. Bc4 f6 3. Nf3 c6 4. d3 Ne7
2019.07.01	0-1	1691	1665	Sicilian Defense: McDonnell Attack	1. e4 c5 2. f4 d5 3. exd5 e6 4. dxe6 Bxe6
2019.07.01	0-1	1045	1102	French Defense: Normal Variation	1. e4 e6 2. d4 g6 3. d5 b6 4. Bc4 Qf6
2019.07.01	1-0	1758	1728	Ruy Lopez: Steinitz Defense	1. e4 e5 2. Nf3 Nc6 3. Bb5 d6 4. Bxc6+ bxc6
2019.07.01	0-1	1652	1668	Four Knights Game: Spanish Variation	1. e4 e5 2. Nf3 Nc6 3. Bb5 Nf6 4. Nc3 a6
2019.07.01	1-0	1549	1527	Scandinavian Defense: Mieses-Kotroc Variation	1. e4 d5 2. exd5 Qxd5 3. Nc3 Qd8 4. Bc4 e6
2019.07.01	1-0	1429	1463	Nimzo-Larsen Attack: Modern Variation #3	1. b3 e5 2. Bb2 Nc6 3. Nf3 d6 4. d4 Bg4
2019.07.01	0-1	1416	1383	French Defense: Normal Variation	1. e4 e6 2. d4 c6 3. d5 cxd5 4. exd5 Qa5+
2019.07.01	0-1	1369	1364	Sicilian Defense: Drazic Variation	1. e4 c5 2. Nf3 a6 3. d4 e6 4. dxc5 Bxc5
2019.07.01	1-0	1631	1599	Scandinavian Defense	1. e4 d5 2. e5 a6 3. a3 d4 4. Nf3 Nc6
2019.07.01	1-0	1094	993	French Defense: Rubinstein Variation	1. Nc3 e6 2. d4 d5 3. e4 dxe4 4. Nxe4 Qe7
2019.07.01	1-0	1262	1294	Sicilian Defense: Bowdler Attack	1. e4 c5 2. Bc4 Nc6 3. Nf3 h6 4. a3 e5
2019.07.01	0-1	1176	1169	Sicilian Defense: Prins Variation	1. e4 c5 2. Nf3 d6 3. d4 cxd4 4. Nxd4 Nf6
2019.07.01	1-0	1889	1792	Ruy Lopez: Closed Variations, Averbakh Variation	1. e4 e5 2. Nf3 Nc6 3. Bb5 a6 4. Ba4 Nf6
2019.07.01	0-1	1560	1485	Modern Defense	1. e4 g6 2. f4 Bg7 3. e5 e6 4. Nf3 Ne7
2019.07.01	0-1	1798	2027	Hungarian Opening	1. g3 c6 2. Nf3 d5 3. Bg2 Bg4 4. O-O Bxf3
2019.07.01	1-0	2070	2070	King's Indian Attack	1. Nf3 d5 2. g3 f6 3. Bg2 e5 4. O-O Bd6
2019.07.01	1-0	1745	1706	English Opening: King's English Variation	1. c4 e5 2. g3 Nf6 3. Bg2 Nc6 4. Nc3 Bb4
2019.07.01	1-0	1518	1495	King's Pawn	1. e4
2019.07.01	1-0	1390	1300	Scotch Game	1. e4 e5 2. Nf3 Nc6 3. d4 d5 4. dxe5 dxe4
2019.07.01	1-0	1780	1781	Sicilian Defense: Dragon Variation	1. e4 c5 2. Nf3 d6 3. d4 cxd4 4. Nxd4 Nf6
2019.07.01	1-0	1184	1243	English Opening: Agincourt Defense	1. c4 e6 2. g3 d5 3. cxd5 exd5 4. Bg2 Nf6
2019.07.01	1-0	1466	1498	King's Pawn Game: Nimzowitsch Defense	1. e4 Nc6 2. d4 e6 3. Nf3 b6 4. Bb5 Bb7
2019.07.01	1-0	1173	1051	Philidor Defense #3	1. e4 e5 2. Nf3 d6 3. Bc4 Be6 4. O-O Bxc4
2019.07.01	0-1	1662	1637	Indian Game	1. d4 Nf6 2. Bf4 d6 3. Nf3 g6 4. e3 Bg7
2019.07.01	0-1	1739	1757	French Defense: Queen's Knight	1. e4 e6 2. Nc3 Bb4 3. f4 Bxc3 4. dxc3 Ne7
2019.07.01	1-0	1815	1845	English Opening: King's English Variation, Two Knights Variation, Reversed Dragon	1. c4 e5 2. Nc3 Nf6 3. g3 d5 4. cxd5 Nxd5
2019.07.01	1-0	1519	1619	Sicilian Defense: Old Sicilian	1. e4 c5 2. Nf3 Nc6 3. c3 e5 4. Bc4 Nf6
2019.07.01	0-1	939	884	Queen's Pawn Game: Mason Attack	1. d4 d5 2. Bf4 f5 3. e3 Nf6 4. Nc3 e6
2019.07.01	1-0	1768	1802	Sicilian Defense: McDonnell Attack	1. e4 c5 2. f4 Nc6 3. d3 Nf6 4. Be3 d6
2019.07.01	0-1	985	1018	King's Pawn Game: Wayward Queen Attack	1. e4 e5 2. Qh5 Nc6 3. Bd3 Nf6 4. Qf3 Nd4
2019.07.01	0-1	1888	2168	French Defense: Paulsen Variation	1. e4 e6 2. d4 d5 3. Nc3 c6 4. Nf3 Nd7
2019.07.01	0-1	1442	1358	Scotch Game: Schmidt Variation	1. e4 e5 2. Nf3 Nc6 3. d4 exd4 4. Nxd4 Nf6
2019.07.01	1-0	1682	1678	Bird Opening: Dutch Variation	1. f4 d5 2. d4 Bf5 3. Nf3 e6 4. e3 a6
2019.07.01	1/2-1/2	1267	1276	King's Knight Opening: Normal Variation	1. e4 Nc6 2. Nf3 e5 3. a3 b6 4. Nc3 Bb7
2019.07.01	0-1	1459	1558	Mikenas Defense	1. d4 Nc6 2. e3 d5 3. Bb5 Bd7 4. Bxc6 Bxc6
2019.07.01	1-0	1343	1351	Benoni Defense: Benoni Gambit Accepted	1. d4 c5 2. dxc5 e6 3. b4 a6 4. e3 Nc6
2019.07.01	1/2-1/2	1438	1512	Queen's Pawn	1. d4 c6 2. Bf4 d5 3. Nf3 Bf5 4. e3 Nf6
2019.07.01	1-0	1615	1591	Mieses Opening	1. d3 d5 2. Bf4 c5 3. Nf3 Nc6 4. e4 d4
2019.07.01	1-0	1692	1468	Van't Kruijs Opening	1. e3 e6 2. c3 d5 3. d4 Nf6 4. f4 c5
2019.07.01	0-1	1021	1052	Scotch Game	1. e4 e5 2. Nf3 Nc6 3. d4 exd4 4. Nxd4 Nxd4
2019.07.01	0-1	1980	1942	Englund Gambit	1. d4 e5 2. dxe5 Nc6 3. Nf3 d6 4. e6 Bxe6
2019.07.01	1-0	1422	1387	Queen's Gambit Declined	1. d4 d5 2. c4 e6 3. a3 Nf6 4. Nc3 Nc6
2019.07.01	1-0	1317	1272	Sicilian Defense: Accelerated Dragon, Modern Variation	1. e4 c5 2. Nf3 Nc6 3. d4 cxd4 4. Nxd4 g6
2019.07.01	0-1	1641	1518	Sicilian Defense: Bowdler Attack	1. e4 c5 2. Bc4 e6 3. Nf3 a6 4. d4 cxd4
2019.07.01	1-0	1125	1167	Modern Defense	1. e4 g6 2. b3 Bg7 3. c3 d5 4. exd5 Qxd5
2019.07.01	1-0	1812	1878	Queen's Pawn	1. d4 c6 2. Nf3 d6 3. Bf4 Nf6 4. e3 Qa5+
2019.07.01	0-1	1034	1060	Giuoco Piano	1. e4 e5 2. Nf3 Nc6 3. Bc4 Bc5 4. b3 Qf6
2019.07.01	1-0	1491	1488	Queen's Gambit Accepted: Old Variation	1. d4 d5 2. c4 dxc4 3. e3 Bf5 4. Bxc4 Nf6
2019.07.01	1-0	1352	1322	English Opening: Symmetrical Variation, Two Knights Variation	1. c4 c5 2. Nc3 Nc6 3. Nf3 d6 4. e3 Bf5
2019.07.01	0-1	1226	1273	Sicilian Defense: Alapin Variation	1. e4 c5 2. c3 Nc6 3. d4 cxd4 4. cxd4 Nf6
2019.07.01	0-1	1126	1113	Queen's Pawn	1. d4 d6 2. d5 Nf6 3. e4 Bg4 4. f3 Bh5
2019.07.01	0-1	1954	1855	Queen's Pawn Game	1. d4 d5 2. f4 Nf6 3. Nf3 e6 4. e3 c5
2019.07.01	0-1	1644	1660	Indian Game	1. d4 Nf6 2. h3 g6 3. g3 d5 4. Bg2 Bg7
2019.07.01	1-0	1154	1134	Semi-Slav Defense	1. d4 d5 2. c4 c6 3. Nf3 Nf6 4. Nc3 e6
2019.07.01	0-1	2130	2208	Slav Defense: Exchange Variation	1. Nf3 d5 2. d4 Nf6 3. c4 c6 4. cxd5 cxd5
2019.07.01	0-1	1689	1674	Mieses Opening: Reversed Rat	1. d3 e5 2. Nf3 d6 3. Bg5 Nf6 4. e3 h6
2019.07.01	1-0	2018	1795	French Defense: Advance Variation #2	1. e4 e6 2. d4 d5 3. e5 c5 4. c3 cxd4
2019.07.01	0-1	1624	1681	Center Game: Kieseritzky Variation #2	1. e4 e5 2. d4 exd4 3. Nf3 Bb4+ 4. c3 dxc3
2019.07.01	0-1	2053	2037	King's Indian Defense: Steiner Attack	1. d4 Nf6 2. c4 g6 3. Nc3 Bg7 4. e4 d6
2019.07.01	1-0	1622	1515	Italian Game	1. e4 e5 2. Nf3 Nc6 3. Bc4 d6 4. d4 Bg4
2019.07.01	0-1	1470	1760	King's Pawn Game: Leonardis Variation	1. e4 e5 2. d3 Nc6 3. Nf3 Nb4 4. Be2 Nc6
