Date	Result	WhiteElo	BlackElo	Opening	Moves
2017.05.31	0-1	1704	1783	Scandinavian Defense: Blackburne-Kloosterboer Gambit	1. e4 d5 2. exd5 c6 3. Nc3 Bf5 4. dxc6 Nxc6
2017.05.31	0-1	1528	1606	Modern Defense	1. d4 g6 2. Bf4 d5 3. Nf3 Bg7 4. Nc3 Nf6
2017.05.31	0-1	1695	2100	Center Game: Berger Variation	1. e4 e5 2. d4 exd4 3. Qxd4 Nc6 4. Qe3 Nf6
2017.05.31	0-1	2418	2325	Anderssen Opening	1. a3 e6 2. h3 d5 3. g3 Nf6 4. Bg2 c5
2017.05.31	1-0	1696	1851	Sicilian Defense: Loewenthal Variation	1. e4 c5 2. Nf3 Nc6 3. d4 cxd4 4. Nxd4 e5
2017.05.31	0-1	1587	1614	Italian Game: Anti-Fried Liver Defense	1. e4 e5 2. Nf3 Nc6 3. Bc4 h6 4. Nc3 Nf6
2017.05.31	1/2-1/2	1933	2070	Sicilian Defense: Open	1. e4 c5 2. Nf3 Nc6 3. d4 cxd4 4. Nxd4 Nf6
2017.05.31	1-0	1647	1612	Sicilian Defense: Lasker-Dunne Attack	1. e4 c5 2. g3 Nc6 3. Bg2 e6 4. c4 Nd4
2017.05.31	1-0	1955	1658	Horwitz Defense	1. d4 e6 2. Bf4 d5 3. Nf3 Bd6 4. Bg5 f6
2017.05.31	1-0	2365	2154	Mikenas Defense	1. d4 Nc6 2. d5 Ne5 3. f4 Ng6 4. e4 e5
2017.05.31	0-1	1041	1306	Nimzowitsch Defense: Franco-Nimzowitsch Variation	1. e4 e6 2. Nf3 Nc6 3. Bc4 Qf6 4. d3 Qg6
2017.05.31	1-0	1367	1329	Nimzowitsch Defense	1. e4 Nc6 2. c4 a6 3. d3 b5 4. c5 d6
2017.05.31	1-0	1601	1599	Queen's Gambit Declined	1. d4 d5 2. c4 e6 3. a3 dxc4 4. Qa4+ Bd7
2017.05.31	1-0	1491	1475	Caro-Kann Defense: Advance Variation	1. e4 c6 2. d4 d5 3. e5 Bf5 4. h3 h6
2017.05.31	1-0	1606	1721	Philidor Defense #2	1. e4 e5 2. Nf3 d6 3. h3 c6 4. Bc4 f5
2017.05.31	1-0	1205	1163	Duras Gambit	1. e4 f5 2. exf5 Nf6 3. Nf3 d5 4. d4 c5
2017.05.31	0-1	2021	1932	English Defense #2	1. d4 b6 2. Nf3 Bb7 3. g3 g6 4. Bg2 Bg7
2017.05.31	*	1500	1500	Zukertort Opening: Tennison Gambit	1. Nf3 d5 2. e4 dxe4 3. Ng5 f5 4. Bc4 Nh6
2017.05.31	1-0	1156	1308	Zukertort Opening: Queen's Gambit Invitation	1. Nf3 e6 2. Nc3 c6 3. d4 Bd6 4. e3 Bb4
2017.05.31	1-0	1390	1397	Gedult's Opening	1. f3 e5 2. Nh3 d5 3. Nf2 Nf6 4. b3 Nc6
2017.05.31	1-0	1880	1812	Nimzowitsch Defense: Franco-Nimzowitsch Variation	1. e4 Nc6 2. Nf3 e6 3. d4 Be7 4. c3 d5
2017.05.31	1-0	1435	1503	Queen's Pawn Game #2	1. d4 d5 2. e3 a6 3. c4 Nc6 4. c5 b6
2017.05.31	1-0	1483	1575	Italian Game: Anti-Fried Liver Defense	1. e4 e5 2. Nf3 Nc6 3. Bc4 h6 4. c3 Nf6
2017.05.31	0-1	1915	1820	Trompowsky Attack	1. d4 Nf6 2. Bg5 d5 3. Bxf6 exf6 4. f4 c5
2017.05.31	1-0	1500	1762	Sicilian Defense: Modern Variations, Main Line	1. e4 d6 2. Nf3 c5 3. d4 cxd4 4. Nxd4 Nf6
2017.05.31	1-0	1869	1801	French Defense: Normal Variation	1. e4 e6 2. d4 b6 3. Bd3 Bb7 4. Be3 Bb4+
2017.05.31	0-1	1630	1537	King's Gambit, Falkbeer Countergambit, Blackburne Attack	1. e4 e5 2. f4 d5 3. Nf3 Bg4 4. Be2 Nc6
2017.05.31	0-1	1741	1801	Bird Opening: Lasker Variation	1. f4 d5 2. Nf3 c5 3. e3 Nf6 4. b3 Bg4
2017.05.31	1-0	1714	1466	Sicilian Defense: Open #3	1. e4 c5 2. Nf3 Nc6 3. d4 cxd4 4. Nxd4 d6
2017.05.31	0-1	1519	1573	Four Knights Game: Italian Variation	1. e4 e5 2. Bc4 Nf6 3. Nc3 Nc6 4. Nf3 Bc5
2017.05.31	1-0	1687	1588	Pirc Defense #4	1. e4 d6 2. Nf3 Nd7 3. d4 e6 4. Bc4 Ne7
2017.05.31	0-1	1897	1754	Scandinavian Defense: Mieses-Kotroc Variation	1. e4 d5 2. exd5 Qxd5 3. Nc3 Qd8 4. d4 e6
2017.05.31	0-1	1657	1594	Queen's Pawn Game: Zukertort Variation	1. d4 d5 2. Nf3 Bf5 3. Bf4 e6 4. e3 Nc6
2017.05.31	1-0	2001	1874	Nimzo-Larsen Attack: Modern Variation #2	1. b3 e5 2. Bb2 d6 3. d4 f6 4. e4 Ne7
2017.05.31	0-1	2491	2268	Dutch Defense: Rubinstein Variation	1. d4 e6 2. c4 f5 3. Nc3 Nf6 4. Nf3 d6
2017.05.31	1-0	1958	1877	Sicilian Defense: Closed Variation	1. e4 c5 2. Nc3 d6 3. f4 Nc6 4. Nf3 e5
2017.05.31	0-1	1870	2085	Indian Game: London System	1. d4 Nf6 2. Nf3 e6 3. Bf4 Be7 4. e3 Nh5
2017.05.31	1-0	1475	1388	Center Game: Berger Variation	1. e4 e5 2. d4 exd4 3. Qxd4 Nc6 4. Qe3 Nf6
2017.05.31	0-1	1665	1783	Bird Opening: Dutch Variation	1. f4 d5 2. Nf3 Nf6 3. e3 Nc6 4. b3 e6
2017.05.31	0-1	2289	2096	Nimzo-Larsen Attack: Indian Variation	1. b3 Nf6 2. Bb2 e6 3. f4 Be7 4. Nf3 b6
2017.05.31	0-1	1613	1652	Sicilian Defense: Old Sicilian	1. e4 c5 2. Nf3 Nc6 3. Nc3 e5 4. Bb5 d6
2017.05.31	1-0	1071	1103	Center Game: Normal Variation	1. e4 e5 2. d4 exd4 3. Qxd4 Nc6 4. Qd5 Nf6
2017.05.31	1-0	1524	1379	Italian Game: Two Knights Defense, Modern Bishop's Opening	1. e4 e5 2. Nf3 Nc6 3. Bc4 Nf6 4. d3 a6
2017.05.31	0-1	1372	1357	Franco-Benoni Defense	1. e4 e6 2. d4 c5 3. d5 b6 4. c4 Bb7
2017.05.31	1/2-1/2	2001	1773	Queen's Gambit Declined: Normal Defense	1. d4 d5 2. c4 Nf6 3. Nc3 e6 4. f3 Nbd7
2017.05.31	1-0	1101	1144	Kangaroo Defense	1. c4 e6 2. d4 Bb4+ 3. Bd2 Bd6 4. c5 Be7
2017.05.31	1-0	1228	1140	Caro-Kann Defense: Gurgenidze Counterattack	1. e4 d5 2. Nc3 c6 3. d4 b5 4. exd5 cxd5
2017.05.31	0-1	1694	1603	Queen's Pawn	1. d4 c6 2. e3 d5 3. Bd3 Nf6 4. Nd2 g6
2017.05.31	0-1	2025	1856	Scotch Game: Benima Defense	1. e4 e5 2. Nf3 Nc6 3. Bc4 Be7 4. d4 exd4
2017.05.31	1-0	1908	1927	English Opening: Jaenisch Gambit	1. c4 b5 2. d4 bxc4 3. Qc2 Ba6 4. e3 d5
2017.05.31	1-0	1755	1704	Pirc Defense: Classical Variation	1. d4 d6 2. e4 Nf6 3. Nc3 g6 4. Nf3 Bg7
2017.05.31	1-0	1926	1892	Philidor Defense #2	1. e4 e5 2. Nf3 d6 3. h3 h6 4. Bc4 Qe7
2017.05.31	1-0	1948	1828	Modern Defense: Mongredien Defense	1. e4 g6 2. d4 Bg7 3. Nc3 b6 4. f4 Bb7
2017.05.31	0-1	1792	2009	Ruy Lopez: Cozio Defense	1. e4 e5 2. Nf3 Nc6 3. Bb5 Nge7 4. O-O Ng6
2017.05.31	0-1	1522	1662	Bishop's Opening: Berlin Defense	1. e4 e5 2. Bc4 Nf6 3. Qf3 Bc5 4. d3 h6
2017.05.31	0-1	1289	1319	Modern Defense	1. e4 g6 2. Bc4 Bg7 3. Qf3 e6 4. c3 Nc6
2017.05.31	0-1	1640	1748	Sicilian Defense: Alapin Variation	1. e4 c5 2. c3 e6 3. Bd3 Qc7 4. Bc2 Nf6
2017.05.31	0-1	2206	1924	Sicilian Defense: Delayed Alapin	1. e4 c5 2. c3 d6 3. Nf3 Nc6 4. Be2 Nf6
2017.05.31	0-1	1545	1501	Sicilian Defense: Delayed Alapin Variation	1. Nf3 e6 2. e4 c5 3. c3 Nc6 4. d4 cxd4
2017.05.31	1-0	1949	1954	Polish Opening: Outflank Variation	1. b4 c6 2. Bb2 Qb6 3. a3 a5 4. c4 axb4
2017.05.31	0-1	1713	1777	Nimzowitsch Defense: Scandinavian Variation, Exchange Variation	1. e4 d5 2. exd5 Qxd5 3. d4 Nc6 4. Nf3 Bg4
2017.05.31	0-1	1233	1236	Amar Opening	1. Nh3 e5 2. e4 Nf6 3. Bc4 h6 4. d4 d6
2017.05.31	1-0	1697	1651	Queen's Gambit Refused: Austrian Defense	1. d4 d5 2. c4 c5 3. dxc5 Qa5+ 4. Nc3 Qxc5
2017.05.31	0-1	1934	2013	Sicilian Defense: Canal-Sokolsky Attack	1. e4 c5 2. Nf3 d6 3. Bb5+ Nd7 4. Qe2 a6
2017.05.31	0-1	1565	2180	King's Gambit Accepted, Becker Defense	1. e4 e5 2. f4 exf4 3. Nf3 h6 4. Bc4 d6
2017.05.31	0-1	1337	1374	Scotch Game	1. e4 e5 2. Nf3 Nc6 3. d4 d6 4. dxe5 dxe5
2017.05.31	1-0	1709	1778	Nimzowitsch Defense: Kennedy Variation, Linksspringer Variation	1. e4 Nc6 2. d4 e5 3. d5 Nce7 4. Nf3 Ng6
2017.05.31	0-1	1500	1507	Scandinavian Defense	1. e4 d5 2. d3 dxe4 3. dxe4 Qxd1+ 4. Kxd1 Nf6
2017.05.31	1-0	1952	1950	Old Benoni Defense	1. d4 c5 2. c3 cxd4 3. cxd4 d5 4. Nc3 Nc6
2017.05.31	1-0	1602	1670	Italian Game: Evans Gambit, McDonnell Defense	1. e4 e5 2. Nf3 Nc6 3. Bc4 Bc5 4. b4 Bxb4
2017.05.31	1-0	994	1285	Ruy Lopez: Classical Variation	1. e4 e5 2. Nf3 Nc6 3. Bb5 Bc5 4. Bxc6 dxc6
2017.05.31	0-1	1709	1660	Center Game: Kieseritzky Variation #2	1. e4 e5 2. d4 exd4 3. Nf3 d5 4. exd5 Qxd5
2017.05.31	1-0	1892	1944	Zukertort Opening: Pirc Invitation	1. Nf3 d6 2. g3 g6 3. Bg2 Bg7 4. c3 e5
2017.05.31	1-0	1736	1398	French Defense: Mediterranean Defense	1. e4 e6 2. d4 Nf6 3. e5 Nd5 4. c4 Ne7
2017.05.31	1-0	1738	1730	King's Gambit Accepted, Blachly Gambit	1. e4 e5 2. f4 exf4 3. Nf3 g5 4. Bc4 Nc6
2017.05.31	0-1	1203	1551	French Defense: Classical Variation, Steinitz Variation	1. e4 e6 2. d4 d5 3. Nc3 Nf6 4. e5 Nfd7
2017.05.31	1/2-1/2	1650	1693	Slav Defense #2	1. d4 d5 2. c4 c6 3. Nc3 Bf5 4. Nf3 Nf6
2017.05.31	0-1	1420	1615	Sicilian Defense: Bowdler Attack	1. e4 c5 2. Bc4 d6 3. Nf3 e6 4. c3 a5
2017.05.31	0-1	1611	1602	Grob Opening	1. g4 Nc6 2. Bg2 d6 3. g5 e5 4. h4 g6
2017.05.31	1-0	1973	2094	Sicilian Defense: Accelerated Dragon, Maroczy Bind	1. e4 c5 2. Nf3 Nc6 3. d4 cxd4 4. Nxd4 g6
2017.05.31	1-0	1764	1711	Ruy Lopez: Berlin Defense, Closed Wolf Variation	1. e4 e5 2. Nf3 Nc6 3. Bb5 d6 4. O-O Nf6
2017.05.31	0-1	1578	1691	Sicilian Defense: Alapin Variation	1. e4 c5 2. c3 Nc6 3. Bc4 e6 4. Nf3 d5
2017.05.31	1-0	1774	1765	English Opening: Carls-Bremen System	1. c4 e5 2. Nc3 Nf6 3. g3 Bc5 4. Bg2 O-O
2017.05.31	1-0	1267	1238	Modern Defense	1. e4 g6 2. Nf3 d6 3. b3 Bg4 4. Bb2 Nf6
2017.05.31	1-0	1403	1335	Slav Defense: Exchange Variation	1. d4 d5 2. c4 c6 3. cxd5 cxd5 4. Nc3 e6
2017.05.31	0-1	1431	1427	French Defense: Knight Variation	1. e4 e6 2. Nf3 d5 3. exd5 exd5 4. Bb5+ c6
2017.05.31	0-1	1362	1250	Richter-Veresov Attack	1. d4 d5 2. Nc3 Nf6 3. Bg5 Nc6 4. Bxf6 exf6
2017.05.31	1-0	1646	1680	King's Gambit Accepted, MacLeod Defense	1. e4 e5 2. f4 exf4 3. Nf3 Nc6 4. Bc4 h6
2017.05.31	0-1	1409	1428	French Defense: Knight Variation	1. e4 e6 2. Nf3 c6 3. Bc4 d5 4. exd5 exd5
2017.05.31	1-0	1981	2005	Sicilian Defense: Closed Variation, Korchnoi Defense	1. e4 c5 2. Nc3 e6 3. g3 d5 4. d3 dxe4
2017.05.31	0-1	1961	1819	Alekhine Defense	1. e4 Nf6 2. Nc3 Nxe4 3. Nxe4 d5 4. Ng5 e6
2017.05.31	0-1	1694	1773	Sicilian Defense: Accelerated Dragon, Maroczy Bind, Breyer Variation	1. e4 c5 2. Nf3 Nc6 3. d4 cxd4 4. Nxd4 g6
2017.05.31	1/2-1/2	1815	1803	Ruy Lopez: Steinitz Defense	1. e4 e5 2. Nf3 Nc6 3. Bb5 d6 4. Bxc6+ bxc6
2017.05.31	1-0	1756	1711	French Defense: Mediterranean Defense	1. e4 e6 2. d4 Nf6 3. Nc3 b6 4. Be3 Bb7
2017.05.31	1-0	1342	1296	Giuoco Piano	1. e4 e5 2. Nf3 Nc6 3. Bc4 Bc5 4. O-O Nf6
2017.05.31	0-1	2028	2522	French Defense: Knight Variation	1. e4 e6 2. Nf3 d5 3. exd5 exd5 4. d4 Bd6
2017.05.31	1-0	1518	1436	English Defense #2	1. d4 b6 2. e4 Bb7 3. f3 f6 4. c4 e6
2017.05.31	1-0	1608	1495	Sicilian Defense: O'Kelly Variation, Venice System, Steiner Line	1. e4 c5 2. Nf3 d6 3. c3 a6 4. d4 cxd4
2017.05.31	0-1	1928	2159	Sicilian Defense: Lasker-Pelikan Variation, Sveshnikov Variation, Chelyabinsk Variation	1. e4 c5 2. Nf3 Nc6 3. d4 cxd4 4. Nxd4 Nf6
2017.05.31	0-1	1165	1535	Anderssen Opening	1. a3 e5 2. b3 d6 3. c3 Nf6 4. d3 Be7
2017.05.31	0-1	1484	2171	Nimzo-Larsen Attack	1. b3 g6 2. e3 f6 3. Bd3 Bg7 4. c3 Nc6
2017.05.31	0-1	1211	1256	Queen's Pawn Game: Colle System	1. d4 d5 2. e3 Nf6 3. Nf3 Nc6 4. b3 Bg4
2017.05.31	0-1	1630	1627	Polish Opening	1. b4 d5 2. Bb2 e6 3. e3 Nf6 4. c4 Bxb4
2017.05.31	1-0	1604	1563	Elephant Gambit: Paulsen Countergambit	1. e4 e5 2. Nf3 d5 3. exd5 e4 4. Qe2 Nf6
2017.05.31	1-0	1282	1275	Danish Gambit Accepted, Classical Defense	1. e4 e5 2. d4 exd4 3. c3 dxc3 4. Bc4 cxb2
2017.05.31	1-0	2429	2326	Queen's Pawn Game: Veresov Attack, Alburt Defense	1. d4 d5 2. Nc3 Bf5 3. f3 Bg6 4. e4 e6
2017.05.31	0-1	2101	2339	English Opening: Anglo-Indian Defense, King's Indian Formation	1. Nf3 Nf6 2. c4 g6 3. g3 Bg7 4. Bg2 O-O
2017.05.31	1-0	1053	1045	Italian Game: Anti-Fried Liver Defense	1. e4 e5 2. Nf3 Nc6 3. Bc4 h6 4. d4 d6
2017.05.31	0-1	1513	1766	Modern Defense	1. e4 g6 2. Nc3 Bg7 3. Nf3 e6 4. d4 Ne7
2017.05.31	1-0	1324	1434	Scandinavian Defense	1. e4 d5 2. e5 d4 3. Bb5+ c6 4. Bc4 e6
2017.05.31	0-1	2349	1962	Hungarian Opening: Catalan Formation	1. g3 e6 2. Bg2 d5 3. c4 Nf6 4. cxd5 Nxd5
2017.05.31	0-1	2072	2131	Nimzo-Larsen Attack	1. b3 c6 2. Bb2 d5 3. Nf3 Nf6 4. g3 e6
2017.05.31	0-1	1969	2281	Mieses Opening	1. d3 d5 2. Bg5 Nd7 3. Nf3 Ngf6 4. Nbd2 h6
2017.05.31	0-1	1437	1462	French Defense #2	1. e4 e6 2. Bc4 d5 3. exd5 exd5 4. Bb3 Nc6
2017.05.31	0-1	1708	1611	Queen's Gambit Declined: Tartakower Defense, Makogonov Exchange Variation	1. d4 d5 2. c4 e6 3. Nc3 Nf6 4. Bg5 Be7
2017.05.31	0-1	1614	1630	Old Indian: Czech Variation, with Nc3	1. d4 d6 2. c4 Nf6 3. Nc3 c6 4. e4 Bg4
2017.05.31	0-1	1371	1263	Sicilian Defense: Old Sicilian	1. e4 c5 2. Nf3 Nc6 3. Nc3 d6 4. Bc4 Nf6
2017.05.31	0-1	1274	1378	King's Pawn Game	1. e4 e5 2. h3 d6 3. d4 exd4 4. Qxd4 c5
2017.05.31	0-1	1616	1789	Semi-Slav Defense: Main Line	1. d4 d5 2. c4 c6 3. Nc3 e6 4. e3 Nf6
2017.05.31	0-1	1451	1472	Philidor Defense #4	1. e4 e5 2. Nf3 d6 3. Bc4 Be7 4. Nc3 c6
2017.05.31	0-1	1090	1152	Tarrasch Defense	1. d4 d5 2. c4 c5 3. Nc3 e6 4. dxc5 dxc4
2017.05.31	1-0	1991	1941	Queen's Gambit Declined	1. d4 e6 2. c4 d5 3. a3 dxc4 4. Nc3 c6
2017.05.31	0-1	1148	1137	Philidor Defense #3	1. e4 e5 2. Nf3 d6 3. Bc4 c6 4. d3 a5
2017.05.31	0-1	1684	1618	Old Indian Defense: Tartakower-Indian	1. d4 Nf6 2. c4 d6 3. Nf3 Bg4 4. Qb3 b6
2017.05.31	1/2-1/2	1847	1883	Caro-Kann Defense	1. e4 c6 2. Nf3 h6 3. c3 d5 4. e5 Bg4
2017.05.31	1-0	1308	1274	King's Pawn Game: Maroczy Defense	1. e4 e5 2. d4 d6 3. d5 Nf6 4. Nc3 Bg4
2017.05.31	1-0	1617	1702	Vienna Game: Stanley Variation	1. e4 e5 2. Nc3 Nf6 3. Bc4 Bc5 4. h3 O-O
2017.05.31	1-0	1860	1810	Sicilian Defense: Bowdler Attack	1. e4 c5 2. Bc4 e6 3. d4 cxd4 4. Qxd4 Nc6
2017.05.31	1-0	1397	1614	Alekhine Defense: Scandinavian Variation	1. e4 Nf6 2. Nc3 d5 3. e5 d4 4. exf6 dxc3
2017.05.31	1-0	1789	1691	Pirc Defense	1. d4 d6 2. e4 Nf6 3. Bd3 g6 4. Ne2 Bg7
2017.05.31	0-1	1790	1958	Queen's Pawn Game: Mason Attack	1. d4 d5 2. Bf4 Nc6 3. e3 Nf6 4. c3 Bg4
2017.05.31	1-0	1490	1500	Sicilian Defense: French Variation	1. e4 e6 2. Nf3 c5 3. Bc4 a6 4. d3 h6
2017.05.31	0-1	1684	1841	Hungarian Opening: Symmetrical Variation	1. g3 g6 2. Bg2 Bg7 3. Nf3 Nf6 4. d3 O-O
2017.05.31	0-1	1535	1620	French Defense: La Bourdonnais Variation	1. e4 e6 2. f4 d5 3. exd5 Qxd5 4. Nf3 c5
2017.05.31	0-1	1364	1716	Vienna Game: Max Lange Defense	1. e4 e5 2. Nc3 Nc6 3. d3 h6 4. Nf3 Nf6
2017.05.31	0-1	1228	1203	Van't Kruijs Opening	1. e3 e5 2. Be2 Nf6 3. Nf3 d6 4. O-O Be6
2017.05.31	1-0	1510	1506	Ponziani Opening: Jaenisch Counterattack	1. e4 e5 2. Nf3 Nc6 3. c3 Nf6 4. d3 d5
2017.05.31	0-1	1704	1703	Bishop's Opening	1. e4 e5 2. Bc4 d6 3. d3 Nf6 4. a3 a6
2017.05.31	0-1	1864	1938	Sicilian Defense	1. e4 c5 2. Nf3 d6 3. d3 g6 4. g3 Bg7
2017.05.31	0-1	1200	1180	Italian Game: Two Knights Defense	1. e4 e5 2. Nf3 Nc6 3. Bc4 Nf6 4. O-O Be7
2017.05.31	1-0	1840	1891	Philidor Defense: Lion Variation	1. e4 d6 2. d4 Nf6 3. Nc3 e5 4. Nf3 Nbd7
2017.05.31	1-0	1674	1388	Sicilian Defense: Old Sicilian	1. e4 c5 2. Nf3 Nc6 3. Bc4 e6 4. d4 Nf6
2017.05.31	1-0	2395	1955	Queen's Pawn Game: Levitsky Attack	1. d4 d5 2. Bg5 Nd7 3. Nc3 Ngf6 4. f3 c6
2017.05.31	1-0	1934	1918	Queen's Gambit Refused: Chigorin Defense, Exchange Variation	1. d4 Nc6 2. c4 d5 3. cxd5 Qxd5 4. e3 Nf6
2017.05.31	0-1	1689	1586	French Defense: Knight Variation	1. e4 e6 2. Nf3 d6 3. Bd3 c5 4. O-O Nc6
2017.05.31	1-0	1916	1935	Scandinavian Defense	1. e4 d5 2. e5 a6 3. d4 c5 4. c3 Nc6
2017.05.31	1-0	2174	2013	Queen's Pawn Game: Levitsky Attack	1. d4 d5 2. Bg5 Nf6 3. Bxf6 gxf6 4. Nf3 e6
2017.05.31	0-1	1399	1468	Russian Game: Three Knights Game	1. e4 Nf6 2. Nc3 e5 3. Nf3 d6 4. h3 Be7
2017.05.31	0-1	2011	1973	Alekhine Defense: Scandinavian Variation	1. e4 Nf6 2. Nc3 d5 3. e5 Ne4 4. Nxe4 dxe4
2017.05.31	1-0	1932	1531	French Defense: Advance Variation, Milner-Barry Gambit	1. e4 e6 2. e5 d5 3. d4 c5 4. c3 Nc6
2017.05.31	0-1	1674	1719	Indian Game: London System	1. d4 Nf6 2. Nf3 e6 3. Bf4 d5 4. e3 a6
2017.05.31	1-0	1781	1624	Caro-Kann Defense: Exchange Variation, Rubinstein Variation	1. d4 d5 2. Bf4 c5 3. e3 cxd4 4. exd4 Nc6
2017.05.31	0-1	1941	2061	Queen's Gambit Refused: Albin Countergambit	1. d4 d5 2. c4 e5 3. dxe5 d4 4. e3 c5
2017.05.31	1-0	1583	1585	King's Gambit Accepted, King's Knight Gambit	1. e4 e5 2. f4 exf4 3. Nf3 Bd6 4. Bc4 Ne7
2017.05.31	1-0	1999	1820	French Defense: Normal Variation	1. d4 e6 2. e4 b6 3. Bd3 Bb7 4. Qe2 d6
2017.05.31	1-0	1494	1520	Nimzo-Larsen Attack: Modern Variation #3	1. b3 e5 2. Bb2 Nc6 3. g3 d5 4. Bg2 Nf6
2017.05.31	0-1	1453	1508	Queen's Pawn Game: Zukertort Variation	1. Nf3 d5 2. d4 e6 3. Nc3 Nc6 4. e4 Bb4
2017.05.31	1-0	1625	1690	Alekhine Defense: Mokele Mbembe	1. e4 Nf6 2. e5 Ne4 3. d3 Nxf2 4. Kxf2 d6
2017.05.31	1-0	1179	967	King's Pawn Game: Busch-Gass Gambit	1. e4 e5 2. Nf3 Bc5 3. Nc3 Nf6 4. Nxe5 d6
2017.05.31	1-0	1261	1304	Robatsch (Modern) Defense	1. e4 g6 2. d4 Bg7 3. Nf3 d5 4. Bd3 e6
2017.05.31	0-1	954	981	French Defense: Reti-Spielmann Attack	1. e4 e6 2. g3 d5 3. d3 Qf6 4. b3 Bc5
2017.05.31	1-0	1736	1624	Queen's Pawn Game: Chigorin Variation	1. d4 d5 2. Nc3 e6 3. Nf3 f5 4. Bf4 Nf6
2017.05.31	1-0	2064	2090	Nimzo-Larsen Attack: Classical Variation	1. b3 d5 2. Bb2 Nf6 3. Nf3 Bf5 4. g3 e6
2017.05.31	0-1	1668	1829	Polish Opening	1. b4 Nf6 2. Bb2 d5 3. e3 Nc6 4. b5 Nb8
2017.05.31	1-0	1775	1776	Sicilian Defense	1. e4 c5 2. Nf3 d6 3. a3 Nf6 4. Nc3 Nc6
2017.05.31	0-1	1230	1217	Sicilian Defense	1. e4 c5 2. Nf3 d6 3. Bc4 Nf6 4. Nc3 e6
2017.05.31	1-0	1561	1138	Robatsch (Modern) Defense	1. e4 g6 2. d4 Bg7 3. e5 b6 4. Be2 Bb7
2017.05.31	0-1	1638	1652	Old Benoni Defense	1. d4 c5 2. c4 e6 3. Nf3 cxd4 4. Nxd4 g6
2017.05.31	1-0	1450	1450	Indian Game: Reversed Chigorin Defense	1. d4 Nf6 2. Nc3 c5 3. dxc5 e6 4. e4 Bxc5
2017.05.31	0-1	1297	1367	Sicilian Defense: Classical Variation	1. e4 c5 2. Nf3 d6 3. d4 cxd4 4. Nxd4 Nf6
2017.05.31	0-1	1715	1677	Caro-Kann Defense	1. e4 c6 2. Nf3 d5 3. exd5 cxd5 4. Nc3 Nf6
2017.05.31	0-1	1585	1594	Queen's Pawn Game: Zukertort Variation	1. d4 d5 2. Nf3 Bf5 3. e3 c6 4. Bd3 Bg6
2017.05.31	1-0	1255	1227	King's Pawn Game: Damiano Defense	1. e4 e5 2. Nf3 f6 3. a3 d6 4. Nc3 c6
2017.05.31	0-1	1164	1258	Italian Game: Anti-Fried Liver Defense	1. e4 e5 2. Nf3 Nc6 3. Bc4 h6 4. O-O Nf6
2017.05.31	1-0	1958	2039	Vienna Game: Stanley Variation, Three Knights Variation	1. e4 e5 2. Bc4 Nf6 3. Nc3 Nc6 4. a3 Bc5
2017.05.31	1/2-1/2	2090	2038	Indian Game: London System	1. d4 e6 2. Nf3 Nf6 3. Bf4 b6 4. e3 c5
2017.05.31	1-0	1730	1628	Hungarian Opening	1. g3 d5 2. Bg2 Nf6 3. b3 Bg4 4. Bb2 e6
2017.05.31	1-0	1398	1386	Center Game	1. e4 e5 2. d4 exd4 3. Qxd4 Nf6 4. Qe3 Be7
2017.05.31	1-0	1888	1865	King's Pawn Game: McConnell Defense	1. e4 e5 2. Nf3 Qf6 3. d4 h6 4. dxe5 Qxe5
2017.05.31	0-1	1561	1721	King's Gambit	1. e4 e5 2. f4 f6 3. Nf3 exf4 4. Bc4 Bc5
2017.05.31	1-0	1580	1587	Philidor Defense #4	1. e4 e5 2. Nf3 d6 3. Bc4 Be7 4. d3 Nf6
2017.05.31	0-1	1154	1248	Mieses Opening	1. d3 g6 2. e4 Bg7 3. f4 e6 4. g4 Ne7
2017.05.31	0-1	2057	2093	Queen's Gambit Accepted: Showalter Variation	1. d4 d5 2. Nf3 Nf6 3. c4 dxc4 4. Nc3 a6
2017.05.31	1-0	1450	1435	Scotch Game	1. e4 e5 2. Nf3 Nc6 3. d4 Bb4+ 4. c3 Ba5
2017.05.31	1/2-1/2	1939	1947	Sicilian Defense: Dragon Variation	1. e4 c5 2. Nf3 d6 3. d4 cxd4 4. Nxd4 Nf6
2017.05.31	1-0	1817	1778	Sicilian Defense #2	1. e4 c5 2. Nf3 d6 3. d4 cxd4 4. Nxd4 e6
2017.05.31	1-0	1712	1670	Alekhine Defense: Exchange Variation	1. e4 Nf6 2. e5 Nd5 3. c4 Nb6 4. d4 d6
2017.05.31	1-0	1806	1688	Philidor Defense	1. e4 e5 2. Nf3 d6 3. d4 Ne7 4. dxe5 Nec6
2017.05.31	1-0	1564	1692	Four Knights Game: Spanish Variation	1. e4 e5 2. Nf3 Nf6 3. Nc3 Nc6 4. Bb5 d6
2017.05.31	0-1	1376	1265	Three Knights Opening	1. e4 e5 2. Nf3 Nc6 3. Nc3 d6 4. Bd3 Be6
2017.05.31	0-1	1978	1829	English Opening: King's English Variation, Two Knights Variation	1. c4 e5 2. Nc3 Nf6 3. e4 c6 4. d3 d5
2017.05.31	1-0	1552	1559	King's Indian Defense: Normal Variation, Rare Defenses	1. d4 Nf6 2. c4 g6 3. Nc3 Bg7 4. e4 d6
2017.05.31	1-0	1746	1689	Queen's Gambit Accepted: Old Variation	1. d4 d5 2. c4 dxc4 3. e3 Nc6 4. Bxc4 e5
2017.05.31	0-1	1530	1481	Philidor Defense	1. e4 e5 2. Nf3 d6 3. d4 Qe7 4. dxe5 dxe5
2017.05.31	0-1	1966	1948	Sicilian Defense: Lasker-Pelikan Variation, Sveshnikov Variation, Chelyabinsk Variation	1. e4 c5 2. Nf3 Nc6 3. d4 cxd4 4. Nxd4 Nf6
2017.05.31	0-1	1216	1322	Queen's Pawn Game #3	1. d4 Nf6 2. e3 d5 3. Bb5+ c6 4. Ba4 e6
2017.05.31	0-1	1769	1659	Van't Kruijs Opening	1. e3 g6 2. c3 Bg7 3. d4 d5 4. Bd3 Nf6
2017.05.31	0-1	1626	1649	Caro-Kann Defense	1. e4 c6 2. f4 d5 3. Nf3 dxe4 4. Ne5 Nd7
2017.05.31	1-0	1171	1251	Scandinavian Defense: Mieses-Kotroc Variation	1. e4 d5 2. exd5 Qxd5 3. f3 e5 4. Bd3 Nh6
2017.05.31	0-1	1800	1880	Van't Kruijs Opening	1. e3 c6 2. d4 d5 3. c4 dxc4 4. Bxc4 Nf6
2017.05.31	0-1	1528	1449	Scandinavian Defense: Mieses-Kotroc Variation	1. e4 d5 2. exd5 Qxd5 3. Nc3 Qd8 4. Bc4 Nf6
2017.05.31	1-0	1968	1961	Amar Opening	1. Nh3 e6 2. g3 Be7 3. Bg2 d6 4. f3 Nf6
2017.05.31	0-1	1638	1625	Van't Kruijs Opening	1. e3 d5 2. Nf3 Nc6 3. d4 f6 4. b3 Bg4
2017.05.31	1-0	2049	1948	Slav Defense: Three Knights Variation	1. d4 d5 2. Nf3 c6 3. c4 Nf6 4. Nc3 Bg4
2017.05.31	1-0	1862	1770	Bird Opening: Dutch Variation	1. f4 d5 2. Nf3 c6 3. d4 Bg4 4. g3 Bxf3
2017.05.31	0-1	1571	1494	Lion Defense: Anti-Philidor	1. e4 d6 2. d4 Nf6 3. Nc3 Nbd7 4. f4 c5
2017.05.31	1-0	1964	1963	Sicilian Defense: O'Kelly Variation, Maroczy Bind, Geller Line	1. e4 c5 2. Nf3 Nc6 3. d4 cxd4 4. Nxd4 a6
2017.05.31	1-0	1982	2021	Scandinavian Defense	1. e4 d5 2. Nc3 d4 3. Nce2 e5 4. f4 Bd6
2017.05.31	1-0	1757	1732	Ruy Lopez: Steinitz Defense	1. e4 e5 2. Nf3 Nc6 3. Bb5 d6 4. O-O Bd7
2017.05.31	1-0	2304	1883	Philidor Defense: Exchange Variation #2	1. e4 e5 2. Nf3 d6 3. d4 exd4 4. Nxd4 Be7
2017.05.31	0-1	1414	1860	Queen's Pawn	1. d4 c6 2. Nf3 d5 3. e3 Nf6 4. Bd3 e6
2017.05.31	1-0	1753	1780	Sicilian Defense: Smith-Morra Gambit Deferred	1. e4 c5 2. Nf3 e6 3. d4 cxd4 4. c3 a6
2017.05.31	0-1	1171	1308	Ruy Lopez: Exchange Variation	1. e4 e5 2. Nf3 Nc6 3. Bb5 a6 4. Bxc6 dxc6
2017.05.31	0-1	1517	1595	Robatsch (Modern) Defense	1. d4 g6 2. e4 Bg7 3. Nf3 e6 4. Be3 Ne7
2017.05.31	1-0	989	1032	King's Pawn Game: Wayward Queen Attack	1. e4 e5 2. Qh5 d6 3. Bc4 Nf6 4. Qxf7#
2017.05.31	0-1	1038	1139	Englund Gambit Declined, Reversed French	1. e3 e5 2. d4 d6 3. c4 f6 4. Nc3 b6
2017.05.31	1-0	1765	1237	Van Geet Opening: Napoleon Attack	1. Nc3 e5 2. Nf3 Nc6 3. d4 d6 4. dxe5 dxe5
2017.05.31	1-0	2130	2173	Sicilian Defense: Paulsen Variation	1. e4 c5 2. Nf3 e6 3. d4 cxd4 4. Nxd4 a6
2017.05.31	0-1	1347	1733	Caro-Kann Defense: Panov Attack #2	1. e4 c6 2. d4 d5 3. exd5 cxd5 4. c4 Nf6
2017.05.31	1-0	1506	1468	Russian Game: Three Knights Game	1. e4 e5 2. Nf3 Nf6 3. Nc3 Bb4 4. Nxe5 Bxc3
2017.05.31	0-1	1330	1532	Giuoco Piano	1. e4 e5 2. Nf3 Nc6 3. Bc4 Bc5 4. Nc3 d6
2017.05.31	1-0	1333	1386	Queen's Pawn Game #2	1. d4 d5 2. e3 Nc6 3. c3 e5 4. Bd3 exd4
2017.05.31	0-1	1662	1769	Sicilian Defense: Accelerated Dragon, Maroczy Bind, Breyer Variation	1. Nf3 c5 2. d4 cxd4 3. Nxd4 g6 4. c4 Bg7
2017.05.31	1-0	1652	1685	King's Indian Defense: Orthodox Variation	1. e4 g6 2. d4 Bg7 3. c4 d6 4. Nc3 Nf6
2017.05.31	1/2-1/2	1326	1322	Philidor Defense #3	1. e4 e5 2. Nf3 d6 3. Bc4 h6 4. d4 exd4
2017.05.31	0-1	1492	1400	Gruenfeld Defense: Brinckmann Attack, Gruenfeld Gambit	1. d4 d5 2. c4 Nf6 3. Nc3 g6 4. Bf4 Bg7
2017.05.31	1-0	1476	1526	Italian Game: Anti-Fried Liver Defense	1. e4 e5 2. Nf3 Nc6 3. Bc4 h6 4. Nc3 Nf6
2017.05.31	0-1	1722	1883	Center Game: von der Lasa Gambit	1. e4 e5 2. d4 exd4 3. Bc4 Nf6 4. e5 d5
2017.05.31	1-0	1845	1687	Sicilian Defense: Old Sicilian	1. e4 c5 2. Nf3 Nc6 3. d3 d6 4. Be2 Nf6
2017.05.31	1/2-1/2	1514	1528	Italian Game: Anti-Fried Liver Defense	1. e4 e5 2. Nf3 Nc6 3. Bc4 h6 4. c3 Nf6
2017.05.31	1-0	2031	1916	Semi-Slav Defense	1. Nf3 d5 2. d4 Nf6 3. c4 c6 4. Nc3 e6
2017.05.31	0-1	2285	1877	English Opening: Symmetrical Variation, Two Knights Variation	1. c4 c5 2. Nc3 Nc6 3. Nf3 d6 4. g3 e5
2017.05.31	0-1	2201	2178	Trompowsky Attack	1. d4 Nf6 2. Bg5 c5 3. d5 Qb6 4. c3 h6
2017.05.31	1-0	1304	1471	French Defense: Knight Variation	1. e4 e6 2. Nf3 d5 3. Bb5+ c6 4. Ba4 b5
2017.05.31	1-0	1595	1574	Philidor Defense #3	1. e4 e5 2. Nf3 d6 3. Bc4 Bg4 4. d4 exd4
2017.05.31	1-0	1744	1773	Queen's Gambit Declined: Modern Variation	1. d4 d5 2. c4 Nf6 3. Nc3 e6 4. Bg5 Bb4
2017.05.31	1-0	1180	1134	Ruy Lopez: Exchange Variation, Normal Variation	1. e4 e5 2. Nf3 Nc6 3. Bb5 a6 4. Bxc6 dxc6
2017.05.31	1-0	2018	1975	Pirc Defense	1. e4 d6 2. d4 Nf6 3. Bd3 c6 4. Ne2 e5
2017.05.31	1-0	1143	1027	Mieses Opening: Reversed Rat	1. d3 e5 2. e3 d5 3. Nc3 f5 4. e4 fxe4
2017.05.31	0-1	1601	1759	Van't Kruijs Opening	1. e3 h6 2. d3 a6 3. Ne2 e6 4. Nd2 Qe7
2017.05.31	1-0	1733	1733	Queen's Pawn Game #2	1. d4 d5 2. e3 c6 3. h3 Nf6 4. a3 Nbd7
2017.05.31	1-0	1517	1498	Sicilian Defense: Open #3	1. e4 c5 2. Nf3 Nc6 3. d4 cxd4 4. Nxd4 d6
2017.05.31	0-1	1819	1929	Scotch Game	1. e4 e5 2. Nf3 Nc6 3. d4 exd4 4. Nxd4 d6
2017.05.31	1-0	1469	1291	Modern Defense: Standard Line	1. d4 g6 2. Nc3 Bg7 3. e4 Nc6 4. d5 Nb4
2017.05.31	1-0	1750	1746	Sicilian Defense: Nyezhmetdinov-Rossolimo Attack	1. e4 c5 2. Nf3 Nc6 3. Bb5 e6 4. Bxc6 bxc6
2017.05.31	1-0	1393	1378	Zukertort Opening: Tennison Gambit	1. e4 d5 2. Nf3 dxe4 3. Ng5 Nf6 4. c3 h6
2017.05.31	0-1	1500	1220	Ruy Lopez: Steinitz Defense	1. e4 e5 2. Nf3 Nc6 3. Bb5 d6 4. Bxc6+ bxc6
2017.05.31	1-0	1766	1468	Bishop's Opening: Berlin Defense, Greco Gambit	1. e4 e5 2. Bc4 Nf6 3. f4 d6 4. Nf3 Be7
2017.05.31	0-1	1769	1764	Mieses Opening	1. d3 c6 2. c4 d5 3. Nc3 dxc4 4. dxc4 Qxd1+
2017.05.31	1-0	1578	1553	French Defense: Normal Variation	1. e4 e6 2. d4 c6 3. Nc3 b5 4. Nf3 b4
2017.05.31	0-1	1508	1814	Latvian Gambit Accepted, Bilguer Variation	1. e4 e5 2. Nf3 f5 3. Nxe5 Qf6 4. d4 d6
2017.05.31	0-1	1688	1758	Modern Defense	1. e4 g6 2. Nf3 Bg7 3. c3 d6 4. d3 e6
2017.05.31	0-1	1764	1791	French Defense: Exchange Variation	1. e4 e6 2. d4 d5 3. exd5 exd5 4. Nf3 Nc6
2017.05.31	1-0	2124	2142	Sicilian Defense: Paulsen Variation	1. e4 c5 2. Nf3 Nc6 3. d4 cxd4 4. Nxd4 e6
2017.05.31	0-1	1956	2212	French Defense: Queen's Knight	1. e4 e6 2. Nc3 d5 3. exd5 exd5 4. d4 Qe7+
2017.05.31	1-0	1830	1697	Queen's Pawn Game #2	1. d4 d5 2. e3 Bf5 3. a3 Bg6 4. c4 e6
2017.05.31	0-1	1368	1379	French Defense: Advance Variation	1. e4 e6 2. d4 d5 3. e5 c5 4. c3 Nc6
2017.05.31	0-1	2162	2216	Queen's Gambit Refused: Chigorin Defense, Exchange Variation	1. d4 d5 2. c4 Nc6 3. cxd5 Qxd5 4. e3 e5
2017.05.31	1-0	1415	1387	Sicilian Defense: Bowdler Attack	1. e4 c5 2. Bc4 e5 3. Nf3 d6 4. O-O Nc6
2017.05.31	0-1	1555	1564	Italian Game: Classical Variation, Giuoco Pianissimo	1. e4 e5 2. Nf3 Nc6 3. Bc4 Nf6 4. d3 Bc5
2017.05.31	0-1	1176	1266	Nimzowitsch Defense, Declined Variation	1. e4 Nc6 2. Nf3 Nf6 3. e5 Nd5 4. d3 d6
2017.05.31	0-1	1019	1622	Saragossa Opening	1. c3 d5 2. Nf3 Nc6 3. e3 e5 4. Na3 Bxa3
2017.05.31	1-0	1928	1953	King's Indian Defense: Orthodox Variation, Positional Defense	1. e4 g6 2. d4 Bg7 3. c4 d6 4. Nf3 Nf6
