Date	Result	WhiteElo	BlackElo	Opening	Moves
2019.01.31	0-1	1404	1405	Benoni Defense: Benoni Gambit Accepted	1. d4 c5 2. dxc5 e6 3. Bf4 Bxc5 4. Nf3 Nf6
2019.01.31	0-1	1360	1381	Grünfeld Defense: Three Knights Variation, Burille Variation	1. d4 Nf6 2. c4 d5 3. e3 g6 4. Nc3 Bg7
2019.01.31	1-0	1306	1311	Philidor Defense #2	1. e4 e5 2. Nf3 d6 3. Nc3 a6 4. Bc4 b5
2019.01.31	1-0	1466	1470	Indian Game: Budapest Defense	1. d4 Nf6 2. c4 e5 3. d5 c6 4. Nc3 Bb4
2019.01.31	1-0	1300	1301	English Opening: Anglo-Indian Defense	1. c4 Nf6 2. g3 b6 3. Bg2 Nc6 4. Nc3 Bb7
2019.01.31	0-1	1381	1382	Dutch Defense: Raphael Variation	1. d4 f5 2. Nc3 Nf6 3. Nf3 d6 4. Bg5 Nc6
2019.01.31	0-1	1019	979	Pirc Defense #4	1. e4 d6 2. Nc3 Nf6 3. f4 g6 4. Bc4 Bg4
2019.01.31	1-0	1237	1264	Italian Game: Evans Gambit, McDonnell Defense	1. e4 e5 2. Nf3 Nc6 3. Bc4 Bc5 4. b4 Bxb4
2019.01.31	0-1	1386	1392	Bishop's Opening: Boi Variation	1. e4 e5 2. Bc4 Bc5 3. Nf3 Qf6 4. O-O d6
2019.01.31	0-1	1265	1265	Scandinavian Defense: Mieses-Kotroc Variation	1. e4 d5 2. exd5 Qxd5 3. Nc3 Qe5+ 4. Be2 Nf6
2019.01.31	1-0	1334	1327	Italian Game: Two Knights Defense	1. e4 e5 2. Nf3 Nc6 3. Bc4 Nf6 4. O-O Be7
2019.01.31	1-0	1109	1145	Sicilian Defense: Staunton-Cochrane Variation	1. e4 c5 2. c4 Nc6 3. Nc3 Nf6 4. d3 e6
2019.01.31	0-1	1336	1343	French Defense: Exchange Variation	1. e4 e6 2. d4 d5 3. exd5 exd5 4. Qf3 Nf6
2019.01.31	0-1	1427	1406	French Defense: Marshall Variation	1. e4 e6 2. d4 d5 3. Nc3 c5 4. Nf3 Nc6
2019.01.31	0-1	1493	1470	Italian Game: Two Knights Defense, Fried Liver Attack	1. e4 e5 2. Nf3 Nc6 3. Bc4 Nf6 4. Ng5 d5
2019.01.31	1-0	1439	1445	Ruy Lopez: Steinitz Defense	1. e4 e5 2. Nf3 Nc6 3. Bb5 d6 4. Bxc6+ bxc6
2019.01.31	1-0	1199	1200	Petrov's Defense	1. e4 e5 2. Nf3 Nf6 3. d3 Bc5 4. Nc3 d6
2019.01.31	0-1	1201	1228	Ruy Lopez: Cozio Defense	1. e4 e5 2. Nf3 Nc6 3. Bb5 Nge7 4. Nc3 a6
2019.01.31	1-0	1991	1970	Pirc Defense #3	1. e4 d6 2. d4 Nf6 3. Nc3 g6 4. f3 c6
2019.01.31	1-0	1909	1930	Slav Defense: Exchange Variation	1. d4 c6 2. c4 d5 3. cxd5 cxd5 4. Nc3 Nc6
2019.01.31	0-1	1701	1827	Mieses Opening	1. d3 d5 2. e3 Nf6 3. Nf3 e6 4. g3 c5
2019.01.31	0-1	2099	2111	Nimzo-Larsen Attack: Indian Variation	1. b3 Nf6 2. Bb2 c6 3. e3 d5 4. g3 Bg4
2019.01.31	1-0	1818	1813	French Defense: Tarrasch Variation	1. e4 e6 2. d4 d5 3. Nd2 dxe4 4. Nxe4 Nf6
2019.01.31	1/2-1/2	1864	1858	Queen's Gambit Declined: 4.Bg5 Be7	1. d4 Nf6 2. c4 e6 3. Nc3 d5 4. Bg5 Be7
2019.01.31	1-0	1684	1681	Sicilian Defense: French Variation	1. e4 c5 2. Nf3 e6 3. Bc4 d5 4. exd5 exd5
2019.01.31	1-0	1121	1369	French Defense: King's Indian Attack	1. e4 e6 2. d3 d5 3. Nf3 c5 4. Ng5 Nc6
2019.01.31	0-1	1636	1634	Hungarian Opening	1. g3 d5 2. Bg2 e5 3. Nh3 Nf6 4. O-O Bxh3
2019.01.31	0-1	1648	1663	Philidor Defense	1. e4 d6 2. Nf3 e5 3. d4 Nc6 4. d5 Nf6
2019.01.31	1-0	2411	2257	Vienna Game: Vienna Gambit, Steinitz Gambit, Knight Variation	1. e4 e5 2. Nc3 Nc6 3. f4 exf4 4. Nf3 g5
2019.01.31	1-0	1533	1485	Scandinavian Defense	1. e4 d5 2. Nc3 dxe4 3. Nxe4 Nf6 4. Qf3 Nxe4
2019.01.31	0-1	1894	1905	Scotch Game: Schmidt Variation	1. e4 e5 2. Nf3 Nc6 3. d4 exd4 4. Nxd4 Nf6
2019.01.31	1-0	2067	2027	Scandinavian Defense: 2.b3	1. e4 d5 2. b3 c6 3. Bb2 dxe4 4. Nc3 Nf6
2019.01.31	0-1	2223	2157	Pirc Defense #5	1. e4 d6 2. d4 d5 3. Nc3 dxe4 4. Nf3 exf3
2019.01.31	0-1	1662	1648	Indian Game: Spielmann-Indian	1. d4 Nf6 2. Nf3 c5 3. Bg5 cxd4 4. Bxf6 gxf6
2019.01.31	1-0	1365	1356	Sicilian Defense: Paulsen Variation	1. e4 c5 2. Nf3 Nc6 3. d4 cxd4 4. Nxd4 e6
2019.01.31	1-0	1762	1705	Queen's Gambit Accepted: Winawer Defense	1. d4 Nf6 2. Nf3 d5 3. c4 dxc4 4. e3 Be6
2019.01.31	0-1	1933	1994	King's Indian Defense: Smyslov Variation	1. d4 d6 2. c4 Nf6 3. Nc3 g6 4. Nf3 Bg7
2019.01.31	1-0	1224	1284	King's Pawn Game: McConnell Defense	1. e4 e5 2. Nf3 Qf6 3. d4 exd4 4. Bg5 Qg6
2019.01.31	1-0	1573	1574	King's Pawn Game: Napoleon Attack	1. e4 e5 2. Qf3 Qf6 3. Qc3 Qc6 4. Qxe5+ Ne7
2019.01.31	1-0	1615	1617	Sicilian Defense: Paulsen Variation	1. e4 c5 2. Nf3 Nc6 3. d4 cxd4 4. Nxd4 e6
2019.01.31	1-0	1594	1592	Scandinavian Defense: Main Line	1. e4 d5 2. exd5 Qxd5 3. Nc3 Qa5 4. Nf3 Bg4
2019.01.31	1-0	1840	2060	Italian Game: Two Knights Defense, Modern Bishop's Opening	1. e4 e5 2. Nf3 Nc6 3. Bc4 Nf6 4. d3 Be7
2019.01.31	1-0	1242	1223	Bishop's Opening	1. e4 e5 2. Bc4 d6 3. d3 Be6 4. Bxe6 fxe6
2019.01.31	1-0	2292	1925	Caro-Kann Defense: Two Knights Attack	1. e4 c6 2. Nc3 d5 3. Nf3 dxe4 4. Nxe4 Bf5
2019.01.31	0-1	1093	1085	Queen's Pawn Game: Chigorin Variation	1. d4 d5 2. Nf3 Nc6 3. Nc3 Bf5 4. e3 e6
2019.01.31	1-0	1630	1646	Ponziani Opening	1. e4 e5 2. Nf3 Nc6 3. c3 d6 4. d4 exd4
2019.01.31	0-1	1435	1486	Sicilian Defense: Smith-Morra Gambit #2	1. e4 c5 2. d4 cxd4 3. Bf4 Nc6 4. g3 e5
2019.01.31	1-0	1096	1130	Philidor Defense: Philidor Gambit	1. e4 e5 2. Nf3 d6 3. d4 Bd7 4. d5 c6
2019.01.31	1-0	978	995	Zukertort Opening: Tennison Gambit	1. e4 d5 2. Nf3 Nc6 3. e5 d4 4. Bb5 Bd7
2019.01.31	1-0	1831	1808	Alekhine Defense: Exchange Variation	1. e4 Nf6 2. e5 Nd5 3. c4 Nb6 4. d4 d5
2019.01.31	1-0	1192	1190	Scotch Game: Scotch Gambit	1. e4 e5 2. d4 exd4 3. Nf3 Nc6 4. Bc4 d6
2019.01.31	1-0	1604	1600	French Defense: Rubinstein Variation	1. e4 d5 2. d4 dxe4 3. Nc3 e6 4. Nxe4 Nf6
2019.01.31	1-0	1857	1861	Bishop's Opening	1. e4 e5 2. Bc4 Nc6 3. d3 Nf6 4. f4 exf4
2019.01.31	0-1	1144	1161	Elephant Gambit	1. e4 e5 2. Nf3 d5 3. exd5 Qxd5 4. Nc3 Qe6
2019.01.31	0-1	2007	1965	English Opening: King's English Variation, Reversed Sicilian	1. c4 e5 2. Nc3 Bc5 3. e3 Nc6 4. Nge2 d6
2019.01.31	0-1	1406	1487	Caro-Kann Defense: Hillbilly Attack	1. e4 c6 2. Bc4 d5 3. exd5 cxd5 4. Bb3 Bf5
2019.01.31	0-1	1994	1954	Zukertort Opening: Ross Gambit	1. Nf3 e5 2. d3 e4 3. Nbd2 exf3 4. exf3 Nf6
2019.01.31	1-0	1313	1320	Caro-Kann Defense: Advance Variation, Short Variation	1. e4 c6 2. Nf3 d5 3. e5 Bf5 4. d4 e6
2019.01.31	0-1	1320	1498	Scotch Game	1. e4 e5 2. Nf3 Nc6 3. d4 d6 4. d5 Nce7
2019.01.31	1-0	1054	1046	Four Knights Game	1. Nc3 e5 2. Nf3 Nc6 3. e4 Nf6 4. g3 d6
2019.01.31	0-1	827	966	Van't Kruijs Opening	1. e3 e5 2. Qh5 Nf6 3. Qxe5+ Qe7 4. Qg5 h6
2019.01.31	1-0	1233	1056	Bishop's Opening: Berlin Defense	1. e4 e5 2. Bc4 Nf6 3. d3 Bc5 4. Nf3 h6
2019.01.31	0-1	1543	1500	Slav Defense: Three Knights Variation	1. d4 d5 2. c4 Nf6 3. Nc3 c6 4. Nf3 Bg4
2019.01.31	0-1	1702	1753	Caro-Kann Defense: Exchange Variation	1. e4 c6 2. d4 d5 3. exd5 cxd5 4. Bd3 Nc6
2019.01.31	1-0	1593	1582	Scotch Game	1. e4 e5 2. Nf3 Nc6 3. d4 exd4 4. Nxd4 Nxd4
2019.01.31	1-0	1530	1489	Queen's Gambit Refused: Marshall Defense	1. d4 Nf6 2. c4 d5 3. cxd5 Qxd5 4. Nc3 Qa5
2019.01.31	0-1	1956	2124	French Defense: Steinitz Attack	1. e4 e6 2. e5 d6 3. exd6 Bxd6 4. d4 Nf6
2019.01.31	1-0	1789	1811	Philidor Defense: Lion Variation	1. d4 d6 2. e4 Nf6 3. Nc3 Nbd7 4. Nf3 e5
2019.01.31	1-0	1506	1452	Scandinavian Defense: Mieses-Kotroc Variation	1. e4 d5 2. exd5 Qxd5 3. Nc3 Qd8 4. Nf3 Nc6
2019.01.31	1-0	2013	1986	Modern Defense: Pseudo-Austrian Attack	1. e4 g6 2. d4 Bg7 3. Nc3 d6 4. f4 a6
2019.01.31	0-1	1409	1411	French Defense: Knight Variation	1. e4 e6 2. Nf3 d5 3. exd5 exd5 4. Bb5+ Bd7
2019.01.31	1-0	1681	1771	Queen's Pawn Game: Mason Attack	1. d4 d5 2. Bf4 c6 3. e3 e6 4. Nf3 Bd6
2019.01.31	0-1	1598	1601	Russian Game: Three Knights Game	1. e4 e5 2. Nf3 Nf6 3. Nc3 d6 4. d3 Be7
2019.01.31	0-1	1234	1231	Mieses Opening	1. d3 g6 2. c3 Bg7 3. Qb3 Nf6 4. Qc2 O-O
2019.01.31	1-0	1185	1026	Zukertort Opening: Tennison Gambit	1. e4 d5 2. Nf3 dxe4 3. Ne5 Qd6 4. f4 f6
2019.01.31	0-1	1650	1619	Sicilian Defense	1. e4 c5 2. Bd3 d6 3. c3 Nc6 4. Bc2 Nf6
2019.01.31	0-1	1319	1286	Queen's Pawn	1. d4 h6 2. c4 f6 3. Nc3 d6 4. Nf3 b6
2019.01.31	1-0	1527	1237	Van't Kruijs Opening	1. e3 e5 2. g3 d6 3. Bg2 Bd7 4. Ne2 Bc6
2019.01.31	1-0	1437	1417	Anderssen Opening	1. a3 Nf6 2. b4 d5 3. Bb2 g6 4. Nf3 Bg7
2019.01.31	0-1	1460	1553	Modern Defense: Two Knights Variation, Suttles Variation	1. Nf3 g6 2. Nc3 Bg7 3. d4 c6 4. e4 d6
2019.01.31	0-1	1837	1834	Sicilian Defense: Four Knights Variation	1. e4 c5 2. Nf3 e6 3. d4 cxd4 4. Nxd4 Nc6
2019.01.31	1-0	1445	1540	French Defense: Queen's Knight	1. e4 e6 2. Nc3 b6 3. Nf3 Bb7 4. d4 Bb4
2019.01.31	0-1	2201	2323	Sicilian Defense: French Variation	1. e4 c5 2. Nf3 e6 3. Nc3 a6 4. a4 Qc7
2019.01.31	0-1	2328	2292	Nimzo-Larsen Attack: Modern Variation #2	1. b3 e5 2. Bb2 d6 3. e3 Nc6 4. Nf3 Nf6
2019.01.31	1-0	2049	2085	Van't Kruijs Opening	1. e3 d5 2. d3 Bg4 3. Qxg4 Nf6 4. Qd1 c5
2019.01.31	1-0	1467	1412	Sicilian Defense: Loewenthal Variation	1. e4 c5 2. Nf3 Nc6 3. d4 cxd4 4. Nxd4 e5
2019.01.31	0-1	2016	2268	Hungarian Opening: Catalan Formation	1. g3 d5 2. Bg2 e6 3. e3 Nf6 4. Ne2 Be7
2019.01.31	0-1	1915	1826	Bird Opening	1. f4 c5 2. b3 d6 3. Bb2 Nf6 4. e3 e6
2019.01.31	0-1	1295	1323	Queen's Gambit Declined	1. d4 d5 2. c4 e6 3. e3 Nf6 4. Nc3 c5
2019.01.31	1-0	1679	1776	Ware Defense	1. e4 a5 2. Nf3 a4 3. d4 c6 4. c4 b6
2019.01.31	0-1	1394	1392	Four Knights Game: Italian Variation	1. e4 e5 2. Nf3 Nc6 3. Nc3 Nf6 4. Bc4 d6
2019.01.31	1-0	1679	1617	Ruy Lopez: Berlin Defense, Rio Gambit Accepted	1. e4 e5 2. Nf3 Nc6 3. Bb5 Nf6 4. O-O Nxe4
2019.01.31	0-1	1470	1564	Danish Gambit	1. e4 e5 2. d4 exd4 3. c3 dxc3 4. Nf3 Qe7
2019.01.31	1-0	1167	1241	Sicilian Defense: French Variation	1. e4 e6 2. Nf3 c5 3. g3 d5 4. exd5 exd5
2019.01.31	1-0	1324	1378	Italian Game: Two Knights Defense, de Riviere Gambit	1. e4 e5 2. Nf3 Nf6 3. Bc4 Nc6 4. c3 Nxe4
2019.01.31	0-1	1494	1558	Sicilian Defense: Drazic Variation	1. d4 e6 2. e4 c5 3. Nf3 a6 4. Bd3 b5
2019.01.31	0-1	1445	1849	Van't Kruijs Opening	1. e3 b6 2. Qf3 Nc6 3. Bc4 e6 4. Nh3 Nf6
2019.01.31	0-1	1593	1818	Sicilian Defense: French Variation	1. e4 e6 2. Nf3 c5 3. d4 Qc7 4. Nc3 a6
2019.01.31	1-0	1210	1274	Queen's Pawn Game: Veresov Attack, Classical Defense	1. d4 d5 2. Nc3 e6 3. Nf3 Nf6 4. Bg5 Be7
2019.01.31	1-0	1710	1713	Queen's Gambit Refused: Marshall Defense	1. d4 d5 2. c4 Nf6 3. Nc3 dxc4 4. a4 Be6
2019.01.31	1-0	1534	1478	Sicilian Defense: Bowdler Attack	1. e4 c5 2. Bc4 Nc6 3. d3 e6 4. f4 b6
2019.01.31	0-1	1802	1897	Sicilian Defense: Snyder Variation	1. e4 c5 2. b3 e6 3. Bb2 Nf6 4. d3 Nc6
2019.01.31	0-1	1399	1432	Italian Game: Anti-Fried Liver Defense	1. e4 e5 2. Nf3 Nc6 3. Bc4 h6 4. O-O d6
2019.01.31	1-0	959	990	Queen's Pawn Game: Mason Attack	1. d4 d5 2. Bf4 f6 3. e3 e6 4. Qh5+ g6
2019.01.31	1-0	1064	1074	Indian Game	1. d4 Nf6 2. Nc3 Nc6 3. e4 e6 4. e5 Nd5
2019.01.31	0-1	1377	1345	Nimzo-Indian Defense: Ragozin Variation	1. d4 d5 2. c4 e6 3. Nf3 Nf6 4. Nc3 Bb4
2019.01.31	0-1	1247	1263	French Defense #2	1. e4 e6 2. Bc4 d5 3. exd5 exd5 4. Bb3 Nc6
2019.01.31	0-1	1587	1737	Elephant Gambit: Paulsen Countergambit	1. e4 e5 2. Nf3 d5 3. exd5 e4 4. Ne5 Qxd5
2019.01.31	1-0	1237	1109	Englund Gambit Complex: Felbecker Gambit	1. d4 e5 2. dxe5 Nc6 3. Nf3 Bc5 4. Nc3 Nge7
2019.01.31	1-0	1719	1654	Nimzowitsch Defense: Kennedy Variation, Linksspringer Variation	1. e4 Nc6 2. d4 e5 3. d5 Nce7 4. f4 exf4
2019.01.31	0-1	1945	1996	French Defense: Knight Variation	1. e4 e6 2. Nf3 d5 3. exd5 exd5 4. d4 Nf6
2019.01.31	1-0	2057	2028	Sicilian Defense: Alapin Variation, Barmen Defense, Modern Line	1. e4 c5 2. c3 d5 3. exd5 Qxd5 4. d4 Nf6
2019.01.31	1-0	1480	1505	French Defense: Knight Variation	1. e4 e6 2. Nf3 b6 3. d4 Bb7 4. Bd3 Nf6
2019.01.31	1-0	2102	2125	Queen's Pawn	1. d4 c6 2. c3 d6 3. e4 Qc7 4. f4 Nf6
2019.01.31	1-0	1565	1557	Modern Defense	1. e4 g6 2. Nf3 Bg7 3. d4 f5 4. Nc3 fxe4
2019.01.31	0-1	1195	1272	Mieses Opening	1. d3 c5 2. Bd2 e6 3. Qc1 Nc6 4. Qd1 Qb6
2019.01.31	1-0	1312	1285	Modern Defense	1. e4 g6 2. Nf3 Bg7 3. Be2 Nf6 4. Nc3 d6
2019.01.31	1-0	1444	1415	Caro-Kann Defense	1. e4 c6 2. Nf3 d5 3. exd5 cxd5 4. d4 Bf5
2019.01.31	1-0	1170	1190	Bishop's Opening	1. e4 e5 2. Bc4 Qh4 3. Nf3 Qf4 4. d3 Bc5
2019.01.31	1-0	1824	1706	French Defense: Exchange Variation	1. e4 e6 2. d4 d5 3. exd5 exd5 4. Be3 Nf6
2019.01.31	1-0	1915	1872	Englund Gambit Declined, Reversed French	1. d4 e5 2. e3 exd4 3. exd4 d5 4. Nf3 Nc6
2019.01.31	0-1	1480	1629	Modern Defense	1. d4 g6 2. e3 Bg7 3. f4 e6 4. Nf3 Ne7
2019.01.31	0-1	1731	1746	Van Geet Opening: Grünfeld Defense, Steiner Gambit	1. e4 e5 2. f4 d5 3. Nc3 dxe4 4. Nxe4 f5
2019.01.31	0-1	1026	1143	King's Pawn Game: Wayward Queen Attack	1. e4 e5 2. Qh5 d6 3. Bc4 g6 4. Qf3 Nf6
2019.01.31	1-0	1589	1524	Ruy Lopez: Steinitz Defense	1. e4 e5 2. Nf3 Nc6 3. Bb5 d6 4. h3 Nf6
2019.01.31	1-0	1297	1215	Italian Game: Two Knights Defense, Fried Liver Attack	1. e4 e5 2. Nf3 Nc6 3. Bc4 Nf6 4. Ng5 d5
2019.01.31	1-0	1168	1209	Sicilian Defense: McDonnell Attack	1. e4 c5 2. f4 a6 3. Nf3 Nc6 4. Nc3 d6
2019.01.31	1-0	1596	1672	Ruy Lopez: Exchange Variation	1. e4 e5 2. Nf3 Nc6 3. Bb5 a6 4. Bxc6 dxc6
2019.01.31	1/2-1/2	958	948	Russian Game: Three Knights Game	1. e4 e5 2. Nf3 Nf6 3. Nc3 Bb4 4. Nxe5 Bxc3
2019.01.31	1-0	1401	1314	King's Pawn Game: Wayward Queen Attack	1. e4 e5 2. Qh5 Nc6 3. Bc4 Nh6 4. d3 g6
2019.01.31	0-1	1904	1844	Carr Defense	1. e4 h6 2. d4 c6 3. c4 d5 4. Nc3 dxe4
2019.01.31	0-1	1573	1561	Scandinavian Defense	1. e4 d5 2. e5 Bf5 3. f4 Nc6 4. d3 e6
2019.01.31	1/2-1/2	1165	1028	Queen's Gambit Accepted: Old Variation	1. d4 d5 2. c4 dxc4 3. e3 e6 4. Bxc4 Nf6
2019.01.31	1-0	1248	1213	Zukertort Opening: Tennison Gambit	1. e4 d5 2. Nf3 dxe4 3. Ng5 Nf6 4. d3 exd3
2019.01.31	1/2-1/2	1309	1333	Russian Game: Three Knights Game	1. e4 e5 2. Nf3 Nf6 3. Nc3 d6 4. d3 Bg4
2019.01.31	1-0	1844	1893	Zukertort Opening: Reversed Mexican Defense	1. Nc3 d5 2. Nf3 Nc6 3. e3 e5 4. d4 e4
2019.01.31	1-0	1403	1354	French Defense: Advance Variation #2	1. e4 e6 2. d4 d5 3. e5 c5 4. c3 cxd4
2019.01.31	1-0	1527	1529	Sicilian Defense: Lasker-Dunne Attack	1. e4 c5 2. g3 e6 3. Bg2 a6 4. d4 cxd4
2019.01.31	0-1	1037	1129	Modern Defense	1. e4 g6 2. Nf3 Nf6 3. Bc4 Nxe4 4. Qe2 Nc5
2019.01.31	1-0	1858	1686	French Defense: Marshall Variation	1. e4 e6 2. d4 d5 3. Nc3 c5 4. exd5 exd5
2019.01.31	1/2-1/2	1997	1999	Sicilian Defense: Old Sicilian	1. e4 c5 2. Nf3 Nc6 3. d3 e5 4. g3 g6
2019.01.31	1-0	1350	1387	Sicilian Defense: Alapin Variation	1. e4 c5 2. c3 Nc6 3. f4 d6 4. h3 e5
2019.01.31	0-1	1708	1702	English Opening: King's English Variation, Two Knights Variation	1. c4 e5 2. Nc3 Nf6 3. d3 Bb4 4. a3 Bxc3+
2019.01.31	1-0	1972	1843	Nimzowitsch Defense: Franco-Nimzowitsch Variation	1. e4 e6 2. Nf3 Nc6 3. Bc4 d5 4. exd5 exd5
2019.01.31	1-0	1038	1075	Queen's Pawn Game: Chigorin Variation	1. d4 d5 2. Nc3 e6 3. Nf3 Bd6 4. e4 e5
2019.01.31	1-0	1597	1621	Three Knights Opening	1. e4 e5 2. Nf3 Nc6 3. Nc3 Bc5 4. Bb5 d6
2019.01.31	0-1	1395	1511	Philidor Defense #2	1. e4 e5 2. Nf3 d6 3. h3 Nc6 4. Bc4 Nce7
2019.01.31	1-0	1295	1295	Three Knights Opening	1. e4 e5 2. Nf3 Nc6 3. Nc3 a6 4. d3 Bb4
2019.01.31	0-1	807	891	Latvian Gambit Accepted	1. e4 e5 2. Nf3 f5 3. exf5 d6 4. Bc4 Nf6
2019.01.31	1-0	1211	1193	Sicilian Defense	1. e4 c5 2. Nf3
2019.01.31	0-1	1478	1534	Zukertort Opening: Black Mustang Defense	1. Nf3 Nc6 2. d4 e6 3. e4 Bb4+ 4. Nc3 Ba5
2019.01.31	1-0	1091	1084	French Defense #2	1. e4 e6 2. Bc4 d5 3. exd5 exd5 4. Qe2+ Be7
2019.01.31	1-0	1800	1640	Italian Game: Two Knights Defense, Modern Bishop's Opening	1. e4 e5 2. Bc4 Nc6 3. Nf3 Nf6 4. d3 b6
2019.01.31	1-0	1821	1579	Queen's Gambit	1. d4 d5 2. c4 b6 3. e3 Bb7 4. cxd5 Bxd5
2019.01.31	1-0	1717	1748	Slav Defense	1. d4 c6 2. c4 d5 3. e3 e6 4. Nf3 Nf6
2019.01.31	1-0	1517	1567	King's Pawn Game: Busch-Gass Gambit	1. e4 e5 2. Nf3 Bc5 3. Bc4 d6 4. O-O Bg4
2019.01.31	0-1	992	1049	Three Knights Opening	1. e4 e5 2. Nc3 Nc6 3. Nf3 Bc5 4. d4 exd4
2019.01.31	1-0	1339	1348	Russian Game: Three Knights Game	1. e4 e5 2. Nf3 Nf6 3. Nc3 d5 4. exd5 Nxd5
2019.01.31	1-0	1381	1370	Sicilian Defense: Alapin Variation	1. e4 c5 2. c3 Nc6 3. d4 e6 4. Nf3 cxd4
2019.01.31	0-1	1329	1314	Slav Defense	1. d4 d5 2. c4 c6 3. e3 dxc4 4. Nc3 b5
2019.01.31	1-0	1985	1845	Vienna Game: Omaha Gambit	1. e4 e5 2. Nc3 d6 3. f4 Nf6 4. Nf3 exf4
2019.01.31	0-1	1361	1369	Queen's Pawn Game: Chigorin Variation	1. d4 d5 2. Nf3 Nc6 3. e3 Bg4 4. Be2 e5
2019.01.31	0-1	1550	2178	Sicilian Defense: Marshall Counterattack	1. e4 c5 2. Nf3 e6 3. d4 d5 4. exd5 exd5
2019.01.31	1-0	1794	1823	Benko Gambit Declined, Sosonko Variation	1. d4 Nf6 2. c4 c5 3. d5 b5 4. a4 bxc4
2019.01.31	1-0	1753	1729	Van't Kruijs Opening	1. e3 d5 2. Qf3 e6 3. c4 dxc4 4. Bxc4 Nf6
2019.01.31	0-1	1625	1656	English Opening: Anglo-Scandinavian Defense, Schulz Gambit	1. c4 d5 2. cxd5 Nf6 3. Nc3 Nxd5 4. Nxd5 Qxd5
2019.01.31	1-0	2143	1872	Grünfeld Defense: Three Knights Variation	1. d4 Nf6 2. c4 g6 3. Nc3 d5 4. Nf3 Bg7
2019.01.31	1-0	1324	1409	Queen's Pawn Game	1. d4 d5 2. b3 Nc6 3. Bb2 Bf5 4. e3 e6
2019.01.31	0-1	1726	1945	King's Indian Defense: Smyslov Variation	1. d4 d6 2. c4 Nf6 3. Nc3 g6 4. Nf3 Bg7
2019.01.31	0-1	1579	1681	Englund Gambit	1. d4 e5 2. c4 exd4 3. Qxd4 Nc6 4. Qd1 Nf6
2019.01.31	0-1	1248	1222	King's Knight Opening: Normal Variation	1. e4 e5 2. Nf3 Nc6 3. d3 Bc5 4. Bg5 f6
2019.01.31	1-0	1884	1914	Queen's Pawn Game: Zukertort Variation	1. d4 d5 2. Nf3 e6 3. c4 c6 4. Nc3 f5
2019.01.31	1/2-1/2	1529	1576	Sicilian Defense: Smith-Morra Gambit #2	1. e4 c5 2. d4 cxd4 3. Qxd4 Nc6 4. Qe3 Nf6
2019.01.31	0-1	983	1004	Caro-Kann Defense: Hillbilly Attack	1. e4 c6 2. Bc4 e6 3. Nf3 d5 4. exd5 cxd5
2019.01.31	1-0	1797	1760	Italian Game: Hungarian Defense	1. e4 e5 2. Nf3 Nc6 3. Bc4 Be7 4. a3 Nf6
2019.01.31	1-0	1032	1135	French Defense: Advance Variation #4	1. e4 d5 2. e5 c5 3. d4 e6 4. c4 Nc6
2019.01.31	1-0	1697	1678	Colle System	1. d4 e6 2. Nf3 d5 3. e3 Nf6 4. c4 c5
2019.01.31	0-1	2114	2207	English Defense #2	1. d4 b6 2. e4 Bb7 3. Bd3 Nf6 4. Qe2 d6
2019.01.31	0-1	1203	1168	Three Knights Opening	1. e4 e5 2. Nf3 Nc6 3. Nc3 Bc5 4. d3 d6
2019.01.31	1-0	1653	1549	Sicilian Defense: Smith-Morra Gambit #2	1. e4 c5 2. d4 Nc6 3. dxc5 e5 4. Nf3 Bxc5
2019.01.31	1/2-1/2	1969	1937	Sicilian Defense: Lasker-Pelikan Variation, Sveshnikov Variation, Chelyabinsk Variation	1. e4 c5 2. Nf3 Nc6 3. d4 cxd4 4. Nxd4 Nf6
2019.01.31	1-0	1750	1759	French Defense: Knight Variation	1. e4 e6 2. Nf3 d5 3. exd5 exd5 4. Nc3 Bd7
2019.01.31	0-1	1996	2075	Slav Defense #2	1. d4 c6 2. c4 d5 3. Nc3 Nf6 4. cxd5 cxd5
2019.01.31	1-0	1375	1323	Russian Game: Urusov Gambit	1. e4 e5 2. Bc4 Nf6 3. Nf3 Qe7 4. d3 d6
2019.01.31	0-1	1503	1455	French Defense: Advance Variation #4	1. e4 e6 2. d4 d5 3. e5 c5 4. Be3 cxd4
2019.01.31	1-0	1655	1673	Sicilian Defense: Modern Variations, Main Line	1. e4 c5 2. Nf3 d6 3. d4 cxd4 4. Nxd4 Nf6
2019.01.31	0-1	1029	867	Russian Game: Three Knights Game	1. e4 e5 2. Nf3 Nf6 3. Nc3 d6 4. Bc4 a6
2019.01.31	0-1	1706	1704	Sicilian Defense: Paulsen-Basman Defense	1. e4 c5 2. Nf3 e6 3. d4 cxd4 4. Nxd4 Bc5
2019.01.31	1-0	1890	1840	Scotch Game: Schmidt Variation	1. e4 e5 2. Nf3 Nc6 3. d4 exd4 4. Nxd4 Nf6
2019.01.31	0-1	1807	1784	Scandinavian Defense: Mieses-Kotroc Variation	1. e4 d5 2. exd5 Qxd5 3. d4 Qd8 4. Nf3 Bg4
2019.01.31	0-1	2014	1844	Sicilian Defense: Kveinis Variation	1. e4 c5 2. Nf3 e6 3. d4 cxd4 4. Nxd4 Qb6
2019.01.31	1-0	1757	1706	King's Pawn Game: McConnell Defense	1. e4 e5 2. Nf3 Qf6 3. Bc4 c6 4. d4 exd4
2019.01.31	1-0	1978	1982	Horwitz Defense	1. d4 e6 2. Nf3 d5 3. c3 Bd6 4. Bg5 f6
2019.01.31	1/2-1/2	2062	1948	Grünfeld Defense: Smyslov Defense	1. Nf3 d5 2. d4 Nf6 3. c4 g6 4. Nc3 Bg7
2019.01.31	0-1	1861	1943	Queen's Pawn Game: Krause Variation	1. d4 d5 2. Nf3 c5 3. c3 Nc6 4. Bf4 e6
2019.01.31	1-0	1246	1232	Zukertort Opening: Old Indian Attack	1. Nf3 d5 2. d3 Nc6 3. e3 e5 4. Be2 Qf6
2019.01.31	0-1	1672	1878	Sicilian Defense: Najdorf Variation, Adams Attack	1. e4 c5 2. Nf3 d6 3. d4 cxd4 4. Nxd4 Nf6
2019.01.31	0-1	1413	1379	Zukertort Opening: Queenside Fianchetto Variation	1. Nf3 b6 2. g3 Bb7 3. Bg2 e6 4. O-O Bc5
2019.01.31	1-0	1093	1126	Indian Game: Wade-Tartakower Defense	1. d4 Nf6 2. Nf3 d6 3. Bf4 e5 4. dxe5 dxe5
2019.01.31	0-1	1481	1537	Danish Gambit	1. e4 e5 2. d4 exd4 3. c3 d3 4. Bxd3 b6
2019.01.31	0-1	1191	1218	Italian Game: Two Knights Defense, Knight Attack, Normal Variation	1. e4 Nc6 2. Nf3 e5 3. Bc4 Nf6 4. Ng5 d5
2019.01.31	1-0	1107	1064	French Defense: Advance Variation #2	1. e4 e6 2. d4 d5 3. e5 c5 4. c3 cxd4
2019.01.31	1-0	919	816	Ware Defense	1. e4 a5 2. Qh5 Nc6 3. e5 Ra6 4. d4 Nxd4
2019.01.31	1-0	1292	1306	King's Gambit Accepted, MacLeod Defense	1. e4 e5 2. f4 exf4 3. Nf3 Nc6 4. Bc4 Nf6
2019.01.31	0-1	1470	1457	French Defense: Advance Variation, Paulsen Attack	1. e4 e6 2. d4 d5 3. e5 c5 4. c3 Nc6
2019.01.31	0-1	1786	2109	Scandinavian Defense: Richter Variation	1. e4 d5 2. exd5 Nf6 3. d4 Nxd5 4. Nf3 g6
2019.01.31	0-1	1506	1478	Ruy Lopez: Columbus Variation	1. e4 e5 2. Nf3 Nc6 3. Bb5 a6 4. Ba4 Be7
2019.01.31	1-0	1308	1422	Caro-Kann Defense: Advance Variation	1. e4 c6 2. d4 d5 3. e5 Bf5 4. f4 e6
2019.01.31	0-1	1145	1287	King's Pawn Game: Mengarini's Opening	1. e4 e5 2. a3 Qh4 3. Nc3 Nc6 4. Nd5 Qxe4+
2019.01.31	1-0	1630	1600	Sicilian Defense: Paulsen Variation, Szén Variation	1. e4 c5 2. Nf3 e6 3. d4 cxd4 4. Nxd4 Nc6
2019.01.31	0-1	1539	1531	Italian Game: Schilling-Kostic Gambit	1. e4 e5 2. Nf3 Nc6 3. Bc4 Nd4 4. d3 Nxf3+
2019.01.31	1-0	1119	1118	Italian Game: Anti-Fried Liver Defense	1. e4 e5 2. Nf3 Nc6 3. Bc4 h6 4. d4 exd4
2019.01.31	1-0	1678	1484	Sicilian Defense: Smith-Morra Gambit	1. e4 c5 2. d4 cxd4 3. c3 dxc3 4. Nxc3 Nc6
2019.01.31	0-1	1500	1752	Bird Opening: From's Gambit	1. f4 e5 2. fxe5 d6 3. exd6 Bxd6 4. Nf3 Bg4
2019.01.31	1-0	1944	1791	Catalan Opening: Closed Variation	1. c4 e6 2. g3 d5 3. d4 Nf6 4. Bg2 c6
2019.01.31	1-0	1317	1206	Queen's Pawn Game: Chigorin Variation	1. d4 d5 2. Nf3 Nc6 3. Nc3 Nf6 4. e3 e6
2019.01.31	0-1	1515	1557	Indian Game: London System	1. d4 Nf6 2. Bf4 e6 3. Nf3 d5 4. e3 Bd6
2019.01.31	0-1	2151	2014	Sicilian Defense: Hyperaccelerated Pterodactyl	1. e4 c5 2. Nf3 g6 3. d4 Bg7 4. c3 cxd4
2019.01.31	0-1	1596	1637	Robatsch (Modern) Defense	1. e4 g6 2. d4 Bg7 3. e5 e6 4. f4 Ne7
2019.01.31	1-0	1192	1116	Sicilian Defense: Canal Attack, Main Line	1. e4 c5 2. Nf3 d6 3. Bb5+ Bd7 4. Bxd7+ Nxd7
2019.01.31	1-0	2232	2258	Réti Opening: Advance Variation	1. Nf3 d5 2. c4 d4 3. b4 Nf6 4. e3 d3
2019.01.31	1-0	1343	1404	Indian Game: Budapest Defense	1. d4 Nf6 2. c4 e5 3. Nc3 exd4 4. Qxd4 Nc6
2019.01.31	1-0	1657	1628	Queen's Gambit Refused: Marshall Defense	1. d4 d5 2. c4 Nf6 3. Nf3 Bf5 4. e3 e6
2019.01.31	0-1	2049	1746	Pirc Defense	1. e4 d6 2. d4 Nf6 3. Bd3 e5 4. c3 Nc6
2019.01.31	0-1	1637	1622	Queen's Pawn Game: Mason Attack	1. d4 d5 2. Bf4 Nf6 3. e3 g6 4. Nf3 Bg7
2019.01.31	1-0	1071	1198	Italian Game: Giuoco Pianissimo	1. e4 e5 2. Nf3 Nc6 3. Bc4 Bc5 4. d3 d6
2019.01.31	0-1	1474	1430	Sicilian Defense: Open #2	1. e4 c5 2. Nf3 Nc6 3. d4 cxd4 4. Bc4 e6
2019.01.31	1-0	1590	1685	Owen Defense	1. e4 b6 2. Nc3 Bb7 3. b3 Nc6 4. Bb2 e6
2019.01.31	0-1	1917	1909	King's Indian Defense: Fianchetto Variation, Classical Fianchetto	1. d4 d6 2. Nf3 Nf6 3. c4 g6 4. Nc3 Bg7
2019.01.31	1-0	1388	1407	Queen's Pawn Game #3	1. d4 d5 2. e3 Nf6 3. b3 Bf5 4. g3 e6
2019.01.31	1-0	1767	1737	French Defense: La Bourdonnais Variation	1. e4 e6 2. f4 d5 3. e5 c5 4. Nf3 Nc6
2019.01.31	1-0	1823	1836	Queen's Pawn Game: Zukertort Variation	1. Nf3 d5 2. d4 Bf5 3. Bf4 e6 4. e3 Bd6
2019.01.31	1-0	992	921	Englund Gambit	1. d4 e5 2. c3 d5 3. dxe5 Nc6 4. Qd4 Qe7
2019.01.31	1-0	1048	1048	Queen's Pawn Game #2	1. d4 d5 2. e3 Nc6 3. Qh5 Nf6 4. Qf3 a6
2019.01.31	1-0	1747	1755	Caro-Kann Defense: Breyer Variation	1. e4 c6 2. d3 d5 3. Nd2 e5 4. exd5 cxd5
2019.01.31	1-0	1158	1104	Four Knights Game: Halloween Gambit	1. e4 e5 2. Nf3 Nf6 3. Nc3 Nc6 4. Nxe5 Nxe5
2019.01.31	1-0	1794	1787	Queen's Pawn Game: Colle System	1. d4 Nf6 2. Nf3 d5 3. e3 Bg4 4. Be2 e6
2019.01.31	0-1	2101	1991	Sicilian Defense: Keres Variation	1. e4 c5 2. Ne2 e5 3. Nbc3 Nf6 4. g3 d6
2019.01.31	0-1	1499	1312	Scotch Game	1. e4 e5 2. Nf3 Nc6 3. d4 Bb4+ 4. c3 Ba5
2019.01.31	0-1	1585	1637	Queen's Pawn	1. d4 d6 2. Bg5 c6 3. e4 g6 4. f4 Bg7
2019.01.31	1-0	1733	1721	Owen Defense	1. e4 b6 2. d4 Bb7 3. f3 Nf6 4. c4 e6
2019.01.31	0-1	1287	1304	Old Benoni Defense	1. d4 c5 2. e3 cxd4 3. exd4 Nf6 4. Nf3 d5
2019.01.31	1-0	1627	1998	Italian Game: Rousseau Gambit	1. e4 e5 2. Nf3 Nc6 3. Bc4 f5 4. exf5 Nf6
2019.01.31	1-0	1395	1435	Pirc Defense: Byrne Variation	1. e4 d6 2. d4 Nf6 3. Nc3 g6 4. Bg5 Bg7
2019.01.31	1-0	1525	1517	English Defense #2	1. d4 b6 2. e3 Bb7 3. Nf3 h6 4. Be2 g5
2019.01.31	0-1	1808	2161	Ruy Lopez: Morphy Defense, Anderssen Variation	1. e4 e5 2. Nf3 Nc6 3. Bb5 a6 4. Ba4 Nf6
2019.01.31	1-0	1541	1535	French Defense: Tarrasch Variation, Open System, Suechting Line	1. e4 e6 2. d4 d5 3. Nd2 c5 4. c3 Nc6
2019.01.31	1-0	1265	1399	Zukertort Opening: Tennison Gambit	1. e4 d5 2. Nf3 dxe4 3. Ng5 Bf5 4. Nc3 Nf6
2019.01.31	1-0	2187	2398	Dutch Defense: Blackmar's Second Gambit	1. d4 f5 2. Nc3 Nf6 3. e4 fxe4 4. f3 exf3
2019.01.31	1-0	2023	1820	Scandinavian Defense: Mieses-Kotroc Variation	1. e4 d5 2. exd5 Qxd5 3. d4 c5 4. Be3 cxd4
2019.01.31	0-1	1512	1623	Scandinavian Defense: Mieses-Kotroc Variation	1. e4 d5 2. exd5 Qxd5 3. Nc3 Qd8 4. Bb5+ c6
2019.01.31	1-0	1694	1659	Owen Defense	1. e4 b6 2. Nf3 Bb7 3. d3 d6 4. Bg5 Nd7
2019.01.31	1-0	1183	1066	King's Gambit Declined, Queen's Knight Defense	1. e4 e5 2. f4 Nc6 3. fxe5 Nxe5 4. d4 Nc6
2019.01.31	0-1	1882	1823	Sicilian Defense: Nyezhmetdinov-Rossolimo Attack	1. e4 c5 2. Nf3 Nc6 3. Bb5 Na5 4. O-O a6
2019.01.31	0-1	1895	1905	Sicilian Defense: Najdorf Variation	1. Nf3 d6 2. d4 c5 3. Bg5 cxd4 4. Nxd4 a6
2019.01.31	0-1	1924	1997	Queen's Pawn Game	1. d4 d5 2. c3 c6 3. Qc2 e6 4. e4 dxe4
2019.01.31	1-0	1544	1565	Sicilian Defense: Delayed Alapin	1. e4 c5 2. Nf3 d6 3. c3 Bg4 4. d4 cxd4
2019.01.31	0-1	1449	1442	Sicilian Defense: Smith-Morra Gambit	1. e4 c5 2. d4 cxd4 3. c3 Nc6 4. Qb3 e5
2019.01.31	1-0	1634	1642	Sicilian Defense: Modern Variations, Anti-Qxd4 Move Order	1. e4 c5 2. Nf3 d6 3. d4 Nf6 4. dxc5 Qa5+
2019.01.31	1-0	1649	1915	Alekhine Defense: Krejcik Variation, Krejcik Gambit	1. e4 Nf6 2. Bc4 Nxe4 3. Bxf7+ Kxf7 4. Qh5+ Ke6
2019.01.31	1-0	1635	1600	English Opening	1. c4 b6 2. Nc3 g6 3. e3 Bg7 4. d4 Bb7
2019.01.31	0-1	1147	1203	Sicilian Defense: Bowdler Attack	1. e4 c5 2. Bc4 e5 3. Qf3 Nf6 4. d3 d6
