Date	Result	WhiteElo	BlackElo	Opening	Moves
2016.06.30	0-1	1461	1830	Modern Defense	1. e4 g6 2. Nf3 Bg7 3. d3 d6 4. Be2 Nf6
2016.06.30	1-0	1351	1189	Four Knights Game: Scotch Variation	1. e4 e5 2. Nf3 Nf6 3. Nc3 Nc6 4. d4 Bb4
2016.06.30	0-1	2065	2234	French Defense: Exchange Variation	1. e4 e6 2. d4 d5 3. exd5 exd5 4. Nf3 Nc6
2016.06.30	0-1	1123	1494	Queen's Pawn Game	1. d4 d5 2. c3 c6 3. e3 g6 4. g4 Bg7
2016.06.30	0-1	1762	1682	Petrov's Defense #2	1. e4 e5 2. Nf3 Nf6 3. Nxe5 Qe7 4. d4 d6
2016.06.30	1-0	1928	1774	Alekhine Defense: Exchange Variation	1. e4 Nf6 2. e5 Nd5 3. d4 d6 4. c4 Nb6
2016.06.30	0-1	1834	1847	French Defense: Diemer-Duhm Gambit	1. e4 e6 2. d4 d5 3. c4 dxe4 4. Nc3 Nf6
2016.06.30	1-0	2266	2161	Modern Defense: Averbakh System, Randspringer Variation	1. d4 g6 2. c4 Bg7 3. Nc3 d6 4. e4 f5
2016.06.30	0-1	1432	1718	King's Pawn Game: Macleod Attack	1. e4 e5 2. c3 Nf6 3. d3 Nc6 4. Nf3 Bc5
2016.06.30	1/2-1/2	2097	2108	Caro-Kann Defense: Rasa-Studier Gambit	1. d4 d5 2. f3 c6 3. e4 dxe4 4. Nc3 e5
2016.06.30	0-1	1223	1546	Van't Kruijs Opening	1. e3 e5 2. Nf3 Nc6 3. d4 e4 4. Ne5 Nxe5
2016.06.30	1-0	1444	1532	Owen Defense	1. e4 b6 2. f3 Bb7 3. d3 c5 4. Be2 Nc6
2016.06.30	1-0	1837	1640	Modern Defense	1. e4 g6 2. Bc4 Bg7 3. d3 d6 4. Nc3 Nf6
2016.06.30	1-0	1538	1474	Queen's Pawn	1. d4 c6 2. Bf4 d5 3. e3 Nf6 4. Nf3 Nh5
2016.06.30	1-0	1409	1486	Center Game: Normal Variation	1. e4 e5 2. d4 exd4 3. Qxd4 Nc6 4. Qd1 Nf6
2016.06.30	1-0	2007	1995	Scandinavian Defense	1. e4 d5 2. e5 c5 3. Nf3 Nc6 4. Bb5 Bg4
2016.06.30	0-1	1550	1500	Ruy Lopez: Exchange Variation, Normal Variation	1. e4 e5 2. Nf3 Nc6 3. Bb5 a6 4. Bxc6 dxc6
2016.06.30	1-0	1989	2137	Sicilian Defense: Closed Variation, Traditional	1. e4 c5 2. Nc3 Nc6 3. Nf3 e6 4. Bc4 Nf6
2016.06.30	0-1	1299	1783	Sicilian Defense: Old Sicilian	1. e4 c5 2. Nf3 Nc6 3. Bc4 Nf6 4. d3 e6
2016.06.30	1-0	1564	1519	French Defense: Exchange Variation	1. e4 e6 2. d4 d5 3. exd5 exd5 4. Nf3 Nf6
2016.06.30	1/2-1/2	2254	2211	Van Geet Opening	1. Nc3 d6 2. e4 Bd7 3. Nf3 Qc8 4. h3 h5
2016.06.30	0-1	1661	1446	Philidor Defense #3	1. e4 e5 2. Nf3 d6 3. Bc4 Bg4 4. c3 Bxf3
2016.06.30	1-0	1830	1678	Nimzo-Indian Defense: Leningrad Variation	1. d4 Nf6 2. c4 e6 3. Nc3 Bb4 4. Bg5 h6
2016.06.30	0-1	1896	1847	Van Geet Opening: Reversed Nimzowitsch	1. Nc3 e5 2. Ne4 d6 3. d4 f5 4. Ng5 Nc6
2016.06.30	0-1	1366	1335	Sicilian Defense	1. e4 c5 2. d3 e6 3. Be3 Nc6 4. Qd2 Nf6
2016.06.30	1-0	1972	1851	Hungarian Opening	1. g3 d5 2. Bg2 e5 3. c4 c6 4. Qb3 Nf6
2016.06.30	1-0	1332	1463	Scotch Game	1. e4 e5 2. Nf3 Nc6 3. d4 d6 4. dxe5 dxe5
2016.06.30	0-1	2219	2214	Zukertort Opening: Kingside Fianchetto	1. Nf3 g6 2. e4 Bg7 3. d4 c6 4. c4 d6
2016.06.30	1-0	1630	1842	King's Gambit Accepted, Bishop's Gambit, Anderssen Defense	1. e4 e5 2. f4 exf4 3. Bc4 g5 4. Qh5 Qe7
2016.06.30	0-1	1475	1315	King's Indian Defense: Four Pawns Attack	1. d4 Nf6 2. c4 g6 3. Nc3 Bg7 4. e4 d6
2016.06.30	0-1	1883	2000	Modern Defense	1. e4 g6 2. Nf3 Bg7 3. Nc3 d6 4. Bc4 a6
2016.06.30	0-1	1745	1612	Queen's Pawn Game: Zukertort Variation	1. d4 d5 2. Nf3 f6 3. Bf4 Nc6 4. e3 e6
2016.06.30	0-1	1925	2126	Bird Opening	1. f4 e6 2. Nf3 g6 3. e3 Bg7 4. Nc3 d5
2016.06.30	0-1	1389	1442	Blackmar-Diemer Gambit: Diemer-Rosenberg Attack	1. d4 d5 2. e4 dxe4 3. Be3 e6 4. Ne2 Nf6
2016.06.30	0-1	1712	1818	English Opening: Caro-Kann Defensive System	1. c4 c6 2. Nc3 e6 3. e4 d5 4. d3 d4
2016.06.30	0-1	1597	1541	Italian Game: Anti-Fried Liver Defense	1. e4 e5 2. Nf3 Nc6 3. Bc4 h6 4. d4 Bd6
2016.06.30	0-1	1396	1667	English Opening: King's English Variation	1. c4 e5 2. g3 d6 3. Bg2 f5 4. e3 Nf6
2016.06.30	1-0	1523	1483	Sicilian Defense: Alapin Variation	1. e4 c5 2. c3 d6 3. d4 cxd4 4. cxd4 g6
2016.06.30	1-0	1653	1715	Bishop's Opening	1. e4 e5 2. Bc4 Nc6 3. Qf3 Nf6 4. Ne2 d6
2016.06.30	1-0	2336	2152	Nimzowitsch Defense: Kennedy Variation, Linksspringer Variation	1. e4 e5 2. d4 Nc6 3. d5 Nce7 4. Nf3 Ng6
2016.06.30	1-0	1795	1515	Queen's Gambit Refused: Marshall Defense	1. d4 d5 2. c4 Nf6 3. cxd5 e6 4. dxe6 fxe6
2016.06.30	0-1	2036	2087	Sicilian Defense: Lasker-Dunne Attack	1. e4 c5 2. g3 d5 3. Bg2 dxe4 4. Nc3 Nf6
2016.06.30	1-0	2195	2178	French Defense: Steinitz Variation, Boleslavsky Variation	1. e4 e6 2. d4 d5 3. Nc3 Nf6 4. e5 Nfd7
2016.06.30	1-0	1860	1776	Queen's Gambit Declined	1. d4 d5 2. c4 e6 3. Nf3 Nf6 4. e3 Bb4+
2016.06.30	0-1	1395	1590	French Defense: Advance Variation, Euwe Variation	1. e4 e6 2. Nf3 d5 3. e5 c5 4. d4 Nc6
2016.06.30	0-1	1934	1950	English Opening: Anglo-Indian Defense, Queen's Knight Variation	1. c4 Nf6 2. Nc3 c5 3. d4 cxd4 4. Qxd4 Nc6
2016.06.30	1-0	1996	1608	Alekhine Defense	1. e4 Nf6 2. Nc3 b6 3. g3 Bb7 4. Bg2 e6
2016.06.30	1-0	1630	1570	Sicilian Defense: Canal-Sokolsky Attack	1. e4 c5 2. Nf3 d6 3. Bb5+ Nd7 4. d3 a6
2016.06.30	1-0	1694	1333	Nimzo-Indian Defense: Ragozin Variation	1. d4 d5 2. c4 e6 3. Nc3 Bb4 4. Nf3 Nf6
2016.06.30	0-1	1571	1578	French Defense #2	1. e4 e6 2. Nh3 c5 3. Qf3 Nf6 4. d3 Qa5+
2016.06.30	0-1	1500	2183	Scandinavian Defense: Main Line	1. e4 d5 2. exd5 Qxd5 3. Nc3 Qa5 4. d4 Nc6
2016.06.30	1-0	1357	973	King's Pawn Game: Wayward Queen Attack	1. e4 e5 2. Qh5 Nh6 3. Qxe5+ Be7 4. Qxg7 Rg8
2016.06.30	0-1	1562	1722	French Defense: Knight Variation	1. e4 e6 2. Nf3 d5 3. exd5 exd5 4. Qe2+ Be7
2016.06.30	1-0	2073	2217	Russian Game: Urusov Gambit	1. e4 e5 2. Nf3 Nf6 3. Bc4 Bd6 4. d4 Qe7
2016.06.30	1-0	1540	1859	Horwitz Defense	1. d4 e6 2. e3 b6 3. c4 Bb7 4. c5 bxc5
2016.06.30	0-1	1831	1820	Caro-Kann Defense	1. e4 c6 2. Nf3 Qc7 3. Nc3 d6 4. d4 Bg4
2016.06.30	0-1	1500	1359	Nimzowitsch Defense	1. e4 Nc6 2. Nc3 Nf6 3. d3 d5 4. Bg5 dxe4
2016.06.30	1-0	1520	1416	Queen's Gambit Declined	1. d4 d5 2. c4 e6 3. cxd5 exd5 4. a3 Bf5
2016.06.30	1-0	1678	1561	French Defense: Reti-Spielmann Attack	1. e4 e6 2. g3 d5 3. Bg2 c5 4. d3 Nc6
2016.06.30	1-0	1646	1569	Ponziani Opening: Jaenisch Counterattack	1. e4 e5 2. Nf3 Nc6 3. c3 Nf6 4. d3 Be7
2016.06.30	0-1	1525	1644	Scandinavian Defense: Mieses-Kotroc Variation	1. e4 d5 2. exd5 Qxd5 3. Nc3 Qd8 4. d4 Nf6
2016.06.30	1-0	1643	1718	French Defense: Advance Variation, Paulsen Attack	1. e4 e6 2. Nf3 d5 3. e5 c5 4. d4 Nc6
2016.06.30	1-0	1724	1299	King's Pawn Game: Maroczy Defense	1. e4 d6 2. d4 e5 3. dxe5 dxe5 4. Qxd8+ Kxd8
2016.06.30	0-1	1748	1809	Sicilian Defense	1. e4 c5 2. e5 e6 3. f4 Nc6 4. Nf3 d6
2016.06.30	1-0	1965	1720	English Opening: Anglo-Indian Defense	1. c4 Nf6 2. e3 e5 3. d4 exd4 4. exd4 c5
2016.06.30	0-1	1880	1870	Sicilian Defense: Bowdler Attack	1. e4 c5 2. Bc4 e6 3. d3 Nc6 4. Nc3 d6
2016.06.30	0-1	1402	1866	Sicilian Defense: Staunton-Cochrane Variation	1. e4 c5 2. c4 d6 3. Nc3 Nf6 4. Nf3 g6
2016.06.30	1-0	1663	1707	Nimzowitsch Defense: Mikenas Variation	1. e4 Nc6 2. d4 d6 3. c4 Nf6 4. Nc3 g6
2016.06.30	1-0	1600	1583	Petrov's Defense #2	1. e4 e5 2. Nf3 Nf6 3. Nxe5 Qe7 4. f4 d6
2016.06.30	0-1	1687	1702	Englund Gambit Complex Declined	1. d4 e5 2. d5 d6 3. c4 c6 4. Nc3 cxd5
2016.06.30	0-1	1376	1333	Sicilian Defense	1. e4 c5 2. d3 d6 3. c4 Nf6 4. f3 Nc6
2016.06.30	1-0	1869	1793	French Defense: Knight Variation	1. e4 e6 2. Nf3 d5 3. exd5 exd5 4. d4 Bg4
2016.06.30	0-1	1723	1970	Modern Defense: Two Knights Variation, Suttles Variation	1. e4 g6 2. d4 Bg7 3. Nc3 d6 4. Nf3 c6
2016.06.30	0-1	1992	1511	Scandinavian Defense: Mieses-Kotroc Variation	1. e4 d5 2. exd5 Qxd5 3. Nc3 Qd8 4. d4 e6
2016.06.30	0-1	1598	1537	English Opening: Caro-Kann Defensive System	1. c4 c6 2. Nc3 d6 3. e4 Qc7 4. d3 Nf6
2016.06.30	1-0	1951	2057	Nimzowitsch Defense: Kennedy Variation, Linksspringer Variation	1. e4 Nc6 2. d4 e5 3. d5 Nce7 4. Bd3 Nf6
2016.06.30	1-0	1658	1660	Sicilian Defense: Smith-Morra Gambit	1. e4 c5 2. d4 cxd4 3. c3 dxc3 4. Nxc3 g6
2016.06.30	1-0	1939	1611	Nimzowitsch Defense: Mikenas Variation	1. e4 d6 2. d4 Nc6 3. Nc3 e5 4. Nf3 g6
2016.06.30	0-1	2064	2176	Polish Defense	1. d4 b5 2. e4 Bb7 3. Bd3 a6 4. Be3 e6
2016.06.30	1-0	1830	1631	Philidor Defense #3	1. e4 e5 2. Nf3 d6 3. Bc4 Bg4 4. h3 Bxf3
2016.06.30	1-0	2043	2064	Queen's Gambit Accepted: Central Variation, McDonnell Defense	1. d4 d5 2. c4 dxc4 3. e4 e5 4. d5 Bb4+
2016.06.30	0-1	1859	1884	Indian Game	1. d4 Nf6 2. e3 d6 3. c4 Nc6 4. Nf3 Bg4
2016.06.30	1-0	1704	1817	French Defense: Advance Variation #2	1. e4 e6 2. d4 d5 3. e5 c5 4. c3 cxd4
2016.06.30	1-0	1802	1748	Three Knights Opening #2	1. e4 e5 2. Nf3 Nc6 3. Nc3 Bb4 4. Bc4 Nf6
2016.06.30	0-1	1783	1761	Queen's Pawn Game: Krause Variation	1. d4 d5 2. Nf3 c5 3. g3 e6 4. Bg2 Nf6
2016.06.30	1-0	1670	1578	Ruy Lopez: Classical Variation, Central Variation	1. Nf3 Nc6 2. e4 e5 3. Bb5 Bc5 4. c3 Nge7
2016.06.30	0-1	1641	1799	Italian Game: Two Knights Defense, Fried Liver Attack	1. e4 e5 2. Bc4 Nc6 3. Nf3 Nf6 4. Ng5 d5
2016.06.30	1-0	1331	1117	French Defense: Knight Variation	1. e4 e6 2. Nf3 Qh4 3. Bb5 Bb4 4. Nxh4 h5
2016.06.30	1/2-1/2	1817	1851	Sicilian Defense: Classical Variation	1. e4 c5 2. Nf3 d6 3. d4 cxd4 4. Nxd4 Nf6
2016.06.30	1/2-1/2	1722	1737	Queen's Gambit Accepted: Saduleto Variation	1. d4 d5 2. c4 dxc4 3. e4 e6 4. Bxc4 c5
2016.06.30	0-1	1196	1192	Philidor Defense #2	1. e4 e5 2. Nf3 d6 3. h3 Nc6 4. c3 Nf6
2016.06.30	1-0	1826	1855	Reti Opening: Reti Accepted	1. Nf3 d5 2. c4 dxc4 3. Na3 Nf6 4. Nxc4 Nc6
2016.06.30	0-1	1801	1996	Sicilian Defense: Nyezhmetdinov-Rossolimo Attack, Fianchetto Variation	1. e4 c5 2. Nf3 Nc6 3. Bb5 g6 4. Bxc6 bxc6
2016.06.30	1-0	1828	1930	King's Pawn Game	1. e4 e5 2. g3 Bc5 3. Bg2 Qf6 4. Nf3 Nh6
2016.06.30	1/2-1/2	2067	2012	Horwitz Defense	1. d4 e6 2. c3 d5 3. g3 Nf6 4. Bg2 Bd6
2016.06.30	1-0	1538	1584	King's Knight Opening: Normal Variation	1. e4 e5 2. Nf3 Nc6 3. d3 Bc5 4. c3 Nf6
2016.06.30	0-1	1292	1472	French Defense: Knight Variation	1. e4 e6 2. Nf3 a6 3. e5 d6 4. d4 dxe5
2016.06.30	1-0	1605	1498	Caro-Kann Defense	1. e4 c6 2. Nf3 d5 3. exd5 cxd5 4. c4 Nf6
2016.06.30	1/2-1/2	1857	1934	Scandinavian Defense: Marshall Variation	1. e4 d5 2. exd5 Nf6 3. d4 Nxd5 4. Nf3 Nc6
2016.06.30	0-1	1780	1994	Sicilian Defense	1. e4 c5 2. d3 Nc6 3. Be3 d6 4. Be2 e6
2016.06.30	1-0	1828	1917	Old Benoni Defense	1. d4 c5 2. c3 cxd4 3. cxd4 g6 4. e3 Bg7
2016.06.30	0-1	1870	1930	Queen's Pawn Game: Mason Attack	1. d4 d5 2. Bf4 Nf6 3. e3 Bf5 4. Bd3 Bg4
2016.06.30	0-1	1553	1967	Scandinavian Defense: Marshall Variation	1. e4 d5 2. exd5 Nf6 3. d4 Nxd5 4. Nc3 e6
2016.06.30	0-1	2078	2320	Italian Game: Classical Variation, Greco Gambit, Traditional Line	1. e4 e5 2. Nf3 Nc6 3. Bc4 Bc5 4. c3 Nf6
2016.06.30	0-1	1342	1762	Hungarian Opening	1. g3 Nc6 2. Bg2 e5 3. Nf3 e4 4. Ng1 d5
2016.06.30	0-1	1145	1786	Sicilian Defense: Bowdler Attack	1. e4 c5 2. Bc4 Nc6 3. Qh5 e6 4. Qf3 Nd4
2016.06.30	0-1	1895	1915	Sicilian Defense	1. e4 c5 2. Nf3 d6 3. Bc4 e6 4. d3 Nc6
2016.06.30	1-0	1570	1593	Philidor Defense: Exchange Variation #2	1. e4 e5 2. Nf3 d6 3. d4 exd4 4. Nxd4 Nc6
2016.06.30	1-0	1751	1771	Scandinavian Defense: Main Line, Mieses Variation	1. e4 d5 2. exd5 Qxd5 3. Nc3 Qa5 4. d4 Nf6
2016.06.30	1-0	2045	1294	Queen's Pawn	1. d4 c6 2. Nf3 d5 3. Bg5 Bg4 4. e3 Bxf3
2016.06.30	1-0	1536	1536	Van't Kruijs Opening	1. e3 e6 2. a3 d5 3. b3 c5 4. Bb2 Nc6
2016.06.30	0-1	1383	1443	Reti Opening	1. Nf3 d5 2. e3 c5 3. Bb5+ Nd7 4. d4 c4
2016.06.30	1/2-1/2	1977	1988	Owen Defense	1. e4 b6 2. Bc4 Bb7 3. Nc3 e5 4. Nf3 Nf6
2016.06.30	1-0	1772	1877	Sicilian Defense: Four Knights Variation	1. e4 c5 2. Nf3 Nc6 3. d4 cxd4 4. Nxd4 e6
2016.06.30	1-0	2076	2214	Modern Defense: Pseudo-Austrian Attack	1. e4 g6 2. d4 Bg7 3. Nc3 d6 4. f4 a6
2016.06.30	1-0	1591	1706	Sicilian Defense: Alapin Variation	1. e4 c5 2. c3 Nc6 3. d4 cxd4 4. cxd4 e6
2016.06.30	1/2-1/2	1387	1496	Nimzowitsch Defense: Kennedy Variation, Linksspringer Variation	1. e4 Nc6 2. d4 e5 3. d5 Nce7 4. Nf3 f6
2016.06.30	1-0	1508	1286	Owen Defense	1. e4 b6 2. Nf3 Bb7 3. d3 g6 4. Nc3 Bg7
2016.06.30	1-0	1803	1736	Sicilian Defense: Lasker-Pelikan Variation, Sveshnikov Variation, Chelyabinsk Variation	1. e4 c5 2. Nf3 Nc6 3. d4 cxd4 4. Nxd4 Nf6
2016.06.30	1-0	1738	1681	Sicilian Defense: Smith-Morra Gambit #2	1. e4 c5 2. d4 cxd4 3. Qxd4 Nc6 4. Qd1 g6
2016.06.30	1-0	1689	1748	King's Indian Attack: Symmetrical Defense	1. Nf3 Nf6 2. g3 g6 3. Bg2 Bg7 4. O-O d5
2016.06.30	1-0	2064	1981	Sicilian Defense: Wing Gambit, Deferred Variation	1. e4 c5 2. Nf3 d6 3. b4 cxb4 4. Bb2 Nf6
2016.06.30	1-0	1814	1679	Nimzo-Larsen Attack: Modern Variation #4	1. b3 e5 2. Bb2 Nc6 3. e3 f5 4. Bb5 Bd6
2016.06.30	1-0	1500	1500	Italian Game: Two Knights Defense, Fried Liver Attack	1. e4 e5 2. Nf3 Nc6 3. Bc4 Nf6 4. Ng5 d5
2016.06.30	1-0	1770	1975	Sicilian Defense: Closed Variation, Traditional	1. e4 c5 2. Nc3 Nc6 3. Bc4 e6 4. d3 Nf6
2016.06.30	0-1	1877	2149	Caro-Kann Defense: Advance Variation, Botvinnik-Carls Defense	1. e4 c6 2. d4 d5 3. e5 c5 4. c3 Nc6
2016.06.30	1-0	1876	1949	French Defense: Horwitz Attack, Papa-Ticulat Gambit	1. e4 e6 2. b3 d5 3. Bb2 dxe4 4. Nc3 Nf6
2016.06.30	1-0	1531	1298	Nimzowitsch Defense, Declined Variation	1. e4 Nc6 2. Nf3 b6 3. d4 Bb7 4. d5 Na5
2016.06.30	0-1	1404	1374	French Defense: Tarrasch Variation	1. d4 e6 2. e4 d5 3. Nd2 dxe4 4. Nxe4 Nc6
2016.06.30	0-1	1668	1585	Ruy Lopez: Berlin Defense #2	1. e4 e5 2. Nf3 Nc6 3. Bb5 Nf6 4. d3 Bc5
2016.06.30	1-0	2294	2340	English Opening	1. c4 b6 2. Nc3 e6 3. e4 Bb7 4. d4 Bb4
2016.06.30	1-0	1307	1123	King's Pawn Game: Maroczy Defense	1. e4 e5 2. d4 d6 3. c3 c6 4. Qb3 b5
2016.06.30	0-1	2006	1958	French Defense: Schlechter Variation	1. e4 e6 2. d4 d5 3. Bd3 dxe4 4. Bxe4 Nf6
2016.06.30	0-1	1799	1976	Old Benoni Defense	1. d4 c5 2. e3 cxd4 3. exd4 d5 4. Nf3 Nc6
2016.06.30	0-1	1127	1197	Vienna Game	1. e4 e5 2. Nc3 Qh4 3. g3 Qg4 4. Nd5 Qxe4+
2016.06.30	0-1	2052	1793	Sicilian Defense: Paulsen Variation, Normal Variation	1. e4 c5 2. Nc3 e6 3. Nf3 Nc6 4. d4 cxd4
2016.06.30	1-0	1587	1588	Caro-Kann Defense: Hillbilly Attack	1. e4 c6 2. Bc4 d5 3. exd5 cxd5 4. Bb5+ Nc6
2016.06.30	1-0	1403	1282	Ruy Lopez: Berlin Defense #2	1. e4 e5 2. Nf3 Nc6 3. Bb5 Nf6 4. Bxc6 dxc6
2016.06.30	1-0	1369	1443	Zukertort Opening: Black Mustang Defense	1. Nf3 Nc6 2. g4 e5 3. Bg2 g5 4. O-O Nf6
2016.06.30	1-0	1475	1759	Center Game: Normal Variation	1. e4 e5 2. d4 exd4 3. Qxd4 Nc6 4. Qd5 Qf6
2016.06.30	1-0	1774	1796	King's Knight Opening: Normal Variation	1. e4 e5 2. Nf3 Nc6 3. d3 Bc5 4. Nc3 d6
2016.06.30	1-0	1550	1511	Scandinavian Defense: 2.b3	1. e4 d5 2. b3 Qd6 3. exd5 Qxd5 4. Nc3 Qd8
2016.06.30	1-0	1971	1489	Nimzo-Larsen Attack: Modern Variation #3	1. b3 e5 2. Bb2 Nc6 3. Nf3 d5 4. Nxe5 Nxe5
2016.06.30	0-1	1825	1843	Queen's Pawn	1. d4 d6 2. Nc3 Nf6 3. Nf3 g6 4. Bg5 Bg7
2016.06.30	0-1	1987	1812	Mieses Opening	1. d3 g6 2. Nf3 Bg7 3. e3 e6 4. Be2 Ne7
2016.06.30	1-0	1836	1685	Italian Game: Two Knights Defense, Modern Bishop's Opening	1. e4 e5 2. Nf3 Nf6 3. Bc4 Nc6 4. d3 Na5
2016.06.30	1-0	1790	1639	King's Gambit: Panteldakis Countergambit	1. e4 e5 2. f4 f5 3. exf5 exf4 4. d4 d5
2016.06.30	1-0	1663	1682	Bishop's Opening	1. e4 e5 2. Bc4 d6 3. Nc3 Bd7 4. d3 a6
2016.06.30	0-1	1619	1756	English Defense #2	1. d4 b6 2. Nf3 Bb7 3. Bf4 d6 4. e3 Nd7
2016.06.30	1/2-1/2	1423	1454	Queen's Pawn Game: Mason Attack	1. d4 d5 2. Bf4 e6 3. Nc3 Bd6 4. Nh3 Nf6
2016.06.30	1-0	1662	1437	King's Indian Attack: Sicilian Variation	1. g3 d5 2. Bg2 c5 3. Nf3 g6 4. O-O Bg7
2016.06.30	0-1	1718	1561	Philidor Defense #3	1. e4 e5 2. Nf3 d6 3. Bc4 h6 4. d3 Bg4
2016.06.30	0-1	1392	1609	Indian Game	1. d4 Nf6 2. c3 d5 3. e3 g6 4. Qa4+ Bd7
2016.06.30	1-0	1816	1673	Queen's Pawn Game #2	1. d4 d5 2. e3 c6 3. Bd3 Nf6 4. h3 g6
2016.06.30	0-1	1329	1343	Russian Game: Three Knights Game	1. e4 e5 2. Nc3 Nf6 3. Nf3 Bd6 4. Bb5 c6
2016.06.30	1-0	1454	1467	Van't Kruijs Opening	1. e3 d5 2. b3 e6 3. Bb2 c5 4. g3 Nf6
2016.06.30	1-0	1843	1893	Queen's Gambit Accepted: Old Variation	1. d4 d5 2. c4 dxc4 3. e3 Bf5 4. Bxc4 Nf6
2016.06.30	1-0	1538	1532	Italian Game: Anti-Fried Liver Defense	1. e4 e5 2. Nf3 Nc6 3. Bc4 h6 4. O-O Nf6
2016.06.30	0-1	1349	1378	Van't Kruijs Opening	1. e3 d6 2. g3 e5 3. Bg2 g6 4. b3 Bg7
2016.06.30	0-1	1731	1991	Mieses Opening	1. d3 d5 2. Nd2 c5 3. e4 Nf6 4. Ngf3 Nc6
2016.06.30	0-1	1208	1754	Bird Opening: Dutch Variation	1. f4 d5 2. Nf3 Nc6 3. e3 Bg4 4. Bb5 Nf6
2016.06.30	1-0	2133	2034	Indian Game	1. d4 Nf6 2. Bf4 g6 3. e3 Bg7 4. Nf3 d5
2016.06.30	0-1	1621	1613	Modern Defense	1. d4 g6 2. c4 Bg7 3. Nf3 d5 4. Bf4 dxc4
2016.06.30	0-1	1874	1971	Alekhine Defense: Modern Variation, Alekhine Variation	1. e4 Nf6 2. e5 Nd5 3. d4 d6 4. Nf3 Bg4
2016.06.30	1-0	1701	1652	Caro-Kann Defense: Panov Attack #2	1. e4 c6 2. d4 d5 3. exd5 cxd5 4. c4 e6
2016.06.30	1-0	2175	2285	King's Indian Defense: Fianchetto Variation, Uhlmann-Szabo System	1. Nf3 Nf6 2. c4 g6 3. g3 d6 4. Bg2 Bg7
2016.06.30	1-0	1956	1732	Italian Game: Anti-Fried Liver Defense	1. e4 e5 2. Nf3 Nc6 3. Bc4 h6 4. O-O Nf6
2016.06.30	1-0	1590	1682	Sicilian Defense: Canal-Sokolsky Attack	1. e4 c5 2. Nf3 d6 3. Bb5+ Nd7 4. d4 a6
2016.06.30	0-1	1791	1864	Modern Defense: Pseudo-Austrian Attack	1. e4 d6 2. d4 g6 3. Nc3 Bg7 4. f4 Nf6
2016.06.30	0-1	1568	1558	Bishop's Opening	1. e4 e5 2. Bc4 d6 3. Qf3 Nf6 4. d3 Be7
2016.06.30	0-1	1510	1569	Sicilian Defense: Wing Gambit, Marshall Variation	1. e4 c5 2. b4 cxb4 3. a3 g6 4. Bb2 Nf6
2016.06.30	0-1	1315	1465	Bishop's Opening: Vienna Hybrid, Spielmann Attack	1. e4 e5 2. Nc3 Nf6 3. Bc4 Bc5 4. d3 d6
2016.06.30	1-0	2029	1940	Van Geet Opening	1. Nc3 d5 2. e4 e6 3. exd5 exd5 4. d4 Nf6
2016.06.30	1-0	1740	1438	French Defense: La Bourdonnais Variation	1. e4 e6 2. f4 d6 3. d4 c6 4. c4 Be7
2016.06.30	1/2-1/2	1833	1725	Caro-Kann Defense: Exchange Variation	1. e4 c6 2. d4 d5 3. exd5 cxd5 4. c3 Nf6
2016.06.30	1-0	1617	1750	Van't Kruijs Opening	1. e3 d5 2. b3 e5 3. Bb2 Nc6 4. Bb5 Bd6
2016.06.30	0-1	1745	1933	Sicilian Defense: Scheveningen Variation, Classical Variation	1. e4 c5 2. Nf3 e6 3. d4 cxd4 4. Nxd4 d6
2016.06.30	1-0	1931	1723	French Defense: Rubinstein Variation, Blackburne Defense	1. e4 e6 2. d4 d5 3. Nc3 dxe4 4. Nxe4 Nd7
2016.06.30	0-1	1500	1531	Scandinavian Defense	1. e4 d5 2. f3 dxe4 3. fxe4 e6 4. Bc4 Nf6
2016.06.30	1-0	1828	1779	King's Knight Opening: Konstantinopolsky	1. Nf3 Nc6 2. g3 e5 3. e4 Nf6 4. d3 Bc5
2016.06.30	0-1	2212	2041	Mieses Opening	1. d3 Nf6 2. Bd2 d5 3. Qc1 c5 4. a4 Nc6
2016.06.30	1-0	1565	1375	Bishop's Opening	1. e4 e5 2. Bc4 d6 3. Qf3 Be6 4. Bxe6 fxe6
2016.06.30	0-1	1920	1930	Caro-Kann Defense: Karpov Variation, Modern Variation, Kasparov Attack	1. e4 c6 2. d4 d5 3. Nc3 dxe4 4. Nxe4 Nd7
2016.06.30	1-0	1890	1860	Queen's Pawn	1. d4 c6 2. c3 d5 3. Na3 a6 4. Nc2 e6
2016.06.30	0-1	1446	2063	Rat Defense: Harmonist	1. e4 d6 2. f4 Nf6 3. Nf3 Nxe4 4. Bc4 d5
2016.06.30	1-0	1686	1619	French Defense: Advance Variation, Paulsen Attack	1. e4 e6 2. d4 d5 3. e5 c5 4. c3 Nc6
2016.06.30	0-1	1720	2134	Caro-Kann Defense	1. e4 c6 2. Nf3 d5 3. e5 c5 4. d4 Nc6
2016.06.30	0-1	1720	2252	Mieses Opening	1. d3 c5 2. Nf3 Nc6 3. e4 d6 4. Nbd2 e5
2016.06.30	1-0	1706	1690	Italian Game: Two Knights Defense, Fried Liver Attack	1. e4 e5 2. Nf3 Nc6 3. Bc4 Nf6 4. Ng5 d5
2016.06.30	1-0	1770	2011	Polish Opening: Outflank Variation	1. b4 c6 2. Bb2 d5 3. e3 Nf6 4. b5 g6
2016.06.30	0-1	1293	1550	Italian Game	1. e4 e5 2. Nf3 Nc6 3. Bc4 b6 4. d3 Bb7
2016.06.30	0-1	1731	1687	French Defense: Rubinstein Variation	1. e4 e6 2. d4 d5 3. Nc3 dxe4 4. Nxe4 Nc6
2016.06.30	1-0	1867	1363	Modern Defense: Norwegian Defense	1. d4 Nf6 2. e4 g6 3. Nc3 Bg7 4. e5 Nh5
2016.06.30	1-0	2165	2348	Van't Kruijs Opening	1. e3 Nf6 2. d4 g6 3. d5 Bg7 4. c4 O-O
2016.06.30	1-0	1801	1628	English Opening: Anglo-Gruenfeld Defense	1. c4 Nf6 2. Nc3 d5 3. cxd5 Nxd5 4. d4 Nc6
2016.06.30	0-1	1140	1269	Center Game: Normal Variation	1. e4 e5 2. d4 exd4 3. Qxd4 Nc6 4. Qd1 Qe7
2016.06.30	1-0	1785	1556	Nimzo-Larsen Attack: Modern Variation #2	1. b3 e5 2. Bb2 d6 3. e3 Be7 4. Qe2 Bf6
2016.06.30	1-0	1478	1609	King's Gambit Declined: Keene's Defense #2	1. e4 e5 2. f4 Qh4+ 3. g3 Qf6 4. Nf3 exf4
2016.06.30	1-0	1958	1830	Queen's Pawn Game: Stonewall Attack	1. d4 Nf6 2. e3 d5 3. Bd3 g6 4. Nd2 Bg7
2016.06.30	1-0	1582	1648	French Defense: Exchange Variation	1. e4 e6 2. d4 d5 3. exd5 exd5 4. Be2 Nf6
2016.06.30	1-0	2009	1696	Queen's Gambit Refused: Marshall Defense	1. d4 Nf6 2. c4 d5 3. Nc3 Bf5 4. Nf3 e6
2016.06.30	0-1	1334	1305	Robatsch (Modern) Defense	1. e4 g6 2. d4 Bg7 3. Nf3 e6 4. Be2 d5
2016.06.30	1-0	1816	1599	King's Pawn Game: Busch-Gass Gambit	1. e4 e5 2. Nf3 Bc5 3. d4 exd4 4. Nxd4 Qf6
2016.06.30	1-0	1815	1906	French Defense: Exchange Variation	1. e4 e6 2. d4 d5 3. exd5 exd5 4. Nf3 Nf6
2016.06.30	1-0	1471	1634	Sicilian Defense: French Variation	1. e4 c5 2. Nf3 e6 3. Bc4 a6 4. a3 Nc6
2016.06.30	0-1	1509	1549	Four Knights Game: Italian Variation	1. e4 e5 2. Nc3 Nc6 3. Bc4 Nf6 4. Nf3 Bc5
2016.06.30	0-1	1770	1746	King's Indian Defense: Orthodox Variation, Positional Defense, Closed Line	1. d4 Nf6 2. c4 g6 3. Nc3 Bg7 4. Nf3 d6
2016.06.30	0-1	1782	1898	Italian Game: Two Knights Defense, Polerio Defense, Bogoljubov Variation	1. e4 e5 2. Nf3 Nc6 3. Bc4 Nf6 4. Ng5 d5
2016.06.30	1-0	1633	1529	Four Knights Game: Spanish Variation	1. e4 e5 2. Nc3 Nf6 3. Nf3 Nc6 4. Bb5 Nb4
2016.06.30	1-0	1650	1729	English Opening: King's English Variation	1. c4 e5 2. g3 Nc6 3. Bg2 d6 4. Nc3 Be7
2016.06.30	1-0	1298	1383	English Opening: Anglo-Indian Defense, Queen's Knight Variation	1. c4 Nf6 2. Nc3 c5 3. e3 Nc6 4. Nge2 d5
2016.06.30	1-0	2028	2060	Scandinavian Defense: Modern Variation #2	1. e4 d5 2. exd5 Nf6 3. Nc3 Nxd5 4. Bc4 Nb6
2016.06.30	0-1	1726	1648	English Opening: Agincourt Defense	1. c4 e6 2. e3 Bc5 3. a3 b6 4. b3 Bb7
2016.06.30	1-0	1960	1678	Franco-Benoni Defense	1. e4 e6 2. d4 c5 3. d5 d6 4. dxe6 Bxe6
2016.06.30	0-1	1942	2058	Vienna Game: Falkbeer Variation	1. e4 e5 2. Nc3 Nf6 3. b3 d5 4. d3 dxe4
2016.06.30	1-0	1079	1307	Saragossa Opening	1. c3 e5 2. Qc2 d5 3. b3 e4 4. e3 Nf6
2016.06.30	1-0	1756	1996	Queen's Gambit Refused: Marshall Defense	1. d4 Nf6 2. c4 d5 3. Nc3 dxc4 4. e3 e5
2016.06.30	0-1	2532	2456	Sicilian Defense: O'Kelly Variation, Normal System	1. e4 c5 2. Nf3 a6 3. d4 cxd4 4. Nxd4 Nf6
2016.06.30	1/2-1/2	1908	1671	Caro-Kann Defense	1. e4 c6 2. f4 d5 3. e5 Bf5 4. d4 e6
2016.06.30	1-0	1921	1929	Hungarian Opening	1. g3 e5 2. Bg2 d5 3. d3 Be6 4. h3 Bd6
2016.06.30	1-0	1949	2021	Sicilian Defense: Hyperaccelerated Dragon	1. e4 c5 2. Nf3 g6 3. g3 Bg7 4. Bg2 Nc6
2016.06.30	1-0	1823	1689	Bird Opening: Williams Gambit	1. e4 d5 2. f4 d4 3. d3 c5 4. Nf3 Bg4
2016.06.30	0-1	1629	1785	King's Knight Opening	1. e4 e5 2. Nf3 b6 3. Bc4 Bb7 4. Nc3 Nf6
2016.06.30	1-0	2053	1686	Sicilian Defense: Smith-Morra Gambit Accepted, Fianchetto Defense	1. e4 c5 2. d4 cxd4 3. c3 dxc3 4. Nxc3 Nc6
2016.06.30	1-0	1524	1375	French Defense: Queen's Knight	1. e4 e6 2. Nc3 h6 3. Qf3 a6 4. g3 Nf6
2016.06.30	0-1	1792	1716	Italian Game: Scotch Gambit Declined	1. e4 e5 2. Nf3 Nc6 3. Bc4 d6 4. d4 Nf6
2016.06.30	0-1	1352	1678	Sicilian Defense: Bowdler Attack	1. e4 c5 2. Bc4 a6 3. Qh5 e6 4. Qxf7+ Kxf7
2016.06.30	0-1	1492	1548	English Opening: King's English Variation, Reversed Sicilian	1. c4 e5 2. Nc3 Bc5 3. d3 Nc6 4. Nf3 Nf6
2016.06.30	1-0	1427	1422	Russian Game: Urusov Gambit	1. e4 e5 2. Nf3 Nf6 3. Bc4 Nxe4 4. d3 d5
2016.06.30	0-1	1173	1267	Hungarian Opening	1. g3 e5 2. Bg2 d5 3. d4 e4 4. e3 Nf6
2016.06.30	1-0	2102	2031	Caro-Kann Defense	1. e4 c6 2. Nf3 d5 3. exd5 cxd5 4. d4 Nc6
2016.06.30	0-1	2029	2148	East Indian Defense	1. d4 Nf6 2. Nf3 g6 3. e3 Bg7 4. c4 O-O
2016.06.30	0-1	1495	1551	Queen's Pawn Game: London System	1. d4 d5 2. Nf3 Nf6 3. Bf4 e6 4. e3 c5
2016.06.30	1-0	1689	1593	Sicilian Defense: O'Kelly Variation, Normal System	1. e4 c5 2. Nf3 a6 3. d4 cxd4 4. Nxd4 Nc6
2016.06.30	1-0	1363	1332	Zukertort Opening: Ross Gambit	1. Nf3 e5 2. Nxe5 Nf6 3. d3 Ng4 4. Qd2 Qf6
2016.06.30	0-1	1772	1528	Queen's Gambit Accepted: Old Variation	1. d4 d5 2. c4 dxc4 3. e3 b5 4. a4 Bd7
2016.06.30	0-1	1802	1814	Bishop's Opening: Ponziani Gambit	1. e4 e5 2. Bc4 Nf6 3. d4 Nc6 4. dxe5 Nxe5
2016.06.30	1-0	1578	1481	Queen's Pawn Game #2	1. d4 d5 2. e3 e6 3. c4 Bd7 4. cxd5 Nf6
2016.06.30	1-0	1684	1503	Owen Defense	1. e4 b6 2. Bc4 Bb7 3. Qf3 e5 4. Qxf7#
2016.06.30	1-0	2028	1892	French Defense: Normal Variation	1. e4 e6 2. d4 c6 3. Bd3 d5 4. e5 Ne7
2016.06.30	0-1	1506	1513	Italian Game: Two Knights Defense, Polerio Defense, Bishop Check Line	1. e4 e5 2. Nf3 Nc6 3. Bc4 Nf6 4. Ng5 d5
2016.06.30	0-1	1652	1787	Italian Game: Anti-Fried Liver Defense	1. e4 Nc6 2. Nf3 e5 3. Bc4 h6 4. d4 exd4
2016.06.30	1-0	1829	1945	Four Knights Game: Scotch Variation Accepted	1. e4 e5 2. Nf3 Nf6 3. Nc3 Nc6 4. d4 exd4
2016.06.30	0-1	1864	1777	Nimzo-Larsen Attack: English Variation	1. b3 c5 2. Bb2 Nc6 3. Bxg7 Bxg7 4. c3 d5
2016.06.30	1-0	1835	1736	Sicilian Defense: French Variation	1. e4 c5 2. Nf3 e6 3. d3 Qc7 4. c4 Nf6
2016.06.30	1-0	1974	1890	English Opening: Symmetrical Variation	1. c4 c5 2. e3 Nc6 3. d3 e6 4. Nc3 d6
2016.06.30	0-1	1515	1617	Englund Gambit Complex: Soller Gambit	1. d4 e5 2. dxe5 f6 3. exf6 Nxf6 4. Bg5 Bc5
2016.06.30	0-1	1593	1720	Hungarian Opening: Symmetrical Variation	1. g3 g6 2. Bg2 Bg7 3. Nf3 e5 4. d3 d6
2016.06.30	0-1	1500	1477	Philidor Defense: Exchange Variation	1. e4 e5 2. Nf3 d6 3. d4 exd4 4. Nxd4 Nf6
2016.06.30	1-0	1370	1391	Petrov's Defense	1. e4 e5 2. Nf3 Nf6 3. d3 Nc6 4. Bg5 Bc5
2016.06.30	0-1	1538	1647	French Defense: Steinitz Attack	1. e4 e6 2. e5 d5 3. exd6 Bxd6 4. Nf3 Nc6
2016.06.30	0-1	1894	1849	Rat Defense: English Rat, Lisbon Gambit	1. d4 e5 2. c4 d6 3. dxe5 Nc6 4. exd6 Bxd6
2016.06.30	0-1	1509	1500	Three Knights Opening: Steinitz Defense	1. e4 e5 2. Nf3 Nc6 3. Nc3 g6 4. Bc4 Bg7
2016.06.30	0-1	1618	1652	King's Pawn Game	1. e4 e5
2016.06.30	1-0	1838	1697	Van't Kruijs Opening	1. e3 g6 2. Be2 Bg7 3. h3 Nc6 4. Nc3 d6
2016.06.30	1-0	1830	1689	Bishop's Opening	1. e4 e5 2. Bc4 Nc6 3. Qf3 Nf6 4. d3 Be7
2016.06.30	0-1	1609	1549	Queen's Gambit Declined: Queen's Knight Variation	1. d4 d5 2. c4 e6 3. Nc3 Bb4 4. Bd2 Nf6
2016.06.30	0-1	1503	1276	Center Game: Normal Variation	1. e4 e5 2. d4 exd4 3. Qxd4 Nc6 4. Qd1 d6
2016.06.30	1-0	1573	1231	Modern Defense: Three Pawns Attack	1. e4 g6 2. d4 Bg7 3. f4 b6 4. Nf3 Bb7
2016.06.30	0-1	1694	1855	Owen Defense	1. e4 b6 2. Nc3 Bb7 3. Nf3 g6 4. Bc4 Bg7
