Date	Result	WhiteElo	BlackElo	Opening	Moves
2016.04.30	0-1	1475	1552	Sicilian Defense: Old Sicilian	1. e4 c5 2. Nf3 Nc6 3. Nc3 e6 4. d4 d5
2016.04.30	0-1	2144	1871	Mieses Opening	1. d3 d5 2. Bd2 Nc6 3. Qc1 Bf5 4. a4 e5
2016.04.30	1-0	1262	1346	Italian Game	1. e4 e5 2. Nf3 Nc6 3. Bc4 a6 4. c3 b5
2016.04.30	1-0	1705	1420	Robatsch (Modern) Defense	1. d4 g6 2. e4 Bg7 3. e5 b6 4. Nf3 Bb7
2016.04.30	1-0	1617	1645	Ruy Lopez	1. e4 e5 2. Nf3 Nc6 3. Bb5 Qf6 4. Bxc6 bxc6
2016.04.30	1-0	1657	1349	Barnes Defense	1. e4 f6 2. Nf3 Kf7 3. Bc4+ e6 4. O-O c6
2016.04.30	0-1	1820	1862	Queen's Gambit Accepted	1. d4 d5 2. c4 dxc4 3. Nc3 Nf6 4. e4 e6
2016.04.30	0-1	1694	1795	Sicilian Defense: Alapin Variation, Barmen Defense	1. e4 c5 2. c3 d5 3. exd5 Qxd5 4. Nf3 Nc6
2016.04.30	1/2-1/2	1660	1698	Queen's Pawn Game #3	1. d4 d5 2. e3 Nf6 3. Nc3 e6 4. a3 c5
2016.04.30	0-1	1842	1782	King's Pawn Game: Leonardis Variation	1. e4 e5 2. d3 Nc6 3. c4 Bc5 4. Nf3 Nf6
2016.04.30	1-0	1804	1788	Modern Defense: Standard Line	1. d4 g6 2. e4 Bg7 3. Nc3 c6 4. Be3 d5
2016.04.30	1-0	1907	1856	Van't Kruijs Opening	1. e3 d5 2. d3 d4 3. e4 e5 4. f4 f6
2016.04.30	1/2-1/2	1837	1802	English Opening: King's English Variation, Three Knights System	1. c4 e5 2. Nc3 Nc6 3. Nf3 Bc5 4. g3 d6
2016.04.30	0-1	1938	2191	Sicilian Defense: Accelerated Dragon	1. e4 c5 2. Nf3 Nc6 3. d4 cxd4 4. Nxd4 g6
2016.04.30	0-1	1557	1732	Scotch Game	1. e4 e5 2. Nf3 Nc6 3. d4 exd4 4. Nxd4 Nxd4
2016.04.30	0-1	1963	2138	French Defense: Knight Variation	1. e4 e6 2. Nf3 d5 3. exd5 exd5 4. Nc3 Nf6
2016.04.30	1-0	1124	1353	Scandinavian Defense	1. e4 d5 2. e5 Nc6 3. f4 f6 4. exf6 Nxf6
2016.04.30	0-1	1528	1992	Slav Defense: Quiet Variation	1. d4 d5 2. c4 c6 3. e3 Nf6 4. Nf3 g6
2016.04.30	1-0	2174	2051	Queen's Pawn Game: Veresov Attack, Classical Defense	1. d4 d5 2. Nf3 Nf6 3. Bg5 e6 4. Nc3 c5
2016.04.30	1-0	1525	1637	Torre Attack #2	1. d4 Nf6 2. Nf3 Nd5 3. Bf4 Nxf4 4. g3 Ng6
2016.04.30	0-1	2225	2347	Canard Opening	1. d4 Nf6 2. f4 d5 3. e3 Bg4 4. Be2 Bxe2
2016.04.30	1-0	2268	2025	Vienna Game: Vienna Gambit	1. e4 e5 2. Nc3 Nc6 3. f4 Nf6 4. Nf3 d6
2016.04.30	1/2-1/2	1604	1983	Sicilian Defense: Staunton-Cochrane Variation	1. e4 c5 2. c4 e5 3. Nf3 Nc6 4. Nc3 d6
2016.04.30	1-0	1320	1205	Vienna Game	1. e4 e5 2. Nc3 d6 3. Bc4 f5 4. exf5 Bxf5
2016.04.30	1-0	2274	1920	Queen's Pawn Game: Zukertort Variation	1. d4 d5 2. Nf3 e6 3. c3 Nf6 4. Bg5 c5
2016.04.30	1/2-1/2	1342	1514	French Defense: Advance Variation #4	1. e4 e6 2. d4 d5 3. e5 c5 4. Bb5+ Bd7
2016.04.30	0-1	1705	1826	Queen's Gambit Declined	1. d4 d5 2. c4 e6 3. a3 c5 4. Nf3 Nc6
2016.04.30	1-0	1577	1473	Horwitz Defense	1. d4 e6 2. Nf3 Qf6 3. Nc3 Bb4 4. Bg5 Qg6
2016.04.30	0-1	2047	2230	Modern Defense: Averbakh Variation	1. d4 g6 2. c4 Bg7 3. Nc3 d6 4. e4 e5
2016.04.30	0-1	1678	1774	French Defense: Normal Variation	1. e4 e6 2. d4 Be7 3. f4 a6 4. Nf3 d6
2016.04.30	1-0	1917	1844	Grob Opening: Keene Defense	1. g4 d5 2. Bg2 c6 3. h3 e5 4. d4 exd4
2016.04.30	0-1	2090	2235	King's Gambit Accepted, Hanstein Gambit	1. e4 e5 2. f4 exf4 3. Nf3 g5 4. Bc4 Bg7
2016.04.30	1-0	1722	1656	French Defense: Mediterranean Defense	1. e4 e6 2. d4 Nf6 3. e5 Nd5 4. Nf3 f6
2016.04.30	1-0	1952	1871	Queen's Gambit Refused: Albin Countergambit	1. d4 d5 2. c4 e5 3. Nc3 exd4 4. Qxd4 dxc4
2016.04.30	1-0	1752	1676	Slav Defense: Exchange Variation	1. d4 d5 2. c4 c6 3. cxd5 cxd5 4. Nc3 g6
2016.04.30	1-0	1673	1604	Philidor Defense #3	1. e4 e5 2. Nf3 d6 3. Bc4 Bg4 4. c3 a6
2016.04.30	1-0	1931	1804	Italian Game: Classical Variation #2	1. e4 e5 2. Nf3 Nc6 3. Bc4 Bc5 4. c3 d6
2016.04.30	0-1	1900	1568	Queen's Pawn Game: Mason Attack	1. d4 d5 2. Bf4 Bf5 3. Nf3 Nf6 4. e3 e6
2016.04.30	1/2-1/2	2163	1868	Ruy Lopez: Berlin Defense, Improved Steinitz Defense	1. e4 e5 2. Nf3 Nc6 3. Bb5 Nf6 4. O-O d6
2016.04.30	1-0	1805	1721	Bird Opening: Dutch Variation	1. f4 d5 2. d4 c5 3. e3 Nc6 4. Nf3 Bg4
2016.04.30	0-1	1642	1666	Nimzowitsch Defense: Kennedy Variation, Linksspringer Variation	1. e4 e5 2. d4 Nc6 3. d5 Nce7 4. Bc4 Nf6
2016.04.30	1-0	1632	1500	Sicilian Defense: Bowdler Attack	1. e4 c5 2. Bc4 e6 3. Nf3 Nc6 4. c3 d5
2016.04.30	0-1	1687	1737	Slav Defense: Three Knights Variation	1. d4 d5 2. c4 c6 3. Nc3 Nf6 4. Nf3 Bf5
2016.04.30	0-1	1704	1728	French Defense: Knight Variation	1. e4 e6 2. Nf3 Nf6 3. e5 Nd5 4. Bc4 Ne7
2016.04.30	1-0	2014	1951	Scandinavian Defense: Mieses-Kotroc Variation	1. e4 d5 2. exd5 Qxd5 3. Nc3 Qd8 4. d4 Nf6
2016.04.30	0-1	1676	1737	Old Benoni Defense #2	1. d4 c5 2. d5 e6 3. c4 exd5 4. cxd5 d6
2016.04.30	0-1	1084	1278	Vienna Game: Paulsen Variation	1. e4 e5 2. Nc3 Nc6 3. g3 Nf6 4. f4 exf4
2016.04.30	1-0	1979	1729	Ruy Lopez: Morphy Defense, Neo-Arkhangelsk Variation	1. e4 e5 2. Nf3 Nc6 3. Bb5 a6 4. Ba4 Bc5
2016.04.30	1-0	1431	1452	Italian Game: Anti-Fried Liver Defense	1. e4 e5 2. Nf3 Nc6 3. Bc4 h6 4. d3 Nf6
2016.04.30	0-1	1945	1658	English Opening	1. c4 b6 2. e4 Bb7 3. Nc3 e6 4. Bd3 h6
2016.04.30	1-0	2151	2119	Sicilian Defense: Wing Gambit	1. e4 c5 2. b4 b6 3. bxc5 bxc5 4. Bb2 Nc6
2016.04.30	1/2-1/2	1926	1897	Van't Kruijs Opening	1. e3 c5 2. d4 cxd4 3. exd4 d5 4. c3 Nc6
2016.04.30	1-0	1785	1839	Sicilian Defense: Hyperaccelerated Pterodactyl	1. e4 g6 2. Nf3 Bg7 3. d4 c5 4. Nc3 cxd4
2016.04.30	1-0	1879	1919	Alekhine Defense: Exchange Variation	1. e4 Nf6 2. e5 Nd5 3. c4 Nb6 4. d4 d6
2016.04.30	1-0	2086	2153	Horwitz Defense	1. d4 e6 2. Nc3 Ne7 3. g4 d5 4. g5 Ng6
2016.04.30	1-0	1909	1469	Philidor Defense #3	1. e4 e5 2. Bc4 d6 3. Nf3 f6 4. d4 Qe7
2016.04.30	0-1	1549	1837	Vienna Game: Max Lange Defense	1. e4 e5 2. Nc3 Nc6 3. d3 Bb4 4. Bg5 Bxc3+
2016.04.30	1-0	1969	1710	Scandinavian Defense: Gubinsky-Melts Defense	1. e4 d5 2. exd5 Qxd5 3. Nc3 Qd6 4. b4 Nf6
2016.04.30	1-0	1918	1823	Ruy Lopez: Morphy Defense, Caro Variation	1. e4 e5 2. Nf3 Nc6 3. Bb5 a6 4. Ba4 b5
2016.04.30	0-1	2030	2240	Old Benoni Defense	1. d4 c5 2. c3 Nf6 3. Nf3 cxd4 4. cxd4 g6
2016.04.30	1-0	1713	1561	Nimzowitsch Defense: Scandinavian Variation, Exchange Variation, Marshall Gambit	1. e4 Nc6 2. d4 d5 3. exd5 Qxd5 4. Nc3 Qa5
2016.04.30	1-0	2075	2075	Owen Defense	1. e4 b6 2. Nc3 Bb7 3. d3 d5 4. Nf3 dxe4
2016.04.30	1-0	1491	1442	Philidor Defense	1. e4 e5 2. Nf3 d6 3. d4 c6 4. dxe5 d5
2016.04.30	1-0	1379	1399	Four Knights Game: Ranken Variation	1. e4 e5 2. Nf3 Nc6 3. Bb5 Nf6 4. Nc3 a6
2016.04.30	1-0	2068	1848	Three Knights Opening	1. Nc3 e5 2. Nf3 Nc6 3. e4 Bc5 4. Bc4 d6
2016.04.30	1-0	1513	1574	French Defense: Knight Variation	1. e4 e6 2. Nf3 d5 3. e5 Nc6 4. c3 f6
2016.04.30	1-0	1934	1969	Italian Game: Classical Variation, Giuoco Pianissimo	1. e4 e5 2. Nf3 Nc6 3. Bc4 Bc5 4. c3 Nf6
2016.04.30	1-0	1832	2049	Pirc Defense: Classical Variation, Schlechter Variation	1. e4 d6 2. Nf3 g6 3. Nc3 Nf6 4. d4 Bg7
2016.04.30	1-0	1762	1660	Italian Game	1. e4 e5 2. Nf3 Nc6 3. Bc4 d6 4. Nc3 Be6
2016.04.30	1-0	1227	1389	Queen's Pawn	1. d4 d6 2. Nc3 b6 3. e3 e5 4. dxe5 dxe5
2016.04.30	1-0	1525	1225	French Defense: Advance, Steinitz Variation	1. e4 e6 2. d4 d5 3. e5 c5 4. dxc5 Bxc5
2016.04.30	0-1	2207	2210	English Opening: King's English Variation, Kramnik-Shirov Counterattack	1. c4 e5 2. Nc3 Bb4 3. e4 Bxc3 4. dxc3 d6
2016.04.30	1-0	1720	1330	Sicilian Defense: Open	1. e4 c5 2. Nf3 Nc6 3. d4 g6 4. d5 Nd4
2016.04.30	1-0	1970	1972	Zukertort Opening: Slav Invitation	1. Nf3 c6 2. c4 d5 3. cxd5 Bf5 4. d3 Qxd5
2016.04.30	0-1	1668	1477	Modern Defense: Three Pawns Attack	1. e4 g6 2. d4 Bg7 3. f4 e6 4. Nf3 Ne7
2016.04.30	1-0	1930	1851	Slav Defense: Modern Line	1. d4 d5 2. c4 c6 3. Nf3 Bf5 4. Bf4 Nd7
2016.04.30	0-1	1601	1814	Italian Game: Two Knights Defense, Polerio Defense	1. e4 e5 2. Nf3 Nc6 3. Bc4 Nf6 4. Ng5 d5
2016.04.30	1-0	1818	1831	Philidor Defense	1. e4 e5 2. Nf3 d6 3. d4 Bg4 4. Be2 g6
2016.04.30	1-0	1820	1748	Old Benoni Defense	1. d4 c5 2. e3 cxd4 3. Qxd4 Nc6 4. Qd1 g6
2016.04.30	1-0	2448	2351	Old Indian: Czech Variation	1. d4 c6 2. c4 d6 3. Nf3 Nf6 4. Nc3 g6
2016.04.30	0-1	1410	1759	Queen's Pawn Game #2	1. d4 d5 2. e3 c5 3. Nf3 Nc6 4. dxc5 e6
2016.04.30	0-1	1698	1850	Sicilian Defense: Bowdler Attack	1. e4 c5 2. Bc4 e6 3. Nc3 Nc6 4. Nf3 a6
2016.04.30	0-1	1766	1923	Sicilian Defense: Smith-Morra Gambit	1. e4 c5 2. d4 cxd4 3. c3 dxc3 4. Nxc3 e5
2016.04.30	1-0	1445	1420	Sicilian Defense: Four Knights Variation	1. e4 c5 2. Nc3 e6 3. Nf3 Nf6 4. d4 cxd4
2016.04.30	1-0	1943	1881	French Defense: Advance Variation, Nimzowitsch System	1. e4 e6 2. Nf3 d5 3. e5 c5 4. d4 cxd4
2016.04.30	1-0	1366	1261	Bishop's Opening	1. e4 e5 2. Bc4 Nc6 3. Qf3 Nf6 4. c3 Be7
2016.04.30	1/2-1/2	2491	2451	Indian Game: Przepiorka Variation	1. d4 Nf6 2. Nf3 g6 3. g3 Bg7 4. Bg2 O-O
2016.04.30	1/2-1/2	1899	1850	Scandinavian Defense	1. e4 d5 2. Bc4 dxe4 3. Bxf7+ Kxf7 4. Nc3 Ke8
2016.04.30	0-1	1658	1676	Sicilian Defense: Accelerated Dragon, Exchange Variation	1. e4 c5 2. Nf3 Nc6 3. d4 cxd4 4. Nxd4 g6
2016.04.30	0-1	1535	1659	Italian Game: Classical Variation #2	1. e4 e5 2. Nf3 Nc6 3. Bc4 Bc5 4. c3 d6
2016.04.30	0-1	1566	1792	Sicilian Defense: Dragon Variation	1. e4 c5 2. Nf3 d6 3. d4 cxd4 4. Nxd4 Nf6
2016.04.30	1-0	1610	1279	Philidor Defense #3	1. e4 e5 2. Nf3 d6 3. Bc4 Qe7 4. d3 Be6
2016.04.30	0-1	1791	1615	Colle System: Traditional Colle	1. d4 e6 2. e3 d5 3. Bd3 c5 4. c3 Nf6
2016.04.30	1-0	1937	2016	Nimzo-Larsen Attack: Modern Variation #2	1. b3 e5 2. Bb2 d6 3. e3 f5 4. d3 Nf6
2016.04.30	1-0	2020	1784	English Opening: Anglo-Scandinavian Defense	1. c4 d5 2. e3 Nf6 3. d4 c5 4. cxd5 Nxd5
2016.04.30	0-1	1223	1500	Modern Defense	1. e4 g6 2. d4 d5 3. e5 Bg7 4. Nf3 f6
2016.04.30	0-1	1520	2350	Benoni Defense: Benoni Gambit Accepted	1. d4 c5 2. dxc5 Qa5+ 3. Bd2 Qxc5 4. Nc3 Nf6
2016.04.30	1-0	1659	1690	Elephant Gambit: Paulsen Countergambit	1. e4 e5 2. Nf3 d5 3. exd5 e4 4. Bb5+ Bd7
2016.04.30	1-0	1643	1726	Elephant Gambit: Paulsen Countergambit	1. e4 e5 2. Nf3 d5 3. exd5 e4 4. Qe2 Bf5
2016.04.30	1-0	2089	2011	Vienna Game: Anderssen Defense	1. e4 e5 2. Nc3 Bc5 3. Nf3 Nc6 4. Bb5 Nge7
2016.04.30	1-0	1740	1802	Italian Game: Scotch Gambit, Janowski Defense	1. e4 e5 2. d4 exd4 3. Bc4 Nc6 4. Nf3 d6
2016.04.30	0-1	1791	1961	Sicilian Defense: Closed	1. e4 c5 2. Nc3 e6 3. Nf3 d5 4. d4 cxd4
2016.04.30	1-0	1455	1484	French Defense: Steinitz Attack	1. e4 e6 2. e5 d5 3. exd6 Bxd6 4. Nf3 Nf6
2016.04.30	1-0	2144	2104	Queen's Gambit Declined: Modern Variation, Normal Line	1. d4 e6 2. c4 d5 3. Nc3 Nf6 4. Bg5 Be7
2016.04.30	0-1	1618	2188	Pirc Defense #5	1. e4 d6 2. d4 g6 3. e5 dxe5 4. dxe5 Qxd1+
2016.04.30	0-1	1796	1649	Italian Game: Anti-Fried Liver Defense	1. e4 e5 2. Nf3 Nc6 3. Bc4 h6 4. d3 Nf6
2016.04.30	1-0	1921	1254	Zukertort Opening: Pirc Invitation	1. Nf3 d6 2. g3 e6 3. Bg2 Bd7 4. O-O Nc6
2016.04.30	0-1	2056	1853	Van't Kruijs Opening	1. e3 e6 2. d3 d5 3. Nf3 Nf6 4. Be2 Be7
2016.04.30	1-0	1618	1659	Caro-Kann Defense: Hillbilly Attack	1. e4 c6 2. Bc4 d5 3. exd5 cxd5 4. Bb5+ Bd7
2016.04.30	0-1	1669	1581	East Indian Defense	1. d4 Nf6 2. Nf3 g6 3. e3 Bg7 4. b3 O-O
2016.04.30	0-1	1790	1950	Bishop's Opening	1. e4 e5 2. Bc4 Qf6 3. Nf3 h6 4. O-O Ne7
2016.04.30	0-1	1737	1946	French Defense: Exchange Variation, Monte Carlo Variation	1. e4 e6 2. d4 d5 3. exd5 exd5 4. c4 c5
2016.04.30	1-0	1804	1559	Mexican Defense	1. d4 Nf6 2. c4 Nc6 3. Nf3 d6 4. Nc3 Bg4
2016.04.30	1-0	2045	2069	Rat Defense: Accelerated Gurgenidze	1. e4 d6 2. d4 c6 3. Nc3 g6 4. f4 Bg7
2016.04.30	0-1	1441	1858	Sicilian Defense: Alapin Variation	1. e4 c5 2. c3 d6 3. d3 e6 4. Nf3 Nf6
2016.04.30	1-0	1184	1127	Philidor Defense #3	1. e4 e5 2. Nf3 d6 3. Bc4 Bg4 4. d3 Bxf3
2016.04.30	1-0	1428	1618	Philidor Defense	1. e4 e5 2. Nf3 d6 3. d4 f6 4. Nc3 c6
2016.04.30	1-0	1795	1839	Sicilian Defense: Najdorf Variation	1. e4 c5 2. Nf3 d6 3. d4 cxd4 4. Nxd4 Nf6
2016.04.30	0-1	1796	1946	Sicilian Defense: Najdorf Variation	1. e4 c5 2. Nf3 d6 3. d4 cxd4 4. Nxd4 Nf6
2016.04.30	0-1	1500	1546	Mieses Opening	1. d3 d5 2. h3 Nc6 3. g3 e6
2016.04.30	0-1	2182	2171	English Opening: Anglo-Indian Defense	1. c4 Nf6 2. Qc2 e6 3. Nf3 b6 4. e4 Bb7
2016.04.30	0-1	1811	1956	Sicilian Defense: Smith-Morra Gambit #2	1. e4 c5 2. d4 cxd4 3. Qxd4 e6 4. Bf4 Nc6
2016.04.30	1-0	1368	1326	Borg Defense	1. e4 g5 2. Nf3 e6 3. d4 Be7 4. d5 h5
2016.04.30	1-0	1735	1619	Vienna Game: Falkbeer Variation	1. Nc3 Nf6 2. e4 e5 3. d3 Bb4 4. Bg5 d6
2016.04.30	1-0	1568	1565	Horwitz Defense	1. d4 e6 2. c3 d5 3. Be3 Nf6 4. f3 Bd6
2016.04.30	1-0	1602	1833	Italian Game: Anti-Fried Liver Defense	1. e4 e5 2. Bc4 Nc6 3. Nf3 h6 4. c3 d6
2016.04.30	0-1	1772	1807	Blackmar-Diemer Gambit Declined, O'Kelly Defense	1. e4 c6 2. d4 d5 3. Nc3 dxe4 4. f3 Nf6
2016.04.30	0-1	1217	1288	Indian Game	1. d4 Nf6 2. e3 g6 3. Nf3 Bg7 4. d5 O-O
2016.04.30	0-1	1857	1892	Colle System	1. d4 e6 2. Nf3 d5 3. e3 Nf6 4. Bd2 Bd6
2016.04.30	0-1	1762	2236	Queen's Pawn Opening: Veresov, Richter Attack	1. Nc3 d5 2. d4 Nf6 3. f3 g6 4. Bg5 Bg7
2016.04.30	0-1	1713	2013	Hungarian Opening: Dutch Defense	1. g3 f5 2. Bg2 Nf6 3. Bxb7 Bxb7 4. f3 e6
2016.04.30	0-1	1167	1338	St. George Defense	1. e4 a6 2. d4 g6 3. f4 Bg7 4. Nf3 d6
2016.04.30	0-1	1679	2057	Gruenfeld Defense	1. d4 Nf6 2. c4 g6 3. Nc3 d5 4. e3 Bg7
2016.04.30	0-1	1766	2106	Pirc Defense: Classical Variation, Quiet System, Parma Defense	1. e4 d6 2. d4 Nf6 3. Nc3 g6 4. Nf3 Bg7
2016.04.30	1-0	2146	1942	Queen's Gambit Declined	1. d4 d5 2. c4 e6 3. e3 Nf6 4. cxd5 exd5
2016.04.30	1-0	2304	1730	French Defense: Rubinstein Variation, Blackburne Defense	1. e4 e6 2. d4 d5 3. Nc3 dxe4 4. Nxe4 Nd7
2016.04.30	0-1	1595	1661	Blackmar-Diemer Gambit: Euwe Defense	1. e4 d5 2. d4 dxe4 3. Nc3 Nf6 4. f3 exf3
2016.04.30	0-1	1658	1513	Hungarian Opening	1. g3 d5 2. Bg2 Nf6 3. Nf3 Bg4 4. h3 Bxf3
2016.04.30	1-0	1788	1731	Reti Opening: Advance Variation	1. Nf3 d5 2. c4 d4 3. g3 c6 4. Bg2 Qc7
2016.04.30	0-1	1692	1831	Bishop's Opening	1. e4 e5 2. Bc4 Nc6 3. c3 Nf6 4. d3 Be7
2016.04.30	1-0	1514	1600	King's Gambit Accepted, Fischer Defense	1. e4 e5 2. f4 exf4 3. Nf3 d6 4. Bc4 Nc6
2016.04.30	0-1	1895	2297	French Defense: Advance Variation, Paulsen Attack	1. e4 e6 2. e5 d5 3. d4 c5 4. c3 Nc6
2016.04.30	1-0	1830	1885	King's Indian Defense	1. d4 Nf6 2. c4 g6 3. Nc3 Bg7 4. e3 d6
2016.04.30	1-0	1487	1606	Italian Game	1. e4 e5 2. Nf3 Nc6 3. Bc4 Qe7 4. O-O h6
2016.04.30	1-0	1533	1306	Indian Game: Omega Gambit	1. e4 Nf6 2. d4 Nxe4 3. f3 Nd6 4. Nc3 f6
2016.04.30	1-0	1504	1583	Nimzowitsch Defense: Kennedy Variation, Linksspringer Variation	1. e4 e5 2. d4 Nc6 3. d5 Nd4 4. Nf3 Bc5
2016.04.30	0-1	1911	2039	Pirc Defense: Byrne Variation	1. Nc3 Nf6 2. e4 d6 3. d4 g6 4. Bg5 Bg7
2016.04.30	0-1	1966	1929	Zukertort Opening: Sicilian Invitation	1. Nf3 c5 2. c4 g6 3. g3 Bg7 4. Bg2 Nc6
2016.04.30	1-0	1822	1449	Sicilian Defense: Najdorf Variation, English Attack	1. e4 c5 2. Nf3 d6 3. d4 cxd4 4. Nxd4 Nf6
2016.04.30	1-0	1795	1761	Philidor Defense #3	1. e4 e5 2. Bc4 d6 3. Nf3 Bg4 4. Nc3 Nc6
2016.04.30	0-1	1286	1739	Van Geet Opening: Napoleon Attack	1. Nc3 e5 2. Nf3 Nc6 3. d4 exd4 4. Nxd4 Bb4
2016.04.30	1-0	2097	1950	Bird Opening	1. f4 c5 2. Nf3 Nc6 3. e3 d5 4. Bb5 Bg4
2016.04.30	0-1	1783	1784	Bishop's Opening: Calabrese Countergambit	1. e4 e5 2. Bc4 f5 3. Qf3 Nf6 4. Qxf5 d5
2016.04.30	0-1	1430	1419	Sicilian Defense: Bowdler Attack	1. e4 c5 2. Bc4 Nc6 3. f4 d5 4. Bxd5 e6
2016.04.30	1/2-1/2	1995	1898	French Defense: Rubinstein Variation, Blackburne Defense	1. e4 e6 2. d4 d5 3. Nc3 dxe4 4. Nxe4 Nd7
2016.04.30	1-0	1832	1562	Slav Defense: Modern Line	1. d4 c6 2. Nf3 d5 3. c4 Nd7 4. cxd5 cxd5
2016.04.30	1-0	1857	1846	Queen's Pawn Game	1. d4 d5 2. f4 Nc6 3. Nf3 Nf6 4. c3 Bg4
2016.04.30	0-1	1253	1922	Alekhine Defense: Maroczy Variation	1. e4 Nf6 2. d3 d5
2016.04.30	1-0	1701	1397	Caro-Kann Defense	1. e4 c6 2. d4 e6 3. Nf3 Nf6 4. Nc3 d5
2016.04.30	0-1	1710	1756	Queen's Gambit Declined: Queen's Knight Variation	1. d4 e6 2. c4 d5 3. Nc3 dxc4 4. e3 Nf6
2016.04.30	1-0	1903	1987	Pirc Defense #4	1. e4 d6 2. Nf3 g6 3. d4 Bg7 4. Be3 Nc6
2016.04.30	0-1	1583	1244	Zukertort Opening: Pirc Invitation	1. Nf3 d6 2. g3 e5 3. d4 e4 4. Nh4 d5
2016.04.30	0-1	1197	1705	Sicilian Defense: Staunton-Cochrane Variation	1. e4 c5 2. c4 d6 3. Nf3 Nf6 4. Nc3 g6
2016.04.30	0-1	1486	1315	King's Gambit	1. e4 e5 2. f4 d6 3. Nf3 Nc6 4. Bc4 Bg4
2016.04.30	0-1	1336	1401	Sicilian Defense: Closed Variation	1. e4 c5 2. Nc3 a6 3. a3 e6 4. b4 cxb4
2016.04.30	1-0	1903	1901	Sicilian Defense: Scheveningen Variation, Classical Variation	1. e4 c5 2. Nf3 d6 3. d4 cxd4 4. Nxd4 Nf6
2016.04.30	1-0	2268	2141	Indian Game: Dzindzi-Indian Defense	1. d4 Nf6 2. c4 a6 3. Nf3 e6 4. g3 d5
2016.04.30	0-1	1439	1300	King's Pawn Game: Napoleon Attack	1. e4 e5 2. Qf3 d6 3. Bc4 Nf6 4. d3 Nc6
2016.04.30	1-0	1714	1382	King's Pawn Game: Beyer Gambit	1. e4 e5 2. d4 d5 3. dxe5 d4 4. Nf3 Nc6
2016.04.30	1-0	1723	1751	Queen's Pawn Game: Symmetrical Variation	1. d4 Nf6 2. Nf3 d5 3. Nc3 Bf5 4. Bg5 e6
2016.04.30	0-1	1624	1671	Nimzo-Larsen Attack: Modern Variation #2	1. b3 e5 2. Bb2 d6 3. g3 a5 4. Bg2 a4
2016.04.30	1-0	1740	1542	Philidor Defense #3	1. e4 e5 2. Nf3 d6 3. Bc4 Bg4 4. Nc3 Nc6
2016.04.30	0-1	1786	2174	Queen's Pawn	1. d4 c6 2. e3 d5 3. Nf3 Nf6 4. Bc4 dxc4
2016.04.30	0-1	1336	1328	King's Pawn Game: Wayward Queen Attack	1. e4 e5 2. Qh5 Nc6 3. Bc4 g6 4. Qf3 f6
2016.04.30	0-1	1847	1916	Modern Defense	1. e4 g6 2. d3 Bg7 3. Bd2 Bxb2 4. Bc3 Bxa1
2016.04.30	0-1	1374	1369	Owen Defense	1. e4 b6 2. Nf3 Bb7 3. Nc3 g6 4. Bc4 Bg7
2016.04.30	1-0	1637	1495	Van't Kruijs Opening	1. e3 e5 2. b3 d5 3. Bb2 Nc6 4. Bb5 Bd7
2016.04.30	1-0	2006	1816	Benoni Defense: Classical Variation, Main Line	1. d4 c5 2. d5 Nf6 3. c4 e6 4. Nf3 exd5
2016.04.30	0-1	1178	1346	Queen's Gambit Refused: Albin Countergambit	1. d4 d5 2. c4 e5 3. e3 e4 4. Nc3 c6
2016.04.30	0-1	1720	1933	Benoni Defense: Benoni Gambit Accepted	1. d4 c5 2. dxc5 Nf6 3. Nc3 e6 4. b4 Nc6
2016.04.30	1-0	1894	1817	Center Game: Paulsen Attack Variation	1. e4 e5 2. d4 exd4 3. Qxd4 Nc6 4. Qe3 d6
2016.04.30	1-0	1858	1983	Modern Defense: Norwegian Defense	1. d4 Nf6 2. e4 g6 3. e5 Nd5 4. c4 Nb6
2016.04.30	0-1	1751	1702	Scandinavian Defense: Mieses-Kotroc Variation	1. e4 d5 2. exd5 Qxd5 3. Nc3 Qd8 4. Nf3 Nc6
2016.04.30	1-0	1836	2143	French Defense: Knight Variation	1. e4 e6 2. Nf3 d5 3. d3 dxe4 4. dxe4 Qxd1+
2016.04.30	0-1	1626	2098	Van't Kruijs Opening	1. e3 d5 2. g3 e5 3. Bg2 Nf6 4. b3 Bg4
2016.04.30	0-1	1284	1625	Bishop's Opening: Berlin Defense	1. e4 e5 2. Bc4 Nf6 3. d3 h6 4. Be3 Nc6
2016.04.30	1-0	1655	1698	French Defense: Advance Variation, Main Line	1. e4 e6 2. d4 d5 3. e5 c5 4. c3 Qb6
2016.04.30	0-1	1825	1918	Van't Kruijs Opening	1. e3 e5 2. c3 d5 3. d4 e4 4. Nd2 Nf6
2016.04.30	1-0	1571	1638	Scandinavian Defense	1. e4 d5 2. f3 dxe4 3. fxe4 Nc6 4. g3 e5
2016.04.30	1-0	1686	1632	Queen's Gambit Declined: Semi-Tarrasch Defense	1. d4 Nf6 2. Nf3 e6 3. c4 d5 4. Nc3 c5
2016.04.30	0-1	1382	1217	Queen's Gambit Accepted	1. d4 d5 2. c4 dxc4 3. Nc3 b5 4. e4 a6
2016.04.30	1-0	1862	2060	Sicilian Defense: Alapin Variation	1. e4 c5 2. c3 Nf6 3. e5 Nd5 4. c4 Nb6
2016.04.30	0-1	1514	1621	Vienna Game: Zhuravlev Countergambit #2	1. e4 e5 2. Nc3 Bb4 3. Nf3 Bxc3 4. dxc3 d6
2016.04.30	1-0	2213	1913	Queen's Pawn Game: Veresov Attack, Alburt Defense	1. d4 d5 2. Nc3 Bf5 3. e3 c6 4. g4 Bg6
2016.04.30	0-1	1441	1389	Three Knights Opening	1. e4 e5 2. Nf3 Nc6 3. Nc3 d6 4. Bc4 Be6
2016.04.30	0-1	1577	1662	King's Pawn Game: Beyer Gambit	1. d4 d5 2. e4 e5 3. exd5 c6 4. dxc6 Nxc6
2016.04.30	1-0	1831	1461	Bishop's Opening: Philidor Counterattack	1. e4 e5 2. Bc4 c6 3. Nf3 Qf6 4. d4 Bd6
2016.04.30	1-0	1754	1648	Ruy Lopez: Morphy Defense, Anderssen Variation	1. e4 e5 2. Nf3 Nc6 3. Bb5 a6 4. Ba4 Nf6
2016.04.30	1-0	1249	1268	Van Geet Opening: Reversed Nimzowitsch	1. Nc3 e5 2. e3 Nf6 3. h3 e4 4. b3 d5
2016.04.30	1-0	1679	1639	Caro-Kann Defense	1. e4 c6 2. Nf3 a6 3. d4 e6 4. Be3 d5
2016.04.30	1-0	1922	1253	Queen's Pawn Game #2	1. d4 d5 2. e3 e6 3. g3 c5 4. Bg2
2016.04.30	1-0	1462	1453	Scandinavian Defense: Mieses-Kotroc Variation	1. e4 d5 2. exd5 Qxd5 3. Nc3 Qc6 4. Nf3 Bg4
2016.04.30	0-1	1977	1904	Slav Defense: Three Knights Variation	1. d4 Nf6 2. c4 d5 3. Nc3 c6 4. Nf3 Bg4
2016.04.30	0-1	1685	1794	French Defense: Advance Variation	1. e4 e6 2. d4 d5 3. e5 c5 4. c3 Nc6
2016.04.30	0-1	1814	1996	Sicilian Defense: Chekhover Variation	1. e4 c5 2. Nf3 d6 3. d4 cxd4 4. Qxd4 Nc6
2016.04.30	1-0	1816	1457	French Defense: Knight Variation	1. e4 e6 2. Nf3 d5 3. exd5 exd5 4. d4 c5
2016.04.30	0-1	2036	2284	Bogo-Indian Defense: Vitolins Variation	1. d4 e6 2. c4 Nf6 3. Nf3 Bb4+ 4. Bd2 c5
2016.04.30	0-1	1986	2018	Sicilian Defense: Old Sicilian	1. e4 c5 2. Nf3 Nc6 3. Bc4 e6 4. d4 cxd4
2016.04.30	1-0	1661	1719	French Defense: Advance Variation, Paulsen Attack	1. e4 e6 2. d4 d5 3. e5 c5 4. c3 Nc6
2016.04.30	1-0	2046	1914	Sicilian Defense: Franco-Sicilian Variation	1. e4 c5 2. Nf3 Nc6 3. d4 e6 4. d5 Nce7
2016.04.30	0-1	1793	1898	Queen's Pawn Game: Zukertort Variation	1. d4 d5 2. Nf3 e6 3. g3 Nf6 4. Bg2 Bd6
2016.04.30	0-1	1294	1824	French Defense: Perseus Gambit	1. d4 e6 2. Nf3 d5 3. e4 c6 4. exd5 exd5
2016.04.30	0-1	2006	2022	Sicilian Defense: Delayed Alapin Variation	1. e4 c5 2. Nf3 e6 3. c3 b6 4. d3 Qc7
2016.04.30	1-0	1483	1236	English Opening: King's English Variation, Kramnik-Shirov Counterattack	1. c4 e5 2. Nc3 Bb4 3. Qc2 Nf6 4. e3 Nc6
2016.04.30	1-0	1847	1238	Queen's Pawn Game: Chigorin Variation	1. Nf3 d5 2. d4 Nc6 3. Bf4 Bf5 4. a3 e6
2016.04.30	0-1	1546	1629	Queen's Pawn Game: Chigorin Variation	1. d4 d5 2. Nc3 Nf6 3. Bf4 Nc6 4. Nb5 e6
2016.04.30	1-0	1731	1669	Queen's Pawn Game	1. d4 d5
2016.04.30	1-0	2035	1926	King's Indian Defense: 3.Nc3	1. d4 Nf6 2. c4 g6 3. Nc3 c5 4. d5 Bg7
2016.04.30	1-0	1673	1498	French Defense: Classical Variation, Delayed Exchange Variation	1. e4 e6 2. d4 Nf6 3. Nc3 d5 4. exd5 Nxd5
2016.04.30	1-0	1910	1671	Slav Defense: Exchange Variation	1. d4 c5 2. c3 cxd4 3. cxd4 d5 4. Nf3 Nf6
2016.04.30	0-1	1514	1458	King's Pawn Game: King's Head Opening #2	1. e4 e5 2. f3 d6 3. g3 Nc6 4. c3 Nf6
2016.04.30	0-1	1828	1864	Sicilian Defense: Loewenthal Variation	1. e4 c5 2. Nf3 Nc6 3. d4 cxd4 4. Nxd4 e5
2016.04.30	0-1	1755	1731	Queen's Pawn Game: Zukertort Variation	1. d4 d5 2. Nf3 e6 3. c4 c6 4. cxd5 exd5
2016.04.30	0-1	2082	1742	Italian Game: Classical Variation, Center Attack	1. e4 e5 2. Nf3 Nc6 3. Bc4 Bc5 4. c3 Nf6
2016.04.30	0-1	1632	1763	Torre Attack	1. d4 Nf6 2. Nf3 g6 3. Bg5 Bg7 4. Bxf6 exf6
2016.04.30	1-0	2134	2091	Mieses Opening	1. d3 d5 2. e4 dxe4 3. dxe4 Qxd1+ 4. Kxd1 Nc6
2016.04.30	0-1	1795	2133	Sicilian Defense: Najdorf Variation	1. e4 c5 2. Nf3 d6 3. d4 cxd4 4. Nxd4 Nf6
2016.04.30	1-0	1791	1673	Polish Opening	1. b4 d5 2. Bb2 c5 3. bxc5 e6 4. e3 Nf6
2016.04.30	1-0	1314	1288	Center Game: Normal Variation	1. e4 e5 2. d4 exd4 3. Qxd4 Nc6 4. Qd1 d6
2016.04.30	0-1	1233	1425	English Opening: Anglo-Lithuanian Variation	1. c4 Nc6 2. d3 f5 3. Nf3 e6 4. Bg5 Nf6
2016.04.30	1-0	1394	1258	Modern Defense	1. e4 g6 2. Nf3 Bg7 3. d4 e6 4. e5 d5
2016.04.30	1-0	1862	1961	Indian Game: Omega Gambit	1. d4 Nf6 2. e4 d5 3. e5 Nfd7 4. c4 dxc4
2016.04.30	0-1	1755	1789	Philidor Defense: Lopez Countergambit	1. e4 e5 2. Bc4 d6 3. Nf3 f5 4. exf5 Nf6
2016.04.30	0-1	1828	1869	French Defense #2	1. e4 e6 2. c3 Ne7 3. d4 Ng6 4. Nf3 Be7
2016.04.30	1/2-1/2	1518	1597	Queen's Gambit Refused: Marshall Defense	1. d4 d5 2. c4 Nf6 3. Nf3 Nc6 4. e3 Bg4
2016.04.30	1-0	1458	1602	English Opening: King's English Variation, Reversed Sicilian	1. c4 e5 2. Nc3 f5 3. e3 Nf6 4. d4 e4
2016.04.30	0-1	1601	1859	Sicilian Defense: Bowdler Attack	1. e4 c5 2. Bc4 Nc6 3. Qh5 g6 4. Qf3 Ne5
2016.04.30	0-1	2139	2099	Englund Gambit Declined, Reversed Mokele Mbembe	1. Nf3 e5 2. d4 e4 3. Ne5 Nf6 4. c4 d6
2016.04.30	1-0	1761	1665	English Opening: King's English Variation, Two Knights Variation	1. c4 e5 2. Nc3 Nf6 3. d4 exd4 4. Qxd4 Nc6
2016.04.30	1-0	1772	1440	Queen's Gambit Refused: Albin Countergambit	1. d4 d5 2. c4 e5 3. e3 Nc6 4. Nc3 Be6
2016.04.30	0-1	1414	1828	Owen Defense	1. e4 b6 2. Qf3 Bb7 3. Bc4 Nf6 4. Nh3 Bxe4
2016.04.30	1-0	1988	1880	King's Gambit Accepted, Polerio Gambit	1. e4 e5 2. f4 exf4 3. d4 g5 4. Bc4 b5
2016.04.30	1-0	1513	1464	French Defense: Advance Variation #2	1. e4 c5 2. c3 e6 3. d4 d5 4. e5 cxd4
2016.04.30	0-1	1252	1923	Center Game #2	1. e4 e5 2. d4 Nf6 3. dxe5 Nxe4 4. Nf3 Nc5
2016.04.30	1-0	1873	1830	French Defense: La Bourdonnais Variation	1. e4 e6 2. f4 d5 3. exd5 exd5 4. Nf3 Nf6
2016.04.30	1-0	1333	1304	French Defense: Normal Variation	1. e4 e6 2. d4 c6 3. c4 d5 4. cxd5 cxd5
2016.04.30	1-0	1940	2104	Sicilian Defense: Wing Gambit	1. e4 c5 2. b4 cxb4 3. d4 Nc6 4. d5 Ne5
2016.04.30	0-1	1139	1124	Three Knights Opening #2	1. e4 e5 2. Nc3 Nc6 3. Nf3 Bb4 4. d3 Bxc3+
2016.04.30	0-1	1584	1512	Sicilian Defense: Sozin Attack	1. e4 c5 2. Bc4 d6 3. Nf3 Nf6 4. Nc3 e6
2016.04.30	1-0	2064	2086	Hungarian Opening	1. g3 Nc6 2. Bg2 g6 3. d3 Bg7 4. e4 e6
2016.04.30	1-0	1945	1824	Hungarian Opening	1. g3 e5 2. Bg2 d5 3. d3 Nf6 4. c4 dxc4
2016.04.30	0-1	1529	1651	Bishop's Opening: Philidor Counterattack	1. e4 e5 2. Bc4 c6 3. Nf3 f6 4. d3 d5
2016.04.30	1-0	1764	1840	Sicilian Defense: Paulsen Variation	1. e4 c5 2. Nf3 Nc6 3. d4 cxd4 4. Nxd4 e6
2016.04.30	1-0	2314	2288	King's Indian Attack: Symmetrical Defense	1. Nf3 Nf6 2. g3 g6 3. Bg2 Bg7 4. O-O O-O
2016.04.30	1-0	2050	1926	King's Pawn Game: Alapin Opening	1. e4 e5 2. Ne2 f5 3. exf5 d5 4. Ng3 Nh6
2016.04.30	0-1	2042	2036	Sicilian Defense: Nyezhmetdinov-Rossolimo Attack, Fianchetto Variation	1. e4 c5 2. Nf3 Nc6 3. Bb5 g6 4. O-O Bg7
2016.04.30	1-0	1600	1611	Mieses Opening	1. d3 Nf6 2. Nd2 g6 3. Ngf3 Bg7 4. g3 d6
2016.04.30	0-1	2170	2183	English Opening: Anglo-Indian Defense	1. c4 Nf6 2. Qc2 e6 3. Nf3 Nc6 4. e3 Nb4
2016.04.30	1-0	1383	1276	Nimzo-Larsen Attack	1. b3 g6 2. Ba3 Bg7 3. c3 d5 4. d4 Bf5
2016.04.30	0-1	1830	1847	Italian Game: Anti-Fried Liver Defense	1. e4 e5 2. Nf3 Nc6 3. Bc4 h6 4. O-O Nf6
2016.04.30	1-0	1823	1794	Sicilian Defense: Old Sicilian	1. e4 c5 2. Nf3 Nc6 3. Bc4 e6 4. d4 cxd4
2016.04.30	0-1	1939	1889	Englund Gambit Complex: Stockholm Variation	1. d4 e5 2. dxe5 Nc6 3. Nf3 Qe7 4. Qd5 b6
