Date	Result	WhiteElo	BlackElo	Opening	Moves
2016.06.30	0-1	1657	1802	Blackmar-Diemer Gambit: Ryder Gambit	1. d4 d5 2. e4 dxe4 3. f3 exf3 4. Qxf3 Nf6
2016.06.30	0-1	1880	1853	Ruy Lopez: Classical Variation	1. e4 e5 2. Nf3 Nc6 3. Bb5 Bc5 4. O-O d6
2016.06.30	0-1	1888	1777	Russian Game: Damiano Variation	1. e4 e5 2. Nf3 Nf6 3. Nxe5 Nxe4 4. Qe2 d5
2016.06.30	0-1	1415	1690	Scandinavian Defense: Mieses-Kotroc Variation	1. e4 d5 2. exd5 Qxd5 3. c4 Qe4+ 4. Qe2 Nf6
2016.06.30	1-0	1741	1293	Alekhine Defense: John Tracy Gambit	1. e4 Nf6 2. Nf3 d5 3. d4 Bg4 4. h3 Bxf3
2016.06.30	0-1	1718	1936	Sicilian Defense: Nyezhmetdinov-Rossolimo Attack, Fianchetto Variation	1. e4 c5 2. Nf3 Nc6 3. Bb5 g6 4. O-O Bg7
2016.06.30	0-1	1674	2046	Caro-Kann Defense	1. e4 c6 2. Nf3 d5 3. exd5 cxd5 4. d4 Nc6
2016.06.30	1-0	1626	1262	Nimzowitsch Defense: Williams Variation	1. e4 Nc6 2. Nf3 d6 3. Bc4 g6 4. d3 b6
2016.06.30	1/2-1/2	1359	1208	Ruy Lopez: Morphy Defense, Modern Steinitz Defense #2	1. e4 e5 2. Nf3 d6 3. Bc4 Nc6 4. Bb5 a6
2016.06.30	1-0	1757	1938	Semi-Slav Defense: Main Line	1. d4 d5 2. Nf3 e6 3. c4 c6 4. Nc3 Nf6
2016.06.30	0-1	1530	1622	Bishop's Opening	1. e4 e5 2. Bc4 Nc6 3. Qf3 Nf6 4. c3 d6
2016.06.30	0-1	1859	1646	Old Benoni Defense	1. d4 c5 2. d5 e5 3. Nc3 d6 4. f4 Nf6
2016.06.30	0-1	2152	2243	Benko Gambit Accepted, Dlugy Variation	1. d4 Nf6 2. c4 c5 3. d5 b5 4. cxb5 a6
2016.06.30	0-1	2280	2259	French Defense: Rubinstein Variation, Blackburne Defense	1. e4 e6 2. d4 d5 3. Nd2 dxe4 4. Nxe4 Nd7
2016.06.30	0-1	1695	1675	French Defense: Winawer Variation, Delayed Exchange Variation	1. e4 e6 2. d4 d5 3. Nc3 Bb4 4. exd5 exd5
2016.06.30	0-1	1445	1822	Modern Defense	1. e4 g6 2. f4 Bg7 3. Nf3 d6 4. Bc4 Nc6
2016.06.30	1-0	1620	1647	Sicilian Defense: Lasker-Pelikan Variation, Exchange Variation	1. e4 c5 2. Nf3 Nc6 3. d4 cxd4 4. Nxd4 Nf6
2016.06.30	1-0	1763	1364	Queen's Gambit Accepted	1. d4 d5 2. c4 dxc4 3. Nc3 a6 4. e4 b5
2016.06.30	0-1	1500	1547	Rat Defense: Small Center Defense	1. e4 d6 2. d4 e6 3. Bc4 c6 4. Nf3 h6
2016.06.30	0-1	1986	2064	English Opening: Symmetrical Variation, Two Knights Variation	1. c4 c5 2. Nc3 Nc6 3. Nf3 e6 4. e3 d5
2016.06.30	1/2-1/2	1746	1800	Queen's Pawn	1. d4 c6 2. Nf3 e6 3. g3 d5 4. Bg2 Nf6
2016.06.30	0-1	1582	1577	Sicilian Defense: McDonnell Attack	1. e4 c5 2. f4 Nc6 3. Nf3 a6 4. Nc3 b5
2016.06.30	0-1	1367	1523	Philidor Defense #3	1. e4 e5 2. Nf3 d6 3. Bc4 h6 4. d4 exd4
2016.06.30	1-0	2103	2162	Sicilian Defense: French Variation	1. e4 c5 2. Nf3 e6 3. d4 Be7 4. Nc3 h6
2016.06.30	0-1	1865	1898	Bishop's Opening	1. e4 e5 2. Bc4 Nc6 3. d3 Bc5 4. Nc3 d6
2016.06.30	1-0	1939	1740	Scotch Game: Classical Variation	1. e4 e5 2. Nf3 Nc6 3. d4 exd4 4. Nxd4 Bc5
2016.06.30	1-0	1486	1376	King's Pawn Game: Wayward Queen Attack	1. e4 e5 2. Qh5 Nc6 3. Bb5 Nf6 4. Qf5 Nd4
2016.06.30	0-1	1873	1717	Pirc Defense: Roscher Gambit	1. e4 d6 2. d4 Nf6 3. Nf3 Bg4 4. Nc3 Nbd7
2016.06.30	1-0	1671	1769	Semi-Bononi	1. d4 c5 2. d5 e5 3. e4 d6 4. Bc4 f5
2016.06.30	1-0	1485	1377	Petrov's Defense	1. e4 e5 2. Nf3 Nf6 3. Bd3 Nc6 4. O-O Bd6
2016.06.30	1-0	2058	2136	Slav Defense: Modern Line	1. d4 d5 2. Nf3 c6 3. c4 e6 4. cxd5 exd5
2016.06.30	0-1	1632	1711	Philidor Defense #3	1. e4 e5 2. Nf3 d6 3. Bc4 g6 4. Nc3 Bg7
2016.06.30	0-1	1697	1737	Owen Defense	1. e4 b6 2. Nf3 Bb7 3. d3 Nc6 4. Be3 e6
2016.06.30	0-1	1685	1619	Scandinavian Defense: Main Line	1. e4 d5 2. exd5 Qxd5 3. Nc3 Qa5 4. Nf3 Bg4
2016.06.30	0-1	1792	1843	Slav Defense: Slav Gambit, Alekhine Attack	1. d4 d5 2. c4 c6 3. Nc3 dxc4 4. e4 g6
2016.06.30	1-0	1489	1740	Owen Defense	1. e4 b6 2. d4 Bb7 3. d5 c6 4. Bc4 cxd5
2016.06.30	0-1	1838	1676	Scandinavian Defense: Mieses-Kotroc Variation	1. e4 d5 2. exd5 Qxd5 3. Nc3 Qd8 4. Nf3 Nf6
2016.06.30	1/2-1/2	1008	1436	Scotch Game	1. e4 e5 2. Nf3 Nc6 3. d4 d6 4. dxe5 dxe5
2016.06.30	0-1	1558	1483	French Defense: La Bourdonnais Variation	1. e4 e6 2. f4 d5 3. exd5 exd5 4. Nc3 Nf6
2016.06.30	0-1	1100	1419	Elephant Gambit	1. e4 e5 2. Nf3 d5 3. exd5 Qxd5 4. Qe2 Bg4
2016.06.30	1/2-1/2	1228	1576	Hungarian Opening	1. g3 e5 2. Bg2 d5 3. b3 f5 4. Bb2 Bd6
2016.06.30	0-1	2387	2149	Budapest Defense: Alekhine Variation	1. d4 Nf6 2. c4 e5 3. dxe5 Ng4 4. e4 Nxe5
2016.06.30	0-1	1493	1562	Queen's Gambit Accepted	1. d4 d5 2. c4 dxc4 3. Nc3 a6 4. e4 e6
2016.06.30	1-0	1905	1893	Old Benoni Defense	1. d4 c5 2. Nf3 cxd4 3. Nxd4 e6 4. b3 Nc6
2016.06.30	1-0	1829	1848	Queen's Gambit Accepted	1. d4 d5 2. c4 dxc4 3. Nc3 e5 4. d5 Bb4
2016.06.30	0-1	1603	1528	Italian Game: Giuoco Pianissimo	1. e4 e5 2. Nf3 Nc6 3. Bc4 Bc5 4. d3 d6
2016.06.30	0-1	1491	1706	Italian Game: Evans Gambit, Pierce Defense	1. e4 e5 2. Nf3 Nc6 3. Bc4 Bc5 4. b4 Bxb4
2016.06.30	0-1	2001	1950	Reti Opening: Reti Accepted	1. Nf3 d5 2. c4 dxc4 3. Na3 Bg4 4. Ne5 Be6
2016.06.30	0-1	1928	1883	Alekhine Defense: Exchange Variation	1. e4 Nf6 2. e5 Nd5 3. c4 Nb6 4. d4 d6
2016.06.30	1-0	1316	1321	Hungarian Opening	1. g3 e6 2. Bg2 Be7 3. Nf3 Nf6 4. d3 O-O
2016.06.30	0-1	1690	1844	Duras Gambit	1. e4 f5 2. Bc4 fxe4 3. Nc3 Nf6 4. d3 d5
2016.06.30	1-0	2054	2138	Bishop's Opening: Stein Gambit	1. e4 e5 2. f4 Bc5 3. Bc4 d6 4. Nf3 Nc6
2016.06.30	0-1	1296	1592	Amazon Attack	1. d4 d5 2. Qd3 e6 3. Qb5+ c6 4. Qb3 Nf6
2016.06.30	0-1	1904	1960	Alekhine Defense: Four Pawns Attack, 6...Nc6	1. e4 Nf6 2. e5 Nd5 3. d4 d6 4. c4 Nb6
2016.06.30	1-0	1694	1700	Sicilian Defense: Closed Variation	1. e4 c5 2. Nc3 d6 3. f4 Nc6 4. Bc4 a6
2016.06.30	0-1	1868	1760	Alekhine Defense: Hunt Variation	1. e4 Nf6 2. e5 Nd5 3. d4 d6 4. c4 Nb6
2016.06.30	1-0	2615	2375	Queen's Gambit Declined: Exchange Variation, Positional Variation	1. d4 Nf6 2. c4 e6 3. Nc3 d5 4. cxd5 exd5
2016.06.30	1-0	1754	1682	Queen's Gambit Refused: Marshall Defense	1. d4 Nf6 2. c4 d5 3. Nc3 c5 4. Bg5 dxc4
2016.06.30	0-1	1901	1968	Zukertort Opening: Tennison Gambit	1. e4 d5 2. Nf3 dxe4 3. Ng5 Bf5 4. d3 exd3
2016.06.30	1-0	1822	1929	Slav Defense: Quiet Variation, Pin Defense	1. d4 d5 2. c4 c6 3. e3 Nf6 4. Nf3 Bg4
2016.06.30	0-1	1424	2028	Bishop's Opening: Berlin Defense	1. e4 e5 2. Bc4 Nf6 3. c3 Nc6 4. Qb3 Qe7
2016.06.30	1-0	1604	1662	Czech Defense	1. e4 Nf6 2. Nc3 d6 3. d4 c6 4. Nf3 Bg4
2016.06.30	1-0	1873	1726	Queen's Pawn Game: London System	1. d4 Nf6 2. Nf3 d5 3. Bf4 e6 4. e3 Nc6
2016.06.30	1-0	1331	1460	Queen's Pawn Game: Mason Attack	1. d4 d5 2. Bf4 e6 3. e3 c5 4. b3 cxd4
2016.06.30	0-1	1918	1931	Owen Defense	1. e4 b6 2. d4 Bb7 3. Bd3 e6 4. Be3 g6
2016.06.30	0-1	1791	1850	Sicilian Defense: McDonnell Attack	1. e4 c5 2. f4 Nc6 3. Nf3 e6 4. Bb5 d5
2016.06.30	0-1	1668	1726	Italian Game: Giuoco Pianissimo, Normal	1. e4 e5 2. Nf3 Nc6 3. Bc4 Nf6 4. d3 Bc5
2016.06.30	1-0	1364	1273	Hungarian Opening	1. g3 d5 2. Bg2 e5 3. d4 e4 4. f3 f5
2016.06.30	1-0	2057	1930	Pirc Defense #4	1. e4 d6 2. Nc3 Nf6 3. d3 g6 4. f4 Bg7
2016.06.30	0-1	1751	1701	French Defense: Normal Variation	1. e4 e6 2. d4 b6 3. g3 Bb7 4. Bg2 Nf6
2016.06.30	1-0	2045	1913	Scandinavian Defense: Blackburne-Kloosterboer Gambit	1. e4 d5 2. exd5 c6 3. Nf3 cxd5 4. d4 Nf6
2016.06.30	1-0	2088	2004	French Defense: King's Indian Attack	1. e4 e6 2. d3 d5 3. Nd2 Nf6 4. g3 Nc6
2016.06.30	1-0	2300	2100	Queen's Pawn Game: Levitsky Attack	1. d4 d5 2. Bg5 c5 3. dxc5 Qa5+ 4. Nc3 e6
2016.06.30	1/2-1/2	1570	1593	Ruy Lopez: Exchange Variation	1. e4 e5 2. Nf3 Nc6 3. Bb5 a6 4. Bxc6 dxc6
2016.06.30	0-1	1567	1378	Sicilian Defense: Staunton-Cochrane Variation	1. e4 c5 2. c4 Nc6 3. Nc3 d6 4. g3 Nf6
2016.06.30	1-0	1841	1823	English Opening: Symmetrical Variation	1. c4 c5 2. g3 e6 3. Bg2 a6 4. e3 d6
2016.06.30	1-0	2335	2208	Sicilian Defense: Closed Variation	1. e4 c5 2. Nc3 d6 3. f4 Nc6 4. Nf3 g6
2016.06.30	0-1	1439	1486	Danish Gambit	1. e4 e5 2. d4 exd4 3. c3 Nc6 4. Bc4 Qh4
2016.06.30	1-0	1621	1814	Sicilian Defense: Old Sicilian	1. e4 c5 2. Nf3 Nc6 3. c3 e5 4. d4 cxd4
2016.06.30	0-1	1706	1743	Pirc Defense: Classical Variation	1. e4 d6 2. d4 Nf6 3. Nc3 g6 4. Nf3 Bg7
2016.06.30	0-1	1539	1314	Scandinavian Defense: Icelandic-Palme Gambit	1. e4 d5 2. exd5 Nf6 3. c4 e6 4. Nc3 Qe7
2016.06.30	1-0	1514	1370	Ruy Lopez: Berlin Defense #2	1. e4 e5 2. Nf3 Nc6 3. Bb5 Nf6 4. Bxc6 bxc6
2016.06.30	1-0	1751	1517	Latvian Gambit	1. e4 e5 2. Nf3 f5 3. Nxe5 d6 4. Nc4 Nf6
2016.06.30	1-0	1871	1779	Caro-Kann Defense: Advance Variation, Botvinnik-Carls Defense	1. e4 c6 2. d4 d5 3. e5 c5 4. c3 Nc6
2016.06.30	0-1	1466	1820	Bishop's Opening: Berlin Defense	1. e4 e5 2. Bc4 Nf6 3. d3 h6 4. Nf3 c6
2016.06.30	0-1	1997	2129	French Defense: Two Knights Variation	1. e4 e6 2. Nc3 d5 3. Nf3 Nf6 4. exd5 exd5
2016.06.30	0-1	1568	1525	Nimzo-Indian Defense: Leningrad Variation	1. d4 Nf6 2. c4 e6 3. Nc3 Bb4 4. Bg5 c5
2016.06.30	1-0	1504	1501	Petrov's Defense #2	1. e4 e5 2. Nf3 Nf6 3. Nxe5 Qe7 4. d4 d6
2016.06.30	1-0	1550	1496	King's Knight Opening	1. e4 e5 2. Nf3 Bd6 3. d4 exd4 4. Nxd4 Bc5
2016.06.30	1-0	2167	1349	Scandinavian Defense	1. e4 d5 2. Nc3 d4 3. Nce2 e5 4. d3 Nc6
2016.06.30	1-0	1934	1871	Scotch Game: Classical Variation	1. e4 e5 2. Nf3 Nc6 3. d4 exd4 4. Nxd4 Bc5
2016.06.30	1-0	1967	1682	English Opening: Anglo-Indian Defense, King's Indian Formation	1. Nf3 Nf6 2. c4 g6 3. Nc3 Bg7 4. g3 O-O
2016.06.30	0-1	2088	1956	Ruy Lopez: Cozio Defense	1. e4 e5 2. Nf3 Nc6 3. Bb5 Nge7 4. O-O g6
2016.06.30	1-0	1537	1401	Ruy Lopez	1. e4 e5 2. Nf3 Nc6 3. Bb5 Bd6 4. h3 Nd4
2016.06.30	0-1	2062	1883	Philidor Defense #2	1. e4 e5 2. Nf3 d6 3. h3 Be7 4. Nc3 c6
2016.06.30	1-0	2083	2213	Van't Kruijs Opening	1. e3 f6 2. Nf3 Kf7 3. Nc3 Ke8 4. d3 Kf7
2016.06.30	1-0	1736	1793	Philidor Defense #3	1. e4 e5 2. Nf3 d6 3. Bc4 Be6 4. Bxe6 fxe6
2016.06.30	0-1	1587	1593	Zukertort Opening: Reversed Mexican Defense	1. Nc3 d5 2. Nf3 d4 3. Ne4 f5 4. Ng3 h5
2016.06.30	0-1	1565	1624	Scandinavian Defense: Mieses-Kotroc Variation	1. e4 d5 2. exd5 Qxd5 3. Nc3 Qd8 4. d4 Nf6
2016.06.30	1-0	1474	1502	Old Benoni Defense	1. d4 c5 2. e3 cxd4 3. Qxd4 Nc6 4. Qd1 Qc7
2016.06.30	0-1	1903	1945	English Opening: King's English Variation, Two Knights Variation, Reversed Dragon	1. c4 e5 2. Nc3 Nf6 3. g3 d5 4. cxd5 c6
2016.06.30	0-1	2092	2042	Modern Defense: Standard Line	1. e4 g6 2. d4 Bg7 3. Nc3 e6 4. Be3 Ne7
2016.06.30	1-0	2208	2176	Semi-Slav Defense	1. d4 d5 2. c4 c6 3. Nf3 Nf6 4. Nc3 e6
2016.06.30	1-0	1699	1412	Ruy Lopez: Closed Variations	1. e4 e5 2. Nf3 Nc6 3. Bb5 a6 4. Ba4 Nf6
2016.06.30	0-1	1745	1723	Italian Game: Anti-Fried Liver Defense	1. e4 e5 2. Nf3 Nc6 3. Bc4 h6 4. O-O Bc5
2016.06.30	0-1	1889	1934	Nimzo-Larsen Attack: Modern Variation #3	1. b3 e5 2. Bb2 Nc6 3. Bxe5 Nf6 4. Bxf6 Qxf6
2016.06.30	0-1	1653	1639	Caro-Kann Defense: Panov Attack #2	1. d4 d5 2. c4 c5 3. e3 cxd4 4. exd4 Nc6
2016.06.30	0-1	1777	1691	Semi-Slav Defense	1. d4 d5 2. c4 c6 3. Nf3 e6 4. Nc3 Nf6
2016.06.30	1-0	1413	1322	Russian Game: Urusov Gambit	1. e4 e5 2. Bc4 Nf6 3. Nf3 Nxe4 4. Qe2 Nd6
2016.06.30	0-1	1462	2147	Zukertort Opening: Black Mustang Defense	1. Nf3 Nc6 2. b3 e5 3. Bb2 e4 4. Ne5 d5
2016.06.30	1-0	2125	2122	Caro-Kann Defense: Classical Variation, Main Line	1. e4 c6 2. d4 d5 3. Nd2 dxe4 4. Nxe4 Bf5
2016.06.30	0-1	1696	1806	King's Pawn Game: Napoleon Attack	1. e4 e5 2. Qf3 Nf6 3. Be2 d6 4. h3 Nc6
2016.06.30	0-1	1958	1941	Englund Gambit	1. d4 e5 2. c4 exd4 3. Qxd4 Nc6 4. Qd3 g6
2016.06.30	0-1	1677	1999	Sicilian Defense: Grand Prix Attack	1. e4 c5 2. Nc3 Nc6 3. f4 g6 4. Nf3 Bg7
2016.06.30	0-1	1971	1844	French Defense: Knight Variation	1. e4 e6 2. Nf3 d5 3. exd5 exd5 4. d4 c6
2016.06.30	1-0	1552	1790	Polish Opening	1. b4 b6 2. Bb2 Bb7 3. Nf3 e6 4. e3 Nc6
2016.06.30	0-1	1613	1708	Queen's Pawn Game: Mason Attack	1. d4 d5 2. Bf4 Nf6 3. Nc3 g6 4. h3 Bg7
2016.06.30	1-0	1822	1467	French Defense: King's Indian Attack	1. e4 e6 2. d3 Nf6 3. Bg5 Be7 4. e5 Nd5
2016.06.30	1-0	1531	1916	Queen's Pawn Game #3	1. d4 d5 2. e3 Nf6 3. Nc3 e6 4. Nf3 c5
2016.06.30	1-0	2081	2060	Sicilian Defense: Mengarini Variation	1. e4 c5 2. a3 Nc6 3. b4 cxb4 4. axb4 Nxb4
2016.06.30	1-0	1726	1681	Alekhine Defense: John Tracy Gambit	1. e4 Nf6 2. Nf3 Nxe4 3. Nc3 d5 4. Nxe4 dxe4
2016.06.30	1-0	1481	1561	French Defense: Knight Variation	1. e4 e6 2. Nf3 d6 3. d4 h6 4. b3 a6
2016.06.30	0-1	1569	1702	Bishop's Opening	1. e4 e5 2. Bc4 Nc6 3. Nc3 Bb4 4. Nd5 Bc5
2016.06.30	0-1	1627	1861	Horwitz Defense	1. d4 e6 2. c4 Be7 3. f3 c6 4. e4 d5
2016.06.30	1-0	1723	1289	King's Gambit Accepted, Rosentreter Gambit	1. e4 e5 2. f4 exf4 3. Nf3 g5 4. d4 d6
2016.06.30	1-0	1948	1674	Benoni Defense: Benoni Gambit Accepted	1. d4 c5 2. dxc5 Nc6 3. Nf3 e5 4. e4 Bxc5
2016.06.30	1-0	1886	1711	French Defense: Normal Variation	1. d4 e6 2. e4 Bb4+ 3. c3 Be7 4. f4 d6
2016.06.30	1-0	1667	1610	Old Benoni Defense	1. d4 c5 2. e3 Nc6 3. Nc3 cxd4 4. exd4 e6
2016.06.30	0-1	1893	1981	Philidor Defense #2	1. e4 e5 2. Nf3 d6 3. h3 Nf6 4. Nc3 Nc6
2016.06.30	1-0	1776	1839	English Defense #2	1. d4 b6 2. e3 Bb7 3. c3 g6 4. Bd3 Bxg2
2016.06.30	1-0	1571	1592	Rat Defense: Small Center Defense	1. e4 d6 2. d4 e6 3. f4 c6 4. Nf3 Be7
2016.06.30	1-0	1727	1464	King's Indian Defense	1. d4 Nf6 2. c4 g6 3. Nc3 Bg7 4. g3 O-O
2016.06.30	1-0	1982	1823	King's Gambit: Panteldakis Countergambit	1. e4 e5 2. f4 f5 3. fxe5 fxe4 4. Bc4 Qh4+
2016.06.30	1-0	1823	1665	Queen's Pawn Game: Chigorin Variation	1. Nf3 d5 2. d4 Nc6 3. Bf4 Nf6 4. e3 e6
2016.06.30	1-0	1903	1978	Queen's Pawn Game: Chigorin Variation	1. d4 d5 2. Nf3 Nc6 3. Bf4 Bf5 4. c3 e6
2016.06.30	0-1	1633	1762	Danish Gambit	1. e4 e5 2. d4 exd4 3. c3 dxc3 4. Bc4 Bc5
2016.06.30	0-1	1541	1962	Caro-Kann Defense: Hillbilly Attack	1. e4 c6 2. Bc4 d5 3. exd5 cxd5 4. Bb5+ Nc6
2016.06.30	1-0	1335	1429	Sicilian Defense: Old Sicilian	1. e4 c5 2. Nf3 Nc6 3. Bc4 e6 4. d3 a6
2016.06.30	0-1	1993	1775	Sicilian Defense: Pin Variation	1. e4 c5 2. Nf3 e6 3. d4 cxd4 4. Nxd4 Nf6
2016.06.30	0-1	1372	1068	Sicilian Defense	1. e4 c5 2. Qh5 b6 3. Qf5 Nc6 4. Bc4 e6
2016.06.30	1-0	2093	2121	Modern Defense	1. d4 g6 2. Nf3 Bg7 3. Bf4 d6 4. e3 Nf6
2016.06.30	1-0	1717	1749	English Defense #2	1. d4 b6 2. e4 Bb7 3. Nc3 c6 4. d5 d6
2016.06.30	1-0	1781	1615	Scandinavian Defense	1. e4 d5 2. Nc3 d4 3. Nce2 c5 4. Ng3 Nc6
2016.06.30	1-0	1925	1816	Sicilian Defense: Loewenthal Variation	1. e4 c5 2. Nf3 Nc6 3. d4 cxd4 4. Nxd4 e5
2016.06.30	1-0	1986	1977	Benko Gambit Accepted, Modern Variation	1. d4 Nf6 2. c4 c5 3. d5 b5 4. cxb5 a6
2016.06.30	1/2-1/2	1713	2015	French Defense: Advance Variation	1. e4 e6 2. d4 d5 3. e5 c5 4. c3 Nc6
2016.06.30	1-0	1848	1808	French Defense: Steinitz Variation #2	1. e4 Nf6 2. Nc3 d5 3. e5 Nfd7 4. d4 e6
2016.06.30	1-0	1229	1173	Queen's Pawn	1. d4 f6 2. e4 d6 3. Bc4 Bd7 4. Bf4 Qc8
2016.06.30	1-0	2017	1921	Slav Defense: Geller Gambit #2	1. d4 c6 2. c4 d5 3. Nf3 Nf6 4. Nc3 dxc4
2016.06.30	0-1	1630	1556	Scandinavian Defense: Main Line, Mieses Variation	1. e4 d5 2. exd5 Qxd5 3. Nc3 Qa5 4. d4 Nf6
2016.06.30	0-1	2235	2200	Modern Defense: Pseudo-Austrian Attack	1. e4 g6 2. d4 Bg7 3. Nc3 d6 4. f4 a6
2016.06.30	0-1	1650	1679	English Defense #2	1. d4 b6 2. a3 Bb7 3. h3 e6 4. Nf3 Nf6
2016.06.30	1-0	2031	1972	Caro-Kann Defense	1. e4 c6 2. Nf3 d5 3. exd5 cxd5 4. Nc3 d4
2016.06.30	1-0	1579	1645	Van't Kruijs Opening	1. e3 e5 2. b3 d5 3. Bb2 Nc6 4. g3 Bd6
2016.06.30	0-1	2207	2064	Sicilian Defense: Smith-Morra Gambit	1. e4 c5 2. d4 cxd4 3. c3 g6 4. Qxd4 Nf6
2016.06.30	1-0	1396	1339	French Defense: Steiner Variation	1. e4 e6 2. c4 g6 3. Nc3 Bg7 4. d3 Ne7
2016.06.30	1-0	1221	1348	French Defense: Queen's Knight	1. e4 e6 2. Nc3 Qe7 3. b3 d5 4. exd5 exd5+
2016.06.30	1-0	2155	2093	Caro-Kann Defense	1. e4 c6 2. d4 d6 3. Nf3 Qa5+ 4. c3 Nf6
2016.06.30	0-1	1521	1686	Philidor Defense: Exchange Variation	1. e4 e5 2. Nf3 d6 3. d4 exd4 4. Nxd4 Nf6
2016.06.30	1-0	1893	1897	Scandinavian Defense: Marshall Variation	1. e4 d5 2. exd5 Nf6 3. d4 Nxd5 4. c4 Nb6
2016.06.30	1-0	1621	1687	Queen's Pawn Game: Mason Attack	1. d4 d5 2. Bf4 e6 3. Nf3 h6 4. e3 Nf6
2016.06.30	1-0	1559	1612	Sicilian Defense: Snyder Variation	1. e4 c5 2. b3 Nc6 3. Bb2 e6 4. Nc3 Nf6
2016.06.30	0-1	1640	1869	Alekhine Defense	1. e4 Nf6 2. e5 Nd5 3. d4 d6 4. f4 dxe5
2016.06.30	0-1	2061	1903	Sicilian Defense: McDonnell Attack	1. e4 c5 2. f4 g6 3. c3 Bg7 4. Nf3 e6
2016.06.30	1-0	1440	1482	Queen's Gambit Declined: Queen's Knight Variation	1. d4 d5 2. c4 e6 3. Nc3 Bb4 4. Bd2 Nc6
2016.06.30	0-1	1864	1942	French Defense: Advance Variation, Milner-Barry Gambit	1. e4 e6 2. d4 d5 3. e5 c5 4. c3 Nc6
2016.06.30	1-0	1769	2097	Polish Opening	1. b4 e5 2. Bb2 f6 3. e3 a5 4. Bd3 Ne7
2016.06.30	1-0	1641	1482	Bishop's Opening: Berlin Defense	1. e4 e5 2. Bc4 Nf6 3. Qf3 d5 4. exd5 e4
2016.06.30	1-0	2108	2203	English Opening: King's English Variation	1. c4 e5 2. d3 f5 3. Nf3 d6 4. Nc3 Nf6
2016.06.30	1-0	1767	1704	Vienna Game: Stanley Variation, Three Knights Variation	1. e4 e5 2. Bc4 Nf6 3. Nc3 Nc6 4. a3 Bc5
2016.06.30	0-1	1671	1598	Queen's Pawn Game: Chigorin Variation	1. d4 d5 2. Nf3 Nc6 3. g3 Bf5 4. Bg2 f6
2016.06.30	1-0	1552	1490	Philidor Defense #3	1. e4 e5 2. Nf3 d6 3. Bc4 c6 4. d4 exd4
2016.06.30	0-1	1281	1777	Queen's Pawn Game	1. d4 d5 2. c3 c5 3. e3 Nc6 4. dxc5 e5
2016.06.30	0-1	1444	1533	King's Pawn Game: Napoleon Attack	1. e4 e5 2. Qf3 d6 3. Bc4 Nf6 4. h3 Nc6
2016.06.30	0-1	2208	2025	English Opening: Agincourt Defense	1. c4 e6 2. g3 b6 3. Bg2 Nc6 4. Nf3 Bb7
2016.06.30	0-1	1766	1726	Scotch Game: Schmidt Variation	1. e4 e5 2. Nf3 Nc6 3. d4 exd4 4. Nxd4 Nf6
2016.06.30	0-1	1812	2035	Robatsch (Modern) Defense	1. e4 g6 2. d4 Bg7 3. e5 d6 4. f4 c6
2016.06.30	0-1	1542	1558	Queen's Pawn Game: Zukertort Variation	1. d4 d5 2. Nf3 Bf5 3. e3 e6 4. a3 a6
2016.06.30	0-1	1863	1786	Slav Defense: Three Knights Variation	1. Nf3 Nf6 2. d4 d5 3. c4 c6 4. Nc3 Bg4
2016.06.30	1-0	1710	1555	King's Gambit	1. e4 e5 2. f4 d6 3. Nf3 Bg4 4. fxe5 Nc6
2016.06.30	0-1	1927	1969	Benoni Defense: Hromadka System	1. d4 c5 2. d5 d6 3. c4 Nf6 4. Nc3 g6
2016.06.30	1-0	1541	1479	French Defense: Steinitz Attack	1. e4 e6 2. e5 Nc6 3. d4 Bb4+ 4. Bd2 a5
2016.06.30	1-0	1653	1626	Caro-Kann Defense	1. e4 c6 2. Nc3 d5 3. exd5 cxd5 4. d4 e6
2016.06.30	0-1	1872	1873	Rat Defense: English Rat, Lisbon Gambit	1. d4 e5 2. c4 d6 3. dxe5 Nc6 4. c5 d5
2016.06.30	0-1	1721	2048	Indian Game	1. d4 Nf6 2. e3 c5 3. c3 g6 4. f4 Bg7
2016.06.30	0-1	1642	1710	Sicilian Defense: Open	1. e4 c5 2. Nf3 Nc6 3. d4 cxd4 4. Nxd4 Nf6
2016.06.30	1-0	1814	1791	Queen's Gambit Accepted	1. d4 d5 2. c4 dxc4 3. Nc3 a6 4. a4 c6
2016.06.30	0-1	1406	1612	Sicilian Defense	1. e4 c5 2. Nf3 d6 3. c4 e5 4. Qb3 Nc6
2016.06.30	1-0	1751	1846	King's Indian Defense: Larsen Variation	1. e4 d6 2. Nf3 g6 3. d4 Bg7 4. c4 Nf6
2016.06.30	0-1	1818	1675	French Defense: King's Indian Attack	1. e4 e6 2. d3 d5 3. Qf3 dxe4 4. dxe4 Nc6
2016.06.30	0-1	1415	1493	Four Knights Game: Italian Variation	1. e4 e5 2. Nf3 Nc6 3. Nc3 Bc5 4. Bc4 Nf6
2016.06.30	1-0	1757	1792	Sicilian Defense: Bowdler Attack	1. e4 c5 2. Bc4 d6 3. Qf3 e6 4. d3 Nc6
2016.06.30	0-1	1576	1642	Sicilian Defense: Old Sicilian	1. e4 c5 2. Nf3 Nc6 3. c3 e5 4. d4 cxd4
2016.06.30	0-1	1865	2008	Modern Defense: Averbakh Variation	1. c4 g6 2. d4 Bg7 3. Nc3 d6 4. e4 e5
2016.06.30	1-0	1515	1304	Queen's Pawn Game: Zukertort Variation	1. d4 d5 2. Nf3 Qd6 3. c4 Qa6 4. cxd5 Qa5+
2016.06.30	1-0	1877	1956	Scotch Game: Benima Defense	1. e4 e5 2. Nf3 Nc6 3. d4 exd4 4. Bc4 Be7
2016.06.30	0-1	1629	1516	Nimzo-Larsen Attack: Modern Variation #4	1. e3 e5 2. b3 Nc6 3. Bb2 d5 4. Bb5 Nf6
2016.06.30	0-1	1365	1513	Robatsch (Modern) Defense	1. e4 g6 2. d4 Bg7 3. Nf3 e6 4. Be3 Ne7
2016.06.30	0-1	1952	2015	Four Knights Game: Spanish Variation, Rubinstein Variation	1. e4 Nf6 2. Nc3 e5 3. Nf3 Nc6 4. Bb5 Nd4
2016.06.30	0-1	2211	2150	Scandinavian Defense: Kloosterboer Gambit	1. e4 d5 2. exd5 c6 3. dxc6 e5 4. Bb5 bxc6
2016.06.30	0-1	1827	1830	Old Indian Defense: Janowski Variation	1. d4 Nf6 2. c4 d6 3. Nc3 Bf5 4. e3 e6
2016.06.30	1-0	1831	1820	Saragossa Opening	1. c3 c5 2. Nf3 d5 3. Qc2 Nf6 4. d3 e5
2016.06.30	0-1	1985	2017	Sicilian Defense: Delayed Alapin	1. e4 c5 2. Nf3 d6 3. c3 Nf6 4. Bd3 Nc6
2016.06.30	1-0	2133	2087	Dutch Defense: Queen's Knight Variation	1. d4 f5 2. c4 Nf6 3. Nc3 e6 4. e4 fxe4
2016.06.30	0-1	1883	1864	Slav Defense: Exchange Variation	1. d4 d5 2. c4 c6 3. cxd5 cxd5 4. Nc3 Nf6
2016.06.30	1-0	1361	1444	Queen's Pawn Game: Chigorin Variation	1. d4 d5 2. Nf3 Nc6 3. e3 Nf6 4. Bd3 e6
2016.06.30	0-1	1769	1902	Franco-Benoni Defense	1. d4 e6 2. e4 c5 3. d5 d6 4. Nc3 f5
2016.06.30	0-1	2183	2003	Queen's Pawn Game: Franco-Sicilian Defense	1. e4 e6 2. d4 c5 3. c3 a6 4. Nf3 h6
2016.06.30	0-1	1428	1979	Van't Kruijs Opening	1. e3 c5 2. Ne2 Nc6 3. Ng3 d6 4. Be2 e5
