Date	Result	WhiteElo	BlackElo	Opening	Moves
2018.12.31	1-0	1469	1446	Slav Defense	1. d4 d5 2. c4 c6 3. e3 Nf6 4. Qc2 g6
2018.12.31	1-0	1699	1719	Indian Game	1. d4 Nf6 2. Bf4 d6 3. e3 g6 4. h3 Bg7
2018.12.31	0-1	1338	1371	Sicilian Defense: French Variation	1. e4 c5 2. Nf3 e6 3. d3 Nc6 4. g3 d5
2018.12.31	1-0	1218	1134	Robatsch (Modern) Defense	1. e4 g6 2. d4 Bg7 3. Be3 Nc6 4. c3 d6
2018.12.31	0-1	1500	1510	Pirc Defense	1. e4 d6 2. d4 Nf6 3. Qd3 g6 4. c4 Bg7
2018.12.31	0-1	1542	1570	Queen's Pawn Game: Zukertort Variation	1. Nf3 d5 2. d4 e6 3. e3 c5 4. Bd3 cxd4
2018.12.31	0-1	1753	1853	Sicilian Defense: McDonnell Attack	1. e4 c5 2. f4 d6 3. Nf3 g6 4. c3 Bg7
2018.12.31	0-1	986	1216	Horwitz Defense	1. d4 e6 2. Bf4 b6 3. e3 Nf6 4. Nf3 Ne4
2018.12.31	1-0	1893	1840	Slav Defense: Exchange Variation	1. d4 d5 2. Nf3 c6 3. c4 Nf6 4. cxd5 cxd5
2018.12.31	1-0	2046	2127	Zukertort Opening: Queen's Gambit Invitation	1. Nf3 e6 2. e3 d5 3. Be2 Nf6 4. O-O c5
2018.12.31	0-1	1531	1483	Sicilian Defense: O'Kelly Variation	1. e4 c5 2. Nf3 a6 3. Bc4 e6 4. a4 b5
2018.12.31	1-0	1318	1343	Italian Game: Classical Variation, Giuoco Pianissimo	1. e4 e5 2. Bc4 Nc6 3. d3 Bc5 4. Nf3 Nf6
2018.12.31	0-1	1603	1636	Sicilian Defense: Najdorf Variation	1. e4 c5 2. Nf3 d6 3. d4 cxd4 4. Nxd4 Nf6
2018.12.31	0-1	1015	1220	Vienna Game: Stanley Variation	1. e4 e5 2. Bc4 Nf6 3. Nc3 c6 4. Nf3 d5
2018.12.31	1-0	1569	1540	Colle System	1. d4 d5 2. e3 Nf6 3. Nf3 e6 4. Nc3 c5
2018.12.31	1-0	1716	1665	Nimzo-Larsen Attack: Classical Variation	1. b3 d5 2. Bb2 Nf6 3. g3 Nc6 4. Bg2 e5
2018.12.31	0-1	1414	1475	Queen's Pawn Game: Krause Variation	1. Nf3 d5 2. d4 c5 3. Nc3 Nc6 4. dxc5 Nf6
2018.12.31	1/2-1/2	1739	1782	French Defense: Knight Variation	1. e4 e6 2. Nf3 d5 3. exd5 Nf6 4. Bb5+ c6
2018.12.31	1-0	1821	1916	Benoni Defense: King's Pawn Line	1. d4 Nf6 2. c4 e6 3. Nc3 c5 4. d5 exd5
2018.12.31	0-1	1486	1569	Pirc Defense #4	1. e4 d6 2. Nf3 Nf6 3. Bc4 g6 4. Nc3 Bg7
2018.12.31	0-1	1610	1630	Van't Kruijs Opening	1. e3 e5 2. Nc3 Nf6
2018.12.31	1/2-1/2	1757	1798	Scandinavian Defense	1. e4 d5 2. d3 dxe4 3. dxe4 Qxd1+ 4. Kxd1 Nc6
2018.12.31	0-1	2158	2280	Grünfeld Defense: Three Knights Variation	1. d4 Nf6 2. Nf3 g6 3. c4 Bg7 4. Nc3 d5
2018.12.31	0-1	2239	2286	Zukertort Opening: Tennison Gambit	1. e4 d5 2. Nf3 dxe4 3. Ng5 f5 4. Nc3 e5
2018.12.31	0-1	1612	1819	Bird Opening: Dutch Variation	1. f4 d5 2. Nf3 Nc6 3. e3 f6 4. Bb5 e5
2018.12.31	1-0	1475	1230	Queen's Pawn Game: Zukertort Variation	1. d4 d5 2. Nf3 e6 3. e3 Bd6 4. c4 Nf6
2018.12.31	1/2-1/2	1766	1843	Sicilian Defense: Accelerated Dragon	1. e4 c5 2. Nf3 Nc6 3. d4 cxd4 4. Nxd4 g6
2018.12.31	1-0	2610	2156	Hungarian Opening: Catalan Formation	1. g3 d5 2. Bg2 e6 3. Nf3 Be7 4. O-O Nf6
2018.12.31	1-0	1745	1702	Bird Opening	1. f4 c5 2. b3 Qa5 3. Bb2 d6 4. e3 Be6
2018.12.31	0-1	1214	1243	French Defense: Knight Variation	1. e4 e6 2. Nf3 d6 3. d4 c6 4. c4 Nd7
2018.12.31	0-1	1641	1666	Scotch Game	1. e4 e5 2. Nf3 Nc6 3. d4 exd4 4. Nxd4 Nxd4
2018.12.31	1-0	1397	1418	Scandinavian Defense	1. e4 d5 2. d3 g6 3. Nc3 d4 4. Nb5 Bg7
2018.12.31	0-1	1272	1261	Russian Game: Urusov Gambit	1. e4 e5 2. Bc4 Nf6 3. Nf3 Nxe4 4. Bxf7+ Kxf7
2018.12.31	1-0	1813	1895	King's Pawn Game: Busch-Gass Gambit	1. e4 e5 2. Nf3 Bc5 3. c3 d6 4. d4 Bb6
2018.12.31	1-0	1845	1915	Sicilian Defense: Smith-Morra Gambit #2	1. e4 c5 2. d4 cxd4 3. Qxd4 Qc7 4. Qe3 e6
2018.12.31	1-0	1360	1385	English Opening: King's English Variation, Reversed Sicilian	1. c4 e5 2. Nc3 Bc5 3. e3 d6 4. d4 exd4
2018.12.31	0-1	1345	1315	English Opening: King's English Variation, Two Knights Variation	1. c4 e5 2. Nc3 Nf6 3. a3 b6 4. Nf3 Nc6
2018.12.31	1-0	1059	1853	Sicilian Defense: Closed Variation	1. e4 c5 2. Nc3 d6
2018.12.31	0-1	1240	1248	French Defense: Knight Variation	1. e4 e6 2. Nf3 d6 3. d4 Nf6 4. e5 Ne4
2018.12.31	0-1	1648	1763	Scandinavian Defense: Mieses-Kotroc Variation	1. e4 d5 2. exd5 Qxd5 3. Nc3 Qe6+ 4. Be2 Qg6
2018.12.31	1-0	1209	1141	Four Knights Game: Scotch Variation	1. e4 e5 2. Nf3 Nc6 3. Nc3 Nf6 4. d4 d5
2018.12.31	1-0	1231	1217	Pirc Defense #4	1. e4 d6 2. Nf3 e6 3. Bc4 h6 4. c3 Ne7
2018.12.31	0-1	1372	1379	Queen's Gambit Declined: Cambridge Springs Defense: 7.cxd5	1. d4 e6 2. c4 d5 3. Nc3 Nf6 4. Bg5 c6
2018.12.31	1-0	1489	1478	Ruy Lopez: Morphy Defense, Neo-Arkhangelsk Variation	1. e4 e5 2. Nf3 Nc6 3. Bb5 Nf6 4. O-O a6
2018.12.31	0-1	1142	1177	Scotch Game	1. e4 e5 2. Nf3 Nc6 3. d4 exd4 4. Nxd4 Nxd4
2018.12.31	0-1	1870	1864	Queen's Pawn Game: Veresov Attack, Classical Defense	1. d4 Nf6 2. Nc3 e6 3. Nf3 d5 4. Bg5 Bb4
2018.12.31	0-1	1936	1981	Neo-Grünfeld Defense: Ultra-delayed Exchange Variation	1. d4 Nf6 2. Nf3 g6 3. g3 Bg7 4. Bg2 O-O
2018.12.31	1-0	1769	1619	Sicilian Defense: Old Sicilian	1. e4 c5 2. Nf3 Nc6 3. c3 e6 4. Na3 d5
2018.12.31	1-0	1454	1397	Ruy Lopez: Exchange Variation, Normal Variation	1. e4 e5 2. Nf3 Nc6 3. Bb5 a6 4. Bxc6 dxc6
2018.12.31	0-1	2097	2074	Ruy Lopez: Closed	1. e4 e5 2. Nf3 Nc6 3. Bb5 a6 4. Ba4 Nf6
2018.12.31	0-1	1623	1634	Réti Opening: Réti Accepted	1. Nf3 d5 2. c4 dxc4 3. Nc3 c6 4. e3 Nf6
2018.12.31	1-0	1075	1039	Ruy Lopez	1. e4 e5 2. Nf3 Nc6 3. Bb5 Nb4 4. Nxe5 c6
2018.12.31	1-0	1933	1910	Sicilian Defense: Alapin Variation	1. e4 c5 2. c3 d6 3. d4 Qc7 4. Bd3 a6
2018.12.31	0-1	1013	914	King's Gambit	1. e4 e5 2. f4 d6 3. Nf3 Nc6 4. Bc4 exf4
2018.12.31	0-1	1466	1359	Indian Game	1. d4 Nf6 2. Bf4 d5 3. e3 c5 4. c3 Bf5
2018.12.31	0-1	1121	1146	Ruy Lopez: Classical Variation	1. e4 e5 2. Nf3 Nc6 3. Bb5 Bc5 4. d4 exd4
2018.12.31	0-1	1534	1519	Sicilian Defense: Smith-Morra Gambit Accepted, Pin Defense	1. e4 c5 2. d4 cxd4 3. c3 Nc6 4. Nf3 dxc3
2018.12.31	0-1	1686	1816	Caro-Kann Defense	1. e4 c6 2. Nf3 d5 3. exd5 cxd5 4. d4 g6
2018.12.31	1-0	2012	1987	Scandinavian Defense: Mieses-Kotroc Variation	1. e4 d5 2. exd5 Qxd5 3. c4 Qc5 4. d4 Qb6
2018.12.31	1-0	1957	1738	Semi-Slav Defense: Romih Variation	1. d4 e6 2. c4 c6 3. Nf3 d5 4. Nc3 Nf6
2018.12.31	0-1	1376	1395	French Defense: Normal Variation	1. e4 e6 2. d4 b6 3. Bc4 g6 4. d5 Bg7
2018.12.31	0-1	2035	2004	Queen's Pawn Game	1. d4 d5 2. c3 e6 3. Bf4 Be7 4. e3 f5
2018.12.31	1-0	1537	1667	Slav Defense #2	1. d4 d5 2. c4 c6 3. Nc3 Nf6 4. Bf4 e6
2018.12.31	1-0	2137	1917	English Defense #2	1. d4 b6 2. e4 Bb7 3. f3 e6 4. h4 Nf6
2018.12.31	0-1	1374	1420	St. George Defense	1. e4 a6 2. d4 b5 3. Nf3 Bb7 4. Nc3 b4
2018.12.31	1-0	1430	1460	French Defense: Steinitz Attack	1. e4 e6 2. e5 d6 3. Nf3 dxe5 4. Nxe5 Nf6
2018.12.31	0-1	1374	1362	Queen's Pawn Game: Chigorin Variation	1. d4 d5 2. Nc3 Nf6 3. Bf4 a6 4. b4 Nc6
2018.12.31	1-0	1848	1755	French Defense: Normal Variation	1. e4 e6 2. d4
2018.12.31	1-0	1103	980	King's Gambit Declined, Classical Variation	1. e4 e5 2. f4 Bc5 3. fxe5 Nc6 4. Nf3 d6
2018.12.31	0-1	851	973	Scandinavian Defense	1. e4 d5 2. Bb5+ c6 3. Ba4 b5 4. Bb3 dxe4
2018.12.31	1-0	1796	1701	Scandinavian Defense: Mieses-Kotroc Variation	1. e4 d5 2. exd5 Qxd5 3. Nc3 Qd8 4. g3 e6
2018.12.31	0-1	1275	1279	Vienna Game: Falkbeer Variation	1. e4 e5 2. Nc3 Nf6 3. d4 exd4 4. Qxd4 b6
2018.12.31	1-0	2164	1944	Nimzo-Indian Defense: Hübner Variation	1. d4 Nf6 2. c4 e6 3. Nc3 Bb4 4. e3 c5
2018.12.31	1-0	1118	833	King's Pawn Game	1. e4 e5 2. h3 f6 3. Qh5+ g6 4. Qf3 Bd6
2018.12.31	1-0	1870	1885	French Defense: Advance Variation, Nimzowitsch System	1. e4 e6 2. Nf3 d5 3. e5 c5 4. d4 Nc6
2018.12.31	0-1	1318	1345	Queen's Gambit Declined	1. d4 d5 2. c4 e6 3. e3 Nf6 4. Bd3 Nc6
2018.12.31	1-0	1687	1695	Philidor Defense: Exchange Variation	1. e4 e5 2. Nf3 d6 3. d4 exd4 4. Nxd4 Nf6
2018.12.31	1-0	1770	1785	Robatsch (Modern) Defense	1. e4 g6 2. d4 Bg7 3. c3 e6 4. Be3 c6
2018.12.31	0-1	1652	1675	Ruy Lopez: Exchange Variation	1. e4 e5 2. Nf3 Nc6 3. Bb5 a6 4. Bxc6 dxc6
2018.12.31	0-1	1877	1917	Mieses Opening	1. d3 d5 2. Nd2 Nf6 3. f4 g6 4. Ngf3 Bg7
2018.12.31	0-1	1300	1429	French Defense: Knight Variation	1. e4 e6 2. Nf3 Be7 3. d4 d6 4. Bd3 Bd7
2018.12.31	1-0	1183	1152	St. George Defense	1. e4 a6 2. Nf3 b6 3. d4 c6 4. Nc3 d6
2018.12.31	1-0	1944	1926	Modern Defense	1. e4 g6 2. f4 Bg7 3. e5 d6 4. Nf3 dxe5
2018.12.31	1-0	1604	1524	Horwitz Defense	1. d4 e6 2. Nc3 d5 3. Bg5 Qxg5 4. f3 Be7
2018.12.31	0-1	876	915	Queen's Pawn Game #2	1. d4 d5 2. e3 Nc6 3. Be2 Nf6 4. Nf3 g6
2018.12.31	1-0	1685	1678	Hungarian Opening	1. g3 e5 2. Bg2 Nf6 3. d3 d5 4. Bg5 c5
2018.12.31	1/2-1/2	1722	1696	Grünfeld Defense	1. d4 Nf6 2. c4 g6 3. Nc3 d5 4. e3 Bg7
2018.12.31	0-1	1822	1847	French Defense: Advance Variation, Euwe Variation	1. e4 e6 2. d4 d5 3. e5 c5 4. c3 Nc6
2018.12.31	0-1	1847	1969	Italian Game: Classical Variation, Giuoco Pianissimo	1. e4 e5 2. Nf3 Nc6 3. Bc4 Bc5 4. c3 Nf6
2018.12.31	0-1	2023	2022	Sicilian Defense: Kan Variation, Maróczy Bind, Réti Variation	1. e4 c5 2. Nf3 e6 3. d4 cxd4 4. Nxd4 a6
2018.12.31	0-1	1723	1914	Bishop's Opening	1. e4 e5 2. Bc4 d6 3. d3 Be6 4. b3 Nf6
2018.12.31	0-1	1928	1976	French Defense: Knight Variation	1. e4 e6 2. Nf3 Be7 3. e5 d5 4. exd6 cxd6
2018.12.31	1-0	1965	1417	Van't Kruijs Opening	1. e3 e5 2. d3 Nc6 3. e4 d5 4. Be2 d4
2018.12.31	0-1	1604	1825	Robatsch (Modern) Defense	1. e4 g6 2. d4 Bg7 3. Nf3 d6 4. e5 dxe5
2018.12.31	1/2-1/2	1482	1436	Bishop's Opening: Berlin Defense	1. e4 e5 2. Bc4 Nf6 3. d3 d5 4. exd5 Nxd5
2018.12.31	1-0	1386	1361	Queen's Gambit Refused: Austrian Defense	1. d4 d5 2. c4 c5 3. Nf3 Nf6 4. dxc5 dxc4
2018.12.31	1-0	1539	1520	Sicilian Defense: Bowdler Attack	1. e4 c5 2. Bc4 Nc6 3. a3 e6 4. d3 Qe7
2018.12.31	1-0	896	1105	Horwitz Defense	1. d4 e6 2. Nc3 Qh4 3. g3 Qh5 4. e4 d5
2018.12.31	0-1	1392	1420	Three Knights Opening	1. e4 e5 2. Nf3 Nc6 3. Nc3 a6 4. a4 Bc5
2018.12.31	1-0	1180	1125	King's Pawn Game: Damiano Defense	1. e4 e5 2. Nf3 f6 3. Bb5 c6 4. Ba4 b5
2018.12.31	0-1	1743	1723	Torre Attack #2	1. d4 Nf6 2. Nf3 Nc6 3. c4 d5 4. e3 Bg4
2018.12.31	1-0	1833	1879	King's Pawn Game: Busch-Gass Gambit	1. e4 e5 2. Nf3 Bc5 3. Bc4 Nf6 4. d3 O-O
2018.12.31	1-0	1639	1619	King's Indian Attack: French Variation	1. g3 c5 2. Bg2 d5 3. Nf3 Nc6 4. O-O e5
2018.12.31	0-1	1556	1934	King's Indian Defense: Normal Variation, Rare Defenses	1. c4 Nf6 2. Nc3 d6 3. e4 g6 4. Nf3 Bg7
2018.12.31	0-1	1762	1766	Sicilian Defense: Pin Variation	1. e4 c5 2. Nf3 e6 3. d4 cxd4 4. Nxd4 Nf6
2018.12.31	1-0	1455	1288	Queen's Gambit Accepted: Central Variation, Greco Variation	1. d4 d5 2. c4 dxc4 3. e4 b5 4. a4 Bd7
2018.12.31	0-1	1534	1546	Queen's Pawn Game: Mason Attack	1. d4 d5 2. Bf4 Bf5 3. Nf3 e6 4. e3 h6
2018.12.31	1-0	1355	1239	Scandinavian Defense: Mieses-Kotroc Variation	1. e4 d5 2. exd5 Qxd5 3. Nc3 Qe5+ 4. Be2 e6
2018.12.31	1-0	1887	1924	Sicilian Defense: Paulsen Variation, Normal Variation	1. e4 c5 2. Nf3 e6 3. d4 cxd4 4. Nxd4 Nc6
2018.12.31	1-0	1623	1638	Ruy Lopez: Steinitz Defense	1. e4 e5 2. Nf3 Nc6 3. Bb5 d6 4. Bxc6+ bxc6
2018.12.31	0-1	1522	1572	Dutch Defense	1. d4 f5 2. Bf4 e6 3. e3 c6 4. c3 d5
2018.12.31	1-0	2054	2105	Van't Kruijs Opening	1. e3 d6 2. d4 e5 3. dxe5 dxe5 4. Qxd8+ Kxd8
2018.12.31	1-0	1656	1647	Horwitz Defense	1. d4 e6 2. e3 d5 3. Nf3 Bd6 4. Bd3 Nf6
2018.12.31	0-1	2042	2039	Modern Defense	1. d4 g6 2. Nc3 Bg7 3. Nf3 d6 4. Bf4 e6
2018.12.31	1-0	1998	2020	Réti Opening #2	1. Nf3 Nf6 2. g3 d6 3. Bg2 g6 4. O-O Bg7
2018.12.31	0-1	1582	1581	Philidor Defense	1. e4 e5 2. Nf3 d6 3. d4 g6 4. dxe5 dxe5
2018.12.31	1-0	1500	1515	Old Benoni Defense	1. d4 c5 2. Bg5 cxd4 3. Qxd4 Nc6 4. Qd1 h6
2018.12.31	0-1	1479	1486	Old Indian Defense	1. d4 d6 2. c4 Nf6 3. e4 g6 4. e5 Bg7
2018.12.31	0-1	1344	1380	French Defense: Knight Variation	1. e4 e6 2. Nf3 d6 3. d4 Be7 4. Bc4 h6
2018.12.31	1-0	1843	1834	Caro-Kann Defense	1. e4 c6 2. Nf3 d5 3. exd5 cxd5 4. d4 Nc6
2018.12.31	0-1	1836	1901	Sicilian Defense	1. e4 c5
2018.12.31	0-1	1834	1836	Dutch Defense: Semi-Leningrad Variation	1. d4 f5 2. g3 Nf6 3. Bg2 g6 4. c4 c6
2018.12.31	1-0	1467	1706	Hungarian Opening	1. g3 e5 2. b3 d5 3. e3 c6 4. d3 Nf6
2018.12.31	0-1	1479	1446	Center Game: Normal Variation	1. e4 e5 2. d4 exd4 3. Qxd4 Nc6 4. Qd1 Qe7
2018.12.31	0-1	1543	1533	French Defense: Normal Variation	1. e4 e6 2. d4 g6 3. Nf3 b6 4. g3 d6
2018.12.31	0-1	1332	1380	Sicilian Defense: Paulsen-Basman Defense	1. e4 e6 2. d4 c5 3. Nf3 cxd4 4. Nxd4 Bc5
2018.12.31	1-0	1861	1867	Old Benoni Defense	1. d4 c5 2. c4 cxd4 3. Qxd4 e6 4. Qd1 Be7
2018.12.31	0-1	1428	1423	Van't Kruijs Opening	1. e3 e6 2. Qf3 d5 3. b3 c5 4. Bb2 Nc6
2018.12.31	1-0	1809	1736	Scandinavian Defense: Main Line, Mieses Variation	1. e4 d5 2. exd5 Qxd5 3. Nc3 Qa5 4. d4 Nf6
2018.12.31	1/2-1/2	824	1870	Scandinavian Defense: Gubinsky-Melts Defense	1. e4 d5 2. exd5 Qxd5 3. Nc3 Qd6 4. Nf3 Nf6
2018.12.31	1-0	1370	1433	King's Gambit Accepted, Gianutio Countergambit	1. e4 e5 2. f4 exf4 3. Nf3 f5 4. e5 d6
2018.12.31	1-0	1782	1764	Italian Game: Classical Variation, Albin Gambit	1. e4 e5 2. Nf3 Nc6 3. Bc4 Nf6 4. O-O Bc5
2018.12.31	1-0	1980	1845	Slav Defense	1. d4 c6 2. c4 d5 3. e3 g6 4. Nc3 Bg7
2018.12.31	1-0	1670	1690	Center Game: Normal Variation	1. e4 e5 2. d4 exd4 3. Qxd4 Nc6 4. Qd1 Nf6
2018.12.31	0-1	1265	1261	King's Knight Opening: Normal Variation	1. e4 e5 2. Nf3 Nc6 3. d3 Nf6 4. Be3 d5
2018.12.31	1-0	1402	1417	Three Knights Opening	1. e4 e5 2. Nf3 Nc6 3. Nc3 d6 4. Bb5 Bg4
2018.12.31	1-0	1903	1930	Sicilian Defense: Closed Variation, Traditional	1. e4 c5 2. Nc3 Nc6 3. Bc4 d6 4. d3 Nf6
2018.12.31	1-0	1500	1426	Sicilian Defense	1. e4 c5 2. Nf3 d5 3. exd5 Qxd5 4. Nc3 Qd6
2018.12.31	0-1	1500	1526	King's Pawn Game: McConnell Defense	1. e4 e5 2. Nf3 Qf6 3. Bb5 Bc5 4. d3 Bxf2+
2018.12.31	1-0	1739	1580	Dutch Defense: Queen's Knight Variation	1. d4 f5 2. c4 Nf6 3. Nc3 d5 4. Bf4 a6
2018.12.31	1-0	1766	1765	Caro-Kann Defense: Advance Variation, Short Variation	1. e4 c6 2. d4 d5 3. e5 Bf5 4. Nf3 e6
2018.12.31	0-1	1657	1657	Modern Defense: Two Knights Variation	1. e4 d6 2. d4 g6 3. Nc3 Bg7 4. Nf3 Bg4
2018.12.31	0-1	1038	1031	Philidor Defense #2	1. e4 e5 2. Nf3 d6 3. h3 Nf6 4. Bd3 Nc6
2018.12.31	1-0	1267	1348	Sicilian Defense: Modern Variations	1. e4 c5 2. Nf3 d6 3. d4 cxd4 4. Nxd4 Nf6
2018.12.31	0-1	1727	1722	Nimzo-Larsen Attack	1. b3 d6 2. Bb2 e5 3. g3 g6 4. Bg2 Bg7
2018.12.31	1-0	2015	2042	Zukertort Opening: Nimzo-Larsen Variation	1. Nf3 Nf6 2. b3 g6 3. Bb2 Bg7 4. c4 d5
2018.12.31	0-1	1339	1362	Scandinavian Defense	1. e4 d5 2. Nc3 d4 3. Nce2 e5 4. Ng3 Nc6
2018.12.31	1-0	1407	1410	King's Pawn Game: Tortoise Opening	1. e4 e5 2. Bd3 Nc6 3. Nf3 d6 4. O-O Bg4
2018.12.31	1-0	1559	1658	Owen Defense	1. e4 b6 2. d4 Bb7 3. Bd3 a5 4. Nf3 e6
2018.12.31	0-1	1806	1874	French Defense: Schlechter Variation	1. e4 e6 2. d4 d5 3. Bd3 Nf6 4. e5 Ne4
2018.12.31	1-0	1100	1089	Caro-Kann Defense: Advance Variation, Van der Wiel Attack	1. d4 c6 2. e4 d5 3. e5 Bf5 4. Nc3 h5
2018.12.31	0-1	1503	1520	Zukertort Opening: Queenside Fianchetto Variation	1. Nf3 b6 2. d4 Bb7 3. Nbd2 d5 4. c4 dxc4
2018.12.31	1-0	1252	1271	Queen's Gambit Refused: Marshall Defense	1. d4 Nf6 2. c4 d5 3. cxd5 Nxd5 4. e4 Nf4
2018.12.31	1-0	1702	1678	French Defense: Advance Variation, Nimzowitsch System	1. e4 c5 2. Nf3 e6 3. d4 d5 4. e5 f6
2018.12.31	1-0	1245	1121	King's Pawn Game: Busch-Gass Gambit	1. e4 e5 2. Nf3 Bc5 3. Bc4 c6 4. Nxe5 Qf6
2018.12.31	1-0	834	800	Queen's Pawn	1. d4 a5 2. Nc3 Ra6 3. Nf3 h5 4. Bf4 Nc6
2018.12.31	1-0	1319	1306	Caro-Kann Defense	1. e4 c6 2. Nc3 d5 3. d3 d4 4. Nce2 e5
2018.12.31	0-1	1872	1898	Danish Gambit	1. e4 e5 2. d4 exd4 3. c3 dxc3 4. Bc4 d6
2018.12.31	1-0	1674	1573	English Defense #2	1. d4 b6 2. c4 d6 3. Nc3 Bb7 4. Nf3 Nd7
2018.12.31	0-1	1476	1393	Nimzo-Larsen Attack: Modern Variation	1. b3 e5 2. e3 Nc6 3. g3 b6 4. Bb2 Bb7
2018.12.31	0-1	1581	1664	Sicilian Defense: Alapin Variation	1. e4 c5 2. c3 Qc7 3. d4 e6 4. d5 d6
2018.12.31	0-1	895	841	Petrov's Defense	1. e4 e5 2. Nf3 Nf6 3. Bd3 Bc5 4. O-O d5
2018.12.31	0-1	1050	1120	Zukertort Opening: Tennison Gambit	1. e4 d5 2. Nf3 dxe4 3. Ng5 Nf6 4. Bc4 e6
2018.12.31	0-1	1149	1153	Bird Opening	1. f4 e6 2. e3 d5 3. Bb5+ Nc6 4. Qg4 Nf6
2018.12.31	0-1	1730	1795	French Defense: Paulsen Variation	1. e4 e6 2. d4 d5 3. Nc3 c6 4. Nf3 a6
2018.12.31	1-0	1258	1197	Richter-Veresov Attack	1. d4 Nf6 2. Nc3 d5 3. Bg5 c6 4. Nf3 Nbd7
2018.12.31	1-0	1345	1294	Caro-Kann Defense: Hillbilly Attack	1. e4 c6 2. Bc4 e6 3. d4 Qa5+ 4. Bd2 Qb6
2018.12.31	0-1	1024	994	Scandinavian Defense	1. e4 d5 2. exd5 e5 3. Qf3 e4 4. Qxe4+ Ne7
2018.12.31	1-0	1980	1408	Rat Defense: Antal Defense	1. e4 d6 2. d4 Nd7 3. f4 b6 4. Nf3 Bb7
2018.12.31	0-1	1343	1392	Ruy Lopez: Exchange Variation	1. e4 e5 2. Nf3 Nc6 3. Bb5 a6 4. Bxc6 dxc6
2018.12.31	1-0	1800	1837	Queen's Gambit Declined: Harrwitz Attack	1. d4 e6 2. c4 d5 3. Nc3 Nf6 4. Nf3 Be7
2018.12.31	1-0	1516	1498	Robatsch (Modern) Defense	1. e4 g6 2. d4 Bg7 3. Be3 b6 4. Nf3 Bb7
2018.12.31	1-0	1214	1182	Russian Game: Damiano Variation, Kholmov Gambit	1. e4 e5 2. Nf3 Nf6 3. Nxe5 Nxe4 4. Qe2 Qe7
2018.12.31	0-1	1624	1679	Mieses Opening	1. d3 d5 2. e3 c6 3. a3 Nf6 4. h3 e5
2018.12.31	0-1	1377	1430	English Defense #2	1. d4 b6 2. c4 Bb7 3. Nc3 Nf6 4. Bf4 e6
2018.12.31	1-0	1708	1705	Semi-Slav Defense: Accelerated Move Order	1. d4 d5 2. c4 c6 3. Nc3 e6 4. Nf3 g6
2018.12.31	0-1	1437	1467	French Defense: Exchange Variation	1. e4 e6 2. d4 d5 3. exd5 exd5 4. Nf3 Nf6
2018.12.31	0-1	1709	1902	French Defense: Knight Variation	1. e4 e6 2. Nf3 d5 3. exd5 exd5 4. d4 Bd6
2018.12.31	0-1	1585	1599	Sicilian Defense: Closed Variation	1. e4 c5 2. Nc3 d6 3. Bb5+ Bd7 4. Bxd7+ Nxd7
2018.12.31	0-1	2005	2006	French Defense: Classical Variation	1. e4 e6 2. d4 d5 3. Nc3 Nf6 4. Nf3 Bb4
2018.12.31	1-0	2023	2062	Benoni Defense: Benoni Gambit, Schlenker Defense	1. d4 c5 2. dxc5 Na6 3. Nf3 Nxc5 4. e3 d6
2018.12.31	0-1	1164	1234	Englund Gambit Complex: Hartlaub-Charlick Gambit	1. d4 e5 2. dxe5 d6 3. exd6 cxd6 4. Nc3 Nc6
2018.12.31	0-1	1506	1527	Queen's Pawn	1. d4 c6 2. g3 d5 3. Bg2 Bg4 4. e3 Nf6
2018.12.31	1-0	1986	1942	Dutch Defense: Classical Variation	1. d4 e6 2. c4 f5 3. Nf3 Nf6 4. Nc3 b6
2018.12.31	0-1	2152	2085	English Opening: Anglo-Scandinavian Defense	1. c4 d5 2. c5 b6 3. cxb6 axb6 4. d4 c5
2018.12.31	1-0	1786	1831	Sicilian Defense: Delayed Alapin	1. e4 c5 2. Nf3 d6 3. c3 Nf6 4. d3 Nc6
2018.12.31	0-1	1709	1716	Queen's Gambit Refused: Marshall Defense	1. d4 d5 2. c4 Nf6 3. e3 b6 4. Nc3 Bb7
2018.12.31	0-1	1369	1490	Four Knights Game: Italian Variation	1. e4 e5 2. Nf3 Nc6 3. Nc3 Nf6 4. Bc4 Bb4
2018.12.31	0-1	1413	1602	Pirc Defense: Classical Variation	1. e4 d6 2. d4 Nf6 3. Nc3 g6 4. Nf3 Bg7
2018.12.31	0-1	2315	1979	King's Indian Defense: Orthodox Variation	1. d4 d6 2. Nf3 Nf6 3. c4 g6 4. Nc3 Bg7
2018.12.31	0-1	879	1391	Vienna Game	1. e4 e5 2. Nc3 d6 3. d3 Be6 4. h4 Be7
2018.12.31	1-0	1914	1814	Ruy Lopez: Morphy Defense, Classical Defense Deferred	1. e4 e5 2. Nf3 Nc6 3. Bb5 a6 4. Ba4 Bc5
2018.12.31	0-1	1641	1807	Sicilian Defense	1. e4 c5 2. Nf3 d6 3. b3 Nf6 4. Nc3 e6
2018.12.31	1-0	1647	1667	Italian Game: Giuoco Pianissimo, Italian Four Knights Variation	1. Nc3 Nc6 2. e4 e5 3. Bc4 Nf6 4. d3 Bc5
2018.12.31	1-0	1285	1315	Vienna Game: Stanley Variation, Three Knights Variation	1. e4 e5 2. Bc4 Nc6 3. Nc3 Nf6 4. Bb3 Bc5
2018.12.31	0-1	1748	1762	Italian Game: Scotch Gambit, de Riviere Defense	1. e4 e5 2. Nf3 Nc6 3. Bc4 Be7 4. O-O Nf6
2018.12.31	1-0	1581	1566	Caro-Kann Defense: Advance Variation	1. e4 c6 2. d4 d5 3. e5 Bf5 4. f4 e6
2018.12.31	0-1	1935	1839	Zukertort Opening: Sicilian Invitation	1. Nf3 c5 2. c4 Nc6 3. g3 g6 4. Bg2 Bg7
2018.12.31	1-0	1225	1140	Polish Defense	1. d4 b5 2. e4 Nc6 3. Nf3 e6 4. Nc3 b4
2018.12.31	1/2-1/2	1763	1766	Rat Defense: Small Center Defense	1. e4 e6 2. d4 d6 3. Be3 Be7 4. Nd2 Bd7
2018.12.31	1-0	1788	1827	Nimzowitsch Defense	1. e4 Nc6 2. g3 e5 3. Bg2 Bc5 4. Nf3 d6
2018.12.31	1-0	1701	1674	French Defense: Two Knights Variation	1. e4 e6 2. Nf3 d5 3. Nc3 Nf6 4. exd5 Nxd5
2018.12.31	1/2-1/2	1975	1858	Slav Defense: Modern Line	1. d4 d5 2. c4 c6 3. Nf3 e6 4. Nc3 f5
2018.12.31	1-0	1739	1703	Queen's Gambit Accepted: Old Variation	1. d4 d5 2. c4 dxc4 3. e3 Bf5 4. Bxc4 e6
2018.12.31	1-0	1511	1545	Caro-Kann Defense	1. e4 c6 2. Nf3 d5 3. exd5 cxd5 4. d4 Bg4
2018.12.31	1-0	1822	1844	Caro-Kann Defense: Classical Variation, Main Line	1. e4 c6 2. d4 d5 3. Nc3 dxe4 4. Nxe4 Bf5
2018.12.31	1-0	1393	1451	Sicilian Defense	1. e4 c5 2. Nf3 d6 3. Bc4 Nf6 4. Nc3 e6
2018.12.31	1-0	1661	1674	Queen's Pawn Game: Zukertort Variation	1. Nf3 d5 2. d4 c6 3. e3 Bg4 4. c4 e5
2018.12.31	1-0	1781	1759	Sicilian Defense: Najdorf, Lipnitsky Attack	1. e4 c5 2. Nf3 d6 3. d4 cxd4 4. Nxd4 Nf6
2018.12.31	1-0	1612	1696	Scotch Game	1. e4 e5 2. Nf3 Nc6 3. d4 exd4 4. Nxd4 Nge7
2018.12.31	0-1	1574	1606	Queen's Pawn Game: Mason Attack	1. d4 d5 2. Bf4 e6 3. Nf3 Bd6 4. Bg3 Nc6
2018.12.31	0-1	2002	1985	Zukertort Opening: Quiet System	1. Nf3 Nf6 2. e3 c5 3. c4 Nc6 4. Nc3 e5
2018.12.31	0-1	1358	1328	Russian Game: Damiano Variation	1. e4 e5 2. Nf3 Nf6 3. Nxe5 Nxe4 4. Qe2 d5
2018.12.31	0-1	2248	2214	Hungarian Opening: Reversed Modern Defense	1. g3 d5 2. Bg2 c5 3. c4 Nc6 4. cxd5 Nb4
2018.12.31	0-1	983	941	Scandinavian Defense: Mieses-Kotroc Variation	1. e4 d5 2. exd5 Qxd5 3. Nc3 Qc5 4. Nf3 Nf6
2018.12.31	0-1	1185	1089	Scandinavian Defense	1. e4 d5 2. Nc3 dxe4 3. Nxe4 Nf6 4. d3 Nxe4
2018.12.31	1-0	1943	1929	French Defense: Rubinstein Variation	1. e4 e6 2. d4 d5 3. Nc3 dxe4 4. Nxe4 Be7
2018.12.31	1-0	1459	1409	Bishop's Opening: Vienna Hybrid, Hromádka Variation	1. e4 e5 2. Nc3 Nc6 3. Bc4 Nf6 4. d3 Bb4
2018.12.31	1-0	1547	1578	Pirc Defense #4	1. e4 d6 2. Bc4 Nf6 3. Nc3 g6 4. f4 Bg7
2018.12.31	0-1	1790	1842	French Defense: Knight Variation	1. e4 e6 2. Nf3 d5 3. exd5 exd5 4. d4 Nf6
2018.12.31	1-0	1288	1190	Three Knights Opening	1. e4 e5 2. Nf3 Nc6 3. Nc3 d6 4. d4 exd4
2018.12.31	0-1	1677	1680	Owen Defense	1. e4 b6 2. Nf3 Bb7 3. Nc3 e6 4. d4 Bb4
2018.12.31	0-1	2069	2196	Zukertort Opening: Kingside Fianchetto	1. Nf3 g6 2. g3 Bg7 3. Bg2 d6 4. O-O Nc6
2018.12.31	0-1	1301	1315	Scotch Game	1. e4 Nc6 2. Nf3 e5 3. d4 d6 4. d5 Nce7
2018.12.31	1-0	1380	1363	Caro-Kann Defense	1. e4 c6 2. Nf3 d5 3. e5 c5 4. d4 Nd7
2018.12.31	0-1	1721	1832	Modern Defense	1. d4 g6 2. Bf4 Bg7 3. Nf3 f6 4. e3 Nh6
2018.12.31	0-1	1835	1805	King's Pawn Game: King's Head Opening #2	1. e4 e5 2. f3 Nc6 3. d3 d6 4. Be3 d5
2018.12.31	1-0	1806	1568	Sicilian Defense: Kan Variation, Knight Variation	1. e4 c5 2. Nf3 e6 3. d4 cxd4 4. Nxd4 a6
2018.12.31	1-0	2106	2084	Queen's Pawn	1. d4 c6 2. Nc3 d6 3. Nf3 Qc7 4. e4 Bg4
2018.12.31	1-0	2194	2166	Pirc Defense #4	1. e4 d6 2. Nc3 c5 3. d4 cxd4 4. Qxd4 e5
2018.12.31	1-0	1741	1574	Mieses Opening	1. d3 Nc6 2. Bg5 Ne5 3. Bd2 Nf6 4. d4 Nc6
2018.12.31	0-1	1628	1626	Sicilian Defense	1. e4 c5 2. Nf3 d6 3. Bc4 Nf6 4. d3 g6
2018.12.31	1/2-1/2	1068	1064	Mikenas Defense	1. d4 Nc6 2. Bg5 f6 3. Bh4 e5 4. d5 Nb4
2018.12.31	0-1	1525	1529	Sicilian Defense: Nyezhmetdinov-Rossolimo Attack	1. e4 c5 2. Nf3 Nc6 3. Bb5 h6 4. Bxc6 bxc6
2018.12.31	1-0	1579	1492	Ruy Lopez: Classical Variation, Central Variation	1. e4 e5 2. Nf3 Nc6 3. Bb5 Bc5 4. c3 Nf6
2018.12.31	1-0	1116	1131	Russian Game: Three Knights Game	1. e4 e5 2. Nf3 Nf6 3. Nc3 Bc5 4. Nxe5 d6
2018.12.31	1-0	1962	2059	Caro-Kann Defense: Panov Attack, Modern Defense, Mieses Line	1. e4 c6 2. d4 d5 3. exd5 cxd5 4. Nf3 Nc6
2018.12.31	0-1	1238	1275	Philidor Defense: Philidor Countergambit	1. e4 e5 2. Nf3 d6 3. d4 f5 4. exf5 Bxf5
2018.12.31	0-1	1462	1401	Scandinavian Defense	1. e4 d5 2. e5 Nc6 3. Nf3 f6 4. exf6 Nxf6
2018.12.31	1-0	1832	1804	King's Indian Defense: Normal Variation, Rare Defenses	1. d4 Nf6 2. c4 g6 3. Nc3 Bg7 4. e4 d6
2018.12.31	1/2-1/2	1894	1871	Sicilian Defense: Old Sicilian	1. e4 c5 2. Nf3 Nc6 3. Bc4 e6 4. d4 cxd4
2018.12.31	1-0	1549	1512	Queen's Pawn Game: Steinitz Countergambit	1. d4 d5 2. Bf4 c5 3. e3 cxd4 4. exd4 e6
2018.12.31	1-0	2034	1993	Gunderam Defense	1. e4 e5 2. Nf3 Qe7 3. d4 d6 4. Nc3 c6
2018.12.31	0-1	1891	2110	Nimzowitsch Defense: Kennedy Variation, Linksspringer Variation	1. e4 Nc6 2. d4 e5 3. d5 Nce7 4. f4 Ng6
2018.12.31	0-1	1991	1826	Caro-Kann Defense: Hillbilly Attack	1. e4 c6 2. Bc4 d5 3. Bb3 e6 4. e5 Qc7
2018.12.31	0-1	1403	1418	Sicilian Defense: Katalimov Variation	1. e4 c5 2. Nf3 b6 3. d4 e6 4. c4 Bb7
2018.12.31	1-0	1396	1384	Slav Defense #2	1. d4 d5 2. c4 c6 3. Nc3 Nf6 4. cxd5 cxd5
2018.12.31	0-1	1251	1300	Van't Kruijs Opening	1. e3 c5 2. d4 cxd4 3. Qxd4 Nc6 4. Qd1 d6
2018.12.31	1-0	1610	1645	Robatsch (Modern) Defense	1. e4 g6 2. d4 Bg7 3. Nf3 e6 4. Bc4 Ne7
2018.12.31	0-1	1573	1498	Queen's Gambit Accepted: Central Variation, McDonnell Defense	1. d4 d5 2. c4 dxc4 3. e4 e5 4. Nf3 exd4
2018.12.31	0-1	1211	1373	St. George Defense	1. e4 a6 2. d4 b5 3. Nf3 Bb7 4. d5 Nf6
2018.12.31	1-0	1135	1208	Philidor Defense #3	1. e4 e5 2. Nf3 d6 3. Bc4 h6 4. d3 Nc6
2018.12.31	1-0	1587	1597	Sicilian Defense: Old Sicilian	1. e4 c5 2. Nf3 Nc6 3. Bc4 e6 4. d3 Be7
2018.12.31	0-1	1615	1799	English Defense #2	1. d4 b6 2. Nf3 Bb7 3. e3 e6 4. g3 Nf6
2018.12.31	0-1	1421	1337	Queen's Pawn Game #2	1. d4 d5 2. e3 e6 3. c4 dxc4 4. Nc3 Bb4
2018.12.31	1-0	1926	1888	Italian Game: Hungarian Defense	1. e4 e5 2. Nf3 Nc6 3. Bc4 Be7 4. O-O Nf6
2018.12.31	1-0	1614	1597	Queen's Gambit Refused: Marshall Defense	1. d4 d5 2. c4 Nf6 3. cxd5 Nxd5 4. e4 Nf6
2018.12.31	1-0	1936	1956	Caro-Kann Defense: Exchange Variation	1. e4 c6 2. d4 d5 3. exd5 cxd5 4. Bf4 Nc6
2018.12.31	1-0	1580	1565	Queen's Gambit Declined	1. d4 d5 2. c4 e6 3. Bf4 Nf6 4. e3 Ne4
2018.12.31	1-0	2074	2088	Indian Game: Wade-Tartakower Defense	1. d4 d6 2. Nf3 Nf6 3. Nc3 g6 4. Bg5 Bg7
2018.12.31	1-0	1361	1388	Sicilian Defense	1. e4 c5 2. Nf3 d6 3. Bc4 e6 4. Nc3 Nc6
2018.12.31	0-1	1659	1631	Scandinavian Defense	1. e4 d5 2. e5 c5 3. d4 c4 4. Nf3 e6
2018.12.31	1-0	1822	1557	Scandinavian Defense: Mieses-Kotroc Variation	1. e4 d5 2. exd5 Qxd5 3. Nc3 Qe6+ 4. Qe2 Qg6
2018.12.31	0-1	1383	1317	Four Knights Game: Italian Variation	1. e4 e5 2. Nf3 Nf6 3. Nc3 Nc6 4. Bc4 Nxe4
2018.12.31	1-0	1253	1077	French Defense: Advance Variation #3	1. e4 e6 2. e5 d5 3. d4 c6 4. Nh3 h6
2018.12.31	1-0	2109	2006	Zukertort Opening: Grünfeld Reversed	1. Nf3 e6 2. g3 d5 3. Bg2 c5 4. O-O Nc6
2018.12.31	1-0	1194	1292	Zukertort Opening: Sicilian Invitation	1. Nf3 c5 2. g3 g6 3. Bg2 Bg7 4. d3 Nc6
